,id_recipe,Step_Count,Step Description
302,6601483,4,Knead dough briefly on a lightly floured surface. Cut into 16 equal portions. Roll each portion into a 6-inch circle.
303,6601483,5,Carefully fit one circle into each tart pan. Spoon an equal amount of filling into each tart pan. Fold pastry edges over filling. Place filled tarts onto a baking sheet.
304,6601483,6,"Bake in the preheated oven until golden brown, about 30 minutes. Melt apricot jam and brush over finished tarts if desired."
305,6581791,1,"Make crust: Combine flours, sugar, and salt in a large bowl. Cut in butter and shortening with 2 knives or a pastry blender until mixture resembles coarse crumbs. Mix in sour cream and lemon juice until dough comes together; some lumps are okay. Divide dough in half and shape into 2 disks. Wrap each in plastic wrap and chill in the refrigerator for 1 hour."
306,6581791,2,Preheat the oven to 350 degrees F (175 degrees C). Grease a 9-inch pie dish.
307,6581791,3,Roll 1 dough disk out to fit the prepared 9-inch pie dish. Roll out remaining dough disk for top crust; set aside.
308,6581791,4,"Prepare filling: Place apples into crust in the pie dish. Stir together sugar, flour, and nutmeg in a small bowl; sprinkle over apples. Drizzle with lemon juice."
309,6581791,5,Brush outer edge of bottom crust with beaten egg. Cover with top crust; trim and crimp edges together. Brush top with beaten egg and cut 4 steam vents.
310,6581791,6,"Bake in the preheated oven until golden brown, about 45 minutes. Allow pie to completely cool before serving."
311,6588293,1,Preheat the oven to 350 degrees F (175 degrees C).
312,6588293,2,"Combine apples, sugar, cinnamon, and nutmeg in a large pot over low heat. Mix well and cook, stirring frequently, until apples are tender but not mushy, 8 to 12 minutes."
313,6588293,3,"Place one pie pastry in a 9-inch pie pan. Pour in apple mixture, then cover with remaining pastry. Seal the edges and cut several steam vents in the top."
314,6588293,4,"Bake in the preheated oven until crust is golden brown, 30 to 40 minutes."
315,6601183,1,Preheat the oven to 325 degrees F (165 degrees C). Grease a 10-inch pie pan.
316,6601183,2,"In a large bowl, mix apples, cinnamon, and nutmeg together; turn mixture into pan. In a separate bowl, beat sugar, milk, 1/2 cup biscuit mix, eggs, and butter until smooth. Pour over apples."
317,6601183,3,"In a small bowl, stir together 1 cup biscuit mix, nuts, brown sugar and butter; mix until crumbly. Sprinkle streusel over top of pie."
318,6601183,4,Bake in preheated oven for 55 to 60 minutes; bake until knife inserted in center of pie comes out clean.
319,6580227,1,"Combine 2 1/3 cups all-purpose flour, 1 cup vegan margarine, 1 tablespoon white sugar, and salt in a food processor; pulse until mixture clumps together. Pour water in slowly and pulse a few times until a dough forms."
320,6580227,2,"Transfer dough to a flat work surface; knead for 30 seconds and shape into a disk. Wrap with plastic wrap and refrigerate until firm, about 30 minutes."
321,6580227,3,Preheat the oven to 325 degrees F (165 degrees C).
322,6580227,4,Dust a flat work surface with flour. Roll dough out into two 10-inch crusts. Press 1 crust gently into a 9-inch pie plate.
323,6580227,5,"Combine brown sugar, 1/2 cup vegan margarine, 1/4 cup white sugar, rice milk, 3 tablespoons flour, cinnamon, and nutmeg in a saucepan; cook and stir over medium heat until margarine melts and brown sugar is dissolved, 3 to 5 minutes."
324,6580227,6,Place apple slices in a large bowl. Pour brown sugar mixture on top; mix until apples are evenly coated. Pile apples into the bottom crust. Cover with second crust. Cut slits in the top crust with a sharp knife.
325,6580227,7,"Bake in the preheated oven until crust is golden brown and apples are semitranslucent, 45 to 60 minutes."
326,6650108,1,Gather Ingredients. Preheat the oven to 400 degrees F (200 degrees C). Line a baking sheet with parchment paper. Set out two 6-ounce ramekins.
327,6650108,2,Place puff pastry sheet on a work surface and let thaw for just 5 minutes; it should still be partially frozen and very firm. Use a round pastry cutter the same diameter as your ramekins to cut out 2 rounds of dough. Transfer to the prepared baking sheet. Prick each pastry round all over with a fork.
328,6650108,3,"Bake in the preheated oven until the pastries are puffed up and the bottoms are golden brown, about 15 minutes."
329,6650108,4,Remove from the oven and slide parchment paper off the baking pan onto a work surface; press warm pastries down lightly with the back of a fork to deflate them a bit. Let cool.
330,6650108,5,Increase the oven temperature to 425 degrees F (220 degrees C).
331,6650108,6,"Mix brown sugar, white sugar, a pinch of cinnamon, and a very small pinch of salt together in a bowl."
332,6650108,7,"Use 1 1/2 teaspoons butter to generously grease the bottom and sides of each ramekin. Spoon the sugar mixture evenly into each ramekin, reserving about 1 1/2 teaspoons for later. Shake ramekins gently to settle and flatten the sugar mixture."
333,6650108,8,Fill a bowl with 3 cups cold water. Add lemon juice.
334,6650108,9,"Turn one apple on its side; trim about 1/4 inch off the top and bottom of the apple, then cut it in half through the center. Repeat with the second apple."
335,6650108,10,"Peel around the apple halves to remove the peel; discard. Continue to peel the flesh, making ribbons as long and as thick as possible until you reach the core, letting the ribbons drop into the water. As long as your ribbons are 3- to 4-inches long, that's fine."
336,6650108,11,"Pull out 3 to 4 of the longest ribbons and line them up on a work surface into one long ribbon, overlapping the ends an inch or so."
337,6650108,12,"Roll the ribbon up tightly to form the center of the tart, then turn it up on its end."
338,6650108,13,"Coil more ribbons around the center, overlapping as you go, until you have a coil that's the same diameter as your ramekin. Pick up the apple coil and place it into the ramekin, with the flat side on top of the sugar. Repeat to make the second tart."
339,6650108,14,"Dot 1/2 teaspoon butter over each tart, then sprinkle with the remaining sugar mixture."
340,6650108,15,"Top each tart with a pastry round, placing the fork-poked side down on the apples."
341,6650108,16,"Bake in the preheated oven until pastries have browned and juices are bubbling, about 30 minutes. Remove from the oven and press the hot pastries down gently with a fork. Let cool for about 10 minutes."
342,6650108,17,"Run a knife around each pastry, then turn over onto serving plates. Use a spoon to go around each tart to separate the layers and create more definition, if desired."
343,6603394,1,"Combine the apple juice, 1/2 cup white sugar, and butter in a large saucepan. Cook over medium heat, stirring occasionally, until sugar has melted. Add the apples and cook until fruit is tender, about 10 minutes."
344,6603394,2,"Whisk remaining 1/2 cup sugar with the cornstarch. Stir into the fruit mixture, bring mixture to a boil, then cook until juices thicken, about 2 minutes. Allow filling to cool (it will continue to thicken as it cools)."
345,6603394,3,Preheat oven to 350 degrees F (175 degrees C). Place a baking sheet on an oven rack.
346,6603394,4,Roll out bottom crust to line a 9-inch pie pan. Roll out top crust and set aside. Pour cooled apple filling into the pie shell. Cover with the top crust and seal. Cut or poke holes in top crust to allow steam to escape.
347,6603394,5,"Bake in preheated oven on baking sheet until crust is golden brown and filling is bubbly, about 45 minutes."
348,6577530,1,"Spray a cast iron pie cooker with nonstick cooking spray. Evenly spread one side of each slice of bread with softened butter. Lay a slice of bread, butter side down, into the cooker. Spoon on pie filling, and top with second slice of bread, butter side up."
349,6577530,2,"Close up cooker, and cook over a hot campfire, turning occasionally, until the pie is hot and golden brown, about 4 minutes."
350,6591126,1,Preheat oven to 450 degrees F (225 degrees C). Fit bottom crust into a 9 inch pie plate.
351,6591126,2,"In a small bowl, mix together sugar, flour, salt, cinnamon, and nutmeg. Place sliced apples in a large bowl and sprinkle with sugar mixture. Toss until apples are thoroughly coated. Spoon apples into pan."
352,6591126,3,"Dot apples with butter or margarine, then sprinkle with whiskey. Cover with top crust. Seal edges and cut steam vents in top."
353,6591126,4,Bake in preheated oven for 10 minutes. Lower temperature to 350 degrees F (175 degrees C) and bake an additional 40 minutes. Serve warm.
