,id_recipe,Step_Count,Step Description
0,7642173,1,Gather all ingredients. Preheat oven to 425 degrees F (220 degrees C). Let pie crusts stand according to package directions. Line 2 baking sheets with parchment paper; set aside.Dotdash Meredith Food Studios
1,7642173,2,Transfer apple pie filling into a food processor.  Lightly pulse apple pie filling in a food processor until in 1/4-inch chunks (see Cook's Note).Dotdash Meredith Food Studios
2,7642173,3,Roll one pie crust into a 14-inch circle on a lightly floured piece of parchment paper.Dotdash Meredith Food Studios
3,7642173,4,"Using a pizza cutter or a sharp knife, cut 1/4-inch wide strips.Dotdash Meredith Food Studios"
4,7642173,5,Cover cut pie dough with parchment paper or plastic wrap and set aside.Dotdash Meredith Food Studios
5,7642173,6,Roll remaining pie crust dough into a 13-inch circle on lightly floured piece of parchment paper.Dotdash Meredith Food Studios
6,7642173,7,Spread caramel sauce over rolled pastry.Dotdash Meredith Food Studios
7,7642173,8,"Spoon apple pie filling over caramel sauce, spreading so that it is evenly distributed.Dotdash Meredith Food Studios"
8,7642173,9,Create a lattice top with dough strips by alternately placing strips on top of the filling.Dotdash Meredith Food Studios
9,7642173,10,"Using a 2 1/2-inch diameter cookie cutter, cut rounds from pastry.Dotdash Meredith Food Studios"
10,7642173,11,Transfer cookies to the prepared baking sheets.Dotdash Meredith Food Studios
11,7642173,12,Stir together sugar and apple pie spice in a small bowl.Dotdash Meredith Food Studios
12,7642173,13,Brush cookies with half and half and sprinkle cookies with sugar and spice mixture.Dotdash Meredith Food Studios
13,7642173,14,"Bake in the preheated oven until cookies are golden brown, about 12 minutes (working in batches).Dotdash Meredith Food Studios"
14,7642173,15,Cool on baking sheets on wire racks for 20 minutes. Remove cookies to a serving tray and serve warm.Dotdash Meredith Food Studios
15,6737700,1,Preheat the oven to 400 degrees F (200 degrees C). Line the bottom and sides of a 9-inch pie plate with one pie crust.
16,6737700,2,"Arrange sliced apples in prepared crust; spread cranberries over apples. Whisk sugar, cornstarch, and cinnamon in a small bowl; sprinkle mixture over cranberries. Distribute butter pieces over pie filling."
17,6737700,3,"Cover filling with remaining pie crust; crimp both crusts together, and cut several slits into top crust to vent steam."
18,6737700,4,"Bake in the preheated oven until pie is browned and fruit filling is bubbling, 45 minutes to 1 hour."
19,6663393,1,"Peel and core apples, then thinly slice. Set aside."
20,6663393,2,Preheat the oven to 425 degrees F (220 degrees C).
21,6663393,3,"Melt butter in a saucepan over medium heat. Add flour and stir to form a paste; cook until fragrant, about 1 to 2 minutes. Add both sugars and water; bring to a boil. Reduce the heat to low and simmer for 3 to 5 minutes. Remove from the heat."
22,6663393,4,Press one pastry into the bottom and up the sides of a 9-inch pie pan. Roll out remaining pastry so it will overhang the pie by about 1/2 inch. Cut pastry into eight 1-inch strips.
23,6663393,5,"Place sliced apples into the bottom crust, forming a slight mound. Lay four pastry strips vertically and evenly spaced over apples, using longer strips in the center and shorter strips at the edges."
24,6663393,6,"Make a lattice crust: Fold the first and third strips all the way back so they're almost falling off the pie. Lay one of the unused strips perpendicularly over the second and fourth strips, then unfold the first and third strips back into their original position."
25,6663393,7,Fold the second and fourth vertical strips back. Lay one of the three unused strips perpendicularly over top. Unfold the second and fourth strips back into their original position.
26,6663393,8,"Repeat Steps 6 and 7 to weave in the last two strips of pastry. Fold and trim excess dough at the edges as necessary, and pinch to secure."
27,6663393,9,"Slowly and gently pour sugar-butter mixture over lattice crust, making sure it seeps over sliced apples. Brush some onto lattice, but make sure it doesn't run off the sides."
28,6663393,10,"Bake in the preheated oven for 15 minutes. Reduce the temperature to 350 degrees F (175 degrees C) and continue baking until apples are soft, 35 to 45 minutes."
29,6649719,1,Place apples in a bowl. Toss apples with lemon juice in a large bowl and set aside.Dotdash Meredith Food Studios
30,6649719,2,"Pour water into a Dutch oven over medium heat. Combine sugar, cornstarch, cinnamon, salt, and nutmeg in a bowl; add to water, stir well, and bring to a boil. Boil for 2 minutes, constantly stirring.Dotdash Meredith Food Studios"
31,6649719,3,"Add apples and return to a boil. Reduce heat, cover, and simmer until apples are tender, 6 to 8 minutes. Cool for 30 minutes.Dotdash Meredith Food Studios"
32,6649719,4,"Ladle into 5 freezer containers, leaving 1/2 inch of headspace. Cool at room temperature no longer than 1 1/2 hours.Dotdash Meredith Food Studios"
33,6649719,5,Seal and freeze. Can be stored for up to 12 months.
34,6649719,6,Enjoy!DOTDASH MEREDITH FOOD STUDIOS
35,6651083,1,Preheat oven to 425 degrees F (220 degrees C).
36,6651083,2,Coat a 10-inch oven-proof skillet with butter. Sprinkle sugar evenly over the top of the butter.
37,6651083,3,"Place apple quarters, rounded sides down, on top of the butter and sugar in a circular pattern."
38,6651083,4,"Place skillet over medium-high heat and cook until butter melts and sugar dissolves and begins to caramelize. Continue to cook until apples soften and caramel begins to brown, 10 to 12 minutes. Remove from heat."
39,6651083,5,Sprinkle work surface with flour and roll pie dough into an 11-inch circle. Pinch edge to create a ruffle around crust.
40,6651083,6,Place crust on top of apples and tuck in edges around apples.
41,6651083,7,"Bake in the preheated oven until crust is golden brown, about 20 minutes. Allow to cool for 5 minutes. Place a plate over the top of the pan and carefully invert to release tarte from the pan. Scrape any remaining apples stuck to the pan back on top of crust."
42,6598591,1,"Mix sugar, cornstarch, cinnamon, and nutmeg in a large pan. Add water and salt and mix well. Bring to a boil and cook until thick and bubbly. Remove from heat and add lemon juice and food coloring."
43,6598591,2,"Sterilize canning jars, lids, and rings by boiling them in a large pot of water."
44,6598591,3,"Peel, core, and slice apples. Pack the sliced apples into hot canning jars, leaving a 1/2 inch of headspace."
45,6598591,4,"Fill jars with hot syrup, and gently remove air bubbles with a knife."
46,6598591,5,Put lids on and process in a water bath canner for 20 minutes.
47,6649894,1,Preheat the oven to 450 degrees F (230 degrees C).
48,6649894,2,Line a 9-inch pie dish with one pastry crust; set second one aside.
49,6649894,3,Combine 3/4 cup sugar and cinnamon in a small bowl. Add more sugar if your apples are tart.
50,6649894,4,"Layer apple slices in the prepared pie dish, sprinkling each layer with cinnamon-sugar mixture.Dotdash Meredith Food Studios"
51,6649894,5,Dot top layer with small pieces of butter. Cover with top crust.Dotdash Meredith Food Studios
52,6649894,6,"Bake pie on the lowest rack of the preheated oven for 10 minutes. Reduce oven temperature to 350 degrees F (175 degrees C) and continue baking until golden brown and filling bubbles, 30 to 35 minutes more."
53,6649894,7,Serve warm or cold.DOTDASH MEREDITH FOOD STUDIOS
54,6663607,1,Preheat the oven to 375 degrees F (190 degrees C).
55,6663607,2,"Place sliced apples in a large bowl; sprinkle with lemon juice. Mix white sugar, 2 tablespoons flour, cinnamon, and nutmeg together in a small bowl; sprinkle mixture over apples and toss until evenly coated. Stir in raisins and walnuts; transfer mixture into pie shell."
56,6663607,3,Mix 1/2 cup flour and brown sugar together in a small bowl. Blend in butter with a fork until mixture is crumbly; sprinkle over apple filling. Cover top of pie loosely with aluminum foil.
57,6663607,4,"Bake in the preheated oven for 25 minutes. Remove foil and bake until top is golden brown and filling is bubbly, about 25 to 30 minutes more. Cool on a wire rack before serving."
58,6740849,1,"Melt butter in a large skillet over medium heat; let butter brown to a light golden color and smell toasted, about 1 minute. Stir apples into hot butter; sprinkle with 1/4 cup white sugar, brown sugar, and salt. Cook and stir apple mixture until apples are softened, about 5 minutes. Mix in cinnamon and water; continue cooking until apples are soft and sticky, 1 to 2 more minutes. Spread apple filling onto a plate to cool.Dotdash Meredith Food Studios"
59,6740849,2,Preheat the oven to 400 degrees F (200 degrees C). Line a baking sheet with a silicone mat or parchment paper.
60,6740849,3,"Form a dough piece into a ball, place on a floured work surface, and roll into a circle about 8 inches in diameter.Dotdash Meredith Food Studios"
61,6740849,4,Spoon 1/3 to 1/2 cup apple filling in the center.Dotdash Meredith Food Studios
62,6740849,5,"Fold dough over filling, leaving about 1 inch of dough on the bottom side visible below the top side. Gently press dough closed around filling, using your fingertips.Dotdash Meredith Food Studios"
63,6740849,6,"Fold the overhanging bottom part of dough up over the top edge, working your way around the crust, and pinch the overhang tightly to the top part of the crust.Dotdash Meredith Food Studios"
64,6740849,7,"Crimp the edge tightly closed, pinching a little bit of dough with the thumb and forefinger of one hand and using your index finger on the other hand to push a small notch into the pinched dough. Continue pinching and notching all the way around until crust is tightly crimped together. Repeat with remaining dough and filling. Transfer pies onto prepared baking sheet.Dotdash Meredith Food Studios"
65,6740849,8,Whisk egg with milk in a small bowl until thoroughly combined. Brush top of each hand pie with egg mixture and sprinkle with about 1/4 teaspoon white sugar. Cut 3 small vent holes in the top of each pie.Dotdash Meredith Food Studios
66,6740849,9,"Bake in the preheated oven until pies are golden brown and filling is bubbling, 25 to 30 minutes. Let cool for at least 15 minutes before serving.DOTDASH MEREDITH FOOD STUDIOS"
67,7508367,1,"Add flour and butter to a large bowl, and use your fingertips to rub butter into flour until mixture resembles coarse breadcrumbs with no large lumps of butter remaining."
68,7508367,2,"Add the 1/4 cup Demerara sugar, egg yolks, sour cream, and brandy to flour mixture and combine with a spatula just until the dough comes together. Wrap dough in plastic wrap and chill for at least 2 hours or overnight."
69,7508367,3,"Meanwhile, place apples, raisins, the 1/3 cup Demerara sugar, vanilla sugar, cinnamon, and lemon juice in a saucepan. Bring to a simmer over medium-low heat and simmer until apples are tender, and mixture is slightly thickened, about 10 minutes. Set aside to cool."
70,7508367,4,Preheat the oven to 400 degrees F (200 degrees C). Line a 9x16-inch baking pan with parchment.
71,7508367,5,Divide the chilled dough into two equal pieces. Roll the dough out on a lightly floured surface into 2 9x16-inch rectangles. Place one of the rectangles into the prepared baking pan.
72,7508367,6,"Bake in the preheated oven until a pale crust develops on top, 10 to 15 minutes. Remove from the oven."
73,7508367,7,Carefully brush the semi-baked crust with apricot jam. Evenly distribute filling over the crust. Place the second rectangle of dough on top and prick it all over with a fork.
74,7508367,8,"Bake until crust is lightly browned and filling is hot and bubbly, about 30 minutes."
75,7508367,9,"Remove to a wire rack, and allow to cool slightly, about 10 minutes. Dust the still-warm pie with confectioner’s sugar, cut into squares, and serve warm or at room temperature."
76,6599611,1,Preheat the oven to 425 degrees F (220 degrees C).
77,6599611,2,"Make the apple pie: Place apple slices in a large bowl. Mix white sugar, flour, cinnamon, nutmeg, and allspice together in a separate bowl until combined; sprinkle over apples and toss until evenly coated."
78,6599611,3,"Remove pie shell from freezer; pour apple mixture into pie shell and dot with butter. Lay a sheet of aluminum foil lightly on top of filling, but do not seal."
79,6599611,4,Bake pie in the preheated oven for 10 minutes.
80,6599611,5,"Meanwhile, make the streusel topping: Mix flour, oats, brown sugar, lemon zest, and cinnamon in a medium bowl until combined. Cut in butter until mixture is crumbly. Remove pie from oven and sprinkle streusel on top."
81,6599611,6,"Reduce heat to 375 degrees F (190 degrees C). Return pie to oven and bake until streusel is browned and apples are tender, 30 to 35 minutes more. Cover loosely with aluminum foil to prevent excess browning."
82,6571544,1,Preheat the oven to 425 degrees F (220 degrees C). Line a 9-inch pie plate with bottom crust.
83,6571544,2,"Combine apples, sugar, flour, cinnamon, salt, and nutmeg in a bowl. Place mixture into the prepared pie plate. Dot with butter. Cover with top crust and seal. Cut holes in top crust to allow venting."
84,6571544,3,Bake in the preheated oven for 10 minutes.
85,6571544,4,"Reduce the oven temperature to 300 degrees F (150 degrees C) and bake until crust is golden brown and apples are tender, 40 for 50 minutes. Cool and serve."
86,6649646,1,Make pastry: Sift flour and salt together in a large bowl. Cut in shortening with 2 knives or a pastry blender until mixture resembles coarse crumbs.Dotdash Meredith Food Studios
87,6649646,2,"Add cold water, 1 tablespoon at a time, tossing with a fork, until flour mixture is moistened. Do not add more water than you need: when you squeeze a handful of moistened pastry mixture, it should form a ball. Wrap in plastic wrap and refrigerate for 30 minutes.Dotdash Meredith Food Studios"
88,6649646,3,"Make filling: Place apples in a saucepan. Combine sugar and cinnamon; pour over apples and toss to coat. Cook, covered, in a saucepan on low heat until soft; mash with a fork to make thick applesauce. Set aside to cool.Dotdash Meredith Food StudiosDotdash Meredith Food Studios"
89,6649646,4,Roll dough on a lightly floured surface to 1/8-inch thick; cut out eight 4-inch rounds with a large cookie cutter.Dotdash Meredith Food Studios
90,6649646,5,"Place 1 heaping tablespoon of applesauce in the center of each pastry round. Moisten edges with cold water, fold in half, and press the edge with a fork to seal. Repeat with remaining pastry and filling.Dotdash Meredith Food Studios"
91,6649646,6,Heat oil in a deep fryer or large saucepan to 375 degrees F (190 degrees C).
92,6649646,7,"Lower pies carefully into the hot oil in batches. Fry until golden brown, about 2 to 3 minutes on each side. Transfer to a paper towel-lined plate to drain. Repeat with remaining pies.Dotdash Meredith Food Studios"
93,6738936,1,Preheat the oven to 350 degrees F (175 degrees C).
94,6738936,2,Place 1/2 cup butter into a 9-inch cast iron skillet; place the skillet in the preheated oven until butter is melted. Remove the skillet and sprinkle with brown sugar; return to the oven to heat while you prepare the apples.
95,6738936,3,Remove the skillet from the oven; arrange 1 refrigerated pie crust on top of brown sugar. Top pie crust with 1/2 of the sliced apples. Sprinkle 1/2 cup of white sugar and 1 teaspoon of cinnamon on top. Place second pie crust over apples; top second crust with remaining apples and sprinkle with 1/2 cup sugar and 1 teaspoon cinnamon. Top with third crust; sprinkle with 1/4 cup sugar and dot with 1 tablespoon of butter. Cut 4 slits into the top crust for steam to escape.
96,6738936,4,"Bake in the preheated oven until the apples are tender and the crust is golden brown, about 45 minutes. Serve warm."
97,6590572,1,Preheat the oven to 350 degrees F (175 degrees C).
98,6590572,2,Whisk 1/3 cup apple juice concentrate together with cornstarch and cinnamon in a small bowl. Set aside.
99,6590572,3,"Simmer apples with remaining apple juice concentrate in a large saucepan until apples are tender, about 10 minutes. Stir in cornstarch mixture and continue to simmer until thickened. Remove from heat."
100,6590572,4,Spoon apple mixture into pastry-lined pie plate. Cover with top crust. Seal and flute edges. Cut steam vents in top.
101,6590572,5,"Bake in the preheated oven until crust is golden brown, about 45 minutes."
102,6649546,1,Gather all ingredients.Dotdash Meredith Food Studios
103,6649546,2,Preheat the oven to 425 degrees F (220 degrees C).
104,6649546,3,"Combine white sugar, brown sugar, butter, water, cinnamon, and salt in a saucepan over medium heat. Bring to a boil, remove from heat, and set aside.Dotdash Meredith Food Studios"
105,6649546,4,Roll out half the pastry to fit a 9-inch pie plate. Place bottom crust in pie plate; pour in apple slices.Dotdash Meredith Food Studios
106,6649546,5,Roll out top crust into a 10-inch circle. Cut into 8 (1-inch) wide strips with a sharp paring knife or pastry wheel.Dotdash Meredith Food Studios
107,6649546,6,"Weave the pastry strips, one at a time, into a lattice pattern. Fold the ends of the lattice strips under the edge of the bottom crust and crimp to seal.Dotdash Meredith Food Studios"
108,6649546,7,"Pour butter-sugar mixture over top of pie, coating the lattice, and allowing any remaining sauce to drizzle through the crust.Dotdash Meredith Food Studios"
109,6649546,8,"Bake in the preheated oven for 15 minutes. Reduce heat to 350 degrees F (175 degrees C), and bake until the crust is golden brown, the caramel on the top crust is set, and the apple filling is bubbling, 35 to 40 more minutes. Allow to cool completely before slicing.Dotdash Meredith Food Studios"
110,6585101,1,Preheat the oven to 400 degrees F (200 degrees C).
111,6585101,2,"Make the pie: Mix apples, brown sugar, white sugar, flour, and cinnamon together in a bowl. Pour into pie shell."
112,6585101,3,"Make the topping: Mix flour, oats, and 2/3 cup plus 2 tablespoons brown sugar together in a bowl. Drizzle in melted butter and stir until crumbly. Scatter over pie."
113,6585101,4,"Bake in the preheated oven until apples start to soften, about 15 minutes. Reduce the oven temperature to 350 degrees F (175 degrees C). Continue baking until apples are soft and topping is browned, about 40 minutes more."
114,6601530,1,Preheat the oven to 350 degrees F (175 degrees C).
115,6601530,2,Toss apples with 1 tablespoon sugar and pour them into a pie plate.
116,6601530,3,"Thoroughly mix together 1 cup sugar with flour, butter, egg, and cinnamon. Spread this evenly over the top of the pie."
117,6601530,4,"Bake in the preheated oven until apples have cooked and topping is golden brown, 40 to 45 minutes."
118,6562725,1,Preheat the oven to 425 degrees F (220 degrees C).
119,6562725,2,"Melt butter in a large saucepan over medium heat. Stir in brown sugar, white sugar, water, cinnamon, and salt. Bring to a boil, stirring constantly to dissolve sugar, then remove caramel sauce from heat."
120,6562725,3,Unroll a pie crust and press into a 9-inch pie dish. Place apples into crust. Unroll second pie crust on a work surface and cut into 8 (1-inch-wide) strips. Arrange strips in a criss-cross pattern over apples or weave into a lattice crust. Crimp bottom crust over ends of lattice strips with your fingers.
121,6562725,4,"Spoon caramel sauce over pie, covering lattice strips; let remaining sauce drizzle over crust and onto filling."
122,6562725,5,"Bake in the preheated oven for 15 minutes. Reduce heat to 350 degrees F (175 degrees C) and continue baking until crust is golden brown, caramel on top crust is set, and filling is bubbly, 35 to 40 more minutes. Allow to cool completely before slicing."
123,6739186,1,"Combine apples, brown sugar, butter, and cinnamon in a nonstick skillet. Cook over medium heat until apples have softened, about 5 minutes."
124,6739186,2,"Dissolve cornstarch in cold water. Stir into apple mixture and cook until sauce thickens, about 1 minute. Remove apple pie filling from heat and set aside to cool while you prepare the crust."
125,6739186,3,"Unroll pie crust on a lightly floured surface and roll out slightly to smooth the surface of the dough. Cut dough into rectangles small enough so that two can fit in your air fryer at one time. Repeat with remaining crust until you have 8 equal rectangles, re-rolling some of the scraps of dough if needed."
126,6739186,4,"Wet the outer edges of 4 rectangles with water and place some apple filling in the center, about 1/2-inch from the edges. Roll out the remaining 4 rectangles so that they are slightly larger than the filled ones. Place these rectangles on top of the filling; crimp the edges with a fork to seal. Cut 4 small slits in the tops of the pies."
127,6739186,5,Preheat an air fryer to 385 degrees F (195 degrees C) according to manufacturer's instructions.
128,6739186,6,Spray the basket of an air fryer with cooking spray. Brush the tops of 2 pies with oil and transfer pies to the air fryer basket using a spatula.
129,6739186,7,"Insert basket and bake in the preheated air fryer until golden brown, about 8 minutes. Remove pies from the basket and repeat with the remaining 2 pies."
130,6739186,8,Mix together confectioners' sugar and milk in a small bowl. Brush glaze on warm pies and allow to dry. Serve pies warm or at room temperature.
131,6578724,1,Place 1 pie crust onto a lightly floured surface and roll out the dough with a rolling pin. Using a 2-1/4-inch round biscuit or cookie cutter cut the pie crust into 10 circles. Repeat with the second pie crust for a total of 20 pie crust circles.
132,6578724,2,"Fill about 1/2 of each circle with apple pie filling. Place a second pie crust circle on top, making a mini pie. Do not overfill. Press down the edges of the mini pies, crimping with a fork to seal. Brush tops with beaten egg and sprinkle with cinnamon sugar."
133,6578724,3,Preheat the air fryer to 360 degrees F (175 degrees C).
134,6578724,4,"Lightly spray the air fryer basket with cooking spray. Place a batch of the mini pies in the air fryer basket, leaving space around each for air circulation."
135,6578724,5,"Bake until golden brown, 5 to 7 minutes. Remove from the basket and bake remaining pies. Serve warm or at room temperature."
136,6576905,1,Preheat the oven to 350 degrees F (175 degrees C).
137,6576905,2,"Beat milk, 1/4 cup butter, egg, and vanilla extract together in a bowl until smooth. Stir 1 1/2 cups flour, 1/2 cup sugar, baking powder, and salt into milk mixture until dough comes together. Spread dough out into the bottom of a rimmed baking sheet."
138,6576905,3,Spread apples over the dough on the baking sheet.
139,6576905,4,"Stir 1 cup sugar, 1/4 cup melted butter, 1/4 cup flour, and cinnamon together in a bowl until topping is combined. Sprinkle topping over apples."
140,6576905,5,"Bake in the preheated oven until apples are tender and topping is golden, about 40 minutes."
141,6573495,1,Preheat the oven to 425 degrees F (220 degrees C). Press the pie crust into and up the sides of a 9 inch pie plate.
142,6573495,2,"In a medium bowl, stir together 3/4 cup sugar, 2 tablespoons of flour, and salt. Mix in the sour cream, egg and vanilla until smooth. Add apples, and stir to coat. Scrape the mixture into the pie shell."
143,6573495,3,"Bake for 15 minutes in the preheated oven, then reduce heat to 350 degrees F (175 degrees C), and continue baking for 30 minutes more."
144,6573495,4,"While the pie is baking, prepare the topping in a medium bowl. Stir together 1/3 cup of flour, 1/3 cup sugar, and cinnamon. Cut in the butter until the mixture resembles fine crumbs."
145,6573495,5,"After the 30 minute bake time has passed, cover the top of the pie with the crumb topping, and continue to bake for 15 minutes, or until topping is lightly browned and apples are tender. Allow the pie to cool, then refrigerate until chilled before serving."
146,6650756,1,Preheat oven to 400 degrees F (200 degrees C).
147,6650756,2,"Cut 4 6-inch rounds out of the pie crusts, and fit them into 4 5-inch mini pie dishes. Cut remaining pie crust into 1/8-inch strips, and set dough aside."
148,6650756,3,"In a bowl, mix the diced apple, tapioca, sugar, lemon juice, nutmeg, and cinnamon until thoroughly combined; allow the mixture to stand for 5 minutes to soften the tapioca. Stir the mixture again, and spoon into the pie shells. Use the strips of dough to weave a small lattice crust on top of each pie, and pinch the strips onto the bottom crust."
149,6650756,4,"Bake in the preheated oven until the pies are browned and the filling is thickened and bubbling, about 30 minutes. Cool before serving."
150,6737427,1,Preheat the oven to 350 degrees F (175 degrees C). Grease a 9-inch pan.
151,6737427,2,"Combine flour, butter, 1 1/2 eggs, 1/3 cup plus 1 tablespoon sugar, and 1 teaspoon cinnamon in a large bowl. Knead by hand to form a smooth, consistent dough."
152,6737427,3,Turn dough out onto a lightly floured work surface. Roll out 3/4 of the dough into a 10-inch circle; press over the bottom and up the sides of the prepared pan.
153,6737427,4,"Mix apples, sultanas, 1/4 cup white sugar, and 1 tablespoon cinnamon together in a bowl. Spread over dough in the cake pan."
154,6737427,5,"Roll out remaining dough into a circle; cut into strips about 1/3-inch wide. Form an X in the center of the tart with the 2 longest strips. Create a lattice by weaving vertical and horizontal strips in an over-and-under pattern, using the shortest strips for the edges. Press ends of the strips firmly to the edge of the tart; trim excess dough with a knife."
155,6737427,6,Brush remaining beaten egg over dough.
156,6737427,7,"Bake in the preheated oven until pastry is light brown, 60 to 65 minutes."
