,id_recipe,Step_Count,Step Description
157,6737730,1,Preheat oven to 400 degrees F (200 degrees C.)
158,6737730,2,Arrange apple slices in unbaked pie shell. Mix 1/2 cup sugar and cinnamon; sprinkle over apples.
159,6737730,3,Mix 1/3 cup sugar with flour; cut in butter until crumbly. Spoon mixture over apples.
160,6737730,4,"Bake in preheated oven until apples are soft and top is lightly browned, about 40 minutes."
161,6590369,1,"To make the bottom crust, stir the flour and white sugar together in a bowl until well-combined. Rub the unsalted butter into the flour until the mixture resembles coarse crumbs; sprinkle with cold water, a couple of tablespoons at a time, mixing the dough together lightly with a fork until it barely holds together."
162,6590369,2,Form the dough into a ball and roll it out to a circle about 1/8-inch thick. Gently ease the dough into an 8-inch pie dish. Cut off any excess pastry with a knife. Finish the edge of the crust by gently pressing the tines of a fork into the dough all the way around the edge of the pie dish. Set the crust aside.
163,6590369,3,"To make the pie filling, stir the apples, brown sugar, 2 tablespoons of flour, the cinnamon, nutmeg, ginger, and lemon juice together in a large bowl; set aside."
164,6590369,4,"To make the topping, mix 1/2 cup of flour, 1/2 cup of softened butter, and the superfine sugar together in a bowl until you have a sticky, moist dough."
165,6590369,5,"To assemble the pie, cover the bottom of the pie crust with a light, even layer of graham cracker crumbs. Fill the pie with the apple mixture, piling it up in a mound shape. Pinch off pieces of the topping mixture, flatten them a little with your fingers, and dot them at random all over the top of the filling, covering as much of the filling as possible."
166,6590369,6,Preheat oven to 425 degrees F (220 degrees C).
167,6590369,7,"Tear off 2 30-inch-long pieces of parchment paper and place them in a cross shape on a work surface. Place the filled pie in the center of the two pieces of parchment, bring the paper ends up over the pie and fold and staple the parchment paper over the pie to completely enclose and seal in the pie. The paper should not touch the top or sides of the pie. Place the parchment-wrapped pie on a baking sheet to catch any drips."
168,6590369,8,"Bake in the preheated oven for 1 hour. Don't peek inside the parchment paper while baking. Remove from the oven, carefully tear the parchment paper away from the pie, and let cool; serve warm. Store leftovers in refrigerator."
169,6739162,1,"Preheat the oven to 350 degrees F (175 degrees C.) Combine 1 ½ cups flour, 1 ½ tablespoons sugar, baking powder, and salt in a large bowl. Cut in ½ cup butter until mixture resembles coarse crumbs. Mix egg yolk and water together until blended; add to flour and mix to form a dough. Roll out dough to fit the bottom of a 10x15-inch pan."
170,6739162,2,"Combine apples and lemon juice in a large bowl; add 1 ¾ cups white sugar, 2 tablespoons flour, and ½ teaspoon cinnamon. Pour filling into pie crust and dot with 2 tablespoons butter."
171,6739162,3,"Combine 1 cup flour, ⅔ cup brown sugar, and 1 teaspoon cinnamon in a medium bowl; cut in ⅔ cup butter until crumbly, then sprinkle over apples."
172,6739162,4,"Bake in the preheated oven until topping is golden brown, about 1 hour."
173,6588973,1,Preheat oven to 375 degrees F (190 degrees C.)
174,6588973,2,"In a large bowl, combine flour and salt. Cut in shortening until mixture resembles coarse crumbs. Beat egg yolk in measuring cup and add enough milk to make 2/3 cup total liquid. Stir into flour mixture until all flour is damp. Divide the dough in half. On floured surface, roll half the dough into a rectangle and fit into a 9x13 inch pan."
175,6588973,3,"In large bowl, combine apples, brown sugar, white sugar, cinnamon and nutmeg. Put apple mixture in pan. Roll out remaining dough and place over apples. Seal edges and cut slits in top dough. Beat egg white till frothy and brush on crust."
176,6588973,4,"Bake in the preheated oven for 50 minutes, or until golden brown."
177,6650624,1,Preheat the oven to 425 degrees F (220 degrees C). Arrange pastry in the bottom of a 9-inch pie pan. Place apples in crust.
178,6650624,2,"Combine 1/2 cup sugar, 2 tablespoons flour, and cinnamon. Pour over apples in crust. Sprinkle lemon juice on top."
179,6650624,3,"Cut 1/2 cup butter, 1/2 cup sugar, and 1/2 cup flour together until crumbly; sprinkle over top of filling."
180,6650624,4,Take two 15-inch pieces of parchment paper and enclose pie; fold edges up 3 times. Place on a baking sheet.
181,6650624,5,"Bake in the preheated oven, without opening the parchment, for 1 hour. Remove from oven, split parchment open, and cool pie on a wire rack. Serve warm, or at room temperature."
182,6592720,1,Preheat oven to 350 degrees F (175 C).
183,6592720,2,"Prepare the topping by combining the butter, brown sugar, flour and chopped pecans. Cut in all ingredients with pastry cutter until pea-sized. Set aside"
184,6592720,3,"Combine the apples, sugar, flour and cinnamon. Toss gently together and set aside."
185,6592720,4,Place apple mixture in unbaked pie shells. Heap the apples up high in each shell and fill completely. Sprinkle topping on top of each.
186,6592720,5,Bake at 350 degrees F (175 degrees C) for 50 minutes. Do not allow topping to get too dark.
187,6575836,1,Preheat the oven to 350 degrees F (175 degrees C).
188,6575836,2,Whisk 2 cups flour and salt together in a bowl. Cut butter into flour mixture using a pastry blender or a fork until crumbly.
189,6575836,3,"Whisk water, eggs, and lemon juice together in a separate bowl; stir into flour mixture until dough forms a ball. Split dough into halves; roll each half into about a 9x13-inch rectangle. Press 1 rectangle into the bottom of a 9x13-inch baking dish."
190,6575836,4,"Place apple slices in a large bowl; add sugar, 3 tablespoons flour, and cinnamon. Toss apples to coat; spread over crust. Cover apple filling with remaining crust, piecing together any scraps to cover any holes. Cut several slits into top crust for ventilation while cooking."
191,6575836,5,"Bake in the preheated oven until edges are browned and crisp, 45 minutes to 1 hour. Cool to room temperature before cutting into squares, about 30 minutes."
192,6572877,1,"Peel and slice apples. Toss with sugars, cinnamon and flour. Set aside."
193,6572877,2,Roll crust to make slightly larger to fit 10-inch glass pie pan. Fit bottom crust in pie pan. Turn in apple mixture and dot with butter. Put crust on top and crimp edges of crust together.
194,6572877,3,Preheat oven to 450 degrees F (230 degrees C).
195,6572877,4,Wet hands with water and dampen top of pie. Sprinkle with additional sugar. Puncture top of pie with fork so the steam can escape.
196,6572877,5,"Bake for 15 minutes in preheated oven. Reduce heat to 350 degrees F (175 degrees C) and continue baking for about 45 minutes more, until crust is golden brown. It's a good practice to place a piece of aluminum foil slightly larger than the pie under the pie plate to catch overflows. Serve warm."
197,6664570,1,"To make the pastry: Stir 1 1/3 cups of flour and salt together in a medium bowl. Add butter, 1 egg yolk, and water; stir until mixture forms large crumbs. If it is too dry to press a handful together, stir in more water. Press dough into a ball and wrap in plastic wrap. Flatten slightly and refrigerate for at least 30 minutes, or until firm. This part can be done up to three days in advance."
198,6664570,2,"To make the frangipane: Cream butter and 1/2 cup of sugar together in a medium bowl with an electric mixer until light and soft. Gradually mix in an egg and remaining egg yolk one at a time. Stir in apple brandy. Stir 2 tablespoons of flour into ground almonds, then mix into batter. Set aside."
199,6664570,3,"Roll out pastry dough into a 12-inch circle on a lightly floured surface. Fold loosely into quarters, and center the point in a 10-inch tart or pie pan. Unfold dough, and press into the bottom and up the sides. Prick with a fork all over, and flute the edges. Return pastry to the refrigerator to chill until firm."
200,6664570,4,Preheat the oven to 400 degrees F (200 degrees C). Place a baking sheet inside the oven while it preheats.
201,6664570,5,"Spoon frangipane into chilled pastry crust, and spread into an even layer. Arrange apple slices in an overlapping spiral pattern. Each slice should have one edge pressed into the frangipane until it touches the pastry base, and then overlap the previous slice. Start at the outside edge, and work towards the center."
202,6664570,6,"Place the pie plate on top of the baking sheet in the preheated oven. Bake until filling begins to brown, about 15 minutes. Reduce the oven temperature to 350 degrees F (175 degrees C). Bake for another 10 minutes, then sprinkle sugar over the top of the tart. Return to the oven until the sugar caramelizes slightly, about 10 minutes more."
203,6664570,7,"Cool the tart on a wire rack. A short time before serving, warm the apricot jelly; add some water if necessary to make it a liquid consistency. Brush over the tart for a nice shine."
204,6568503,1,Preheat oven to 425 degrees F (220 degrees C).
205,6568503,2,"In a large bowl mix together flour, salt, and cinnamon. Add apples and lemon juice. Toss until apples are thoroughly coated. Allow to sit for 10 minutes."
206,6568503,3,Pour apples into pastry-lined pie plate. Dot with butter or margarine. Cover with top pastry. Seal edges and cut steam vents in top pastry.
207,6568503,4,"Bake in preheated oven for 35 to 45 minutes, until crust is golden brown."
208,6593398,1,Preheat oven to 425 degrees F (220 degrees C).
209,6593398,2,"Mix together the sugar, flour, cinnamon, nutmeg and lemon peel."
210,6593398,3,Line one crust in a 9-inch deep-dish pie pan. Layer 1/3 of apples into pie crust. Sprinkle with sugar mixture and repeat until done. Sprinkle with lemon juice and dot with butter.
211,6593398,4,Place second pie crust on top of filling and flute the edges. Cut vents in top crust and brush with milk for a glazed appearance if desired.
212,6593398,5,Bake at 425 degrees F (220 degrees C) for 40 to 50 minutes.
213,6592125,1,Preheat oven to 350 degrees F (175 degrees C).
214,6592125,2,"To Make Crust: In a large bowl, mix together 1 1/2 cups flour, oil, milk, 1 1/2 teaspoons sugar and salt until evenly blended. Pat mixture into a 9 inch pie pan, spreading the dough evenly over the bottom and up sides. Crimp edges of the dough around the perimeter."
215,6592125,3,"To Make Filling: Mix together 3/4 cup sugar, 3 tablespoons flour, cinnamon, and nutmeg. Sprinkle over apples and toss to coat. Spread evenly in unbaked pie shell."
216,6592125,4,"To Make Topping: Using a pastry cutter, mix together 1/2 cup flour, 1/2 cup sugar and butter until evenly distributed and crumbly in texture. Sprinkle over apples."
217,6592125,5,Put pie in the oven on a cookie sheet to catch the juices that may spill over. Bake 45 minutes.
218,6572860,1,Preheat oven 425 degrees F (220 degrees C). Spray deep dish pie plate with cooking spray
219,6572860,2,"Combine white sugar, light brown sugar, flour, lemon, cinnamon, and mix well. Add apples and raisins to sugar mixture; stir until fruit is well coated."
220,6572860,3,"Spoon apple mixture into pie crust. Place second piecrust on top of filling, and trim edges. Lightly glaze top of pie with a beaten egg, then sprinkled with a little sugar."
221,6572860,4,"Bake till golden brown, about 35 to 40 minutes. Place on a wire rack, and cool 30 minutes."
222,6601198,1,Preheat oven to 425 degrees F (220 degrees C).
223,6601198,2,"In a medium mixing bowl combine butter or margarine, sugar, and eggs. Beat until smooth. Add applesauce and vanilla. Mix thoroughly."
224,6601198,3,Pour custard mixture into pie shell. Sprinkle top lightly with cinnamon.
225,6601198,4,Bake in preheated oven for 30 to 40 minutes or until set in center.
226,6573808,1,Preheat oven to 350 degrees F (175 degrees C). Lightly grease a 9 inch pie pan with margarine.
227,6573808,2,Fill 2/3 of the pan with sliced apples. Sprinkle with cinnamon and 1 teaspoon sugar.
228,6573808,3,"In a medium bowl, mix 1 cup sugar with the melted margarine. Stir in pecans, flour, egg and salt. Mix well. Spread mixture over the apples."
229,6573808,4,"Bake in preheated oven for 65 minutes, or until golden brown."
230,6578047,1,"Preheat oven to 375 degrees F (190 degrees C). On a lightly floured surface, roll out one crust, and place in a 9 inch pie plate. Roll out top crust, and set aside."
231,6578047,2,"In a large bowl, mix together the sugar, tapioca, and cinnamon. Add blackberries and apple slices. Toss gently to coat without mashing the berries. Let stand for 20 minutes."
232,6578047,3,Spoon filling into pastry lined pan. Dot with butter. Moisten the edge of the pastry with water. Cover with top crust; trim and crimp edge. Cut a few slits in the top to allow steam to escape during baking. Cover edge with foil to prevent over-browning.
233,6578047,4,"Bake in preheated oven for 25 minutes. Remove foil, and continue baking for 20 to 25 minutes, or until crust is golden brown. Cool on wire rack."
234,6598313,1,"Preheat oven to 350 degrees F (175 degrees C). Place butter in a large iron skillet and place in preheating oven until melted, about 5 minutes."
235,6598313,2,"Stir brown sugar into melted butter and place back in oven until bubbling, about 5 minutes."
236,6598313,3,"Gently lay 1 pie crust on top of butter-brown sugar mixture, without pressing crust down. Arrange apple slices on top of pie crust."
237,6598313,4,"Mix white sugar, cinnamon, and flour together in a bowl; sprinkle over apple slices. Place the remaining pie crust over apple slices, making slits in the top crust for ventilation. Seal the 2 crusts together."
238,6598313,5,"Bake in the preheated oven until top crust is lightly browned, about 45 minutes."
239,6597880,1,"Combine apple slices and cinnamon in a saucepan and cook over low heat for 10 minutes. If necessary, add a tiny bit of water so apples don't burn. Remove from heat and set aside to cool."
240,6597880,2,Preheat the oven to 350 degrees F (175 degrees C). Grease a 10-inch springform pan with butter
241,6597880,3,"Combine butter, sugar, vanilla sugar, and egg in a large bowl; beat using an electric mixer until smooth and creamy. Mix flour and baking powder in a separate bowl. Add 2/3 of flour mixture, 1 tablespoon at a time, to butter mixture and beat on low speed. Add remaining flour mixture and mix in by hand to make a crumbly dough."
242,6597880,4,"Transfer 1/2 the dough into the prepared springform pan and press down to create a bottom crust. Add apple slices, leaving a small space around the edges. Crumble remaining dough evenly on top."
243,6597880,5,"Bake in the preheated oven until streusel and crust are lightly browned, about 50 minutes. Cool on a wire rack for 5 minutes. Run a table knife around the edges to loosen. Carefully transfer to a serving plate or cooling rack."
244,6590886,1,Preheat oven to 375 degrees F (190 degrees C).
245,6590886,2,"In a 9 inch deep-dish pie pan, combine pecans, brown sugar and margarine; spread into a single layer. Roll out dough, and place bottom crust over pecan mixture."
246,6590886,3,"In a large bowl, combine apples, sugar, flour, cinnamon and nutmeg. Pour into crust in pan. Top with second crust. Fold edges of crust over, and flute to seal edges. Make several small slits in the top to allow steam to escape."
247,6590886,4,"Place pan on foil or cookie sheet during baking to guard against spillage. Bake in preheated oven for 40 to 50 minutes, or until crust is golden brown and apples are tender."
248,6590886,5,"Cool pie in pan for 5 minutes. Place serving plate over pie, and flip to invert, being careful not to come in contact with molten sugar. If some of the nuts stick to the pan, remove them with a knife, and place on pie. Allow to cool for 1 hour."
249,6736374,1,"In a medium saucepan over medium heat, combine 1/2 cup sugar, 1/2 cup milk, 1/2 cup cream, and 1/4 cup butter. Heat until butter is melted, stirring occasionally. In a small bowl, whisk together the cornstarch, 2 tablespoons milk, and vanilla; stir into saucepan. Cook until thickened, stirring constantly. Remove from heat, and set aside to cool slightly."
250,6736374,2,"Preheat oven to 400 degrees F (200 degrees C). In a medium bowl, combine the apples, flour, and cinnamon. Mix well."
251,6736374,3,"Line a 9 inch pie pan with pie dough. Pour thickened filling mixture into pastry-lined pie pan. Arrange apple mixture evenly over filling. Top with second crust, seal and flute the edges. Cut slits in top crust."
252,6736374,4,"Bake for 30 to 40 minutes, or until crust is golden brown and apples are tender. Cool for at least 30 minutes."
253,6736374,5,"In small bowl, combine confectioners' sugar, 1 tablespoon milk, 1/4 teaspoon vanilla, and 1 tablespoon softened butter. Blend until smooth; pour evenly over warm pie. Refrigerate for AT LEAST 1 1/2 hours before serving (longer is better)."
254,6649933,1,Preheat oven to 440 degrees F (220 degrees C).
255,6649933,2,"Combine apples and rhubarb in a large bowl. Mix together sugar and cinnamon in a small bowl, then sprinkle over fruit. Toss until fruit is thoroughly coated. Spoon mixture into pastry shell."
256,6649933,3,Bake in preheated oven for 40 minutes.
257,6596220,1,Preheat oven to 375 degrees F (190 degrees C).
258,6596220,2,"In a bowl, toss apple slices together with sugar, flour, salt, apple pie spice, and vanilla extract until evenly coated."
259,6596220,3,"Lay pie dough flat on a lightly greased baking sheet. Pile apples on one side of dough, leaving a 1 inch border. Brush border and opposite half side of dough with milk. Fold dough over apples, being careful not to over-stuff or the dough will tear. Fold over edges and pinch together to seal. Cut several small slits in the top of the pocket with a sharp knife, then brush top with beaten egg."
260,6596220,4,"Bake in the preheated oven for 40 minutes, or until flakey and golden brown. Serve warm, or at room temperature."
261,6587483,1,Preheat the oven to 350 degrees F (175 degrees C).
262,6587483,2,"Melt butter in a saucepan over medium heat. Add apples; toss until coated with butter. Stir in brown sugar, white sugar, lemon juice, 1 1/2 teaspoons cinnamon, 1/2 teaspoon vanilla extract, salt, nutmeg, allspice, and cloves; cook and stir until apples have softened and sugars have melted, about 5 minutes. Bring to a boil."
263,6587483,3,"Combine water and cornstarch in a bowl. Stir cornstarch mixture into the apple mixture; cook and stir until apple mixture is thickened, about 5 minutes. Remove from heat; cool completely, about 20 minutes."
264,6587483,4,Roll out 1 sheet of pie crust on a work surface with a rolling pin; cover with half of the cooled apple mixture. Roll out a second sheet of pie crust with a rolling pin; slice into 1/2-inch wide strips with a sharp knife. Weave pie crust strips together over the apple mixture to create a lattice top.
265,6587483,5,Flour a round cookie cutter or drinking glass. Press cookie cutter through the dough to create 12 round pies. Transfer to a baking sheet.
266,6587483,6,"Bake in the preheated oven until crust is cooked through and golden brown, about 20 minutes. Transfer to a wire rack to cool, about 10 minutes."
267,6587483,7,"Repeat with remaining pie crusts and apple mixture; place on a second baking sheet. Bake in the oven until crust is cooked through and golden brown, about 20 minutes."
268,6587483,8,Combine confectioners' sugar and 1 teaspoon cinnamon in a mixing bowl; add 1 teaspoon vanilla extract. Stir in milk slowly until desired consistency is reached; drizzle over cooled pies.
269,6595993,1,"Heat the oven to 350 degrees F (175 degrees C). Toss apple slices, 1/4 cup brown sugar, and cinnamon in a large bowl until evenly coated. Arrange apples in pie crust. Whisk sweetened condensed milk and melted butter in the same bowl until smooth. Pour evenly over apples. Bake 30 minutes."
270,6595993,2,Combine remaining 1/3 cup brown sugar and flour in a medium bowl. Cut in 2 tablespoons cold butter with pastry blender or 2 knives until mixture resembles coarse crumbs. Stir in walnuts. Sprinkle evenly over pie.
271,6595993,3,Bake an additional 35 to 40 minutes or until apples are tender and topping is golden brown. Cool completely on a wire rack.
272,6579291,1,Preheat the oven to 425 degrees F (220 degrees C).
273,6579291,2,"Melt butter in a saucepan over medium-low heat; stir in flour to make a smooth paste. Whisk white sugar, brown sugar, water, and lemon juice into butter mixture. Bring to a simmer, whisking constantly, until sauce is thick, about 3 minutes. Stir 6 blackberry halves into sauce, reduce heat to low, and continue cooking while you complete remaining steps. Stir sauce occasionally."
274,6579291,3,"Line a 9-inch pie dish with 1 pastry crust. Place apple slices and remaining blackberries into crust. Cut remaining pastry crust into strips, about 1-inch wide. Use strips to weave a lattice top over apple-blackberry filling; pinch ends of strips to edge of bottom crust to seal. Spoon hot blackberry sauce over pie, letting it soak through the openings in top crust. Place pie onto a baking sheet."
275,6579291,4,"Bake in the preheated oven for 15 minutes. Reduce oven temperature to 350 degrees F (175 degrees C) and continue baking until crust is golden brown and sauce is bubbling, 35 to 45 more minutes."
276,6575460,1,Preheat the oven to 400 degrees F (200 degrees C).
277,6575460,2,Toss apples and blueberries in unbaked pie crust.
278,6575460,3,"Mix 1/4 cup flour, white sugar, salt, nutmeg, and cinnamon in a bowl. Stir in yogurt, egg, and vanilla extract; pour batter over apples and blueberries."
279,6575460,4,"Combine 1/2 cup flour, pecans, oats, and brown sugar in a mixing bowl. Cut in butter with a knife or pastry blender until mixture resembles coarse crumbs; set aside."
280,6575460,5,"Bake in the preheated oven for 15 minutes; reduce heat to 350 degrees F (175 degrees C) and continue baking until pie crust is lightly browned, about 30 minutes. Sprinkle crumb mixture over pie and bake until golden brown, about 15 minutes more. Cool before serving."
281,6594335,1,Preheat the oven to 425 degrees F (220 degrees C).
282,6594335,2,"Melt butter in a saucepan over medium heat. Add flour and stir to form a paste; cook until fragrant, about 1 to 2 minutes. Add brown sugar and water; bring to a boil. Reduce the heat to low and simmer for 3 to 5 minutes. Remove from the heat."
283,6594335,3,Press one pastry into the bottom and up the sides of a 9-inch pie pan. Roll out remaining pastry so it will overhang the pie by about 1/2 inch. Cut pastry into eight 1-inch strips.
284,6594335,4,"Place sliced apples into the bottom crust, forming a slight mound. Lay four pastry strips vertically and evenly spaced over apples, using longer strips in the center and shorter strips at the edges."
285,6594335,5,"Make a lattice crust: Fold the first and third strips all the way back so they're almost falling off the pie. Lay one of the unused strips perpendicularly over the second and fourth strips, then unfold the first and third strips back into their original position."
286,6594335,6,Fold the second and fourth vertical strips back. Lay one of the three unused strips perpendicularly over top. Unfold the second and fourth strips back into their original position.
287,6594335,7,Repeat Steps 5 and 6 to weave in remaining two pastry strips. Fold and trim excess dough at the edges as necessary. Pinch to secure.
288,6594335,8,"Slowly and gently pour sugar mixture over lattice crust, making sure it seeps over sliced apples. Brush some onto lattice, but make sure it doesn't run off the sides."
289,6594335,9,"Bake in the preheated oven for 15 minutes. Reduce the temperature to 350 degrees F (175 degrees C) and continue baking until apples are soft, 35 to 45 minutes."
290,6574131,1,Preheat the oven to 350 degrees F (175 degrees C). Place a baking sheet on an oven rack.
291,6574131,2,"Stir sugar, flour, and cinnamon together in a small bowl until well combined. Cut butter into small pieces; divide into two equal piles."
292,6574131,3,Roll out pastry to an 11- or 12-inch circle; press into a 9-inch pie pan. Roll out top crust and set aside.
293,6574131,4,Place sliced apples into a large bowl. Pour sugar mixture over top and add 1/2 of the butter pieces. Toss apples until thoroughly coated. Pour into the pastry-lined pie pan.
294,6574131,5,Dot apples with remaining butter. Place second pastry on top. Seal edges and cut steam vents in top crust.
295,6574131,6,"Set pie on the baking sheet in the preheated oven. Bake until filling is bubbly and crust is golden brown, 50 minutes to 1 hour."
296,6599866,1,Preheat oven to 400 degrees F (200 degrees C). Grease a baking sheet.
297,6599866,2,"Combine apples, sugar, cornstarch, cinnamon, and vanilla extract together in a bowl. Place pie crust on the prepared baking sheet. Spoon apple mixture into the center of crust, leaving a 2-inch border. Fold crust over the edges of the apple mixture."
298,6599866,3,"Bake in the preheated oven until apples are tender and crust is golden, about 30 minutes."
299,6601483,1,"Make the dough: In a large bowl, mix together flour, sugar, and salt. Cut in butter until mixture is crumbly. Add eggs and vanilla and mix until dough forms a ball. Wrap in plastic and refrigerate for at least 1 hour but not more than 1 day."
300,6601483,2,"While the dough is chilling, make the filling: In a medium bowl, toss apples with sugar and cinnamon. Mix in walnuts."
301,6601483,3,Preheat the oven to 350 degrees F (175 degrees C). Lightly grease sixteen 3-inch tart pans. Remove the dough from the refrigerator and let stand at room temperature for 30 minutes before rolling out.
