,id_recipe,Step_Count,Step Description
131,7097828,6,"Heat grapeseed oil in a large cast iron skillet over medium-high heat. Add tri tip to skillet, fat-cap-side down, and cook, until all sides are evenly seared and caramelized, 3 to 5 minutes per side."
132,7097828,7,Transfer tri tip to a large cutting board and let rest for 5 minutes before slicing against the grain into 1/4-inch-thick strips.
133,7097828,8,"Serve steak with chile-lime dipping sauce for dipping, if desired."
134,7097119,1,"Trim and tie tenderloin together with kitchen twine the night before cooking. Combine salt and pepper in a bowl and season tenderloin on all sides. Place on a baking rack set over a cookie sheet and allow to rest, uncovered, in the refrigerator overnight."
135,7097119,2,"The next morning place tenderloin, garlic, thyme, and rosemary into a sous vide vacuum bag and seal using a vacuum sealer. Refrigerate until you are ready to sous vide."
136,7097119,3,"Attach sous vide cooker to a heat-proof container of water and set temperature to 133 degrees F (56 degrees C). Sous vide until tenderloin has reached the desired temperature, 2 1/2 to 3 hours, depending on thickness."
137,7097119,4,About 30 minutes pour water in a metal bowl and sprinkle gelatin powder on top. Allow to sit for 30 minutes until gelatin blooms. Set on top of a double boiler over simmering water and stir until a clear liquid forms. Do not allow to boil.
138,7097119,5,"Remove tenderloin from sous vide, pat dry, and let rest while preparing the gravy."
139,7097119,6,"Pour au jus liquids from the sous vide bag into a sauce pan. Stir in 1 to 2 tablespoons butter and red wine. Add as much of the bloomed gelatin as you like depending on desired thickness and whisk until well combined. Season gravy with salt, pepper, and herbs to taste."
140,7097119,7,"Heat cast iron pan to medium-high. Brush tenderloin with olive oil and sear in the hot pan until browned all over, 1 to 2 minutes per side. Melt extra butter in the pan as desired. Remove from pan, tent with foil, and allow to rest for 5 to 10 minutes."
141,7097119,8,Slice tenderloin and serve with gravy.
142,6666175,1,"Pat beef dry with paper towels, trim, and cut into 1 1/2- to 2-inch pieces. Place in a bowl with 2 tablespoons cornstarch, salt, and pepper; toss to coat beef evenly."
143,6666175,2,"Heat oil in a large nonstick skillet over medium-high heat. Add half of the beef and cook, turning often, until beef is browned on all sides, about 6 minutes (do not overcrowd the skillet to ensure browning). Repeat process with remaining beef, using any residual oil in the skillet. (Do not wipe skillet clean.) Place browned beef in an ungreased 6-quart slow cooker."
144,6666175,3,"Once all beef has been browned, lower heat to medium and add curry paste, stirring to release any browned bits from the skillet. Add beef broth and coconut cream to skillet, stirring to combine ingredients. Pour mixture over beef in slow cooker. Add potatoes to slow cooker; cover and cook on HIGH for 4 hours, or LOW for 6 hours, or until beef is very tender when pierced with a fork."
145,6666175,4,"Remove beef and potatoes to a large bowl, and carefully pour liquid from slow cooker into a heatproof glass measuring cup or bowl and allow to stand until fat settles on top of liquid, about 2 minutes. Remove fat from the surface of the liquid with a ladle and discard."
146,6666175,5,"Pour remaining liquid into a saucepan and bring to a boil, undisturbed, over medium-high heat. Whisk remaining 1 1/2 tablespoons cornstarch with 2 tablespoons cold water together in a small bowl; add to boiling liquid in saucepan, whisking until mixture thickens, 2 to 5 minutes. Return meat and potatoes to thickened sauce; stir in lime zest and juice."
147,6666175,6,"Serve family-style, or place 1/2 cup rice into each of 6 bowls, spoon 1 1/3 cups beef, potatoes, and sauce mixture over rice, and garnish each portion with cashews, cilantro, sliced chile, and a lime wedge."
148,6666358,1,"Heat oil in a large Dutch oven over medium-high. Season chuck roast with pepper and 2 teaspoons salt. Sear meat until browned on every side, working in batches if necessary, about 10 minutes. Remove from Dutch oven and transfer to a large plate."
149,6666358,2,"Reduce heat to medium and stir in onion. Cook, stirring often, until softened, about 8 minutes. Add garlic and cook, stirring constantly, until fragrant, about 1 minute. Stir in harissa and tomato paste; cook, stirring constantly, until caramelized, about 2 minutes."
150,6666358,3,"Pour in wine and cook, scraping the bottom of the pot with a wooden spoon to loosen any browned bits, until reduced by two thirds, about 5 minutes. Stir in tomatoes, bay leaf, chuck roast, and remaining 1 teaspoon salt. Reduce heat to medium-low and cover. Cook, stirring occasionally, until meat is tender, sauce has thickened, and flavors meld, about 2 1/2 hours."
151,6666358,4,Remove and discard bay leaf. Transfer meat from Dutch oven to a cutting board and shred using 2 forks. Return meat to pot and stir in pappardelle. Top with grated Parmesan cheese.
152,7093286,1,Gather all ingredients.ALLRECIPES / SONIA BOZZO
153,7093286,2,"Melt butter and oil in a skillet over medium-high heat. Add mushrooms, season with salt, and saute, stirring occasionally, until they turn golden brown, 5 to 10 minutes.ALLRECIPES / SONIA BOZZO"
154,7093286,3,"Add onion and ground beef. Cook, stirring, until meat is browned and crumbly, and onions turn soft and translucent, about 5 minutes. Season with black pepper and cayenne.ALLRECIPES / SONIA BOZZO"
155,7093286,4,"Stir in minced garlic and flour, and cook for 1 minute.ALLRECIPES / SONIA BOZZO"
156,7093286,5,"Pour in vodka and allow to evaporate, about 30 seconds.ALLRECIPES / SONIA BOZZO"
157,7093286,6,"Stir in beef broth and water and bring to a simmer. Cook, stirring occasionally, for 10 minutes.ALLRECIPES / SONIA BOZZO"
158,7093286,7,"Reduce heat to medium, and mix in noodles. Cover with a tight-fitting lid and simmer for 5 minutes. Uncover and stir thoroughly. Cover again and cook until noodles are just tender, about 3 minutes. (See Cook's Note.)ALLRECIPES / SONIA BOZZO"
159,7093286,8,"Once noodles are cooked, reduce heat to low, and stir in sour cream.ALLRECIPES / SONIA BOZZO"
160,7093286,9,Serve immediately with additional sour cream and green onions or chives if so desired.ALLRECIPES / SONIA BOZZO
161,7092203,1,Prepare a thermocirculator and water bath according to manufacturer's directions. Set thermocirculator to 128 degrees F (53 degrees C) and allow water bath to come up to temperature.
162,7092203,2,"While water heats, trim excess fat from the fat cap of the brisket to about 1/4 inch. Do not remove all the fat, as this will contribute to keeping the meat juicy. Pat brisket dry with a paper towel."
163,7092203,3,"Combine salt, onion powder, garlic powder, smoked paprika and pepper in a small bowl. Completely cover all sides of the brisket with the spice mixture."
164,7092203,4,"Place the brisket in a large vacuum sealable bag. Seal bag according to manufacturer's directions. Transfer vacuum sealed brisket to warm water bath with thermocirculator, cover vessel with aluminum foil to reduce evaporation, and cook undisturbed for 48 hours. Remove brisket from bag, reserving cooking liquid (you should have about 3 ½ cups cooking liquid). Strain cooking liquid through a fine mesh sieve and discard any solids. Set brisket aside on a plate or cutting board."
165,7092203,5,"Place dried ancho chiles in a large, dry saucepan over medium high heat. Cook, turning often, until chiles are blistered, and aromatic. Remove chiles from heat and allow to cool briefly. Once chiles have cooled enough to handle, remove stems and seeds, and tear chiles into 2-inch pieces. Place torn chiles in a medium bowl with 1 cup of boiling water and 2 cups of strained, reserved cooking liquid; allow to stand until chiles have softened, about 10 minutes."
166,7092203,6,"Meanwhile, heat 2 tablespoons canola oil in the same saucepan over medium-high heat. Add onions and smashed garlic cloves; cook, stirring often, until onions and garlic have softened, about 5 minutes. Add tomato paste and cook, stirring often, for 1 minute. Add red wine and allow mixture to reduce until most of the liquid excep tfor about 1/4 cup has evaporated, stirring occasionally. Remove from heat."
167,7092203,7,"Remove softened chiles from liquid, and strain liquid through a fine mesh sieve, reserving 1/2 cup of the strained liquid. Combine softened chiles, 1/2 cup reserved liquid, onion mixture, and ketchup in a blender; blend until smooth. Add unsalted butter and sherry vinegar to the mixture and process until smooth. If you want a spicier sauce, add cayenne pepper or hot sauce to taste."
168,7092203,8,Preheat a grill or grill pan to medium high (350 degrees F to 400 degrees F / 175 degrees C to 200 degrees C).
169,7092203,9,"Pat brisket dry with paper towels and rub with remaining 2 tablespoons oil. Place on the preheated grill and grill until grill marks appear, the outside is slightly charred, and the brisket is heated through, about 5 minutes per side."
170,7092203,10,"Transfer brisket to a cutting board, let stand for 5 minutes to rest, and slice thinly against the grain of the meat and serve hot with sauce."
171,6663843,1,"Add ground beef to a bowl and spread gochujang evenly over the surface of the meat. Season evenly with kosher salt, pepper, and soy sauce. Spreading out the seasoning will reduce the time you need to handle the meat. Spread fresh ginger and garlic evenly over the surface. Add green onions and cracker crumbs. Mix in quickly with a fork until well combined."
172,6663843,2,Cover and refrigerate for about 30 minutes.
173,6663843,3,Preheat the oven to 450 degrees C (220 degrees C).
174,6663843,4,Form mixture into 12 equal-sized balls using wet hands. Add to a cast iron skillet.
175,6663843,5,"Bake meatballs in the preheated oven until nicely browned, about 20 minutes."
176,6663843,6,Transfer meatballs to a plate while preparing the sauce in the same skillet.
177,6663843,7,"Drain most of the grease but 1 teaspoon out of the skillet and set onto stove over medium-high heat. Add garlic and stir until fragrant, about 1 minute. Deglaze skillet with rice vinegar and soy sauce. Stir in brown sugar, beef broth, and gochujang. Season with sesame oil and Sriracha. Stir sauce and bring to a simmer. Cook until reduced by a third."
178,6663843,8,"Meanwhile stir together cornstarch and water in a small bowl to create a slurry. Reduce heat to medium-low and mix in slurry while whisking constantly. Keep simmering sauce until it has reduced to about half. Add meatballs back into the skillet and baste with the sauce. Allow to simmer, basting generously, until meatballs are heated through and are well soaked with sauce, 3 to 5 minutes."
179,6663843,9,Serve garnished with toasted sesame seeds and green onions.
180,6741493,1,Lightly season both sides of each cube steak with salt and pepper. (See Cook's Note).
181,6741493,2,"Melt 1 Tablespoon unsalted butter in a large, non-stick skillet over medium heat. Once butter is foamy, add cube steaks and sprinkle about 2 teaspoons Worcestershire sauce on top of each cube steak. Cook until brown, 3 to 4 minutes."
182,6741493,3,"Turn the steaks, and sprinkle each with an additional 1 to 2 teaspoons Worcestershire sauce. Cook until steaks are firm and reddish-pink and juicy in the center, about 3 minutes more. An instant-read thermometer inserted into the center should read 135 degrees F (57 degrees C). Remove to a platter and tent with foil."
183,6741493,4,"To make the pan sauce, pour about 1/2 cup water into the skillet and stir all the browned bits from the bottom of the pan. Bring to a boil and cook for about 2 minutes."
184,6741493,5,"Remove from heat and stir in remaining butter, until melted."
185,6741493,6,Evenly divide pan sauce over each cube steak and serve warm.
186,6745720,1,Gather all ingredients.ALLRECIPES / DIANA CHISTRUGA
187,6745720,2,Put breadcrumbs in a small bowl.ALLRECIPES / DIANA CHISTRUGA
188,6745720,3,"Combine 3 tablespoons olive oil and garlic in a skillet and heat over medium heat until garlic sizzles, 20 to 30 seconds.When is Izzyâs last day?"
189,6745720,4,Strain olive oil into the breadcrumbs and mix to combine to create garlic crumbs. Allow garlic crumbs to cool.ALLRECIPES / DIANA CHISTRUGA
190,6745720,5,Cut the steak into two (8-pounce) portions. Place one of the steaks onto a piece of plastic wrap and fold wrap over to cover meat. Pound with a tenderizer or another heavy object to 1/4 inch thickness. Repeat with the second steak.ALLRECIPES / DIANA CHISTRUGA
191,6745720,6,Season on both sides with salt and pepper.ALLRECIPES / DIANA CHISTRUGA
192,6745720,7,Spoon cooled garlic crumb over the flattened steak to cover the surface up to the edges.ALLRECIPES / DIANA CHISTRUGA
193,6745720,8,Fold over plastic wrap and pound again to drive garlicky breadcrumbs into the steak. Flip steak over and repeat process on the other side.ALLRECIPES / DIANA CHISTRUGA
194,6745720,9,"Heat remaining 2 tablespoon olive oil in a skillet over medium-high heat. Once hot, add steak and cook until meat starts to sizzle, 1 to 2 minutes. Reduce heat to medium and cook about 2 minutes per side for medium to medium-rare. An instant-read thermometer inserted into the center should read 130 to140 degrees F (54 to 60 degrees C).ALLRECIPES / DIANA CHISTRUGA"
195,6745720,10,Serve and enjoy!ALLRECIPES / DIANA CHISTRUGA
196,6750847,1,Preheat an outdoor grill for high heat and lightly oil the grate. Set a cast iron flat-top griddle or large cast iron skillet onto the grill and preheat until smoking.
197,6750847,2,Spread butter on the inside of the buns and toast on the flat-top until lightly browned. Set aside.
198,6750847,3,"Form meat into 8 loosely-packed balls, 2 ounces each. Do not pack the meat tightly, as this will prevent it from smashing properly. Place each ball on the hot flat-top, cover with a piece of parchment (to prevent sticking to the spatula; re-use each parchment square on a second patty) and immediately smash down to a 1/4 inch thickness using 2 stiff, sturdy spatulas that are criss-crossed to get proper leverage as you press down. You may also use the bottom of small skillet. Sprinkle the meat with salt."
199,6750847,4,"Grill for about 45 seconds, until the edges are dark brown and the centers are a light pink color. Using a bench scraper or firm spatula, gently scrape up the patties, flip over and immediately cover 4 of them with cheese. Grill an additional 15 to 20 seconds; stack the plain patties over the cheese-covered patties so you have 4 stacks. Move each stack to a bun and serve with your favorite toppings."
200,6748210,1,"Combine 3/4 of the flour, egg, olive oil, salt, and water in a bowl. Mix with a fork, just like when making a pasta dough, until ingredients just come together. Continue mixing everything with your hands into a shaggy dough. Turn out mixture onto a floured surface and keep kneading until dough is nice and smooth. Add additional flour as needed. Cover and allow dough to rest on the counter for 30 minutes."
201,6748210,2,"Combine ground beef, onion, parsley, smoked paprika, kosher salt, pepper, and Armenian cayenne in a bowl. Mix with a fork at first, then use your hands until filling is well combined. Cover and chill in the refrigerator."
202,6748210,3,Preheat the oven to 400 degrees C (200 degrees C). Grease a cast-iron skillet with olive oil.
203,6748210,4,"Lightly flour a work surface and set the dough on top. Cut dough in half and roll out one half as thin as possible into a large rectangle. Cut dough first into strips, then into 20 small rectangles, about 1.5 x 1.75 inches each. Reserve dough scraps in case there is left over filling to make extra manti. Repeat with second half."
204,6748210,5,"Use a teaspoon to portion out the filling, about 1/2 to 1 teaspoon per manti, and set into the middle of each dough rectangle (you can also use your hands to portion out the filling as shown in the video)."
205,6748210,6,"Moisten the outer, shorter edges of each rectangle with a little bit of water on your fingertips, pick up a rectangle, and trap the filling inside by pinching both ends of the dough together, creating the classic ""little man in the boat"" design. Press dumpling together so manti will sit up straight in the skillet, making sure the dough at the ends is as thin as it is around the filling."
206,6748210,7,Set manti inside the prepared skillet in such a way that there is still a little room between the dumplings as the dough will expand to about twice its size during cooking.
207,6748210,8,Bake in the preheated oven on the center rack for 40 minutes.
208,6748210,9,"Meanwhile, heat olive oil in a pot over medium-high heat and cook garlic until fragrant, 20 to 30 seconds. Add tomato sauce and stir quickly. Add chicken broth and season with salt, pepper, and cayenne."
209,6748210,10,Bring tomato broth to a simmer and turn off the heat.
210,6748210,11,Ladle tomato broth over the manti and return to the oven for 15 more minutes.
211,6649349,1,"Heat olive oil in a large skillet over medium heat. Add ground beef; cook and stir until browned and crumbly, about 10 minutes. Add onions and cook until soft, about 5 minutes. Stir in tomato sauce, olives, sofrito, sazón, garlic, oregano, and pepper. Reduce the heat to medium-low and simmer until mixture thickens, about 15 minutes."
212,6649349,2,"Roll empanada disks on a lightly floured surface until 1/2 inch larger in diameter. Spoon about 1 tablespoon meat mixture into the middle of each disk. Moisten the disk edges with water, fold in half over filling to form a half-moon, and pinch to seal (or seal with a fork)."
213,6649349,3,"Heat 2 1/2 inches corn oil in a deep-fryer or large saucepan to 350 degrees F (175 degrees C). Working in batches, fry empanadas until crisp and golden brown, flipping once, 4 to 6 minutes. Transfer to paper towels to drain."
214,6664604,1,Gather ingredients.
215,6664604,2,Place meat in slow cooker.
216,6664604,3,"Mix flour, salt, and pepper together in a small bowl. Pour over meat, and stir until meat is coated."
217,6664604,4,"Add beef broth, carrots, potatoes, onion, celery, Worcestershire sauce, paprika, garlic, and bay leave; stir to combine."
218,6664604,5,"Cover, and cook until beef is tender enough to cut with a spoon, on Low for 8 to 12 hours, or on High for 4 to 6 hours."
219,6664604,6,Serve hot and enjoy!DOTDASH MEREDITH FOOD STUDIOS
220,6664508,1,Gather all ingredients.Dotdash Meredith Food Studios
221,6664508,2,"Combine ground beef, onion, garlic, and green pepper in a large saucepan over medium-high heat. Cook and stir until meat is browned and crumbly and vegetables are tender, 5 to 7 minutes. Drain grease.Dotdash Meredith Food StudiosDotdash Meredith Food Studios"
222,6664508,3,"Stir diced tomatoes, tomato sauce, and tomato paste into the pan. Season with oregano, basil, salt, and pepper. Simmer spaghetti sauce for 1 hour, stirring occasionally.Dotdash Meredith Food Studios"
223,6664508,4,Serve hot and enjoy!DOTDASH MEREDITH FOOD STUDIOS
224,6664254,1,Gather all your ingredients.Dotdash Meredith Food Studios
225,6664254,2,"Cook sausage, ground beef, onion, and garlic in a Dutch oven over medium heat until well browned.Dotdash Meredith Food Studios"
226,6664254,3,"Stir in crushed tomatoes, tomato sauce, tomato paste, and water. Season with sugar, 2 tablespoons parsley, basil, 1 teaspoon salt, Italian seasoning, fennel seeds, and pepper. Simmer, covered, for about 1 1/2 hours, stirring occasionally.Dotdash Meredith Food Studios"
227,6664254,4,"Bring a large pot of lightly salted water to a boil. Cook lasagna noodles in boiling water for 8 to 10 minutes. Drain noodles, and rinse with cold water.Dotdash Meredith Food Studios"
228,6664254,5,"In a mixing bowl, combine ricotta cheese with egg, remaining 2 tablespoons parsley, and 1/2 teaspoon salt.Dotdash Meredith Food Studios"
229,6664254,6,Preheat the oven to 375 degrees F (190 degrees C).
230,6664254,7,"To assemble, spread 1 1/2 cups of meat sauce in the bottom of a 9x13-inch baking dish. Arrange 6 noodles lengthwise over meat sauce. Spread with 1/2 of the ricotta cheese mixture. Top with 1/3 of the mozzarella cheese slices. Spoon 1 1/2 cups meat sauce over mozzarella, and sprinkle with 1/4 cup Parmesan cheese.Dotdash Meredith Food Studios"
231,6664254,8,"Repeat layers, and top with remaining mozzarella and Parmesan cheese. Cover with foil: to prevent sticking, either spray foil with cooking spray or make sure the foil does not touch the cheese.Dotdash Meredith Food Studios"
232,6664254,9,Bake in the preheated oven for 25 minutes. Remove the foil and bake for an additional 25 minutes.Dotdash Meredith Food Studios
233,6664254,10,Rest lasagna for 15 minutes before serving.Dotdash Meredith Food Studios
234,6663440,1,Preheat the oven to 350 degrees F (175 degrees C). Lightly grease a 9x5-inch loaf pan.
235,6663440,2,"Combine ground beef, onion, milk, bread crumbs and egg in a large bowl; season with salt and pepper. Transfer into prepared loaf pan."
236,6663440,3,"Mix ketchup, brown sugar, and mustard together in a small bowl until well combined; pour over meatloaf and spread it evenly over the top."
237,6663440,4,"Bake in the preheated oven until no longer pink in the center, about 1 hour."
238,6663249,1,"Place potatoes, carrots, and onion into the bottom of a slow cooker; add water and place brisket on top of vegetables. Pour beer over brisket; sprinkle over spices from the packet and cover."
239,6663249,2,Cook on High for 7 hours; stir in the cabbage and cook for 1 more hour.
240,6650289,1,"Place prime rib roast on a plate and bring to room temperature, 2 to 4 hours.Dotdash Meredith Food Studios"
241,6650289,2,Preheat the oven to 500 degrees F (260 degrees C).
242,6650289,3,"Combine butter, pepper, and herbes de Provence in a bowl; mix until well blended. Spread butter mixture evenly over entire roast. Season roast generously with kosher salt.Dotdash Meredith Food Studios"
243,6650289,4,"Roast the 4-pound roast in the preheated oven for 20 minutes. (If your roast is larger or smaller than 4 pounds, multiply the exact weight times 5 minutes.)"
244,6650289,5,"Turn the oven off and, leaving the roast in the oven with the door closed, let the roast sit in the oven for 2 hours."
245,6650289,6,"Remove roast from the oven, slice, and serve.DOTDASH MEREDITH FOOD STUDIOS"
246,6649667,1,Gather all ingredients.Dotdash Meredith Food Studios
247,6649667,2,"Place corned beef in a Dutch oven and cover with water. Add spice packet, cover, and bring to a boil. Reduce heat and simmer until corned beef is just about fork-tender, about 2 hours.Dotdash Meredith Food Studios"
248,6649667,3,"While the corned beef is simmering, cut potatoes in half. Peel carrots and cut into 3-inch pieces. Cut cabbage into small wedges."
249,6649667,4,"When corned beef has cooked for 2 hours, add potatoes and carrots; cook until vegetables are almost tender and meat is fork-tender, about 10 minutes. Add cabbage and cook until tender, about 15 more minutes.Dotdash Meredith Food StudiosDotdash Meredith Food Studios"
250,6649667,5,Remove meat and let rest for 15 minutes. Leave broth and vegetables in the Dutch oven.Slice meat across the grain. Serve with vegetables and broth.DOTDASH MEREDITH FOOD STUDIOS
251,6649567,1,"Heat a large skillet over medium heat. Cook and stir lean ground beef in the hot skillet until some of the fat starts to render, 3 to 4 minutes. Add onion and bell pepper; continue to cook until vegetables have softened and beef is cooked through, 3 to 5 more minutes."
252,6649567,2,"Stir in ketchup, brown sugar, mustard, and garlic powder; season with salt and pepper. Reduce heat to low and simmer for 20 to 30 minutes."
253,6649567,3,Divide meat mixture evenly among hamburger buns.
254,6648676,1,Gather all ingredients.Dotdash Meredith Food Studios
255,6648676,2,"Place steaks side by side in large casserole dish. Add orange juice, cider vinegar, and Worcestershire sauce.Dotdash Meredith Food Studios"
256,6648676,3,"Marinate, uncovered, in the refrigerator for 45 minutes."
257,6648676,4,Preheat the oven to 425 degrees F (220 degrees C).
258,6648676,5,"Remove casserole dish from refrigerator. Cover steaks with plastic wrap and let allow to come to room temperature, at least 15 minutes."
259,6648676,6,Place steaks on a clean work surface and generously rub with steak seasoning and black pepper.Dotdash Meredith Food Studios
260,6648676,7,Heat olive oil in a cast-iron skillet over high heat.
261,6648676,8,"Cook steaks in the hot skillet until lightly browned on the bottom, 2 1/2 minutes.Dotdash Meredith Food Studios"
262,6648676,9,"Flip and cook until browned on the other side and red in the center, about 2 minutes more."
263,6648676,10,Transfer skillet with the steaks to the oven.
264,6648676,11,"Bake in the preheated oven until steaks are firm and reddish-pink to lightly pink in the center, 8 to 10 minutes. An instant-read thermometer inserted into the center should read from 130 degrees F (54 degrees C) to 140 degrees F (60 degrees C)."
265,6648676,12,Remove steaks from oven; season with salt. Let rest for 5 minutes before serving.Dotdash Meredith Food Studios
266,6648676,13,Enjoy!DOTDASH MEREDITH FOOD STUDIOS
267,6664414,1,Preheat the oven to 350 degrees F (175 degrees C). Gather all ingredients.Dotdash Meredith Food Studios
268,6664414,2,"Melt butter in a skillet over medium heat, and cook onion and garlic until onion is soft and translucent, about 5 minutes. Remove from heat, and season with salt and pepper.Dotdash Meredith Food Studios"
