,id_recipe,Step_Count,Step Description
269,6664414,3,"Combine onion and garlic mixture, beef, crumbled bread, crushed crackers, egg, sour cream, Worcestershire sauce, and 1/2 can tomato sauce in a large bowl. Mix until well combined. Gradually stir in milk, 1 teaspoon at a time, until mixture is moist, but not soggy.Dotdash Meredith Food StudiosDotdash Meredith Food Studios"
270,6664414,4,Transfer the mixture to a 5x9-inch loaf pan.Dotdash Meredith Food Studios
271,6664414,5,"Bake uncovered in the preheated oven for 40 minutes. Increase oven temperature to 400 degrees F (200 degrees C). Continue baking 15 minutes, to an internal temperature of 160 degrees F (70 degrees C)."
272,6664414,6,"Mix the remaining tomato sauce and ketchup in a small bowl. Pour over the top of the meatloaf, and continue baking for 10 minutes.Dotdash Meredith Food Studios"
273,6664414,7,Serve hot and enjoy!DOTDASH MEREDITH FOOD STUDIOS
274,6650587,1,Gather all ingredients.Dotdash Meredith Food Studios
275,6650587,2,"Heat vegetable oil in a large wok or skillet over medium-high heat; cook and stir beef until browned, 3 to 4 minutes.Dotdash Meredith Food Studios"
276,6650587,3,"Move beef to the side of the wok and add broccoli, bell pepper, carrots, green onion, and garlic to the center of the wok. Cook and stir vegetables for 2 minutes."
277,6650587,4,"Stir beef into vegetables and season with soy sauce and sesame seeds. Continue to cook and stir until vegetables are tender, about 2 more minutes.Dotdash Meredith Food Studios"
278,6650587,5,Serve hot and enjoy!DOTDASH MEREDITH FOOD STUDIOS
279,6664255,1,"Gently rinse liver slices under cold water and pat dry with paper towels. Place in a shallow dish; pour in enough milk to cover. Let stand while preparing onions, or set aside for longer if you have time. Soaking will remove any bitterness."
280,6664255,2,"Melt 2 tablespoons of butter in a large skillet over medium heat. Add onion rings; cook and stir in butter until tender and soft, about 3 to 5 minutes. Transfer onions into a bowl and set the skillet aside."
281,6664255,3,Place flour on a plate; season with salt and pepper. Drain milk from liver and coat liver slices in flour mixture.
282,6664255,4,"Melt remaining 2 tablespoons of butter in the same skillet; increase heat to medium-high and fry coated liver slices until lightly browned, about 3 to 4 minutes on each side. Return onions to the skillet and reduce heat to medium; continue to cook until onions are heated through and liver is slightly pink inside, or longer to suit your taste."
283,6648238,1,"Season chuck roast with salt and pepper. Heat oil in a large skillet over high heat; add roast and sear to brown, about 4 minutes per side."
284,6648238,2,"Place roast in the slow cooker and sprinkle soup mix on top. Add water, and scatter carrots, potatoes, onion, and celery on top."
285,6648238,3,Cover and cook on Low for 8 to 10 hours.
286,6648220,1,"Combine ground beef, 1/3 cup condensed soup, bread crumbs, egg, salt, and black pepper in a large bowl. Shape into 6 oval patties."
287,6648220,2,Heat a large skillet over medium-high heat; add patties and brown on both sides. Drain excess fat.
288,6648220,3,"Blend remaining soup and flour together in a small bowl until smooth; mix in ketchup, water, Worcestershire sauce, and mustard. Pour soup mixture over patties in the skillet. Cover, and cook for 20 minutes, stirring occasionally."
289,6651006,1,Cover a baking sheet with foil and spray lightly with cooking spray. Soak bread crumbs in milk in a small bowl for 20 minutes.
290,6651006,2,"Meanwhile, heat olive oil in a skillet over medium heat. Add onion; cook and stir until onion has softened and turned translucent, about 5 minutes. Reduce heat to low and continue cooking and stirring until onion is very tender, about 15 minutes more."
291,6651006,3,"Gently stir beef and pork together in a large bowl. Add onions, bread crumb mixture, eggs, Parmesan cheese, parsley, garlic, salt, black pepper, Italian herb seasoning, and red pepper flakes; mix together using a rubber spatula until combined. Cover and refrigerate for about one hour."
292,6651006,4,Preheat the oven to 425 degrees F (220 degrees C).
293,6651006,5,Form mixture into balls about 1 1/2 inches in diameter; arrange in a single layer on the prepared baking sheet.
294,6651006,6,"Bake in the preheated oven until browned and cooked through, 15 to 20 minutes."
295,6648412,1,Gather the ingredients. Preheat the oven to 350 degrees F (175 degrees C).ALLRECIPES/VICTORIA JEMPTY
296,6648412,2,"Heat a large skillet over medium-high heat. Cook and stir ground beef in the hot skillet until completely browned and crumbly, 7 to 10 minutes. Stir in condensed soup; season with salt and black pepper.ALLRECIPES/VICTORIA JEMPTY"
297,6648412,3,Transfer beef mixture to a 9x13-inch baking dish; layer tater tots evenly on top and sprinkle with Cheddar cheese.ALLRECIPES/VICTORIA JEMPTY
298,6648412,4,"Bake in the preheated oven until tater tots are golden brown and hot, 30 to 45 minutes.ALLRECIPES/VICTORIA JEMPTY"
299,6648412,5,Serve and enjoy!ALLRECIPES/VICTORIA JEMPTY
300,6649620,1,"Bring a large pot of lightly salted water to a boil. Add ziti pasta, and cook until al dente, about 8 minutes; drain."
301,6649620,2,"Meanwhile, brown ground beef and onion in a large skillet over medium heat; stir in spaghetti sauce and simmer for 15 minutes."
302,6649620,3,Preheat the oven to 350 degrees F (175 degrees C). Butter a 9x13-inch baking dish.
303,6649620,4,"Spread 1/2 of the ziti in the bottom of the prepared dish; top with Provolone cheese, sour cream, 1/2 of the meat sauce, remaining ziti, mozzarella cheese, and remaining meat sauce. Top with grated Parmesan cheese."
304,6649620,5,"Bake in the preheated oven until heated through and cheeses have melted, about 30 minutes."
305,6738826,1,"Mix ground beef, bread crumbs, egg, Worcestershire sauce, salt, onion powder, garlic powder, and pepper together in a large bowl until combined. Form into 8 balls and flatten into patties."
306,6738826,2,"Heat oil in a large skillet over medium heat. Add patties and onion; fry until patties are nicely browned, about 4 minutes per side. Transfer beef patties to a plate, and keep warm."
307,6738826,3,"Sprinkle flour over onions and drippings in the skillet. Stir in flour with a fork, scraping bits of beef off of the bottom of the skillet as you stir. Gradually mix in beef broth and sherry. Season with seasoned salt. Simmer and stir over medium-low heat until gravy thickens, about 5 minutes."
308,6738826,4,"Reduce heat to low, return patties to the gravy, cover, and simmer until cooked through, about 15 minutes."
309,6649763,1,"Gather all ingredients, and preheat the oven to 350 degrees F (175 degrees C).Dotdash Meredith Food Studios"
310,6649763,2,"Bring water and rice to a boil in a covered saucepan. Reduce heat to low and simmer until rice is tender, about 20 minutes."
311,6649763,3,"Meanwhile, heat oil in a skillet over medium heat. Add ground beef and cook until evenly browned and crumbly, 7 to 9 minutes.Dotdash Meredith Food StudiosDotdash Meredith Food Studios"
312,6649763,4,"Hollow out bell peppers by removing and discarding the tops, seeds, and membranes. Slice the bottoms of the peppers if necessary to make sure they stand up straight."
313,6649763,5,Arrange peppers in a baking dish with the hollowed sides facing upward.Dotdash Meredith Food Studios
314,6649763,6,"Prepare filling by mixing cooked beef, cooked rice, 1/2 of the tomato sauce, Worcestershire sauce, garlic powder, onion powder, salt, and pepper. Spoon an equal amount of filling into each hollowed pepper.Dotdash Meredith Food StudiosDotdash Meredith Food Studios"
315,6649763,7,"Mix remaining tomato sauce and Italian seasoning in a bowl, and pour over the stuffed peppers.Dotdash Meredith Food Studios"
316,6649763,8,"Bake in the preheated oven, basting with sauce every 15 minutes, until peppers are tender, about 1 hour.Dotdash Meredith Food Studios"
317,6649763,9,Serve hot and enjoy!Rita
318,6663165,1,Gather all ingredients.Dotdash Meredith Food Studios
319,6663165,2,Preheat a grill for high heat.
320,6663165,3,"Mix the ground beef, egg, bread crumbs, evaporated milk, Worcestershire sauce, cayenne pepper, and garlic in a large bowl using your hands.Dotdash Meredith Food Studios"
321,6663165,4,Form the mixture into 8 hamburger patties.Dotdash Meredith Food Studios
322,6663165,5,"Lightly oil the grill grate. Grill patties until browned and no longer pink, about 5 minutes per side."
323,6663165,6,Serve hot and enjoy!DOTDASH MEREDITH FOOD STUDIOS
324,6665025,1,Gather all ingredients.Dotdash Meredith Food Studios
325,6665025,2,Sauté ground beef in a large skillet over medium heat until browned and crumbly; 5 to 10 minutes.Dotdash Meredith Food Studios
326,6665025,3,"At the same time, fill a large pot with lightly salted water and bring to a rapid boil. Cook egg noodles at a boil until tender yet firm to the bite, 7 to 9 minutes. Drain and set aside."
327,6665025,4,"Drain and discard any fat from the cooked beef. Stir condensed soup and garlic powder into the beef. Simmer for 10 minutes, stirring occasionally.Dotdash Meredith Food Studios"
328,6665025,5,Remove beef from the heat. Add egg noodles and stir to combine. Stir in sour cream and season with salt and pepper.Dotdash Meredith Food Studios
329,6665025,6,Serve hot and enjoy!DOTDASH MEREDITH FOOD STUDIOS
330,6664293,1,"Combine pork and ground beef in a large, deep skillet over medium-high heat; cook and stir until browned and crumbly, 5 to 7 minutes. Add onion and cook until translucent, about 5 minutes."
331,6664293,2,"Stir in crushed tomatoes, tomato sauce, 1 tablespoon fresh parsley, garlic, basil, salt, oregano, and sugar. Reduce heat to medium-low and simmer, stirring occasionally, for 30 minutes."
332,6664293,3,"While the sauce is simmering, bring a large pot of lightly salted water to a boil. Cook lasagna noodles in the boiling water, stirring occasionally, until tender yet firm to the bite, 8 to 10 minutes. Drain and set aside."
333,6664293,4,"While the noodles are cooking, preheat the oven to 375 degrees F (190 degrees C)."
334,6664293,5,"Mix cottage cheese, Parmesan cheese, eggs, remaining 1 tablespoon fresh parsley, salt, and pepper in a large bowl until combined."
335,6664293,6,"Assemble lasagna: Spread a spoon or two of sauce over the bottom of a 9x13-inch baking dish just to to coat it. Place two layers of noodles over the sauce to cover. Layer with 1/2 of the cheese mixture, 1/2 of the remaining sauce, and 1/2 of the mozzarella cheese. Repeat layers once more using the remaining noodles, cheese mixture, sauce, and mozzarella. Cover the baking dish with aluminum foil."
336,6664293,7,"Bake in the preheated oven for 30 to 40 minutes. Remove the foil and bake until cheese is golden brown, 5 to 10 more minutes."
337,6664293,8,Remove from the oven and let stand for 10 minutes before cutting and serving.
338,6651165,1,"Combine beef, veal, and pork in a large bowl. Mix in cheese, eggs, garlic, parsley, salt, and pepper."
339,6651165,2,"Add bread crumbs and slowly mix in water, 1/2 cup at a time, until mixture is moist but still holds its shape (I usually use about 1 1/4 cups of water); shape into meatballs."
340,6651165,3,"Heat olive oil in a large skillet; add meatballs in batches and cook until browned on all sides, slightly crisp, and cooked through, about 10 to 15 minutes. Drain on paper towels."
341,6648974,1,Preheat the oven to 350 degrees F (175 degrees C).
342,6648974,2,"Mix bread crumbs, Romano cheese, parsley, salt, pepper, garlic powder, and onion powder together in a large bowl; stir in water and eggs. Add ground beef and mix until well combined. Form mixture into balls and place on a nonstick baking sheet."
343,6648974,3,"Bake in the preheated oven cooked through and evenly browned, about 30 minutes."
344,6648642,1,"Place ground beef and onion in a large saucepan over medium heat; cook and stir until meat is browned and onion is tender, about 5 to 7 minutes."
345,6648642,2,"Stir in tomato sauce, kidney beans, stewed tomatoes with juice, and water. Season with chili powder, garlic powder, salt, and black pepper. Bring to a boil, reduce heat to low, cover and let simmer for 15 minutes."
346,6664404,1,"Combine chuck roast, pepperoncini, pepperoncini juice, butter, au jus mix, ranch dressing mix, salt, and pepper in a slow cooker. Cover and cook on Low until roast is fork-tender, about 8 hours."
347,6664404,2,Remove chuck from slow cooker; shred with 2 forks and serve with gravy.
348,6663160,1,Gather all ingredients.Dotdash Meredith Food Studios
349,6663160,2,"Combine water, beer, and garlic in a multi-functional pressure cooker (such as Instant Pot).Dotdash Meredith Food Studios"
350,6663160,3,Place trivet inside. Place brisket on the trivet and sprinkle spice packet on top. Close and lock the lid. Select high pressure according to manufacturer's instructions; set timer for 90 minutes. Allow 10 minutes for pressure to build.Dotdash Meredith Food Studios
351,6663160,4,"Release pressure carefully using the quick-release method according to manufacturer's instructions, about 5 minutes. Unlock and remove the lid."
352,6663160,5,"Transfer brisket to a baking sheet, cover with aluminum foil, and let rest for 10 to 15 minutes.Dotdash Meredith Food Studios"
353,6663160,6,Serve hot and enjoy!DOTDASH MEREDITH FOOD STUDIOS
354,6737604,1,Preheat an air fryer to 350 degrees F (175 degrees C).
355,6737604,2,"Combine beef, pork, Parmesan cheese, bread crumbs, egg, garlic, Italian seasoning, and salt in a large bowl. Mix until evenly combined. Form into 16 equal meatballs (a small ice cream scoop is helpful) and place on a baking sheet."
356,6737604,3,Place 1/2 of the meatballs in the basket of the air fryer and cook 8 minutes. Shake the basket and cook 2 minutes more. Transfer to a serving plate and let rest for 5 minutes. Repeat with remaining meatballs.
