,id_recipe,Step_Count,Step Description
134,6892134,5,"Punch down the dough and transfer to a well-floured surface. Roll dough into a large 10 x 18-inches rectangle. Spread the filling over the surface of the dough, leaving a 1/2 inch border along the top long edge.Dotdash Meredith Food Studios"
135,6892134,6,"Roll the dough away from you to create a log, and pinch seam to seal.Dotdash Meredith Food Studios"
136,6892134,7,"Cut dough log into 12 equal rolls (about 1 1/2 inches wide). Transfer rolls to a greased 13 x 9 inch baking dish. Loosely cover with plastic wrap, and set aside to rise at room temperature until puffy and almost doubled in size, 30 to 45 minutes.Dotdash Meredith Food Studios"
137,6892134,8,Preheat the oven to 375 degrees F (190 degrees C).
138,6892134,9,"Bake rolls in the preheated oven until golden brown, 22 to 25 minutes."
139,6892134,10,"While rolls are baking, prepare the frosting. Combine cream cheese, powdered sugar, orange zest, orange zest, and salt in the bowl of a stand mixer fitted with the paddle attachment. Beat at medium-high speed until very smooth and creamy, 2 to 3 minutes."
140,6892134,11,"Remove rolls from oven and transfer to a wire rack. Let cool 2 minutes, then spread frosting evenly over the rolls. Serve warm.Dotdash Meredith Food Studios"
141,6891180,1,"Combine warm milk and dry active yeast in the bowl of your stand mixer; let stand for 10 minutes. Add flour, eggs, sugar, and salt. Use the dough hook to knead the mixture until the flour almost disappears, about 1 minute. Add the soft room temperature butter, and continue kneading the dough until a very smooth ball of dough forms, 4 to 5 minutes."
142,6891180,2,"Set dough into a lightly buttered bowl, cover, and let rise in a warm spot until doubled in size, 2 to 3 hours."
143,6891180,3,Punch down the dough and divide in 2 pieces. Form each half into a smooth ball and transfer each one into a plastic bag. Refrigerate bags overnight for best results or the dough can be used immediately. Each half of the dough will make 4 brioche.
144,6891180,4,"When ready to make, roll and stretch dough into a 14 x 10 inch rectangle. Spread 4 tablespoons of soft room temperature butter over two thirds of the dough, stopping 1/2 inch from the edge."
145,6891180,5,"Fold unbuttered third up over the top, and then the opposite end to complete the trifold. Gently press and seal the edges together. Fold in thirds again to form a square. Wrap and place in the freezer until cold and slightly firm, about 15 minutes."
146,6891180,6,"Roll the dough out into a rectangle about 1/4 inch thick, or thin enough to fold, and repeat the two folding in thirds step. Wrap and place in the freezer again until cold and slightly firm, 15 more minutes. A little bit of water can be used to help the dough stick if needed."
147,6891180,7,"Roll dough out into a rectangle again, just like in the previous step. Fold into thirds, but keep as a rectangle (do not make the second fold). Wrap and place in the freezer until cold and slightly firm, about 15 minutes."
148,6891180,8,"Roll dough into a 12 x 6 inch rectangle and place in the freezer until cold and slightly firm, about 15 minutes."
149,6891180,9,Trim off about 1/8 inch of dough from the sides and cut into 4 rectangles that are about 6 x 3 inches.
150,6891180,10,"Start with 1 piece (keeping the others in the fridge so they stay cool) and make two cuts starting 1/2 inch from top, all the way to the bottom to create 3 strips of dough. Braid together, and seal at bottom. Flip over and add about 1 tablespoon of dark chocolate chunks along the center of the braided dough, or more to taste. Roll up from the smaller end to create a knot. Place seam side down in buttered muffin tin."
151,6891180,11,"After all braids are done, cover, and let rise in a warm spot until doubled in size, about 1 hour."
152,6891180,12,Preheat the oven to 400 degrees F (200 degrees C).
153,6891180,13,"Brush brioche with egg wash, and sprinkle very lightly with some coarse salt. Then sprinkle very generously with the granulated sugar."
154,6891180,14,"Bake on the center rack of the preheated oven until nicely browned, 20 to 25 minutes. If brioches are getting too dark, tent with aluminum foil after 15 minutes."
155,6891180,15,Let cool in the pan for about 5 minutes and then transfer onto a rack to cool completely before serving.
156,6891086,1,"Combine rice flour, tapioca flour, sugar, baking powder, and salt in the bowl of a stand mixer fitted with the paddle attachment. Beat on low speed until combined, 1 minute. Add milk, butter, vanilla, and egg; beat on low speed until a smooth dough forms about 1 to 2 minutes (dough will be slightly sticky).Dotdash Meredith Food Studios"
157,6891086,2,"Lightly dust rice flour onto a clean work surface and turn dough onto surface. Divide dough into quarters and working in batches, roll dough quarters into 18-inch-long ropes about 1-inch wide."
158,6891086,3,"Cut each rope into 1-inch pieces. Roll each piece into a ball, wetting hands as needed to help roll (about 72 each for 9 donuts).Dotdash Meredith Food Studios"
159,6891086,4,"Cut 9 square pieces of parchment paper, 5x5-inches, and place in a single layer on a baking sheet. Arrange 8 dough balls onto each piece parchment in a ring about 3 1/2 inches in diameter, connecting them side by side and using water to seal together.Dotdash Meredith Food Studios"
160,6891086,5,Pour oil to a depth of 2 inches in a large Dutch oven; heat over medium-high to 350 degrees F (175 degrees C).
161,6891086,6,"Place 3 dough rings, along with parchment, in hot oil. Remove parchment with tongs once dough floats to top of oil. Cook until golden and puffed, turning once halfway through, 2 to 3 minutes. Transfer to a wire rack lined with paper towels; cool 10 minutes. Repeat with remaining dough rings."
162,6891086,7,"For the glaze whisk powdered sugar, 2 tablespoons milk, and vanilla together in a medium bowl. Mixture should be the consistency of heavy cream; add up to 1 tablespoon milk, 1 teaspoon at a time, as needed to adjust consistency. Dip tops of 4 or 5 doughnuts into the glaze; place on wire rack (with paper towel removed).Dotdash Meredith Food Studios"
163,6891086,8,Stir 2 teaspoons dried fruit powder into remaining glaze. Dip remaining doughnuts in the glaze; transfer to wire rack and sprinkle with remaining fruit powder.Dotdash Meredith Food Studios
164,6836099,1,"Combine warm milk, warm water, and dry yeast in the mixing bowl of a stand mixer . Let sit for 10 minutes. Add eggs, sugar, salt, and 1/2 cup melted butter. Whisk all wet ingredients together. Add all purpose flour and knead with the dough hook (or manually) until dough comes together as a ball, 5 to 6 minutes."
165,6836099,2,"Place dough into a lightly buttered bowl, cover, and let sit until the dough is doubled in size, about 2 hours."
166,6836099,3,"Press the dough until it is flat, and divide into 24 equal portions. Form each portion into a smooth ball."
167,6836099,4,Line a baking sheet with a Silpat mat or parchment paper.
168,6836099,5,"Take each ball of dough and roll out on a lightly floured surface into an oval, 4 to 5 inches long. Brush the top with some of the remaining butter and fold in half."
169,6836099,6,"Transfer the rolls to the prepared baking sheet, arranging in 6 rows of 4 rolls. Cover with a clean kitchen towel and let the rolls rise in a warm spot until almost doubled in size, about 1 hour."
170,6836099,7,Preheat the oven to 350 degrees C (175 degrees C).
171,6836099,8,"Bake rolls in the preheated oven until golden brown on top, about 25 minutes."
172,6836099,9,"While rolls are still warm, brush the tops of the rolls with melted butter."
173,6745326,1,Gather all ingredients.Dotdash Meredith Food Studios
174,6745326,2,"Combine sugar, yeast, salt, and 4 cups of the flour in the work bowl of a stand mixer fitted with the paddle attachment. Beat on low speed until just combined, about 15 seconds. With mixer running on low speed, add eggnog, sour cream, butter, and egg. Continue beating until dough forms, 1 to 2 minutes. Switch to a dough hook attachment. Beat on medium-low speed until dough is smooth and elastic, 6 to 9 minutes; gradually add remaining 1/2 cup flour, 1/2 to 1 teaspoon at a time, if necessary."
175,6745326,3,"Place dough in a large bowl greased with cooking spray and turn to coat. Cover with a clean kitchen towel and let rise in a warm draft-free place until dough has doubled in size, 2 to 3 hours.Dotdash Meredith Food Studios"
176,6745326,4,"Spray a 13- x 9-inch pan with cooking spray. Lightly punch down dough. On a lightly floured surface, roll dough into an 18- x 10-inch rectangle.Dotdash Meredith Food Studios"
177,6745326,5,"For the filling spread 1/2 cup of butter over the dough. In a small bowl, stir together brown sugar, cinnamon, and nutmeg. Sprinkle evenly over butter.Dotdash Meredith Food Studios"
178,6745326,6,"Starting with one long side, roll dough into a log; pinch seam to seal.Dotdash Meredith Food Studios"
179,6745326,7,Slice into 12 rolls.Dotdash Meredith Food Studios
180,6745326,8,"Place rolls in the prepared pan. Cover, and let rise in a warm draft-free place until doubled in size, 1 hour to 1 hour and 15 minutes.Dotdash Meredith Food Studios"
181,6745326,9,Preheat the oven to 350 degrees F (175 degrees C).
182,6745326,10,"Bake in the preheated oven, uncovered, until golden brown, 25 to 30 minutes. Let cool in pan on a wire rack 15 minutes.Dotdash Meredith Food Studios"
183,6745326,11,"Add cream cheese and 4 tablespoons butter to the bowl of a stand mixer fitted with the paddle attachment; beat on medium speed until smooth, 1 to 2 minutes. Add powdered sugar, eggnog, and vanilla. Beat on medium speed until smooth, about 1 minute."
184,6745326,12,"Drizzle glaze over warm rolls. Serve with freshly grated nutmeg sprinkled on top and any extra glaze, if desired.Dotdash Meredith Food Studios"
185,6585801,1,Mix flour and salt together in a bowl. Stir in water to form a soft dough.
186,6585801,2,Turn dough out onto a lightly floured work surface and knead several times. Divide into 8 pieces and roll each into a ball. Roll each ball into a very thin round using a rolling pin.
187,6585801,3,"Heat a griddle over medium-high heat. Cook each dough round on griddle until dough bubbles and blisters appear, about 2 minutes. Flip and cook until lightly browned on the other side."
188,6831139,1,"Mix together milk and water in a glass measuring cup for the dough. Microwave mixture until it reaches 105 degrees F to 115 degrees F (40 degrees C to 46 degrees C), 30 to 60 seconds."
189,6831139,2,"Whisk together flour, sugar, yeast, and salt in a large bowl. Add eggs, melted butter, and milk mixture. Beat with an electric mixer at medium speed until a soft dough forms and begins to pull away from sides of bowl, 3 to 5 minutes. (Dough will be sticky.) Lightly grease a bowl. Transfer dough to the bowl and turn to coat. Chill, covered, until dough is easy to handle, at least 2 hours or up to overnight."
190,6831139,3,Grease two 9-inch round cake pans or two 8x8-inch baking pans.
191,6831139,4,"Stir together brown sugar and cinnamon in a small bowl. Punch down dough; divide in half. Roll out one portion of dough on a lightly floured surface into a 6x16-inch rectangle. (If dough springs back when rolling, let rest for 5 to 10 minutes.) Spread 2 tablespoons softened butter over the dough. Sprinkle half of the cinnamon-brown sugar mixture over butter; gently pat mixture so it adheres to the dough."
192,6831139,5,"Starting on a long side, roll up dough and pinch along seam to seal. Slice dough log into 16 (1-inch-thick) pieces. Put rolls, cut sides down, in one of the prepared pans. Repeat with the remaining dough, cinnamon-sugar, and softened butter. Let rise, covered, in a warm place until rolls nearly double in size, about 30 minutes."
193,6831139,6,Preheat the oven to 375 degrees F (190 degrees C).
194,6831139,7,"Bake until rolls until golden brown, 17 to 22 minutes. Cool in pan on a wire rack 10 minutes."
195,6831139,8,"Meanwhile for the icing, beat cream cheese, softened butter, milk, and vanilla with an electric mixer at medium speed until creamy, 1 to 2 minutes. Gradually beat in powdered sugar until smooth. Drizzle rolls with icing and serve warm."
196,6752540,1,"Combine warm milk, molasses, and yeast in a small bowl and stir together until combined. Let sit until foamy, about 5 minutes."
197,6752540,2,"Add sugar, salt, and 4 1/2 cups of the flour to the work bowl of a stand mixer fitted with the paddle attachment. Beat on low speed until just combined, about 15 seconds.Dotdash Meredith Food Studios"
198,6752540,3,"With mixer running on low speed, add milk mixture, sour cream, butter, and egg. Continue beating until dough forms, 1 to 2 minutes."
199,6752540,4,"Switch to a dough hook attachment. Beat on medium-low speed until dough is smooth and elastic, 6 to 9 minutes; add remaining 1/4 cup flour 1/2 to 1 teaspoon at a time, if necessary.Dotdash Meredith Food Studios"
200,6752540,5,"Place dough in a large bowl greased with cooking spray and turn to coat. Cover with a clean kitchen towel. Let rise in a warm draft-free place until dough has doubled in size, 1 hour 30 minutes to 2 hours."
201,6752540,6,"Spray a 13x 9-inch pan with cooking spray. Lightly punch down dough. On a lightly floured surface, roll dough into an 18x10-inch rectangle.Dotdash Meredith Food Studios"
202,6752540,7,"Spread 1/2 cup butter over dough for the filling. In a small bowl, stir together brown sugar, molasses, cinnamon, ginger, and cloves until well combined. Sprinkle evenly over butter.Dotdash Meredith Food Studios"
203,6752540,8,"Starting with one long side, roll dough into a log, pinching seam to seal.Dotdash Meredith Food Studios"
204,6752540,9,"Slice into 12 rolls. Place rolls in the prepared pan. Cover, and let rise in a warm draft-free place until doubled in size, 45 to 60 minutes.Dotdash Meredith Food StudiosDotdash Meredith Food Studios"
205,6752540,10,Preheat the oven to 350 degrees F (175 degrees C).
206,6752540,11,"Bake in the preheated oven, uncovered, until golden brown, 25 to 30 minutes. Let cool in the pan on a wire rack for 15 minutes.Dotdash Meredith Food Studios"
207,6752540,12,"Add cream cheese and 4 tablespoons butter to the bowl of a stand mixer fitted with the paddle attachment; beat on medium speed until smooth, 1 to 2 minutes. Add powdered sugar, vanilla, and milk. Beat on medium speed until smooth, about 1 minute. If desired, add more milk, 1 teaspoon at a time, until desired consistency is reached."
208,6752540,13,Spread glaze over warm rolls.Dotdash Meredith Food Studios
209,6583633,1,Preheat oven to 375 degrees F (190 degrees C).
210,6583633,2,"Combine ricotta cheese, 1/2 of the mozzarella cheese, Parmesan cheese, egg, and Italian seasoning in a bowl."
211,6583633,3,"Cook sausage in a skillet over medium heat until no longer pink, 5 to 10 minutes; drain. Stir in marinara sauce."
212,6583633,4,Spread 1/6 of the cheese mixture evenly on each flatbread; cover with sausage mixture. Top with remaining mozzarella cheese.
213,6583633,5,"Bake in the preheated oven until cheese is melted and bubbly, 10 to 15 minutes."
214,6825961,1,"Combine flour, yeast, sugar, salt, and cinnamon in the work bowl of a stand mixer fitted with dough hook attachment; mix on low until combined. Add egg, warm water, butter, and vanilla; continue mixing on low until dough begins to come together, about 1 minute. Increase speed to medium and continue beating until dough is soft and smooth, about 5 minutes.Dotdash Meredith Food Studios"
215,6825961,2,"Spray a large bowl with cooking spray and set dough inside. Cover and let stand in a warm place (75 degrees F (23 degrees C)) until doubled in size, 1 1/2 to 2 hours.Dotdash Meredith Food Studios"
216,6825961,3,"Punch down the dough, and turn out onto a lightly floured surface. Roll into a 9x18-inch rectangle about 1/4-inch thick. Let rest, uncovered, at room temperature, about 10 minutes. Lightly spray a 9x5-inch loaf pan with cooking spray."
217,6825961,4,"While the dough is resting, stir together sugar, flour, and cinnamon for the filling in a small bowl until combined. Stir in melted butter until mixture is smooth. If dough shrank while resting, re-roll into a 9x 18-inch rectangle. Spread filling in an even layer over the dough, leaving a 1/2-inch border around the edges.Dotdash Meredith Food Studios"
218,6825961,5,"Beginning with the long edge, roll dough gently into a log, pinching seam and ends to seal. Using a serrated knife, cut log in half lengthwise. With cut sides up, twist the two pieces together; tuck ends underneath and place into the prepared loaf pan. Whisk together egg yolk and 1 tablespoon water; gently brush egg wash over the dough.Dotdash Meredith Food StudiosDotdash Meredith Food Studios"
219,6825961,6,"Stir together flour, sugar, cinnamon, and salt for the topping in a bowl until combined. Using your fingers, work in cold butter until coarse crumbs form. Sprinkle topping evenly over the loaf. Loosely cover loaf and let rise in a warm place (75 degrees F (23 degrees C)) until doubled in size, about 1 hour.Dotdash Meredith Food Studios"
220,6825961,7,"Preheat the oven to 350 degrees F (175 degrees C). Bake uncovered in the preheated oven until babka is a deep golden brown and a thermometer inserted in the center registers 190 degrees F (87 degrees C), about 45 minutes. After about 25 minutes, cover babka with aluminum foil so surface does not get too dark."
221,6825961,8,"Set the pan on a wire rack and allow to cool, 10 minutes. Remove from the pan; let cool slightly, about 20 minutes more. Serve warm."
222,6665023,1,Preheat the oven to 400 degrees F (200 degrees C). Lightly grease a 9-inch round cake pan.
223,6665023,2,"Whisk flour, cornmeal, sugar, baking powder, and salt together in a large bowl. Add milk, vegetable oil, and egg; whisk until well combined. Pour batter into the prepared pan."
224,6665023,3,"Bake in the preheated oven until a toothpick inserted into the center of the pan comes out clean, 20 to 25 minutes."
225,6664511,1,Preheat the oven to 400 degrees F (200 degrees C). Grease 8 muffin cups or line with paper liners.
226,6664511,2,"For the muffins: Whisk flour, sugar, baking powder, and salt together in a large bowl."
227,6664511,3,Pour oil into a small liquid measuring cup. Add egg and enough milk to reach the 1-cup mark; stir until combined. Pour into flour mixture and mix just until batter is combined. Fold in blueberries; set batter aside.
228,6664511,4,"For the crumb topping: Combine sugar, flour, butter, and cinnamon in a small bowl. Mix with a fork until crumbly."
229,6664511,5,"Spoon batter into the prepared muffin cups, filling right to the top. Sprinkle with crumb topping."
230,6664511,6,"Bake in the preheated oven until a toothpick inserted in the center of a muffin comes out clean, 20 to 25 minutes."
231,6663850,1,Preheat the oven to 350 degrees F (175 degrees C). Lightly grease a 9x5-inch loaf pan.
232,6663850,2,"Combine flour, baking soda, and salt in a large bowl. Beat brown sugar and butter with an electric mixer in a separate large bowl until smooth. Stir in eggs and mashed bananas until well blended. Stir banana mixture into flour mixture until just combined. Pour batter into the prepared loaf pan."
233,6663850,3,"Bake in the preheated oven until a toothpick inserted into the center comes out clean, about 60 minutes. Let bread cool in pan for 10 minutes, then turn out onto a wire rack to cool completely."
234,6663152,1,Preheat the oven to 325 degrees F (165 degrees C). Grease and flour two 8x4-inch pans.
235,6663152,2,"Sift flour, salt, baking powder, baking soda, and cinnamon together in a large bowl."
236,6663152,3,"Beat eggs, oil, sugar, and vanilla together in a separate large bowl with an electric mixer until combined; add flour mixture and beat well. Stir in zucchini and walnuts until well combined. Pour batter into the prepared pans."
237,6663152,4,"Bake in the preheated oven until a toothpick inserted into the center comes out clean, about 40 to 60 minutes. Cool in the pans on a wire rack for 20 minutes. Run a table knife around the edges to loosen. Invert carefully onto a wire rack and let cool completely.Dotdash Meredith Food Studios"
238,6650456,1,"Preheat the oven to 325 degrees F (165 degrees C). Grease a 9x5-inch loaf pan, preferably glass."
239,6650456,2,"Mix flour, baking powder, baking soda, and salt in a bowl. Stir bananas, milk, and cinnamon in another bowl. Beat sugar and butter together in a third bowl with an electric mixer until light and fluffy; add eggs one at a time, beating well after each addition. Stir banana mixture into butter mixture; mix in flour mixture until just blended. Fold in chocolate chips; pour batter into the prepared loaf pan."
240,6650456,3,"Bake in the preheated oven until a toothpick inserted into the center comes out clean, about 70 minutes. Cool in the pan for 10 minutes before removing to cool completely on a wire rack before slicing."
241,6648543,1,"Gather all ingredients. Preheat oven to 450 degrees F (230 degrees C), and lightly grease a pizza pan.Dotdash Meredith Food Studios"
242,6648543,2,"Place warm water in a bowl; add yeast and sugar. Mix and let stand until creamy, about 10 minutes.Dotdash Meredith Food Studios"
243,6648543,3,"Add flour, oil, and salt to the yeast mixture; beat until smooth. You can do this by hand or use a stand mixer fitted with a dough hook to make it easier.Dotdash Meredith Food Studios"
244,6648543,4,Let rest for 5 minutes.Dotdash Meredith Food Studios
245,6648543,5,Turn dough out onto a lightly floured surface and pat or roll into a 12-inch circle.Dotdash Meredith Food Studios
246,6648543,6,Transfer to the prepared pizza pan.Dotdash Meredith Food Studios
247,6648543,7,Spread crust with sauce and toppings of your choice.Dotdash Meredith Food Studios
248,6648543,8,"Bake in the preheated oven until golden brown, 15 to 20 minutes. Remove from the oven and let cool for 5 minutes before serving.Vilma Ng"
249,6648200,1,"Preheat the oven to 350 degrees F (175 degrees C). Grease a 12-cup muffin tin or line cups with paper liners. Sift flour, baking powder, baking soda, and salt together in a bowl; set aside."
250,6648200,2,"Mix bananas, sugar, egg, and melted butter in a separate large bowl until well combined; fold in flour mixture until smooth. Spoon batter into the prepared muffin cups, filling each 2/3 full."
251,6648200,3,"Bake in the preheated oven until tops spring back when lightly pressed, about 25 to 30 minutes. Cool briefly in the tin, then transfer to a wire rack to cool completely."
252,6565970,1,Preheat the oven to 400 degrees F (200 degrees C). Grease a 9x5-inch loaf pan.
253,6565970,2,Mix sugar and cinnamon together in a bowl.
254,6565970,3,"Set icing packet aside. Cut cinnamon rolls into quarters. Dip pieces in melted butter, coat in cinnamon-sugar, and place in the prepared pan."
255,6565970,4,"Bake in the preheated oven until dough has risen and top is golden brown, 20 to 25 minutes; drizzle icing over top and let cool in the pan for 5 minutes. Turn the monkey bread out onto a plate and serve warm."
256,6651195,1,"Whisk flour, baking powder, and salt together in a mixing bowl. Rub in lard with your fingers until mixture resembles cornmeal. Add water and mix until dough comes together."
257,6651195,2,Transfer dough onto a lightly floured surface; knead for a few minutes until smooth and elastic. Divide dough into 24 equal pieces and roll each piece into a ball.
258,6651195,3,"Preheat a large skillet over medium-high heat. Use a well-floured rolling pin to roll a dough ball into a thin, round tortilla. Place into the hot skillet, and cook until bubbly and golden; flip and continue cooking until golden on the other side. Place the cooked tortilla in a tortilla warmer; continue rolling and cooking the remaining dough."
259,6649845,1,Preheat the oven to 350 degrees F (175 degrees C). Grease a 9x5-inch loaf pan.
260,6649845,2,"Stir sugar and melted butter together in a large bowl. Add eggs and vanilla; mix well. Combine flour, baking soda, and salt; stir into butter mixture until smooth. Fold in banana slices, sour cream, and walnuts; transfer into the prepared pan."
261,6649845,3,"Bake in the preheated oven until a toothpick inserted into the center of the loaf comes out clean, about 1 hour. Cool loaf in the pan for 10 minutes before inverting onto a wire rack to cool completely."
262,6650088,1,"Place water, sugar, and yeast in the pan of the bread machine. Let yeast dissolve and foam for 10 minutes. Add oil, flour, and salt to the yeast. Select Basic or White Bread setting, and press Start."
263,6650088,2,Remove loaf from the machine after the cycle is done; cool in the pan for 5 minutes before turning it out onto a rack to cool completely.
264,6649717,1,Preheat the oven to 400 degrees F (200 degrees C). Grease a 12-cup muffin tin or line cups with paper liners.
265,6649717,2,"Combine milk, oil, and egg in a small bowl until well blended. Combine flour, 1/2 cup sugar, baking powder, and salt together in a large bowl, making a well in the center. Pour milk mixture into well and stir until batter is just combined; fold in chocolate chips."
266,6649717,3,"Spoon batter into the prepared muffin cups, filling each 2/3 full. Mix 3 tablespoons white sugar and brown sugar together in a small bowl; sprinkle on tops of muffins."
267,6649717,4,"Bake in the preheated oven until tops spring back when lightly pressed, about 20 to 25 minutes. Cool in the tin briefly, then transfer to a wire rack. Serve warm or cool completely."
268,6663335,1,Preheat the oven to 350 degrees F (175 degrees C). Grease and flour two 9x5-inch loaf pans.
269,6663335,2,"Whisk flour, baking soda, salt, cinnamon, nutmeg, cloves, and ginger together in a large bowl.Dotdash Meredith Food Studios"
