,id_recipe,Step_Count,Step Description
270,6663335,3,"Mix pumpkin puree, eggs, oil, water, and sugar in a separate bowl until well blended."
271,6663335,4,Stir flour mixture into pumpkin mixture until just blended.Dotdash Meredith Food StudiosDotdash Meredith Food Studios
272,6663335,5,Pour batter into the prepared pans.Dotdash Meredith Food Studios
273,6663335,6,"Bake in the preheated oven until a toothpick inserted in center comes out clean, about 50 minutes.Dotdash Meredith Food Studios"
274,6663335,7,Enjoy!DOTDASH MEREDITH FOOD STUDIOS
275,6663557,1,Preheat the oven to 400 degrees F (200 degrees C). Lightly grease a baking sheet.
276,6663557,2,"Combine flour, sugar, baking powder, and salt in a large bowl; cut in butter with 2 knives or a pastry blender until mixture resembles coarse crumbs. Whisk milk and egg in a small bowl; gradually stir into flour mixture until moistened."
277,6663557,3,"Turn dough out onto a lightly floured surface and knead briefly, 5 or 6 turns. Pat or roll dough out into a 1/2-inch thick round. Cut into 8 wedge-shaped pieces and place onto the prepared baking sheet."
278,6663557,4,"Bake scones in the preheated oven until golden brown on top, about 15 minutes."
279,6649875,1,Gather all ingredients.Dotdash Meredith Food Studios
280,6649875,2,Preheat oven to 350 degrees F (175 degrees C). Grease one 9- or 10-inch tube or Bundt® pan.
281,6649875,3,Mix white sugar and cinnamon in a plastic bag. Cut biscuits into quarters. Shake 6 to 8 biscuit pieces in the sugar-cinnamon mix.Dotdash Meredith Food Studios
282,6649875,4,"Arrange pieces in the bottom of the prepared pan. Continue until all biscuits are coated and placed in the pan. If using walnuts and raisins, arrange in and among the biscuit pieces as you go along.Dotdash Meredith Food Studios"
283,6649875,5,Melt margarine with the brown sugar in a small saucepan over medium heat. Boil for 1 minute. Pour over the biscuits.Dotdash Meredith Food Studios
284,6649875,6,"Bake in the preheated oven for 35 minutes. Let bread cool in the pan for 10 minutes, then turn out onto a plate. Do not cut! The bread just pulls apart.DOTDASH MEREDITH FOOD STUDIOS"
285,6739313,1,Preheat the oven to 400 degrees F (200 degrees C). Grease a 12-cup muffin tin or line cups with paper liners.
286,6739313,2,"Stir flour, baking powder, salt, and sugar together in a large bowl; make a well in the center."
287,6739313,3,"Beat egg with a fork in a small bowl or 2-cup measuring cup; whisk in milk and oil. Pour egg mixture all at once into flour mixture; mix quickly and lightly with a fork until just moistened. The batter will be lumpy. (Fold in additional ingredients if using; see variations below). Spoon batter into the prepared muffin cups, filling each 3/4 full."
288,6739313,4,"Bake in the preheated oven until tops spring back when lightly pressed, about 25 minutes."
289,6650741,1,Preheat the oven to 375 degrees F (190 degrees C). Lightly grease a large baking sheet.
290,6650741,2,"Mix flour, softened margarine, sugar, baking soda, baking powder, and salt together in a large bowl. Stir in 1 cup of buttermilk and egg. Turn dough out onto a lightly floured surface and knead slightly. Form dough into a round and place on the prepared baking sheet."
291,6650741,3,Combine melted butter with 1/4 cup buttermilk in a small bowl; brush loaf with this mixture. Use a sharp knife to cut an 'X' into the top of the loaf.
292,6650741,4,"Bake in preheated oven until a toothpick inserted into the center of the loaf comes out clean, 45 to 50 minutes. Check for doneness after 30 minutes. You may continue to brush the loaf with the butter mixture while it bakes.WeirdAuntMartha"
293,6649341,1,Preheat the oven to 400 degrees F (200 degrees C). Brush a 9-inch square baking dish with 2 tablespoons of the melted butter.Dotdash Meredith Food Studios
294,6649341,2,"To make the dough: Whisk flour, 2 tablespoons white sugar, baking powder, and salt together in a large bowl. Work 3 tablespoons softened butter into flour mixture using your hands.Dotdash Meredith Food Studios"
295,6649341,3,Beat milk and egg together in another bowl; pour into flour-butter mixture and stir with a rubber spatula until a soft dough forms.Dotdash Meredith Food Studios
296,6649341,4,Turn dough out onto a well-floured work surface and roll dough into a 1/4-inch thick rectangle. Brush surface of dough with remaining 2 tablespoons melted butter.
297,6649341,5,"To make the filling: Whisk 1/2 cup white sugar, brown sugar, and cinnamon together in a small bowl. Sprinkle 1/2 of the cinnamon sugar mixture in the bottom of the prepared baking dish. Sprinkle remaining cinnamon sugar over butter-brushed dough.Dotdash Meredith Food Studios"
298,6649341,6,Roll dough around filling to form a log; cut log into 18 rolls and place rolls in the prepared baking dish.Dotdash Meredith Food StudiosDotdash Meredith Food Studios
299,6649341,7,"Bake in the preheated oven until rolls are set, 20 to 25 minutes."
300,6649341,8,"To make the frosting: Beat confectioners' sugar, cream cheese, 1/4 cup softened butter, and vanilla extract together in a bowl until frosting is smooth."
301,6649341,9,Top hot cinnamon rolls with cream cheese frosting.DOTDASH MEREDITH FOOD STUDIOS
302,6663469,1,Gather all ingredients and preheat oven to 450 degrees F (230 degrees C).Dotdash Meredith Food Studios
303,6663469,2,"In a large mixing bowl sift together flour, baking powder and salt. Cut in shortening with fork or pastry blender until mixture resembles coarse crumbs.Dotdash Meredith Food StudiosDotdash Meredith Food StudiosDotdash Meredith Food Studios"
304,6663469,3,"Pour milk into flour mixture while stirring with a fork. Mix in milk until dough is soft, moist and pulls away from the side of the bowl.Dotdash Meredith Food StudiosDotdash Meredith Food Studios"
305,6663469,4,"Turn dough out onto a lightly floured surface and knead dough briefly, 5 to 7 times.Dotdash Meredith Food StudiosDotdash Meredith Food Studios"
306,6663469,5,Roll dough out into a 1/2 inch thick sheet and cut out biscuits with a floured cookie cutter. Press together unused dough and repeat rolling and cutting procedure.Dotdash Meredith Food StudiosDotdash Meredith Food Studios
307,6663469,6,"Place biscuits on ungreased baking sheets and bake in preheated oven until golden brown, about 10 minutes.Dotdash Meredith Food StudiosDotdash Meredith Food Studios"
308,6663469,7,Enjoy!Rita Pellegrini / Allrecipes
309,6648387,1,"Mix flour, baking powder, and salt together in a bowl; stir in milk and olive oil until a soft dough forms. Turn dough onto a lightly floured surface and knead 10 times. Shape dough into a ball; cover with an inverted bowl and let sit for 10 minutes."
310,6648387,2,Roll dough into a 12-inch circle on a baking sheet.
311,6663436,1,Preheat oven to 425 degrees F (220 degrees C). Line a baking sheet with a silicone baking mat or parchment paper.
312,6663436,2,"Whisk flour, baking powder, baking soda, and salt together in a large bowl. Add cold butter slices and cut into the flour with a pastry blender until the mixture resembles coarse crumbs."
313,6663436,3,Make a well in the center of the mixture. Pour cold buttermilk into the well and stir gently until just combined.
314,6663436,4,Turn dough onto a floured work surface and pat it together into a rectangle.
315,6663436,5,"Fold the rectangle in thirds. Turn dough a half turn, gather any crumbs, and flatten back into a rectangle. Repeat twice more, folding and pressing the dough a total of three times."
316,6663436,6,Roll dough on a floured surface to about 1/2 inch thick. Use a 2 1/2-inch round biscuit cutter to cut biscuits. Reroll any scraps to cut more biscuits; you should get 12 total.
317,6663436,7,Transfer biscuits to the prepared baking sheet. Press an indent into the top of each biscuit with your thumb. Brush buttermilk over the tops.
318,6663436,8,"Bake in the preheated oven until biscuits are flaky and golden brown, about 15 minutes."
319,6663436,9,Enjoy!DOTDASH MEREDITH FOOD STUDIOS
320,6664124,1,"Combine 3/4 cup flour, sugar, undissolved yeast, and salt in a large bowl.Dotdash Meredith Food Studios"
321,6664124,2,"Heat milk, water, and 2 tablespoons butter in a saucepan until very warm (120 degrees to 130 degrees F).Dotdash Meredith Food Studios"
322,6664124,3,"Add warm milk mixture to the flour mixture. Beat for 2 minutes on medium speed of an electric mixer, scraping the bowl occasionally. Add 1/4 cup flour; beat for 2 minutes at high speed. Stir in enough remaining flour to make soft dough.Dotdash Meredith Food StudiosDotdash Meredith Food Studios"
323,6664124,4,"Knead dough on a lightly floured surface until smooth and elastic, about 8 to 10 minutes. Cover; let rest for 10 minutes.Dotdash Meredith Food Studios"
324,6664124,5,Divide dough into 12 equal pieces.Dotdash Meredith Food Studios
325,6664124,6,"Shape pieces into balls and place in a greased 8-inch round pan. Cover and let rise in warm, draft-free place until doubled in size, about 30 minutes.Dotdash Meredith Food StudiosDotdash Meredith Food Studios"
326,6664124,7,Preheat the oven to 375 degrees F (190 degrees C).
327,6664124,8,"Bake rolls in the preheated oven until golden brown on top, about 20 minutes.Dotdash Meredith Food Studios"
328,6664124,9,Serve warm and enjoy!DOTDASH MEREDITH FOOD STUDIOS
329,6650503,1,"Combine water, 2 ½ tablespoons sugar, salt, and 2 tablespoons vegetable oil in a small saucepan and place over medium heat. Bring to a boil and remove from the heat. Stir in flour, stirring until mixture forms a ball."
330,6650503,2,Heat oil for frying in a deep fryer or deep pot to 375 degrees F (190 degrees C).
331,6650503,3,Transfer dough to a sturdy pastry bag fitted with a medium star tip. Carefully pipe a few 5- to 6-inch strips of dough into the hot oil; work in batches so you don't crowd the fryer. Cook until golden; use a spider or slotted spoon to transfer churros to paper towels to drain.
332,6650503,4,Combine 1/2 cup sugar and cinnamon. Roll drained churros in cinnamon and sugar mixture.
333,6596545,1,Gather all ingredients.Dotdash Meredith Food Studios
334,6596545,2,"Preheat the oven to 350 degrees F (175 degrees C). Lightly grease an 8x4-inch loaf pan, or line with parchment paper."
335,6596545,3,"Mix almond flour, flaxseed meal, eggs, almond milk, olive oil, baking powder, and salt together in a bowl until a soft dough forms.Dotdash Meredith Food Studios"
336,6596545,4,Transfer to the prepared loaf pan.Dotdash Meredith Food Studios
337,6596545,5,"Bake in the preheated oven until golden brown on top, about 40 minutes. Cool in the loaf pan for 10 minutes before transferring to a wire rack to cool completely.Dotdash Meredith Food Studios"
338,6650039,1,Preheat the oven to 400 degrees F (200 degrees C); adjust the oven rack to the lower-middle position. Line a baking tray with parchment paper.
339,6650039,2,"Mix flour, 1/3 cup sugar, baking powder, salt, and baking soda in a medium bowl. Grate butter into flour mixture on the large holes of a box grater. Use your fingers to work in butter until mixture resembles coarse crumbs, then toss in raisins."
340,6650039,3,Whisk sour cream and egg together in a small bowl until combined.
341,6650039,4,Stir sour cream mixture into flour mixture using a fork until large dough clumps form. Use your hands to shape dough into a ball. (Dough may seem dry at first but will come together as you work it.)
342,6650039,5,"Place dough on a lightly floured surface and pat into a 7- to 8-inch circle, about 3/4-inch thick. Sprinkle with remaining 1 teaspoon of sugar. Use a sharp knife to cut into 8 equal triangles; place on the prepared baking tray, about 1-inch apart."
343,6650039,6,"Bake scones in the preheated oven until golden, about 15 to 17 minutes. Cool for 5 minutes; serve warm or at room temperature."
344,6740965,1,Preheat the oven to 375 degrees F (190 degrees C). Grease 12 muffin cups or line with paper muffin liners.
345,6740965,2,Mix wheat bran and buttermilk together in a large bowl; let stand for 10 minutes.
346,6740965,3,"Meanwhile, beat brown sugar, oil, egg, and vanilla together in a separate bowl until light and fluffy; stir into buttermilk mixture."
347,6740965,4,"Sift flour, baking soda, baking powder, and salt together; stir into buttermilk mixture until just blended. Fold in raisins; spoon batter into the prepared muffin cups, filling each 2/3 full."
348,6740965,5,"Bake in the preheated oven until tops spring back when lightly pressed, about 15 to 20 minutes. Cool in the tin briefly, then transfer to a wire rack to cool completely."
349,6649532,1,Preheat the oven to 375 degrees F (175 degrees C). Grease an 8-inch square pan.
350,6649532,2,Melt butter in a large skillet over medium heat. Remove from heat and stir in sugar. Quickly whisk in eggs.
351,6649532,3,"Combine buttermilk and baking soda in a small bowl; whisk mixture into the skillet. Stir in cornmeal, flour, and salt until well-blended and only a few lumps remain. Pour batter into the prepared pan."
352,6649532,4,"Bake in the preheated oven until a toothpick inserted in the center comes out clean, 30 to 40 minutes."
353,6738854,1,"Dissolve yeast and sugar in warm water that's 110 degrees F (44 degrees C) in a small bowl. Let stand until yeast softens and begins to form a creamy foam, about 5 to 8 minutes."
354,6738854,2,Combine 1 3/4 cups flour and salt in a large bowl. Pour in yeast mixture; mix well until dough comes together.
355,6738854,3,"Transfer dough to a floured surface and knead until smooth, about 2 minutes. Add remaining 1/4 cup flour if dough is too sticky."
356,6738854,4,Roll dough into a 12-inch circle. Transfer to a greased pizza pan.
357,6663528,1,Preheat the oven to 500 degrees F (260 degrees C).
358,6663528,2,"Mix flour and Greek yogurt together in a bowl to form a dough; transfer to a work surface floured with self-rising flour. Knead dough, adding more flour as needed to keep dough from being too sticky, about 8 to 10 minutes."
359,6663528,3,Spray a 12-inch pizza pan with cooking spray and spread dough to the edges of the pan.
360,6663528,4,"Bake pizza crust in preheated oven for 5 to 7 minutes; add your favorite toppings and return to the preheated oven. Bake until crust is lightly browned, 5 to 7 minutes more."
361,6648670,1,Preheat the oven to 400 degrees F (205 degrees C). Line a 12-cup muffin tin with paper liners.
362,6648670,2,"Combine flour, oats, sugar, baking powder, soda, and salt in a medium bowl; set aside."
363,6648670,3,"Beat egg lightly in a large bowl. Whisk in milk, oil, and vanilla. Stir in mashed bananas. Add the flour mixture and stir until just combined. Spoon batter into the prepared muffin cups, filling each 3/4 full."
364,6648670,4,"Bake in the preheated oven until tops spring back when lightly pressed, 18 to 20 minutes."
365,6650301,1,Gather all ingredients.Dotdash Meredith Food Studios
366,6650301,2,Preheat the oven to 375 degrees F (190 degrees C).
367,6650301,3,Beat eggs and milk together in a medium bowl.Dotdash Meredith Food Studios
368,6650301,4,Stir in flour.Dotdash Meredith Food Studios
369,6650301,5,"Divide butter evenly into the cups of a 12-cup muffin tin, about 1/2 teaspoon per cup.Dotdash Meredith Food Studios"
370,6650301,6,"Place the muffin tin in the preheated oven until butter has melted and is sizzling hot, 2 to 3 minutes. Remove from oven, and distribute batter evenly among each cup.Dotdash Meredith Food StudiosDotdash Meredith Food Studios"
371,6650301,7,Return to the oven and bake for 5 minutes. Reduce the heat to 350 degrees F (175 degrees C) and bake until puffed and golden about 25 minutes more.DOTDASH MEREDITH FOOD STUDIOS
372,6663275,1,Preheat the oven to 400 degrees F (200 degrees C). Grease or line a baking sheet with parchment paper.
373,6663275,2,"Stir flour, Cheddar cheese, baking powder, salt, and garlic powder together in a bowl.Dotdash Meredith Food Studios"
374,6663275,3,"Stir milk, softened butter pieces, and egg together in a separate bowl. Add to the flour mixture and stir until just combined and chunky, being very careful not to overmix.Dotdash Meredith Food Studios"
375,6663275,4,Drop batter by tablespoonfuls onto the prepared baking sheet.Dotdash Meredith Food Studios
376,6663275,5,Bake in the preheated oven for 10 minutes.
377,6663275,6,"Meanwhile, stir melted butter, parsley, and garlic powder together in a small bowl. Remove biscuits from the oven and brush melted butter mixture over top.Dotdash Meredith Food Studios"
378,6663275,7,"Return to the oven and bake until golden brown, about 5 more minutes. Serve warm.DOTDASH MEREDITH FOOD STUDIOS"
379,6739341,1,Preheat the oven to 350 degrees F (175 degrees C). Grease a 12-cup muffin pan or line with paper liners.
380,6739341,2,"Mix together cake mix, pumpkin puree, cinnamon, nutmeg, and cloves in a large bowl until smooth. Spoon equal amounts of batter into the prepared muffin cups."
381,6739341,3,"Bake in the preheated oven until a toothpick inserted in the center of one comes out clean, 20 to 25 minutes."
382,6650566,1,Preheat the oven to 350 degrees F (175 degrees C). Grease and flour three 9x5-inch loaf pans (or three empty 16-ounce coffee tins).
383,6650566,2,Gather all ingredients.Allrecipes/Preethi Venkatram
384,6650566,3,"Combine sugar, pumpkin, eggs, oil, and water in a large bowl. Beat with an electric mixer until smooth. Blend in flour, cinnamon, nutmeg, baking soda, and salt.Allrecipes/Preethi Venkatram"
385,6650566,4,Fold in chocolate chips and nuts.Allrecipes/Preethi Venkatram
386,6650566,5,Evenly divide batter between the prepared pans; they should be 1/2 to 3/4 full.Allrecipes/Preethi Venkatram
387,6650566,6,"Bake in the preheated oven until a knife inserted into the center comes out clean, about 1 hour.Allrecipes/Preethi Venkatram"
388,6650566,7,Remove from the oven and let cool on wire racks before removing from the pans.
389,6650566,8,Enjoy!DOTDASH MEREDITH FOOD STUDIOS
390,6650628,1,"Stir water and salt together in a medium bowl; gradually stir in cornmeal with your fingers until the mixture forms a soft, moist, malleable dough.Dotdash Meredith Food Studios"
391,6650628,2,Form dough into eight 2-inch diameter balls; pat each ball to flatten into a 3/8-inch-thick arepa patty.Dotdash Meredith Food Studios
392,6650628,3,"Heat oil in a large skillet over medium heat; fry arepas in batches until golden brown, about 4 to 5 minutes per side. Transfer cooked arepas to a paper towel-lined plate to drain until cool enough to handle.Dotdash Meredith Food Studios"
393,6650628,4,Slice halfway through each arepa horizontally with a thin serrated knife to form a pita-like pocket.Dotdash Meredith Food Studios
394,6650628,5,Enjoy!DOTDASH MEREDITH FOOD STUDIOS
