,id_recipe,Step_Count,Step Description
305,6575663,1,"Place chicken breasts into slow cooker; pour in chicken broth. Season with paprika, salt, and pepper. Cook on Low until chicken is tender, about 4 hours."
306,6575663,2,"Drain broth; shred chicken with 2 forks in the slow cooker. Add Buffalo sauce, cream cheese, and ranch dressing mix; stir until well mixed. Cook on low until flavors are blended, about 1 hour."
307,6575663,3,Preheat oven to 425 degrees F (220 degrees C).
308,6575663,4,Spoon chicken onto the tortillas and sprinkle cheese on top. Roll up and place seam-side down on a nonstick baking sheet. Brush all sides of taquitos with oil.
309,6575663,5,"Bake in the preheated oven, turning every 5 minutes, until slightly browned, about 15 minutes."
310,6571189,1,"Preheat oven to 350 degrees F (175 degrees C). Arrange mushrooms, open-side up, in a baking dish."
311,6571189,2,"Heat olive oil in a small skillet over medium heat; cook and stir celery until tender, about 5 minutes. Add blue cheese dressing, ranch dressing, buffalo wing sauce, and cream cheese to celery; cook and stir until cream cheese is melted and buffalo sauce is smooth, about 5 minutes."
312,6571189,3,Mix chicken and buffalo sauce together in a bowl until chicken is coated; spoon into mushrooms. Sprinkle Cheddar cheese over buffalo sauce.
313,6571189,4,"Bake in the preheated oven until cheese is melted and golden, about 20 minutes."
314,6595519,1,Place cauliflower florets and celery in the bottom of a slow cooker in an even layer. Top with cream cheese.
315,6595519,2,"Whisk Buffalo wing sauce and ranch dressing together in a bowl. Stir in mozzarella cheese and pour mixture over the cauliflower. Cook on Low for 3 hours, stirring every hour."
