,id_recipe,Step_Count,Step Description
119,7511596,2,"Add brown sugar, vinegar, and salsa to a 2 1/2- to 3-quart baking dish or casserole pan. Stir until sugar dissolves."
120,7511596,3,"Add pinto beans, onion, jalapeno peppers, mustard, paprika, black pepper, salt, garlic powder, oregano, and cayenne pepper. Pour lager over, and stir until thoroughly combined."
121,7511596,4,Lay bacon strips on top of casserole.
122,7511596,5,"Bake in the preheated oven until liquids have reduced and thickened, 1 to 1 1/2 hours.Chef John"
123,7510692,1,"Combine warm milk, yeast, sugar, salt, and melted butter in thebowl of a stand mixer with the dough hook attached. Add egg and flour. Drop down dough hook and start kneading on low speed, stopping and scraping down the sides every so often in the beginning to make sure all the ingredients are incorporated, 3 to 5 minutes. Once everything has come together, increase speed 1 notch and continue kneading until dough is very soft, very smooth, and slightly elastic, about 2 minutes."
124,7510692,2,"Transfer dough onto a work surface, knead for 1 minute, and shapeinto a smooth ball. Since the dough has butter in it, it won’t be sticky."
125,7510692,3,"Return dough ball to a lightly buttered bowl. Cover, and allow to rise in a warm spot until it has doubled in size, about 90 minutes."
126,7510692,4,"Once dough is risen, transfer to a work surface and punch down to de-gas. Shape back into a ball, and weigh on a digital scale. Divide amountby 8 and weigh out 8 equal dough portions."
127,7510692,5,"Roll each portion into a smooth ball, using just enough flour to keep it from sticking. Press and flatten the dough into a disc about 3 1/2-inches wide and a 1/2-inch thick. Shape with your hands to make a smallindention in the middle."
128,7510692,6,"Transfer to a silpat-lined baking sheet. Cover and let proof until almost doubles in size, 45 to 60 minutes."
129,7510692,7,"Combine cooled sausage, cream cheese, green onions, milk, sage, ½ of the beaten egg, salt, pepper, and cayenne in a bowl. Mix filling into a thick paste with a spoon."
130,7510692,8,Preheat the oven to 375 degrees F (190 degrees C)
131,7510692,9,Use slightly damp fingertips to press a well into the center of each kolache to place the filling. Be sure to leave no more that 3/4-inch of un-pressed dough around the outside.  Do not press all the way through the dough to the baking sheet.
132,7510692,10,Brush each kolache with remaining egg wash.  Fill evenly with the sausage cream cheese mixture.
133,7510692,11,"Bake in the preheated oven until golden brown, 20 to 25 minutes. Remove from the oven, transfer to a wire rack, and allow to rest for 10 to 15 minutes before serving."
134,7510692,12,Top with sliced green onions for garnish.Chef John
135,7509604,1,"Combine mint, orange juice, fresh oregano, olive oil, garlic cloves, lime juice, salt, cumin, paprika, pepper, ground oregano, and cayenne pepper in a blender; blend until smooth."
136,7509604,2,Poke pork all over with a small sharp knife and place into a container just large enough to fit the meat. You can also use a resealable plastic bag.
137,7509604,3,Pour over marinade and toss to coat. Spoon any excess marinade from the bottom of the container over the top of the meat before covering. Marinate in the refrigerator for 24 hours. You can go as few as 6 or as long as 48 hours.
138,7509604,4,Preheat the oven to 300 degrees F (150 degrees C).
139,7509604,5,"Place onions in a roasting pan, and make a space in the middle. Place pork in the pan, fat side up, and transfer the marinade over the onions on each side. Pour in water."
140,7509604,6,"Transfer into the preheated oven and roast until internal temperature reaches 190 to 195 degrees F (87 to 90 degrees C), about 5 hours.  For best results baste pork occasionally with liquids in the pan. Add more water if the pan gets too dry."
141,7509604,7,"When pork is done, remove from the oven, and cover with foil. Let rest for 1 hour."
142,7509604,8,"Serve by tearing meat apart like for pulled pork, or by removing large chunks, and slicing.Chef John"
143,7507864,1,Add sugar to a mixing bowl and grate in lemon zest. Stir and let sit for 1 hour if possible to intensify the lemon flavor. This step can be skipped if necessary.
144,7507864,2,Preheat the oven to 350 degrees F (175 degrees C). Line a loaf pan with greased parchment paper.
145,7507864,3,"Combine flour, baking powder, and salt in a small bowl; add to lemon sugar. Add butter, eggs, and milk and beat with an electric mixer until batter is smooth and fluffy. Transfer batter into the prepared loaf pan and smooth out the top."
146,7507864,4,"Bake in the preheated oven until a toothpick inserted into the center comes out clean, about 50 minutes. Remove from oven and let cool for 5 minutes."
147,7507864,5,Meanwhile for lemon drizzle topping whisk sugar and lemon juice together in a bowl until smooth.
148,7507864,6,"Poke holes all over the cake with a skewer, and ladle or pour lemon drizzle topping over the top. Let the cake cool all the way to room temperature before removing it from the pan.Chef JohnFor best results, chill cake in the fridge before serving.You can make your own self-rising flour by sifting together 2 1/4 cups of all-purpose flour with 1.5 tablespoons baking powder and 1 teaspoon fine salt.The lemon drizzle topping amounts can be doubled for an extra “moist” version of the cake."
149,7507145,1,"Combine garlic, Fresno chili peppers, habanero pepper, bell pepper, smoked paprika, thyme, kosher salt, black pepper, cayenne pepper, sugar, and onion powder in a blender. Pour in olive oil, sherry vinegar, and lemon juice; blend on high until marinade is completely smooth."
150,7507145,2,Pour 3/4 of the marinade into resealable plastic bag set in a bowl. Reserve the rest for serving on the side.
151,7507145,3,"Make 3 or 4 shallow cuts into the skin side of the chicken quarters. This will allow the sauce to penetrate the skin during marination. Season chicken on both sides with kosher salt, and transfer into the bag. Seal the top, and toss and massage the chicken until all pieces are completely and evenly coated with the marinade. Allow to marinate in the refrigerator for 8 to 24 hours."
152,7507145,4,Preheat an outdoor charcoal grill for medium heat and lightly oil the grate.
153,7507145,5,"Remove chicken from marinade. Set skinside down onto the hot grill, using indirect heat. Cover to keep coals from getting too hot. Cook covered for about 5 minutes, then turn them over and grill another 10 to 12 minutes. Keep turning the chicken pieces, brushing with reserved marinade as desired, until they are cooked through - this can take up to 1 hour depending on grill temperature and size of chicken pieces."
154,7507145,6,"Serve with reserved sauce.Chef JohnThe chicken can also be roasted in the oven at 375 degrees F (180 degrees C) oven. Roast in the preheated oven until chicken is no longer pink in the center, the meat is tender, and the juices run clear, about 45 minutes."
155,7504105,1,"Combine avocado oil, green onions, minced garlic, and a pinch of salt in a saucepan and place over medium heat. Once garlic starts to sizzle, cook and stir for 1 minute. Add cumin, black pepper, and ancho chili powder, and cook stirring for 30 seconds."
156,7504105,2,"Add water, drained black beans, remaining salt, oregano, cayenne, and asiento (crispy pork butter, see Cook's Note). Stir together and simmer for 5 minutes. Use a potato masher to mash beans until smooth. Simmer for 5 minutes more. Turn off heat and taste to adjust seasoning if necessary."
157,7500599,1,"Divide shortbread cookie crumbs into 4 wide glasses, cups, or ramekins. Set aside until needed."
158,7500599,2,"Separate 2 of the eggs, transferring 2 yolks into a saucepan, and 2 whites in a mixing bowl. Transfer bowl of egg whites to the refrigerator until needed. Crack the last egg into the saucepan with the yolks, and add sugar, lemon juice, butter, and lemon zest; whisk briefly to combine."
159,7500599,3,"Place saucepan over medium heat, and cook, stirring with a whisk, until the butter disappears, and the mixture is hot to the touch. Switch to a spatula, and continue cooking, while stirring constantly, making sure to scrape the bottom of the pan with the flat edge of the spatula to prevent egg sticking to the bottom. Continue until the mixture thickens and will hold a sharp line if a finger is dragged across the spatula."
160,7500599,4,"Remove lemon mixture from the heat, and pass through a fine mesh strainer set over a bowl."
161,7500599,5,"Divide lemon curd evenly between the 4 prepared glasses. Refrigerate until lemon curd is firm and fully chilled, 3 to hours."
162,7500599,6,Preheat the oven to 400 degrees F (200 degrees C). Place a silpat on a baking sheet and very lightly grease with vegetable oil.
163,7500599,7,"Beat egg whites in a glass, metal, or ceramic bowl until foamy and stoft peaks just start to form. Add vanilla extract and 1 tablespoon sugar, continuing to beat until medium peaks form. Add second tablespoon of sugar, and continue beating until stiff peaks form."
164,7500599,8,"Transfer meringue into a piping bag with a star tip, and pipe 4 rosettes onto the prepared baking sheet, about 2 inches high, and smaller in diameter than the size glass you’re using."
165,7500599,9,"Bake in the preheated oven until edges of the meringue rosettes are lightly browned, 7 to 10 minutes. Let cool on the baking sheet for 5 minutes before transferring meringues on top of the lemon curd. Serve immediately or refrigerate until needed.Chef John"
166,7376480,1,Preheat the oven to 350 degrees F (175 degrees C). Line a baking sheet with aluminum foil.
167,7376480,2,"Spread out bread cubes in a the prepared baking sheet, and bake in the oven until it they are completely dried, 20 to 30 minutes. Transfer to a mixing bowl."
168,7376480,3,"Meanwhile, place bacon in a large skillet and cook over medium-high heat, turning occasionally, until evenly browned, crispy, and all the fat has rendered, about 10 minutes. Turn off heat, push crisp bacon to one side of the skillet, and drain most of the rendered fat."
169,7376480,4,"Turn heat back on medium-high and add diced onions and peppers. Cook until they just start to soften, 2 to 3 minutes. Add garlic and cook until fragrant, about 1 minute. Add reserved clam juice, and cook, stirring, until half the liquid has been reduced, 3 to 5 minutes."
170,7376480,5,"Transfer skillet contents into the bowl with the bread cubes.Pour in reserved clams and toss to combine. Add ricotta cheese, 1/2 cup Parmigiano-Reggiano cheese, parsley, salt, pepper, and cayenne. Mix well, cover, and refrigerate until needed."
171,7376480,6,"Melt butter in a skillet over medium-high heat and whisk in flour until mixture turns into a light tan color, about 2 minutes. Add cold milk all at once, and whisk until smooth. Cook, whisking often, until sauce begins to simmer, 3 to 5 minutes. Sauce will not be very thick, but will thicken when baked with the shells."
172,7376480,7,"Remove sauce from heat, and transfer 3/4 of it into a 9x12-inch baking dish. Reserve the rest for the top."
173,7376480,8,"Meanwhile, bring a large pot of lightly salted water to a boil. Cook pasta shell in the boiling water, stirring occasionally, until about 75% tender, about 9 minutes (full cooking time would be 12 minutes). Drain and cover with just enough cold water to cover to prevent shells from drying out."
174,7376480,9,Preheat the oven to 400 degrees F (200 degrees C).
175,7376480,10,"Stuff 20 shells with plenty of clam-bread mixture, and place on top of sauce, making 5 rows of 4 shells. Top with remaining white sauce and sprinkle with remaining grated Parmigiano-Reggiano."
176,7376480,11,"Bake in the preheated oven until pasta is fully tender, sauce is bubbling around the edges, and the cheese on top is starting to brown, 30 to 40 minutes. Top with additional chopped parsley if desired, and serve immediately.Chef John"
177,7375074,1,"Whisk together brown sugar, tamarind paste, garlic, lime juice, fish sauce, salt, Sriracha, pepper, cinnamon, clove, and fennel for the marinade in a bowl. Add lamb chops and coat thoroughly. Cover and refrigerate for at least 4 and up to 12 hours. During marination turn chops over a few times if possible."
178,7375074,2,Preheat the broiler on high for at least 10 minutes. Transfer lamb chops to a greased foil lined pan.
179,7375074,3,"Broil about 7 to 8 inches from heat, about 4 minutes per side. Remove from the broiler, and brush excess marinade onto both sides."
180,7375074,4,Return to the broiler for another 1 to 2 minutes to glaze and finish cooking. An instant-read thermometer inserted into the center should read at least 140 degrees F (60 degrees C).
181,7375074,5,"Remove from the oven, cover the pan loosely with foil, and let rest for 5 minutes."
182,7375074,6,"Transfer lamb chops to a serving platter and drizzle with pan juices.. Garnish with lime wedges, diced onion, fresh mint, and more Sriracha if so desired.ChefJohnNutrition data for this recipe includes the full amount of marinade ingredients. The actual amount of marinade consumed will vary."
183,7372803,1,"Place potatoes in a large pot and cover with salted water; bring to a boil. Reduce heat to medium-low and simmer until barely tender, about 15 minutes. Drain well and allow to cool to room temperature."
184,7372803,2,"Meanwhile, add spinach in a dry saucepan over medium-high heat and wilt, turning the entire time with tongues so it doesn't burn, 1 to 2 minutes. Transfer spinach to a high container. Add water, olive oil, peeled garlic, green onions, lemon zest, salt, pepper, cayenne pepper, egg, 1/2 of the feta cheese, and mint leaves. Puree using an immersion blender until well combined."
185,7372803,3,Preheat the oven to 400 degrees F (200 degrees C).
186,7372803,4,"Slice potatoes 1/4-inch thick into a bowl. Pour spinach mixture on top of the sliced potatoes and toss well so each slice is evenly coated. Transfer mixture to a shallow baking dish, smooth out the top, and sprinkle with remaining feta cheese."
187,7372803,5,"Bake on the center rack in the preheated oven until the edges of the feta start to just turn golden, 35 to 45 minutes. Let rest for 10 minutes before serving.Chef John"
188,7368508,1,"Combine diced strawberries and sugar for the strawberry whip in a bowl and mix well. Refrigerate for 2 to 3 hours, tossing occasionally."
189,7368508,2,"While strawberries are macerating, make the tuile cups. Combine flour, sugar, melted butter, egg white, sesame seeds, vanilla extract, and salt in a bowl. Whisk for 2 minutes or until very smooth."
190,7368508,3,Preheat the oven to 350 degrees F (175 degrees C). Line 2 baking sheet2 with silicone baking mats.
191,7368508,4,"Spread a heaping spoonful of batter onto the silicone baking mat and spread it into a circle about 5 1/2 inches across. Two per pan are recommended, since you have to shape them while still hot."
192,7368508,5,"Bake in the preheated oven until the center of the tuile is golden-brown, with the edges darker brown, 10 to 12 minutes."
193,7368508,6,"While hot, transfer the tuile cookie into a small bowl, and press down in the center with a smaller bowl to make the bowl shape. Wait about 30 seconds, and remove the inside bowl, and allow the tuile to cool fully."
194,7368508,7,"To finish the whip, add cold heavy cream to the macerated berries and whisk until medium-stiff peaks form."
195,7368508,8,Spoon the whip into the tuile cups and serve immediately.
196,7371979,1,"Combine butter, carrots, brown sugar, and salt in a saucepan over medium heat. Cook and stir until carrots are just getting tender, about 5 minutes. Season with cinnamon and ginger. Cook for 1 more minute. Turn off heat, and let cool."
197,7371979,2,"Meanwhile, whisk together cream cheese, sweetened condensed milk, and vanilla extract in a bowl until smooth. Stir in cooled carrot mixture and transfer to the refrigerator until needed."
198,7371979,3,Beat cream in a chilled glass or metal bowl with an electric mixer until medium-stiff  peaks form. Add cooled carrot-cream cheese mixture and whisk into the whipped cream. Fold in chopped walnuts and pecans with a spatula.
199,7371979,4,"Transfer mixture into a chilled airtight container and place a piece of plastic wrap directly onto the mixture. Cover with a lid and freeze until solid, at least 4 hours, but best overnight.Chef John"
200,7483030,1,"Combine egg yolks, flour, milk, 2 teaspoons white sugar, vanilla extract, and salt in a bowl; whisk until batter is smooth."
201,7483030,2,"Combine egg whites and lemon juice in a glass, metal, or ceramic bowl and beat until soft peaks form. Add egg whites to yolk mixture and carefully fold in using a spatula until just combined, using as light a touch as possible."
202,7483030,3,"Melt 1 tablespoon butter in a non-stick pan over medium heat. Transfer batter into the hot pan, cover, and cook until the bottom is golden brown and bubbles appear on the surface, about 4 minutes."
203,7483030,4,Use a spatula to cut the pancake into 4 sections and flip over. Cover and cook for another minute. Use 2 spatulas to tear or cut the pancake into 1 to 2 inch pieces.
204,7483030,5,Add remaining butter in little pieces to the pan and sprinkle with remaining 2 teaspoons white sugar. Cook tossing and stirring for a few minutes until pancake pieces are lightly caramelized at the edges.
205,7483030,6,"Serve immediately, dusted with powdered sugar.Chef John"
206,7485132,1,"Combine anchovies, garlic, salt, and pepper in a large bowl. Use a potato masher, or back of a fork, to mash ingredients into a coarse paste."
207,7485132,2,"Add lemon juice, egg yolk, Parmesan cheese, Dijon mustard, oil,and sugar; whisk until marinade is thoroughly combined. Add chicken thighs one by one to the marinade, tossing to coat completely. Transfer to a resealable bag and marinate in the fridge for 8 to 18 hours, for best results."
208,7485132,3,Preheat an outdoor charcoal grill for high heat and lightly oil the grate.
209,7485132,4,"Grill until chicken is uniformely browned and the juices run clear, for 4 to 5 minutes per side, depending on heat and size of thighs. An instant-read thermometer inserted into the center should read about 165 degrees F (74 degrees C)."
210,7485132,5,"Drizzle with olive oil and sprinkle with parsley. Serve with extra Parmigiano-Reggiano cheese, if desired.Chef John"
211,7486525,1,Generously grease an 8-inch or a 9-inch cake pan with butter. Cut a round piece of parchment paper to fit the bottom.
212,7486525,2,Preheat the oven to 425 degrees F (220 degrees C).
213,7486525,3,"Combine yogurt, eggs, salt, pepper, sugar, and cayenne in a bowl and whisk thoroughly. Add flour, and 5 ounces of Cheddar cheese, saving 1 ounce for the top. Add green onions, and mix thoroughly with a spatula."
214,7486525,4,"Bring a large pot of lightly salted water to a boil. Cook elbow macaroni in the boiling water, stirring occasionally, until tender yet firm to the bite, about 30 seconds shorter than indicated in package directions. Drain into a colander, reserving 1/4 cup of cooking water. Do not let macaroni sit and get dry."
215,7486525,5,"Add melted butter to the batter, followed by the just drained macaroni, and reserved 1/4 cup of pasta water (not shown in the video). Mix thoroughly with a spatula, and then transfer into the prepared cake pan. Smooth out the surface, and top with remaining 1 ounce Cheddar cheese, and a few shakes of cayenne."
216,7486525,6,"Bake in the preheated oven until cheese is lightly browned and cake is set, about 25 minutes. Serve hot, warm, or at room temperature garnished with green onion.Instead of self-rising flour you can use all-purpose flour plus 1 1/2 teaspoons baking powder."
217,7495124,1,"Cut ribs of rhubarb in half lengthwise and slice into 1/4-inch pieces; place into a bowl. Add cubed strawberries and 2 tablespoons sugar. Toss to combine, cover, and let fruit macerate in the refrigerator for 1 to 2 hours."
218,7495124,2,"Combine flour, baking powder, baking soda, and salt in a mixing bowl; whisk to combine."
219,7495124,3,Drain fruit in a strainer set over a bowl. Reserve the syrupy juices that pass through.
220,7495124,4,"Grate frozen butter into the flour mixture, while stirring with a fork several times to coat butter pieces with flour. Add 1/4 cup sugar, and drained fruit, mixing with a fork until fruit is coated with flour."
221,7495124,5,"Add 2 tablespoons of the reserved fruit juices, and pour in buttermilk. Mix with a fork just until the dry ingredients are incorporated into the dough. If the mixture is too dry to come together, add a little more buttermilk. If it seems too wet, and sticky, add a little more flour."
222,7495124,6,Preheat the oven to 450 degrees F (230 degrees C). Line a baking sheet with a silpat mat.
223,7495124,7,"Scoop or spoon equal portions of dough onto the prepared baking sheet. Whisk together egg and water in a small bowl. Brush biscuits with egg wash, and sprinkle with sugar."
224,7495124,8,Bake in the preheated oven for about 25 minutes. Transfer to a wire rack and let cool completely.
225,7495124,9,"Mix powdered sugar, lemon zest, and lemon juice together in a small bowl for the lemon icing. Fill icing into a piping bag or a plastic bag with the tip cut off and drizzle icing over cooled biscuits.Chef John"
226,7496452,1,"Combine water, 4 1/2 teaspoons kosher salt, and baking soda in a large pot over high heat and bring to boil. Add potatoes, reduce heat to simmer, and cook until just barely tender, 10 to 12 minutes. Drain and let sit for 30 seconds."
227,7496452,2,"Meanwhile, whisk together olive oil, garlic powder, onion powder, paprika, ground pepper, and cayenne in a large mixing bowl."
228,7496452,3,"Transfer potatoes into the bowl of seasoned oil and toss with a spatula until potatoes are evenly coated, and are roughened up a bit on the surface."
229,7496452,4,Preheat the oven to 450 degrees F (230 degrees C). Line a baking sheet with parchment paper.
230,7496452,5,Spread out potatoes on the prepared baking sheet and smear any excess mashed potato bits in the bowl over the tops of the potatoes. Season with a pinch of salt.
231,7496452,6,"Roast in the preheated oven until potatoes are browned, and the edges are very crispy, 45 to 60 minutes. For best results, turn potatoes over every 15 to 20 minutes until done."
232,7496452,7,"Meanwhile, heat olive oil in a large skillet over medium heat. Add onions, peppers, and salt and cook, stirring, until onions are soft and translucent and peppers have softened and sweetened, about 5 minutes. Turn off heat and stir in green onions to be cooked by the residual heat."
233,7496452,8,"Serve hot, topped with sauteed onions and peppers.Chef John"
234,7499757,1,"Combine tomato, red bell pepper, habanero pepper, fresno chili, garlic, ginger, and water in a blender for the sauce. Blend on high until smooth and set aside."
235,7499757,2,"Heat olive oil in a saucepan over medium heat. Add onion and salt and sauté until onion starts to soften, 4 to 5 minutes. Clear space in the middle of the pan, add tomato paste, and sauté for 2 to 3 minutes. Season with paprika, curry powder, cumin, thyme, pepper, and turmeric; continue cooking for 1 to 2 minutes until everything is well combined."
236,7499757,3,"Turn off the heat, and stir in the rice, making sure every grain of rice is coated with the oil-tomato mixture. Add bay leaf and chicken bouillon paste."
237,7499757,4,"Turn heat to high, stir in tomato sauce, and bring to a vigorous simmer. Cover with a tight fitting lid, reduce heat to medium-low, and simmer for 20 minutes. Do not remove the lid or stir rice."
238,7499757,5,"Turn off heat after 20 minutes, and set the timer for 12 minutes. Allow rice to sit and do not remove the lid."
239,7499757,6,"After the 12 minutes are up, remove lid, and fluff rice with a fork, separating all the grains. Serve garnished with green onions and chopped cilantro.If rice seems to be a little undercooked at this point, stop fluffing. Pat the rice down gently with the back of the fork, cover tightly again, and set heat to medium low. Cook for another 5 minutes, and check again."
240,7497838,1,"Combine peanut butter, grated onion, tomato paste, olive oil, salt, paprika, allspice, garlic powder, cayenne, black pepper, and powdered ginger in a mixing bowl. Stir until well combined."
241,7497838,2,Add steak pieces to the marinade bowl and toss to coat thoroughly. Cover and allow to marinate in the refrigerator for about 2 hours.
242,7497838,3,Preheat an outdoor grill with coal for high heat and lightly oil the grate.
243,7497838,4,Thread marinated steak pieces onto large metal skewers.
244,7497838,5,"Grill over the hot white coals until desired doneness, 5 to 6 minutes per side.Chef JohnGarnish beef skewers with red onions, lime wedges, green onions, chopped cilantro, and chopped peanuts if desired."
245,7488406,1,"Fry tortillas in oil over medium heat until blistered, golden brown, and very crispy. Blot lightly on a paper towel, and sprinkle with salt if desired. Place on a cooling rack and let cool fully. Store in an airtight container until needed."
246,7488406,2,"Remove all but one tablespoon of the oil from the pan, and set heat to medium high. When hot, add shrimp and sear each side for just 30 seconds. The shrimp should still be almost raw inside.  Remove and let cool for 5 minutes."
247,7488406,3,"Cut shrimp into small pieces, and add to a bowl. Add lime juice, chipotle, cumin, paprika, salt, olive oil, and ketchup. Mix well, cover, and transfer into the fridge for 1 to 8 hours."
248,7488406,4,"To make avocado spread, mash avocado and salt with the back of a fork until it’s as smooth as you want. Stir in lime juice, jalapeno and cilantro. Refrigerate until needed."
