,id_recipe,Step_Count,Step Description
249,7488406,5,"Remove shrimp from the fridge and mix in the red onion, tomato, cucumber, and cilantro. Taste for salt and adjust as needed."
250,7488406,6,"To make tostadas, spread crispy tortillas with avocado spread, and top with the deviled shrimp. Finish with a drizzle of Mexican crema or thinned out sour cream."
251,7488406,7,Tostadas should be eaten as soon as they are dressed.Chef John
252,7483649,1,"Heat milk in a large pot on between medium and medium-high heat to 195 degrees F to 205 degrees F (90 to 9 degrees C) until milk is almost simmering. Reduce heat to low, and stir in yogurt and 3 tablespoons lemon juice. Stir for about 30 seconds, and if milk isn’t separating into curds and whey, stir in another 1 to 2 tablespoons lemon juice."
253,7483649,2,"Once curds form, turn off heat, and pour in cold water to stop the cooking process and cool mixture. Pour curds into a cheesecloth or a cotton towel lined colander and drain out whey. Whey can be reserved for other uses."
254,7483649,3,"Let curds sit and drain for 5 to 10 minutes, before gathering up the cloth, and squeezing out excess liquid. Be careful to not burn yourself, as the liquid may still be very hot. Press curds between layers of cloth into a disc of about 2 inches high, being careful not to leave excess cloth bunched up on top, or underneath the cheese. Place something flat over the cheese, and place a heavy pan on top to weigh down. Leave paneer under the weight until very firm to the touch, 30 to 90 minutes. Wrap and refrigerate until well chilled before using."
255,7483649,4,"For the chili garlic marinade combine garlic, Scriracha, yogurt. lemon juice, garam masala, and kosher salt in a bowl; mix until well combined."
256,7483649,5,"Cut paneer into squares or rectangles about 1/4 to 1/2 inch thick, and add to the marinade, tossing well to coat thoroughly on both sides. Wrap and marinate paneer for at least 4 hours."
257,7483649,6,"Combine yogurt, cilantro, jalapeno, lime juice, and salt for the yogurt dipping sauce in a blender; blend until smooth."
258,7483649,7,"Melt butter in a non-stick pan over medium-high heat and pan-fry paneer until well browned, about 2 minutes per side. Serve immediately with dipping sauce.Chef John"
259,7370170,1,"Season the top of the salmon fillets with salt, pepper, and a little cayenne. Spread 1/2 of the melted butter all over the surface. Sprinkle with chopped dill, and drape 2 slices of smoked salmon over each fillet, covering the surface and sides. Place prepped fish in the fridge until needed."
260,7370170,2,Preheat the oven to 400 degrees F (200 degrees C).
261,7370170,3,"Spread mashed potatoes into 2 baking dishes (I used oval ramekins), and set salmon fillets on top. Sprinkle a little cayenne over the top if desired. Set baking dishes on a baking sheet for easy transfer."
262,7370170,4,"Roast salmon in the preheated oven until internal temperature in the center of the thickest part of the fillet reads 135 to 140 degrees F (57 to 60 degrees C), about 20 minute."
263,7370170,5,"Once roasted, brush the remaining melted butter over the top of the salmon fillets and garnish with green onions. Serve with lime wedges.Chef JohnSalmon can be roasted together in a larger baking dish, but cooking time may vary.If salmon is roasted without a mashed potato base, it may cook faster."
264,7254611,1,Break up chocolate into small pieces and set aside.
265,7254611,2,"Add milk, sugar, salt, and cornstarch to a saucepan, and whisk thoroughly."
266,7254611,3,"Place over medium to medium-high heat, and cook stirring until the milk just starts to simmer."
267,7254611,4,"Remove milk from heat, and quickly whisk in chocolate until completely melted and emulsified."
268,7254611,5,"Chef JohnServe immediately in hot cups, garnished with a pinch of cayenne on top if desired."
269,7185428,1,"Cook bacon in a Dutch oven or a large oven-safe pot with a lid over medium heat, turning occasionally, until evenly browned, about 10 minutes. Add butter, onions, and pinch of salt, and cook until onions are soft and translucent. Add garlic, and green onions, and cook stirring for 2 minutes."
270,7185428,2,"Pour in beer, raise heat to high, and cook, stirring occasionally, until beer has reduced by about 75%. While beer is reducing, season with thyme, parsley, black pepper, salt, and pinch cayenne. Once beer has reduced, add potatoes and broth and bring to a simmer."
271,7185428,3,Preheat the oven to 300 degrees F (150 degrees C).
272,7185428,4,"Prick sausage on both sides, and add to the pot on top of the other ingredients."
273,7185428,5,"Cover and place pot into the preheated oven. Cook for about 2 1/2 hours. Remove the lid, and continue cooking uncovered for about 1 more hour."
274,7185428,6,"Remove from oven and skim excess fat from top before serving. Garnish top with green onions, if desired.Chef JohnStew can be simmered gently on the stove instead of cooked in the oven.Any raw pork sausage can be used. Serve with Irish soda bread."
275,7113436,1,"Combine chicken drumsticks, carrots, onions, celery, and broth in a saucepan. Bring to a simmer over high heat. Reduce heat to medium-low, cover, and simmer for 20 minutes. Turn drumsticks over, cover, and cook for another 20 minutes."
276,7113436,2,"Remove chicken and transfer to a plate. Allow to cool, wrap, and transfer into the refrigerator until needed."
277,7113436,3,"Turn heat to medium-high and reduce cooking liquids in the saucepan to about 1/3 cup. Strain liquid into a mixing bowl, pressing some of the cooked vegetables through the sieve. Season gravy with black pepper, salt, thyme leaves, lemon zest, and cayenne; add creme fraiche and eggs and whisk everything together until a smooth batter forms."
278,7113436,4,"Place bread in a shallow baking dish just large enough to fit the slices, and pour over the batter. Toss several times, wrap and place in the fridge for 1 hour or until almost all the batter is absorbed."
279,7113436,5,Preheat the oven to 400 degrees F (200 degrees C). Line a baking sheet with foil and lightly grease with butter.
280,7113436,6,Melt butter in a small skillet over medium heat and brown bread for a few minutes per side. Transfer bread onto the prepared baking sheet.
281,7113436,7,"Press one drumstick into the top of each slice of bread. Brush over any excess batter. Sprinkle with salt, dust with Parmesan cheese, and finish with a shake of cayenne."
282,7113436,8,"Bake in the preheated oven until nicely browned, 30 to 35 minutes."
283,7113436,9,"Mix together maple syrup, Sriracha hot sauce, and cayenne pepper in a little bowl (""dragon syrup"")."
284,7113436,10,Serve chicken leg toast drizzled with dragon syrup.
285,7111885,1,"Mix chicken and pork together on a plate or tray, and place in the freezer for about 15 minutes, or until firm and very cold. Partially frozen is okay."
286,7111885,2,"Add breadcrumbs to the bowl of a food processor (this should be crumbled from the inside of a loaf of fresh or day old French bread – no crust!). Add sauteed onions, egg, white wine, garlic, parsley, salt, pepper, chili flakes, and crushed fennel seeds. Add chilled chicken mixture on top."
287,7111885,3,Pulse on and off in the food processor as shown until the mixture resembles ground meat. Stopping occasionally and scraping the bowl of food processor during the process is recommended.
288,7111885,4,Transfer mixture to fridge and chill for 1 hour before shaping.
289,7111885,5,Preheat the oven to 425 degrees F (220 degrees C). Line a baking sheet with foil and lightly grease with olive oil.
290,7111885,6,"Divide mixture into 12 portions, and place on the prepared baking sheet. Use damp hands to roll into smooth balls."
291,7111885,7,"Bake in the preheated oven until meatballs are cooked through, about 18 minutes. For some additional browning, turn broiler to high, and broil meatballs for 1 to 2 minutes."
292,7111885,8,"Meatballs can be served immediately, or transferred into tomato sauce set over low heat. Simmer gently for about 20 minutes to flavor sauce."
293,6831800,1,Gather all ingredients.ALLRECIPES / DIANA CHISTRUGA
294,6831800,2,Chop leftover turkey and place in a mixing bowl. Add pepperoncini peppers and kalamata olives; set aside.ALLRECIPES / DIANA CHISTRUGA
295,6831800,3,"Heat olive oil in a large pot over medium-high heat. Add Italian sausage and cook until sausage is browned and crumbled, breaking it up into small pieces, about 5 minutes. Add diced onions, mushrooms, and salt. Cook until onions are soft and start to get translucent, 3 to 4 minutes.ALLRECIPES / DIANA CHISTRUGA"
296,6831800,4,"Deglaze the bottom of the pot with white wine and simmer until wine has evaporated, about 5 minutes. Add chicken broth, marinara sauce, water, and cream. Add turkey mixture and bring to a simmer. Reduce heat to medium low and simmer about 15 minutes.ALLRECIPES / DIANA CHISTRUGA"
297,6831800,5,"Meanwhile, bring a large pot of lightly salted water to a boil. Cook rigatoni in the boiling water, stirring occasionally, about 10 minutes. Drain. Preheat the oven to 400 degrees F (200 degrees C).ALLRECIPES / DIANA CHISTRUGA"
298,6831800,6,Transfer the cooked rigatoni into the sauce pot and mix well. Transfer mixture to a large casserole dish. Dot surface with mozzarella cheese and push inside the pasta mixture. Sprinkle the top with freshly grated Parmesan cheese.ALLRECIPES / DIANA CHISTRUGA
299,6831800,7,"Bake in the preheated oven until sauce is bubbling around the edges, and the top is nicely browned, 40 to 45 minutes. Remove from oven and let sit for 10 to 15 minutes. Sprinkle with parsley.ALLRECIPES / DIANA CHISTRUGA"
300,6831800,8,Serve and enjoy.ALLRECIPES / DIANA CHISTRUGA
301,6835064,1,Gather all ingredients.ALLRECIPES / ANA CADENA
302,6835064,2,"Place bacon in a large cold skillet and cook over medium-high heat, turning occasionally, until evenly browned, about 10 minutes. Drain bacon slices on paper towels. Drain bacon fat and wipe the pan, but do not clean completely.ALLRECIPES / ANA CADENA"
303,6835064,3,"Shape ground beef into a patty that is about 1 inch thick by 4 1/4 inches in diameter. Season well with salt, pepper, and cayenne. Sear seasoned burger on high in the skillet for 2 minutes per side. Move the burger to a plate and transfer into a refrigerator to cool.ALLRECIPES / ANA CADENA"
304,6835064,4,"Remove a sheet of puff pastry from the freezer (I used 1/2 package of Dufour Puff Pastry). Roll the pastry to 1/8 inch thick. Cut out a 5 1/4 to 5 1/2 inch round circle of dough for the bottom. Cut out a 7 1/4 to 7 1/2-inch round circle of dough for the top. Place the dough on a sheet pan, and put in the freezer until firm.ALLRECIPES / ANA CADENA"
305,6835064,5,"Cut a small hole into the middle of the top piece (to function as a vent), and lightly score the surface of the pastry with the tip of a knife, but do not cut all the way through. Place the top piece in the fridge to keep cold.ALLRECIPES / ANA CADENA"
306,6835064,6,"Take the bottom pastry on the pan from the freezer and top with burger, bacon, and cheese. Beat egg with 1 teaspoon water in a small bowl and brush the edges with the egg wash. Place the top pastry piece over the fillings. As dough warms and softens, press the top edges into the bottom piece edges and seal tightly. The bottom edge of dough can be rolled up and over top of the pastry to finish the seal. Place in the fridge until well chilled, about 20 minutes.ALLRECIPES / ANA CADENA"
307,6835064,7,"Preheat the oven to 450 degrees F (230 degrees C). Crimp the edge of the pastry with a fork, and egg wash the top surface.ALLRECIPES / ANA CADENA"
308,6835064,8,"Bake in the preheated oven until nicely browned, 20 to 22 minutes. Transfer to a cooling rack and allow to sit for about 5 minutes before serving.ALLRECIPES / ANA CADENA"
309,6835064,9,Serve and enjoy!ALLRECIPES / ANA CADENA
310,6836099,1,"Combine warm milk, warm water, and dry yeast in the mixing bowl of a stand mixer . Let sit for 10 minutes. Add eggs, sugar, salt, and 1/2 cup melted butter. Whisk all wet ingredients together. Add all purpose flour and knead with the dough hook (or manually) until dough comes together as a ball, 5 to 6 minutes."
311,6836099,2,"Place dough into a lightly buttered bowl, cover, and let sit until the dough is doubled in size, about 2 hours."
312,6836099,3,"Press the dough until it is flat, and divide into 24 equal portions. Form each portion into a smooth ball."
313,6836099,4,Line a baking sheet with a Silpat mat or parchment paper.
314,6836099,5,"Take each ball of dough and roll out on a lightly floured surface into an oval, 4 to 5 inches long. Brush the top with some of the remaining butter and fold in half."
315,6836099,6,"Transfer the rolls to the prepared baking sheet, arranging in 6 rows of 4 rolls. Cover with a clean kitchen towel and let the rolls rise in a warm spot until almost doubled in size, about 1 hour."
316,6836099,7,Preheat the oven to 350 degrees C (175 degrees C).
317,6836099,8,"Bake rolls in the preheated oven until golden brown on top, about 25 minutes."
318,6836099,9,"While rolls are still warm, brush the tops of the rolls with melted butter."
319,6891180,1,"Combine warm milk and dry active yeast in the bowl of your stand mixer; let stand for 10 minutes. Add flour, eggs, sugar, and salt. Use the dough hook to knead the mixture until the flour almost disappears, about 1 minute. Add the soft room temperature butter, and continue kneading the dough until a very smooth ball of dough forms, 4 to 5 minutes."
320,6891180,2,"Set dough into a lightly buttered bowl, cover, and let rise in a warm spot until doubled in size, 2 to 3 hours."
321,6891180,3,Punch down the dough and divide in 2 pieces. Form each half into a smooth ball and transfer each one into a plastic bag. Refrigerate bags overnight for best results or the dough can be used immediately. Each half of the dough will make 4 brioche.
322,6891180,4,"When ready to make, roll and stretch dough into a 14 x 10 inch rectangle. Spread 4 tablespoons of soft room temperature butter over two thirds of the dough, stopping 1/2 inch from the edge."
323,6891180,5,"Fold unbuttered third up over the top, and then the opposite end to complete the trifold. Gently press and seal the edges together. Fold in thirds again to form a square. Wrap and place in the freezer until cold and slightly firm, about 15 minutes."
324,6891180,6,"Roll the dough out into a rectangle about 1/4 inch thick, or thin enough to fold, and repeat the two folding in thirds step. Wrap and place in the freezer again until cold and slightly firm, 15 more minutes. A little bit of water can be used to help the dough stick if needed."
325,6891180,7,"Roll dough out into a rectangle again, just like in the previous step. Fold into thirds, but keep as a rectangle (do not make the second fold). Wrap and place in the freezer until cold and slightly firm, about 15 minutes."
326,6891180,8,"Roll dough into a 12 x 6 inch rectangle and place in the freezer until cold and slightly firm, about 15 minutes."
327,6891180,9,Trim off about 1/8 inch of dough from the sides and cut into 4 rectangles that are about 6 x 3 inches.
328,6891180,10,"Start with 1 piece (keeping the others in the fridge so they stay cool) and make two cuts starting 1/2 inch from top, all the way to the bottom to create 3 strips of dough. Braid together, and seal at bottom. Flip over and add about 1 tablespoon of dark chocolate chunks along the center of the braided dough, or more to taste. Roll up from the smaller end to create a knot. Place seam side down in buttered muffin tin."
329,6891180,11,"After all braids are done, cover, and let rise in a warm spot until doubled in size, about 1 hour."
330,6891180,12,Preheat the oven to 400 degrees F (200 degrees C).
331,6891180,13,"Brush brioche with egg wash, and sprinkle very lightly with some coarse salt. Then sprinkle very generously with the granulated sugar."
332,6891180,14,"Bake on the center rack of the preheated oven until nicely browned, 20 to 25 minutes. If brioches are getting too dark, tent with aluminum foil after 15 minutes."
333,6891180,15,Let cool in the pan for about 5 minutes and then transfer onto a rack to cool completely before serving.
334,6950917,1,Gather all ingredients.ALLRECIPES / SONIA BOZZO
335,6950917,2,"Place beef on a pan, and rub with salt. Place meat on a rack or twisted foil so air can circulate under roast, and transfer to the fridge for 24 to 48 hours.ALLRECIPES / SONIA BOZZO"
336,6950917,3,Remove from the refrigerator and let it rest for a few hours to come to room temperature (optional).ALLRECIPES / SONIA BOZZO
337,6950917,4,"Preheat the oven to 300 degrees F (150 degrees C). Transfer roast into a roasting pan, preferably on a rack.ALLRECIPES / SONIA BOZZO"
338,6950917,5,"Mix butter with coarse salt, pepper, and cayenne in a small bowl and spread onto the sides and top of the roast. Then add more salt to the top. Pour water into the bottom of the pan.ALLRECIPES / SONIA BOZZO"
339,6950917,6,"Roast in the preheated oven until internal temperature is 115 to 120 degrees F (46 to 48 degrees C), about 1 hour and 20 minutes (about 20 minutes per pound). Remove from the oven, cover with foil and let rest for at least 20 minutes before serving.ALLRECIPES / SONIA BOZZO"
340,6950917,7,"Drippings from the pan can be deglazed with broth or water, and served alongside meat.ALLRECIPES / SONIA BOZZO"
341,6931031,1,"Gather ingredients. Preheat an oven to 450 degrees F (230 degrees C). Line a baking sheet with foil. Spread out onions, carrots, and celery on the prepared baking sheet. Set rib bones on top.ALLRECIPES / NELLY CUANALO"
342,6931031,2,"Roast until bones are deep brown and onions are black, about 1 hour. Use a spatula or tongues to transfer bones and vegetables into a saucepan. Drain off and reserve any rendered fat from the baking sheet for the gravy.ALLRECIPES / NELLY CUANALO"
343,6931031,3,"Add broth and water to the saucepan, and bring to a boil on high heat. Reduce heat to low and simmer until meat falls off bone and is flavorless, about 4 hours. Skim any fat from the surface and reserve.ALLRECIPES / NELLY CUANALO"
344,6931031,4,Strain broth and let cool to room temp.ALLRECIPES / NELLY CUANALO
345,6931031,5,Melt butter in a pot on medium-high and sauté mushrooms until well browned. Add 2 tablespoons rendered beef fat and stir until melted. Add flour and cook for a few minutes.ALLRECIPES / NELLY CUANALO
346,6931031,6,"Whisk in broth, and bring to a simmer. Cook, stirring occasionally, about 5 minutes. Reduce heat to medium and simmer until gravy has thickened to desired thickness, 5 to 10 minutes moreALLRECIPES / NELLY CUANALO"
347,6931031,7,"Adjust salt to taste and season with freshly ground black pepper, cayenne, and balsamic vinegar.ALLRECIPES / NELLY CUANALO"
348,6931031,8,Serve and enjoy!ALLRECIPES / NELLY CUANALO
349,7090808,1,Preheat the oven to 350 degrees F (175 degrees C).
350,7090808,2,Drizzle olive oil on both sides of the bread.
351,7090808,3,"Bake in the preheated oven until light golden brown, about 20 minutes."
352,7090808,4,"Meanwhile, bring a large pot of lightly salted water to a boil over high heat. Add Swiss chard and cook for 2 minutes. Transfer chard to a bowl of cold water to stop the cooking process. Drain and squeeze out as much excess water from the chard as possible using your hands. Roughly chop."
353,7090808,5,"Heat olive oil in a skillet over medium-heat and add garlic. Cook and stir until fragrant, about 20 seconds. Add chard and stir to combine. Turn off heat, and season with lemon zest, salt, pepper, and cayenne; stir to combine. Remove from stove and set aside until needed."
354,7090808,6,"Meanwhile, place bacon in a large skillet and cook over medium-high heat, turning occasionally, until well browned and crisp, about 10 minutes. Turn off heat and remove bacon with a slotted spoon. Drain bacon slices on paper towels. Crumble once cool enough to handle."
355,7090808,7,Preheat the oven to 450 degrees F (230 degrees C). Line a baking sheet with aluminum foil.
356,7090808,8,"Remove all but 1 to 2 tablespoons of bacon fat from the skillet. Heat skillet over medium-high heat and add green onions. Cook onions for 1 minute. Stir in cumin, oregano, and salt. Add beans, and stir to combine. Add water, and bring to a simmer. Once beans are simmering, use a potato masher to mash beans as smooth as you want. Add more water of you like to achieve desired texture. Taste and adjust for salt."
357,7090808,9,"Spread bean mixture evenly amongst the 4 pieces of toast. Top with chard, followed by crumbled bacon. Drizzle with lemon juice, and top with freshly grated pepper Jack cheese."
358,7090808,10,"Bake in the preheated oven until cheese starts to brown and the tartines are heated through, about 12 minutes."
359,7090808,11,Serve topped with Fresno chile pepper slices and green onions.
360,7108113,1,Preheat the oven to 400 degrees F (200 degrees C).
361,7108113,2,"Add chicken thighs and melted butter to a baking dish, and toss until coated. Season the top with salt."
362,7108113,3,"Bake in the preheated oven until chicken is just cooked through, about 20 minutes."
363,7108113,4,"While chicken is cooking, make sauce by adding mayonnaise, hot sauce, cayenne pepper, paprika, garlic powder, black pepper and white vinegar to a mixing bowl. Whisk together, and refrigerate until ready to use."
364,7108113,5,"Remove cooked chicken from the oven. Transfer thighs to a plate or bowl, and place in the fridge until needed. Reserve all the juices and drippings from the casserole dish, and pour into a measuring cup. Add enough water to get to 1 2/3 cups."
365,7108113,6,"Bring water-drippings mixture and rice to a boil in a saucepan. Reduce heat to medium-low, cover, and simmer until rice is tender and water has been absorbed, about 15 minutes. Turn off heat and allow rice to sit for 10 minutes longer."
366,7108113,7,"Transfer cooked rice to the baking dish used to bake the chicken. Use a spoon to create an even layer, but do not pack or press rice down. Drizzle any accumulated sauce from the cooked chicken over the rice."
367,7108113,8,"Transfer chicken to a cutting board and cut into 1/2-inch cubes. Add chicken to the mayo sauce and mix well. Sprinkle 1/2 of the celery over the rice. Spread out chicken-mayo mixture evenly over the rice. Crumble over about 1/2 of the blue cheese and season with some cayenne on top, if desired."
368,7108113,9,Preheat the oven to 450 degrees F (230 degrees C).
369,7108113,10,"Place baking dish in the preheated oven and cook until the top starts to brown, 15 to 20 minutes. For additional browning, set broiler to high, and broil top for 1 to 2 minutes to achieve more color. Garnish top with the rest of the celery, more blue cheese if desired, and another drizzle of hot sauce. Top with celery leaves if available. Serve hot, or at room temp."
370,7092188,1,Set chicken breast onto a cutting board and make 5 or 6 shallow cuts through the skin. Season generously on both sides with salt.
371,7092188,2,"Heat vegetable oil in a skillet over medium high heat and sear chicken breast, skin-side down, until the skin is golden brown and fat has rendered out, about 5 minutes. Flip breast over, and keep cooking until chicken is cooked through, about 5 minutes more. If oil starts to smoke before the chicken is cooked, reduce heat to medium or medium-low."
372,7092188,3,Turn off the heat and transfer chicken to a plate to rest until cool enough to handle. Peel off the skin and finely chop. Refrigerate chicken breast.
373,7092188,4,"Add minced chicken skin back into the skillet over and medium heat. Cook and stir until the skin browns and starts getting crisp, 3 to 5 minutes. Add ginger, garlic, and onions and cook, stirring, until onions start to turn translucent, about 5 minutes. Add turmeric and rice; cook and stir until rice is well coated with oil, 2 to 3 minutes."
374,7092188,5,"Stir in broth, turn heat to high, and bring to a boil. Cover, reduce heat to low, and simmer undisturbed for 20 minutes. Turn off the heat and set a timer for 10 minutes to allow rice to rest."
375,7092188,6,"Meanwhile, shred the chicken meat using your hands or cut into small pieces. Place into a bowl. Add red onion, green onions, Fresno chili, lime juice, soy sauce, hot sauce, sesame oil, salt, pepper, fresh mint and cilantro. Toss until well combined. Taste and adjust with more lime juice, salt, and/or spice as needed."
376,7092188,7,"After the 10 minute rice timer is up, remove cover, and fluff rice with a fork. Taste and adjust seasoning if necessary. Serve rice topped with the chicken herb salad mixture and lime wedges."
377,7109372,1,"Pour milk into the bowl of a stand mixer. Sprinkle yeast on top, followed by 1 1/3 cups flour and mix with a wooden spoon. Allow to stand until foamy, about 20 minutes."
378,7109372,2,"Add flour, softened butter, powdered sugar, egg, cardamom, and salt; knead with dough hook (or by hand) until a soft, smooth, elastic dough forms, 5 to 6 minutes. Transfer dough to a lightly floured surface and shape into a ball. Divide into 12 equal portions. Using flour as necessary, roll dough under a cupped hand to form perfectly smooth balls."
379,7109372,3,"Place dough balls evenly on a parchment lined baking sheet, leaving space in between and slightly push down. Dust tops with flour, and cover with a clean kitchen towel. Let rise in a warm spot until doubled in size, about 2 hours."
380,7109372,4,Preheat the oven to 425 degrees F (220 degrees C).
381,7109372,5,Stir together egg and water in a small bowl and brush rolls all over with egg wash.
382,7109372,6,"Bake in the preheated oven until lightly golden, about 12 minutes. Transfer buns onto a wire rack and let cool completely."
383,7109372,7,"Combine almond paste, powdered sugar, milk, and cardamom in a food processor and blend almond filling until smooth."
