,id_recipe,Step_Count,Step Description
150,6573463,1,Heat a large stockpot or Dutch oven over medium-high heat. Crumble beef into the hot stockpot. Add onion and garlic; cook and stir until beef is evenly browned. Drain off excess grease.
151,6573463,2,"Stir in chili powder, oregano, cumin, and hot sauce. Pour in tomatoes and vinegar; bring to a boil. Reduce heat to low and simmer for at least 1 hour, stirring occasionally to prevent the bottom from burning."
152,6650732,1,"Break ground beef into small pieces in a large pot over medium heat; cook and stir until beginning to brown, 3 to 5 minutes. Add onion, bell peppers, and carrot; cook and stir until the vegetables begin to soften, 5 to 7 minutes. Add zucchini and squash; cook and stir until beef is completely browned, 3 to 5 more minutes."
153,6650732,2,"Drain excess liquid from the pot. Stir in crushed tomatoes, kidney beans, black beans, diced tomatoes, corn, and garlic; bring to a boil. Stir in chili powder, brown sugar, paprika, oregano, cayenne pepper, cumin, salt, and black pepper. Reduce the heat to low, cover, and simmer for 30 minutes."
154,6738690,1,"Place ground beef and onion into a large nonstick saucepan over medium heat. Cook and stir until beef is browned and crumbly and onion is translucent, about 10 minutes. Drain grease if desired."
155,6738690,2,"Stir in tomato sauce, light and dark kidney beans, salsa, chili seasoning, pepper, and garlic salt until well combined. Reduce the heat to low and simmer for at least 1 hour before serving."
156,6651141,1,"Heat olive oil in a large saucepan over medium-high heat. Sauté tomatoes, bell pepper, onion, mushrooms, corn, and jalapeño until onion is translucent, about 10 minutes. Season with chili powder, cumin, and black pepper. Stir in black beans, broth, and salt; bring to a boil."
157,6651141,2,Reduce heat to medium-low. Remove 1 1/2 cups chili to a food processor or blender; purée until smooth and stir back into chili in the pan. Serve hot by itself or over rice.
158,6650944,1,"Heat oil in a large saucepan over medium-low heat. Add onion; cook and stir until tender, 5 to 8 minutes. Add jalapeño peppers, chile peppers, garlic, cumin, oregano, and cayenne pepper; cook and stir for 3 minutes. Stir in beans, chicken broth, and chicken. Simmer for 15 minutes, stirring occasionally."
159,6650944,2,Remove from the heat. Slowly stir in cheese until melted. Serve warm.
160,6737142,1,"Heat olive oil in a large pot over medium-high heat. Cook and stir hot and mild Italian sausage, onion, and a pinch of salt in hot oil until sausage is browned and crumbly, and most of the liquid is evaporated, about 10 minutes."
161,6737142,2,"Stir in ancho chile powder, paprika, cumin, black pepper, chipotle chile powder, and oregano; sauté until fragrant, about 2 minutes."
162,6737142,3,"Pour in water and tomato purée; bring to a simmer. Reduce heat to medium-low and cook at a steady simmer until sausage is tender, about 45 minutes. Add more water as needed and skim any fat that floats to the top."
163,6737142,4,"Stir in beans and bell peppers. Simmer until vegetables are tender, about 30 minutes. Season with salt."
164,6580889,1,Gather all ingredients.Dotdash Meredith Food Studios
165,6580889,2,"Combine ground beef with onion and garlic in a large soup pot over medium-high heat. Cook and stir until beef is browned and crumbly, 5 to 7 minutes.Dotdash Meredith Food Studios"
166,6580889,3,Drain and discard grease. Add cumin and chili powder; cook 2 minutes more.Dotdash Meredith Food Studios
167,6580889,4,"Drop cream cheese into the pot by bits and mash it into the beef with a big spoon until no white spots remain, 3 to 5 minutes.Dotdash Meredith Food StudiosDotdash Meredith Food Studios"
168,6580889,5,"Stir in broth, diced tomatoes, heavy cream, and salt. Cook until heated through, about 10 minutes more.Dotdash Meredith Food Studios"
169,6581521,1,Set an oven rack about 6 inches from the heat source and preheat the oven's broiler. Line a baking sheet with aluminum foil.
170,6581521,2,"Place chile peppers, cut-sides down, onto the prepared baking sheet."
171,6581521,3,"Cook under the preheated broiler until the skin of peppers has blackened and blistered, 5 to 8 minutes. Place blackened peppers into a large bowl and cover tightly with plastic wrap. Allow peppers to steam as they cool, about 20 minutes. Remove and discard skins; chop peppers into small pieces and set aside."
172,6581521,4,"Place pork in a large resealable plastic bag; add flour, 2 tablespoons salt, and 2 tablespoons black pepper. Seal the bag well and toss to coat."
173,6581521,5,"Heat oil in a skillet over medium heat. Cook and stir pork in hot oil until browned, 5 to 7 minutes. Transfer to a slow cooker."
174,6581521,6,"Add chopped peppers, chicken stock, diced tomatoes with green chile peppers, onion, cumin, remaining 1 tablespoon salt, remaining 1 tablespoon black pepper, and garlic to the slow cooker; mix well."
175,6581521,7,"Cook on High until pork is tender and flavors blend, about 4 hours."
176,6648370,1,"Heat oil in a large saucepan over medium heat. Sauté onions, carrots, and garlic in hot oil until tender. Add bell peppers, celery, and chili powder. Cook, stirring occasionally, until vegetables are tender, about 6 minutes."
177,6648370,2,"Stir in mushrooms and cook until softened, about 4 minutes. Stir in tomatoes, kidney beans, and corn. Season with cumin, oregano, and basil. Bring to a boil, then reduce heat to medium. Cover and simmer for 20 minutes, stirring occasionally."
178,6650515,1,"Heat oil in a 2-quart saucepan over medium-high heat. Add ground beef; cook and stir until browned and crumbly, 7 to 10 minutes. Add onion and garlic; cook until onion is translucent, about 5 minutes. Drain any excess fat."
179,6650515,2,"Stir in beans, crushed tomatoes, chili powder, vinegar, salt, and pepper; bring to a boil. Reduce the heat, cover, and simmer for 30 minutes."
180,6650905,1,"Cook ground beef in a large skillet over medium-high heat until browned and crumbly, 5 to 7 minutes; drain and discard grease."
181,6650905,2,"Transfer beef to a slow cooker. Add tomato sauce, diced tomatoes, onion, jalapeño peppers, chili powder, cayenne pepper, salt, garlic, and black pepper; stir to combine. Cook on Low for 10 hours or High for 6 1/2 hours."
182,6737227,1,"Cook and stir ground beef in a large skillet over medium-high heat until evenly browned, 5 to 7 minutes. Drain off grease, then season with salt and pepper."
183,6737227,2,"Transfer beef to a slow cooker. Add kidney beans, tomatoes, celery, bell pepper, and vinegar. Season with chili powder, cumin, parsley, basil, and Worcestershire sauce. Stir to distribute ingredients evenly."
184,6737227,3,Cook on Low for 8 hours or High for 6 hours. Pour in wine during the last 2 hours.
185,6737663,1,"Heat oil in a large saucepan over medium heat. Cook onions, garlic, ground beef and cubed sirloin in oil for 10 minutes, or until the meat is well browned and the onions are tender."
186,6737663,2,"Mix in the diced tomatoes with juice, dark beer, coffee, tomato paste and beef broth. Season with brown sugar, chili powder, cumin, cocoa powder, oregano, cayenne pepper, coriander and salt. Stir in 2 cans of the beans and hot chile peppers. Reduce heat to low, and simmer for 1 1/2 hours."
187,6737663,3,"Stir in the 2 remaining cans of beans, and simmer for another 30 minutes."
188,6598025,1,"Heat vegetable oil over medium-high heat in a medium-sized pan. Cook and stir ground chicken in the hot skillet until browned and crumbly, 5 to 7 minutes. Drain and discard grease."
189,6598025,2,"Combine chili powder, garlic, cumin, and red pepper flakes in a small bowl; stir into chicken to coat."
190,6598025,3,"Transfer chicken to a slow cooker. Add kidney beans, diced tomatoes with chiles, black beans, onion, and chopped jalapeno. Pour chicken broth over mixture and stir to combine."
191,6598025,4,"Cover and cook on High until chili has cooked down and thickened, about 4 hours, stirring corn kernels into mixture during last 30 minutes of cook time."
192,6598025,5,"Spoon chili into bowls and top each with sour cream, Cheddar cheese, green onions, and sliced jalapeno."
193,6663417,1,"Cook sausage and ground beef in a large pot over medium-high heat until lightly browned and crumbly. When the meat has released its grease, and has begun to brown, drain off accumulated grease, and season with chili powder, cumin, and coriander. Cook and stir for 1 minute until fragrant, then stir in the garlic and onion. Cook until the onion has softened and turned translucent, about 4 minutes."
194,6663417,2,"Stir in the diced tomatoes, tomato sauce, kidney beans, chipotle peppers, salt, and pepper. Bring to a simmer, then pour the chili into a slow cooker. Cover, and cook on Low for 8 to 10 hours. Stir in tomato paste an hour before the chili is done."
195,6597522,1,"Place bacon in a large soup pot. Cook over medium high heat until evenly brown. Drain excess grease, leaving enough to coat bottom of pot Remove bacon, drain on paper towels and chop."
196,6597522,2,"Brown beef and pork in pot over medium high heat. When meat is browned, stir in the bell pepper, onion, jalapeno peppers, habanero peppers, Anaheim peppers, garlic, cumin, red pepper flakes, chili powder, bouillon, crushed tomatoes, whole tomatoes, beer, tomato paste, chile paste and water."
197,6597522,3,"Reduce heat to low and simmer for 45 to 60 minutes, stirring occasionally. Add beans and bacon and continue simmering for another 30 minutes."
198,6594556,1,"Heat oil in a Dutch oven or large pot over medium-high heat. Season pork with salt and pepper, then cook in hot oil until golden brown on all sides, about 7 minutes. Transfer pork to a plate."
199,6594556,2,"Reduce the heat to medium; stir in onion and garlic. Cook and stir until onion has softened and turned translucent, about 5 minutes. Return pork to the pot; stir in chicken broth, green chiles, diced tomatoes with juice, and tomatillo salsa. Season with oregano and ground cloves. Bring to a simmer over medium-high heat, then reduce the heat to medium-low, cover, and simmer for 20 minutes."
200,6594556,3,"After 20 minutes, transfer 2 cups of soup (without any pork pieces) to a blender. Hold down the lid of the blender with a folded kitchen towel, and carefully start the blender, using a few quick pulses to get the soup moving before leaving it on to purée. Purée until smooth, then pour back into the cooking pot. This will create a thicker texture for your chili and will eliminate some of the chunky bits of chiles. Continue to simmer, stirring occasionally, until pork is very tender, at least 35 minutes more."
201,6604536,1,"Place sweet potatoes, stewed tomatoes, tomato sauce, onion, celery, water, chili powder, cumin, cinnamon, salt, black pepper, cayenne pepper, garlic powder, and onion powder in a slow cooker. Cook on high, stirring occasionally, for 5 hours."
202,6604536,2,"Heat a large skillet over medium-high heat and stir in ground turkey and ground beef. Cook and stir until meat is crumbly, evenly browned, and no longer pink, 10 to 15 minutes. Drain and discard any excess grease. Add cooked ground turkey, cooked ground beef, black beans, and corn to sweet potato mixture in the slow cooker; cook until flavors have blended, 1 to 2 more hours. Serve warm."
203,6579042,1,"In a large pot over medium heat, combine the ground beef and onions. Saute for 5 minutes, or until meat is browned. Drain excess fat and add the potatoes, beans, tomato soup, tomato juice, chili powder, water and salt to taste. Bring just to a boil and reduce heat to low. Simmer for 1 hour and serve."
204,6650971,1,"Heat oil in a pot over high heat until nearly smoking. Add pork cubes in a single layer. Let sear until brown on one side, 4 to 5 minutes. Mix, turning pieces over to brown on the other side, 4 to 5 minutes. Add onion and 1/2 teaspoon kosher salt. Cook and stir until onion is translucent, about 4 minutes. Add oregano, cumin, coriander, and cayenne; cook and stir until seasonings are fragrant, about 2 minutes. Reduce the heat to low."
205,6650971,2,"Cut tomatillos into quarters. Place into a blender with chili peppers, garlic, and cilantro. Add chicken stock. Pulse on and off until pieces start to break down, then blend until mixture has liquefied, about 30 seconds."
206,6650971,3,"Stir sauce into pork mixture. Add 1 teaspoon kosher salt and bay leaf. Increase the heat to high and bring to a boil. Reduce the heat to low and maintain a slow but steady simmer for about 1 hour. Add potatoes, remaining 1/2 teaspoon kosher salt, and black pepper. If the mixture has reduced to where potatoes are not immersed, add more broth to cover. Simmer until pork and potatoes are tender, 45 minutes to 1 hour."
207,6650971,4,"Garnish individual servings with a dollop of sour cream, some pickled red onions, and cilantro."
208,6577980,1,"In a large skillet over medium heat, cook venison, onion and garlic in oil until meat is browned. Transfer to a slow cooker and stir together with chiles, beans, broth oregano, cumin, salt and paprika. Cook on medium 4 to 5 hours."
209,6603694,1,Heat the oil in a large skillet over medium high heat. Saute the beef cubes in the oil for 2 minutes. Reduce heat to medium and stir in the garlic.
210,6603694,2,"In a small bowl, combine the chili powder, cumin and flour. Sprinkle over the meat and stir until evenly coated. Crumble the oregano over the meat and pour in 1 1/2 cans of the broth."
211,6603694,3,"Add the salt and ground black pepper, stir together well, bring to a boil, reduce heat to low and let simmer, partially covered for about 90 minutes. Pour in remaining broth and simmer 30 minutes more, until meat begins to fall apart. Cool, cover and refrigerate to allow the flavors to blend."
212,6649659,1,"In a large deep skillet over medium heat, cook the ground elk with the onion until evenly browned. Drain off excess grease."
213,6649659,2,"Pour the tomato sauce, stewed tomatoes, kidney beans and green chilies into the skillet with the meat, and stir to blend. Season with chili powder, cumin, salt, pepper, oregano and brown sugar. Cover, and simmer over low heat for at least one hour."
214,6589173,1,"Place the ground beef in a large pot over medium-high heat. Cook, stirring to crumble, until evenly browned. Drain off grease. Place the pot over medium heat, and add the onion, garlic, green pepper, red pepper and kidney beans. Cook and stir for a few minutes. Stir in the tomato sauce and water, and season with chili powder. Simmer over low heat for 40 minutes uncovered."
215,6664332,1,"Heat the oil in a large skillet over medium heat, and saute the onion, green bell pepper, yellow bell pepper, and garlic until tender. Stir in the turkey, and cook until evenly brown. Drain, and mix in tomatoes and pumpkin. Season with chili powder, pepper, and salt. Reduce heat to low, cover, and simmer 20 minutes. Serve topped with Cheddar cheese and sour cream."
