,id_recipe,Step_Count,Step Description
261,6582167,1,"Mix the ground pork, egg, cornstarch, 2 teaspoons of sesame oil, ginger, monosodium glutamate, salt, and half of the chopped green onions together in a bowl. Use your hands to mix until the ingredients are evenly distributed. Set aside."
262,6582167,2,"Heat the vegetable oil in a wok or large skillet over high heat. When the oil is hot, fry the napa cabbage, stirring constantly, until cabbage begins to wilt, 2 to 3 minutes. Pour in the chicken broth, water, and soy sauce. Bring to a boil, then lower the heat to medium."
263,6582167,3,"Use a spoon to form the meat mixture into 1 inch balls. Drop them into the boiling soup. When the last ball has been added, cover with a lid and simmer for 10 minutes. Taste, and adjust salt before serving. Garnish with remaining green onions and a drizzle of sesame oil."
264,6582079,1,"Trim fat from pork, cut into 1 inch pieces. Combine flour and pork in a resealable bag, seal and shake well."
265,6582079,2,"Heat 1 tablespoon oil in a large skillet over medium high heat. Add pork, cook 3 minutes or until browned. Remove from pan and keep warm."
266,6582079,3,"Heat remaining tablespoon oil in pan. Add bok choy, celery, red pepper, mushrooms, water chestnuts and garlic; stir fry for 3 minutes. In a bowl combine chicken broth, soy sauce, cornstarch, sherry and ginger. Stir well with a whisk. Combine pork and broth mixture in skillet, cook 1 minute or until thick."
