,id_recipe,Step_Count,Step Description
297,6664558,5,Roll or scoop chilled dough into 1-inch balls. Coat each ball in confectioners' sugar and place 1 inch apart on the prepared cookie sheets.Dotdash Meredith Food Studios
298,6664558,6,Bake in the preheated oven for 10 to 12 minutes. Let stand on the cookie sheet for a few minutes before transferring to wire racks to cool.Dotdash Meredith Food Studios
299,6664558,7,Repeat Steps 4 and 5 to make remaining batches.
300,6664558,8,Enjoy!DOTDASH MEREDITH FOOD STUDIOS
301,6605231,1,"Preheat the oven to 350 degrees F (175 degrees C). If using a glass dish, preheat the oven to 325 degrees F (165 degrees C). Coat a 9x13-inch baking dish with cooking spray."
302,6605231,2,Mix graham cracker crumbs and butter in a bowl until well combined. Transfer the mixture to the prepared baking dish and press onto the bottom.
303,6605231,3,"Pour sweetened condensed milk on graham cracker crust. Sprinkle with an even layer of chocolate chips, coconut, and nuts. Press toppings down firmly with the back of a fork."
304,6605231,4,"Bake in the preheated oven until lightly browned, about 25 minutes. Cool completely, then cut into 36 bars or diamonds."
305,6650775,1,Preheat the oven to 375 degrees F (190 degrees C).
306,6650775,2,"Combine flour, baking soda and salt in small bowl."
307,6650775,3,"Beat butter, white sugar, brown sugar and vanilla in a large mixing bowl until creamy. Add eggs, one at a time, beating well after each addition. Gradually beat in flour mixture. Stir in chocolate morsels and nuts."
308,6650775,4,Drop by rounded tablespoon onto ungreased baking sheets.
309,6650775,5,"Bake in the preheated oven until golden brown, 9 to 11 minutes, switching racks halfway through."
310,6650775,6,"Cool on the baking sheets for 2 minutes, then transfer to wire racks to cool completely."
311,6650202,1,Preheat the oven to 350 degrees F (175 degrees C). Grease two cookie sheets.
312,6650202,2,"To make the cookies: Combine flour, cinnamon, baking powder, baking soda, nutmeg, cloves, and salt in a medium bowl."
313,6650202,3,"Cream together sugar and butter in a mixing bowl until fluffy, 2 to 3 minutes. Add pumpkin, egg, and vanilla; beat until creamy. Mix in flour mixture until combined. Drop tablespoonfuls of dough onto the prepared cookie sheets; flatten slightly."
314,6650202,4,"Bake in the preheated oven until centers are set, 15 to 20 minutes, switching racks halfway through. Transfer cookies to a wire rack to cool to room temperature, about 30 minutes."
315,6650202,5,"Meanwhile, make the icing: Stir together confectioners' sugar, milk, butter, and vanilla in a bowl until smooth. Add milk as needed, to achieve drizzling consistency."
316,6650202,6,Drizzle icing over cooled cookies with a fork.
317,6649867,1,Preheat the oven to 350 degrees F (175 degrees C). Grease a 9x13-inch baking dish with cooking spray.
318,6649867,2,"Beat cream cheese, 1 cup sugar, and vanilla extract in a bowl until smooth."
319,6649867,3,"Unroll crescent roll dough, and use a rolling pin to shape each sheet into a 9x13-inch rectangle. Press one piece into the bottom of the prepared baking dish. Evenly spread cream cheese mixture on top, then cover with remaining piece of crescent dough."
320,6649867,4,"Mash remaining 3/4 cup sugar, butter, and cinnamon with a fork until combined. Dot mixture over top of dough."
321,6649867,5,"Bake in the preheated oven until crescent dough has puffed and turned golden brown, about 30 minutes."
322,6649867,6,Remove from the oven and drizzle with honey. Cool completely in the pan for about 2 hours before cutting into 12 squares.
323,6648990,1,"Sift flour, baking powder, and salt together in a medium bowl; set aside."
324,6648990,2,Beat sugar and margarine in a large bowl with an electric mixer until smooth. Beat first egg into butter mixture. Beat second egg into mixture along with vanilla extract; add flour mixture and stir until dough is just combined. Wrap dough; chill in the refrigerator for 2 hours.
325,6648990,3,Preheat the oven to 400 degrees F (200 degrees C). Grease two cookie sheets.
326,6648990,4,Roll out dough on a clean floured surface to 1/4-inch thickness. Cut out shapes using cookie cutters; arrange them on the prepared cookie sheets. Gather scraps and repeat this step.
327,6648990,5,"Bake in batches in the preheated oven until edges are golden, about 6 to 8 minutes. Cool on the baking sheet briefly before removing to a wire rack to cool completely."
328,6650662,1,Gather all ingredients.Allrecipes/Preethi Venkatram
329,6650662,2,Preheat the oven to 350 degrees F (175 degrees C).
330,6650662,3,"Mix peanut butter, sugar, and egg together in a bowl using an electric mixer until smooth and creamy.Allrecipes/Preethi Venkatram"
331,6650662,4,Roll mixture into 1-inch balls and place 1 inch apart on an ungreased baking sheetAllrecipes/Preethi Venkatram
332,6650662,5,"Flatten each with a fork, making a criss-cross pattern.Allrecipes/Preethi Venkatram"
333,6650662,6,"Bake in the preheated oven until edges are firm, about 10 minutes. Cool on the baking sheet briefly before removing to a wire rack to cool completely."
334,6650662,7,Enjoy!Preethi Venkatram/Allrecipes
335,6663311,1,Preheat the oven to 325 degrees F (165 degrees C). Place 1/2 cup sugar into a shallow bowl.
336,6663311,2,"Stir peanut butter, remaining 1 1/4 cup sugar, and eggs together in a mixing bowl until well combined. Roll into 36 small balls."
337,6663311,3,"Roll balls in reserved sugar until coated, then arrange 1 inch apart on ungreased baking sheets."
338,6663311,4,"Bake in the preheated oven until very lightly browned on the bottom and the edges are beginning to crack, 12 to 14 minutes."
339,6663311,5,"Remove from the oven and immediately press one chocolate kiss into the center of each cookie. Cool on the baking sheets for 1 to 2 minutes, then transfer to a wire rack to cool completely, about 15 minutes."
340,6651200,1,Preheat the oven to 350 degrees F (175 degrees C).
341,6651200,2,"Beat sugar, butter, eggs, and vanilla in a large bowl until light and fluffy."
342,6651200,3,"Combine flour, cocoa powder, baking soda, and salt in another bowl; stir into butter mixture until well blended. Mix in chocolate chips and walnuts. Drop spoonfuls of dough 2 inches apart onto ungreased cookie sheets."
343,6651200,4,"Bake in the preheated oven just until set, 8 to 10 minutes. Cool slightly on the cookie sheets before transferring to wire racks to cool completely."
344,6651054,1,Preheat the oven to 350 degrees F (175 degrees C). Grease a baking sheet.
345,6651054,2,"Combine pumpkin, sugar, oil, and egg in a large bowl. Dissolve baking soda into milk in a small bowl and stir in."
346,6651054,3,"Stir together flour, baking powder, cinnamon, and salt in a separate bowl. Add flour mixture to pumpkin mixture and mix well. Add chocolate chips, walnuts, and vanilla; stir just to combine."
347,6651054,4,"Drop by spoonful on the prepared cookie sheet and bake in the preheated oven until lightly brown and firm, approximately 10 minutes."
348,6650664,1,"Mix flour, ginger, cinnamon, baking soda, nutmeg, and salt in large bowl."
349,6650664,2,"Beat butter and brown sugar in large bowl with electric mixer on medium speed until light and fluffy. Add molasses, egg, and vanilla; mix well. Gradually beat in flour mixture on low speed until well mixed.Dotdash Meredith Food Studios"
350,6650664,3,"Press dough into a thick, flat disk. Wrap in plastic wrap. Refrigerate 4 hours or overnight.Dotdash Meredith Food Studios"
351,6650664,4,Preheat the oven to 350 degrees F (175 degrees C).
352,6650664,5,Roll dough on a lightly floured surface to a thickness of 1/4 inch. Cut into gingerbread men shapes with a 5-inch cookie cutter. Place gingerbread men 1 inch apart on ungreased baking sheets.Dotdash Meredith Food Studios
353,6650664,6,"Bake in the preheated oven until edges of cookies are set and just begin to brown, 8 to 10 minutes. Cool on baking sheets for 1 to 2 minutes, then remove to wire racks to cool completely.Dotdash Meredith Food Studios"
354,6650664,7,Decorate cooled cookies as desired. Store cookies in airtight container up to 5 days.
355,6650159,1,Preheat the oven to 350 degrees F (175 degrees C). Place cinnamon sugar in a bowl; set aside.
356,6650159,2,"Sift flour, ginger, baking soda, cinnamon, and salt into a mixing bowl. Stir the mixture until blended, then sift a second time into another bowl."
357,6650159,3,Beat shortening in a large bowl with an electric mixer until creamy. Gradually beat in white sugar. Add egg and molasses and beat until light and fluffy.
358,6650159,4,Sift 1/3 of the flour mixture into the shortening mixture; stir to thoroughly blend. Sift in the remaining flour mixture and mix together until a soft dough forms.
359,6650159,5,"Pinch off small amounts of dough and roll them with your hands into 1-inch-diameter balls. Place balls in cinnamon sugar and roll to coat, then place 2-inches apart on ungreased baking sheets."
360,6650159,6,"Bake in the preheated oven until tops are rounded and slightly cracked, about 10 minutes, switching racks halfway through. Cool cookies on a wire rack."
361,6649830,1,Preheat the oven to 350 degrees F (175 degrees C).
362,6649830,2,"Cream sugar and margarine in a large bowl until light and fluffy. Beat in eggs, one at a time, then stir in vanilla."
363,6649830,3,"Combine flour, cocoa, baking soda, and salt in a separate bowl. Add to the creamed mixture and mix until just blended. Stir in walnuts. Drop spoonfuls of dough 2 inches apart onto ungreased cookie sheets."
364,6649830,4,"Bake in the preheated oven until edges are set and centers are soft, 8 to 10 minutes. Let sit briefly before transferring to wire racks to cool completely."
365,6664865,1,Gather all ingredients.Victoria Jempty/Allrecipes
366,6664865,2,Preheat the oven to 350 degrees F (175 degrees C).
367,6664865,3,"Cream butter and vanilla together in a medium bowl with an electric mixer until smooth, 2 to 3 minutes.Victoria Jempty/Allrecipes"
368,6664865,4,Whisk flour and 6 tablespoons powdered sugar together in separate bowl. Add to the butter mixture and stir until just blended. Add walnuts and mix until incorporated; mixture may be crumbly.Victoria Jempty/AllrecipesVictoria Jempty/Allrecipes
369,6664865,5,Take small scoops of dough and roll between your hands into 1-inch balls. Place balls 2 inches apart on ungreased cookie sheets.Victoria Jempty/Allrecipes
370,6664865,6,"Bake in the preheated oven until edges are just turning golden, about 12 minutes."
371,6664865,7,Remove from the oven and transfer to a wire rack to cool for 15 minutes.
372,6664865,8,Place remaining 1/3 cup powdered sugar in a small bowl. Roll cooled cookies in the powdered sugar once or twice.Victoria Jempty/Allrecipes
373,6664865,9,Enjoy!Dotdash Meredith Food Studios
