,id_recipe,Step_Count,Step Description
167,6738688,8,Heat butter in a large skillet over medium heat.
168,6738688,9,"Dip the sandwiches into the egg mixture, 2 or 3 at a time, and place in the skillet."
169,6738688,10,"Cook until golden brown on both sides, about 3 minutes per side."
170,6738688,11,Transfer pan-fried sandwiches to a baking sheet and place in the preheated oven to keep warm while cooking remaining sandwiches.
171,6738688,12,"To serve, top French toast with warm strawberry glaze and sliced fresh strawberries and sprinkle with confectioners' sugar. Serve with a dollop of whipped cream."
172,6736456,1,Dip bread slices in beaten eggs. Heat a lightly oiled griddle or frying pan over medium high heat. Cook until browned on both sides. Set aside but keep warm.
173,6736456,2,"Place bacon in a large, deep skillet. Cook over medium high heat until evenly brown. Drain and set aside. Reserve 1 tablespoon of bacon grease in pan and fry remaining two eggs."
174,6736456,3,"Place one piece of French toast on each of two plates. Place the fried eggs on top of the bread, top the eggs with strips of bacon. Cover with the remaining pieces of French toast. Following that by pouring on the syrup."
175,6739368,1,"Peel peaches, remove pits, and slice into a heavy saucepan, catching all the juices. Stir in sugar, nutmeg, and cinnamon, and cook over medium heat until bubbly. Continue cooking, stirring occasionally, until the sauce reaches a syrupy consistency, about 10 minutes. Remove from heat."
176,6739368,2,"Meanwhile, cut off and discard the ends of the bolillo rolls. Slice the rolls into 1 1/4-inch-thick slices. Lay each slice of bread on a board, and with a sharp knife held parallel to the board, cut a pocket into each slice, leaving three sides intact. Set aside."
177,6739368,3,"Stir together the mascarpone, confectioners' sugar, and lemon zest until smooth. Scoop this mixture into a small plastic bag. Cut off one corner of the bag, and pipe as much filling into the pocket in each slice of bread as will fit without overflowing."
178,6739368,4,"Whisk together the eggs, milk, and vanilla in a shallow bowl. Melt butter with oil over medium heat in a large nonstick skillet. Dip each stuffed piece of bread into the batter, add to the skillet, and cook until browned on both sides. Serve hot with the warm peach sauce."
179,6564287,1,"Grease a 9x13-inch baking dish. Place bread slices in the prepared baking dish, overlapping slices as needed."
180,6564287,2,"Place eggs, half-and-half, milk, sugar, cinnamon, nutmeg, and salt in a medium bowl and mix thoroughly with a rotary beater or whisk. Pour mixture over bread, making sure all slices are moistened. Cover and refrigerate, 8 hours to overnight."
181,6564287,3,Preheat the oven to 350 degrees F (175 degrees C).
182,6564287,4,"Bake in the preheated oven until a toothpick inserted into the center comes out clean, about 40 minutes."
183,6593060,1,Lightly oil a skillet and heat over medium heat.
184,6593060,2,"Whisk half-and-half, pumpkin purée, eggs, cinnamon, vanilla, and pumpkin pie spice together in a bowl. Stir in walnuts until evenly distributed."
185,6593060,3,"Place 1 slice of bread into the bowl and let soak briefly. Lift bread up to let excess liquid drip back into the bowl, then transfer to the hot skillet. Stir pumpkin mixture to redistribute walnuts. Repeat to soak and cook remaining bread, cooking in several batches if necessary."
186,6593060,4,"Cook each batch until golden brown, about 3 minutes per side. Serve warm."
187,6581315,1,Preheat oven to 350 degrees F (175 degrees C). Grease 9x13-inch baking dish.
188,6581315,2,"Whisk eggs, milk, brown sugar, butter, vanilla extract, ground cinnamon, and ground nutmeg together in a bowl. Stir bread cubes and bananas into egg mixture until coated; pour into prepared baking dish."
189,6581315,3,"Bake in preheated oven until a knife inserted in center comes out clean, 35 to 40 minutes."
190,6580938,1,"Combine the corn syrup , butter, and brown sugar in a small saucepan and simmer until the sugar has melted. Pour this mixture over the bottom of a greased 9x13 inch casserole dish."
191,6580938,2,"Place the bread slices over the sugar-butter mixture in the dish. In a bowl, beat together the eggs, milk, vanilla, and salt; pour this mixture over the bread. Cover the dish and let it stand in the refrigerator overnight."
192,6580938,3,"The next morning, preheat oven to 350 degrees F (175 degrees C)."
193,6580938,4,Uncover the pan and bake for 45 minutes. Serve while hot or warm or the French toast will harden in the pan. It can be reheated.
194,6602141,1,"Preheat waffle iron. In a large mixing bowl, combine waffle mix, sugar and cinnamon. Stir in milk, eggs and vanilla extract."
195,6602141,2,Spray preheated waffle iron with non-stick cooking spray. Pour mix onto hot waffle iron. Cook until golden brown. Serve hot.
196,6599782,1,"Cut bread into 1 1/2 inch thick slices and place in a lightly greased 9x13 inch baking pan. In a large bowl, beat eggs with 1 1/2 cup skim milk, 1/3 cup white sugar, and 1 tablespoon vanilla. Pour egg mixture over bread slices."
197,6599782,2,"Arrange apple slices on top of bread. Sprinkle cinnamon, nutmeg, and 2 tablespoons white sugar over apples. Cover, and refrigerate overnight."
198,6599782,3,In the morning: Preheat oven to 350 degrees F (175 degrees C).
199,6599782,4,"Bake toast in preheated oven until golden brown, about 1 hour. Meanwhile, combine 1/2 cup white sugar, flour, and margarine. Stir in brown sugar, 1/2 cup skim milk, and 2 teaspoons vanilla in a small saucepan. Cook until thick. Serve French toast hot with warm sauce."
200,6603850,1,"Beat the eggs, pumpkin puree, cinnamon, and nutmeg together in a bowl. Dip the bread slices into the pumpkin mixture until coated on both sides."
201,6603850,2,"Melt 1 teaspoon of butter in a large skillet over medium-high heat. Place 4 of the bread slices into the skillet and cook until browned on both sides, about 3 minutes per side. Repeat with the remaining bread and butter."
202,6579897,1,"Combine light corn syrup, butter, and sugar in a saucepan; simmer until syrup-like. Pour mixture over the bottom of a 9x13-inch pan."
203,6579897,2,Slice bread into 12 to 16 slices; place over the syrup. Layer as needed.
204,6579897,3,"Beat together eggs, milk, vanilla, and salt. Pour over bread. Cover with plastic wrap. Refrigerate 8 hours or overnight."
205,6579897,4,Preheat the oven to 350 degree F (175 degrees C).
206,6579897,5,Bake in the preheated oven for 45 minutes.
207,6579897,6,Cut into squares. Invert and serve.
208,6592162,1,"Whisk milk, eggs, sugar, rum extract, salt, cinnamon, nutmeg, cloves, and ginger together in a bowl. Dip each bread slice into the egg mixture, turning to coat both sides."
209,6592162,2,"Melt butter in a non-stick skillet over medium heat. Add bread slices in a single layer and cook until golden brown, about 3 minutes per side."
210,6649997,1,Place stale bread in a shallow dish just large enough to tightly fit the slices in one layer.
211,6649997,2,"Whisk eggs, salt, sugar, vanilla, cinnamon, cayenne, and heavy cream for batter together in a bowl and pour over bread slices. Use tongs to toss to coat evenly. If there's excess batter pooling at the bottom of the dish, spoon it over the top of the bread slices."
212,6649997,3,"Wrap and refrigerate until bread has absorbed all the batter or is fully saturated, 2 to 12 hours."
213,6649997,4,"To make the honey syrup, combine honey, water, chili flakes, and salt in a small saucepan and place over medium heat. Stir and bring to a simmer, then cook for 30 seconds. Turn off the heat and reserve until needed."
214,6649997,5,Remove bread from the refrigerator and press sliced feta into the top of each piece; about 2 tablespoons feta should almost cover the surface of each piece.
215,6649997,6,"Heat butter and olive oil in a large nonstick skillet over medium-high heat. Place in the bread, cheese-side down. Cook until the cheese has caramelized and the surface is well browned, 3 to 5 minutes. Turn the slices over, reduce heat to medium, and cook the other side until golden brown."
216,6649997,7,Serve immediately with the honey syrup spooned over top.
217,6569301,1,Cut each slice of bread twice diagonally to make 4 triangles (24 total). Set aside.
218,6569301,2,"Beat together milk, eggs, vanilla, and cinnamon in a shallow bowl until well combined."
219,6569301,3,"Heat butter over medium-high heat in a frying pan or skillet. Working in batches, dunk bread triangles in egg mixture, soaking both sides. Cook bread triangles in hot butter until golden brown, 2 to 3 minutes per side. Serve warm."
220,6576874,1,Spray a 9x13-inch baking pan with cooking spray; add bread cubes.
221,6576874,2,"In a large bowl, beat cream cheese with an electric mixer on medium speed until smooth. Add eggs, one at a time, mixing well after each addition. Stir in milk, half-and-half, maple syrup, and vanilla until mixture is smooth; pour over bread cubes. Cover and refrigerate, 8 hours to overnight."
222,6576874,3,"The next morning, remove soufflé from the refrigerator and let stand at room temperature for 30 minutes. Meanwhile, preheat the oven to 375 degrees F (190 degrees C)."
223,6576874,4,"Bake soufflé, uncovered, in the preheated oven until a knife inserted in the center comes out clean, about 30 minutes. Serve warm, sprinkled with confectioners' sugar."
224,6597327,1,Mix together whole milk and brown sugar in a large bowl until combined.
225,6597327,2,"Beat together eggs, vanilla extract, almond extract, cinnamon, nutmeg, and allspice in a separate bowl until eggs are well beaten; add to milk mixture and stir to dissolve brown sugar."
226,6597327,3,Heat a nonstick skillet or griddle over medium-low heat.
227,6597327,4,"Set 1 slice Texas toast into milk mixture; let soak until moistened, about 10 seconds per side."
228,6597327,5,"Cook dipped toast in the preheated skillet until the bottom is golden brown, 3 to 5 minutes; flip toast and continue cooking until the other side is browned, 3 to 5 minutes more. Repeat dipping and cooking remaining bread slices."
229,6651116,1,"In a bowl, whisk milk, vanilla, sugar, and cinnamon into the beaten eggs until well blended. Set aside. In a separate bowl, cream together raspberry puree and cream cheese until smooth. Make 'sandwiches' by cutting each slice of bread in half and spreading raspberry-cheese mixture in the center, then top with the other half."
230,6651116,2,"Melt butter over medium heat in a large skillet or griddle. Dip bread into egg mixture, coating thoroughly. Cook until well-browned on both sides, about 5 minutes. Dust with confectioners' sugar and nutmeg. Serve immediately."
231,6575243,1,Spread chocolate-hazelnut spread on 1 side of each slice of bread. Arrange banana slices over chocolate-hazelnut spread on 2 of the slices. Place remaining slices atop bananas to form 2 sandwiches.
232,6575243,2,"Whisk chocolate milk, eggs, vanilla extract, and cinnamon together in a bowl. Dip sandwiches in milk mixture and turn as necessary to coat completely."
233,6575243,3,"Melt butter in a large skillet over medium-low heat. Cook sandwiches in hot butter until both sides are golden brown and banana and chocolate spread have softened, 4 to 6 minutes per side."
