,id_recipe,Step_Count,Step Description
0,7966411,1,"Spread 1 tablespoon peanut butter over the center of 4 slices of bread, taking care not to spread it all the way to the edges. Repeat with remaining bread slices and jelly.  Place peanut butter slices on top of the jelly slices to make a peanut butter and jelly sandwich."
1,7966411,2,"Whisk eggs, milk, and cinnamon together in a shallow dish until well combined.  Place one sandwich in egg mixture, allowing it to soak through just slightly.  Flip and repeat."
2,7966411,3,"Heat 1 tablespoon butter in a skillet over medium heat.  Place sandwich into skillet and cook until golden and lightly toasted, about 4 minutes.  Flip and repeat until egg is cooked through and the sandwich is toasted on both sides.  Repeat with the remaining sandwiches,  egg mixture, and butter."
3,7966411,4,Dust with powdered sugar and serve immediately.Dotdash Meredith Food Studios
4,7112447,1,Preheat the oven to 200 degrees F (95 degrees C).
5,7112447,2,"Whisk eggs, half-and-half, sugar, vanilla, cinnamon, salt, and nutmeg together in a shallow bowl. Dip each croissant half into the egg mixture, one at a time, flipping it and lightly pressing down, until well coated."
6,7112447,3,"Melt the butter in a large skillet over medium heat; add four croissant halves, cut side down. Fry until browned on both sides, turning once, 2 to 3 minutes per side. Transfer to the oven to keep warm while you cook the remaining croissants."
7,7112447,4,Serve warm with your favorite toppings.
8,6664040,1,Gather all ingredients.Dotdash Meredith Food Studios
9,6664040,2,"Whisk milk, eggs, vanilla, cinnamon, and salt together in a shallow bowl.Dotdash Meredith Food Studios"
10,6664040,3,Lightly butter a griddle or skillet and heat over medium-high heat.
11,6664040,4,"Dunk bread in the egg mixture, soaking both sides.Dotdash Meredith Food StudiosDotdash Meredith Food Studios"
12,6664040,5,"Transfer to the hot skillet and cook until golden, 3 to 4 minutes per side.Dotdash Meredith Food StudiosDotdash Meredith Food Studios"
13,6664040,6,Serve hot.DOTDASH MEREDITH FOOD STUDIOS
14,6648752,1,"Measure flour into a large mixing bowl. Slowly whisk in milk. Whisk in eggs, sugar, vanilla extract, cinnamon, and salt until smooth."
15,6648752,2,Heat a lightly oiled griddle or frying pan over medium heat.
16,6648752,3,Soak bread slices in milk mixture until saturated.
17,6648752,4,"Working in batches, cook bread on the preheated griddle or pan until golden brown on each side. Serve hot."
18,6663400,1,"Prepare casserole: Lightly grease a 9x13-inch baking dish. Arrange 1/2 of the bread cubes in the dish and top with cream cheese cubes. Sprinkle blueberries over the cream cheese, then top with remaining bread cubes."
19,6663400,2,"Whisk eggs, milk, vanilla extract, and syrup together in a large bowl until well-combined; pour over the bread cubes. Cover and refrigerate overnight."
20,6663400,3,Remove casserole from the refrigerator about 30 minutes before baking. Preheat the oven to 350 degrees F (175 degrees C).
21,6663400,4,"Bake casserole in the preheated oven, covered, for 30 minutes. Uncover, and continue baking until center is firm and surface is lightly browned, about 25 to 30 minutes."
22,6663400,5,"Meanwhile, prepare blueberry sauce: Mix sugar, water, and cornstarch together in a medium saucepan; bring to a boil and cook, stirring constantly, 3 to 4 minutes. Stir in blueberries, reduce heat to low, and simmer until all the blueberries burst, about 10 minutes. Stir in butter."
23,6663400,6,Serve portions of casserole on plates and pour warm syrup over top.
24,6664362,1,Pour melted butter into a 9x13-inch baking dish; grease the sides with butter and let remaining butter sit in the bottom of the dish.
25,6664362,2,Sprinkle brown sugar and cinnamon evenly over melted butter. Arrange two layers of bread slices on top.
26,6664362,3,"Whisk eggs, milk, and salt together in a bowl; pour over bread slices. Cover and refrigerate 8 hours to overnight."
27,6664362,4,Preheat the oven to 350 degrees F (175 degrees C).
28,6664362,5,"Bake in the preheated oven until golden brown, about 30 minutes."
29,7372061,1,Preheat the oven to 350 degrees F (175 degrees C). Line a standard-sized loaf pan with parchment paper. Set aside. Cut bread into 1 inch thick slices. Set aside.
30,7372061,2,"Whisk eggs, maple syrup or honey, cinnamon, vanilla extract, and salt together in a bowl. Stir in Almond BreezeUnsweetened Vanilla Almondmilk. Soak sliced bread in the mixture, turning to coat both sides evenly."
31,7372061,3,"Meanwhile, slice apples horizontally into thin rings. Use a corer or a metal frosting tip to core the apple core from the slices."
32,7372061,4,"Layer soaked bread slices and apples in the prepared loaf pan, alternating 1 slice of bread to 3 slices of apples. If you have any egg mixture left over once you’re done, pour it over the entire loaf. Sprinkle with chopped Blue Diamond Almonds and cover loosely with foil."
33,7372061,5,"Bake in the preheated oven for 45 to 50 minutes, removing the tin foil after 30 minutes. Allow to cool for 10 minutes before sprinkling with powdered sugar!"
34,7372061,6,"To serve, use a bread knife to cut slices from the loaf. Drizzle with maple syrup!"
35,7113436,1,"Combine chicken drumsticks, carrots, onions, celery, and broth in a saucepan. Bring to a simmer over high heat. Reduce heat to medium-low, cover, and simmer for 20 minutes. Turn drumsticks over, cover, and cook for another 20 minutes."
36,7113436,2,"Remove chicken and transfer to a plate. Allow to cool, wrap, and transfer into the refrigerator until needed."
37,7113436,3,"Turn heat to medium-high and reduce cooking liquids in the saucepan to about 1/3 cup. Strain liquid into a mixing bowl, pressing some of the cooked vegetables through the sieve. Season gravy with black pepper, salt, thyme leaves, lemon zest, and cayenne; add creme fraiche and eggs and whisk everything together until a smooth batter forms."
38,7113436,4,"Place bread in a shallow baking dish just large enough to fit the slices, and pour over the batter. Toss several times, wrap and place in the fridge for 1 hour or until almost all the batter is absorbed."
39,7113436,5,Preheat the oven to 400 degrees F (200 degrees C). Line a baking sheet with foil and lightly grease with butter.
40,7113436,6,Melt butter in a small skillet over medium heat and brown bread for a few minutes per side. Transfer bread onto the prepared baking sheet.
41,7113436,7,"Press one drumstick into the top of each slice of bread. Brush over any excess batter. Sprinkle with salt, dust with Parmesan cheese, and finish with a shake of cayenne."
42,7113436,8,"Bake in the preheated oven until nicely browned, 30 to 35 minutes."
43,7113436,9,"Mix together maple syrup, Sriracha hot sauce, and cayenne pepper in a little bowl (""dragon syrup"")."
44,7113436,10,Serve chicken leg toast drizzled with dragon syrup.
45,6592800,1,"Beat eggs in a wide mixing bowl; mix in sugar, vanilla extract, cinnamon, and nutmeg."
46,6592800,2,Melt butter in a skillet over medium-low heat.
47,6592800,3,"Dip 2 slices of bread into egg mixture, ensuring both sides are covered; place in the skillet and cook until golden brown, about 4 minutes per side. Repeat with remaining 2 slices of bread. Serve warm."
48,6649488,1,Melt butter in a small saucepan over medium heat. Add brown sugar and corn syrup; stir until sugar is dissolved. Pour into a 9x13-inch baking dish.
49,6649488,2,"Remove crusts from bread and arrange in the baking dish in a single layer. Whisk eggs, half and half, vanilla, brandy, and salt together in a bowl. Pour over the bread. Cover and chill at least 8 hours, or overnight."
50,6649488,3,"Preheat the oven to 350 degrees F (175 degrees C). Meanwhile, remove the dish from the refrigerator and bring to room temperature."
51,6649488,4,"Bake, uncovered, in the preheated oven until puffed and lightly browned, 35 to 40 minutes."
52,6568859,1,"Combine milk, egg, salt, and vanilla extract in a shallow bowl. Dip both sides of each piece of bread in egg mixture."
53,6568859,2,"Heat a large frying pan over medium-low heat. Add oil to the hot pan and cook both pieces of toast until lightly browned, 2 to 3 minutes per side. Top with maple syrup and sprinkle with cinnamon."
54,6592496,1,Preheat the oven to 350 degrees F (175 degrees C).
55,6592496,2,"Whisk milk, eggs, vanilla, sugar, nutmeg, and salt together in a bowl."
56,6592496,3,"Heat 1 1/2 teaspoons butter in a skillet over medium heat. Working in batches, dip each slice of brioche bread in the egg mixture and cook in the hot butter until golden, 2 to 3 minutes per side, adding more butter as needed. Transfer French toast to a baking sheet."
57,6592496,4,"Bake in the preheated oven until puffed, 8 to 10 minutes."
58,6592496,5,"Cook and stir 1/4 cup butter in a skillet over medium-low heat until browned and toasty, 3 to 5 minutes. Transfer browned butter to a cold dish. Drizzle browned butter over baked French toast and top each slice with 1 tablespoon maple syrup."
59,6663689,1,"Whisk eggnog, eggs, cinnamon, and pumpkin pie spice together in a mixing bowl until well blended; pour into a shallow dish."
60,6663689,2,Preheat an electric skillet to 300 degrees F (150 degrees C). Lightly grease the skillet.
61,6663689,3,"Dip one slice of bread at a time into eggnog mixture, being sure to coat each side of the bread thoroughly."
62,6663689,4,"Place prepared bread slices into the preheated skillet, and cook, turning once, until golden brown on each side. Place cooked bread slices on a serving plate and cover with foil to keep warm until all the slices are cooked. Serve immediately."
63,6588837,1,"Whisk milk, eggs, maple syrup, vanilla, and cinnamon together in a medium bowl. Add crumbled cornflakes and stir to combine."
64,6588837,2,"Working in batches, soak 1/2 of the bread slices in the mixture for about 2 to 3 minutes."
65,6588837,3,"Heat oil in a large skillet or griddle over medium-high heat. Cook soaked bread slices in the hot skillet until dark golden brown, 4 to 5 minutes per side. Repeat to soak and cook remaining bread."
66,6588837,4,Sprinkle hot French toast with confectioners' sugar. Serve immediately.
67,6588481,1,"Mix eggs, milk, butter, vanilla extract, and cinnamon together in a bowl."
68,6588481,2,Line an air fryer basket with parchment paper and spray with nonstick cooking spray. Dip each slice of bread into the milk mixture and place in the basket. Make sure they are not touching; work in batches if necessary.
69,6588481,3,Preheat the air fryer to 370 degrees F (190 degrees C).
70,6588481,4,Add basket and air fry French toast for 4 to 6 minutes; flip and cook for 2 to 3 minutes more. Sprinkle with confectioners' sugar.
71,6585057,1,"Whisk milk, cinnamon, and vanilla together in a shallow bowl until well combined."
72,6585057,2,Melt butter in a large skillet over medium heat.
73,6585057,3,Gently press two bread slices into milk mixture until lightly coated on both sides (do not soak).
74,6585057,4,"Cook coated slices in melted butter until golden brown and somewhat firm, 5 to 8 minutes per side. Repeat for remaining bread slices."
75,6650181,1,"Mix beaten eggs, sugar, milk, cinnamon, and salt together in a large, shallow bowl. Dip bread slices into egg mixture to coat."
76,6650181,2,"Spray a skillet with cooking spray and heat over medium heat. Working in batches, cook bread in the hot skillet until browned, 2 to 3 minutes per side."
77,6589153,1,"Mix eggs, powdered sugar, milk, maple syrup, brown sugar, and cinnamon together in a bowl with a fork until well blended. Dip each bread stick into the egg mixture."
78,6589153,2,"Coat a skillet with nonstick spray and heat over medium heat. Place sticks in the hot skillet and cook until brown, 2 to 3 minutes; turn over and cook until browned on other side, 2 to 3 minutes more. Repeat with the second batch."
79,6583246,1,"In a shallow bowl, whisk together the eggs, sweetened condensed milk and vanilla with a fork. Set aside."
80,6583246,2,"Melt butter in a large skillet over medium heat. Slice banana bread into 4 thick slices. Dip each slice into the egg mixture, then place in the hot pan. Cook on each side until golden brown. Dust with confectioners' sugar just before serving, if desired."
81,6571972,1,"Whisk eggs, Parmesan cheese, milk, and black pepper in a shallow bowl until light and fluffy, about 1 minute."
82,6571972,2,Melt butter in a large skillet over medium heat.
83,6571972,3,"Dip both sides of each slice of bread in egg mixture; place bread in hot butter in the skillet. Cook until golden brown, 2 to 3 minutes per side."
84,6571972,4,Transfer to a warmed plate and dot with butter to serve.
85,6573194,1,"Whisk milk, egg, and cinnamon together in a shallow bowl. Dip panettone slice in the milk mixture; turn to ensure both sides are coated and most of the liquid has been absorbed."
86,6573194,2,"Melt butter in a nonstick skillet over medium-low heat. Cook panettone in the hot butter until golden brown, about 5 minutes per side."
87,6598427,1,"In a large bowl, whisk together eggs, milk, cream and vanilla. Dip bread slices into egg mixture and place in a lightly greased 9x13 inch baking pan. Refrigerate overnight."
88,6598427,2,The next morning: Preheat oven to 350 degrees F (175 degrees C).
89,6598427,3,"In a small bowl, combine butter, sugar, maple syrup and pecans. Spoon mixture over bread."
90,6598427,4,"Bake in preheated oven until golden, about 40 minutes. Let stand 5 minutes before serving."
91,6576270,1,"Beat the eggs, sugar, and salt together in a mixing bowl. Whisk in the milk, followed by the flour; whisk until smooth."
92,6576270,2,Heat oil in a deep-fryer or large saucepan to 375 degrees F (190 degrees C).
93,6576270,3,"Soak the bread slices in the egg mixture until the egg has penetrated through to the center of the bread. Wipe off the excess egg. Cook in the deep-fryer several pieces at a time to avoid overcrowding. Cook until golden brown on both sides and no longer soggy in the center, about 4 minutes. Drain the French toast on a paper towel-lined plate before serving."
94,6739309,1,Spread softened cream cheese on four slices of bread. Spread raspberry jam on the remaining 4 slices of bread; press the cream cheese and jam slices together forming sandwiches.
95,6739309,2,"Beat eggs, milk, and almond extract together in a medium, shallow bowl."
96,6739309,3,"Melt butter in a large, heavy skillet over medium-high heat. Dip sandwiches in egg mixture to coat evenly; place in the skillet, and cook on both sides until golden brown, about 2 to 4 minutes per side."
97,6737183,1,Melt two tablespoons of butter in a frying pan or skillet over medium high heat.
98,6737183,2,"Beat together eggs, milk and salt. Dip bread one at a time into egg mixture and fry until light brown and egg is cooked."
99,6737183,3,"After 4 slices of bread have been cooked, melt remaining 2 tablespoons butter. Cook remaining bread slices until light brown on both sides and egg is cooked."
100,6737183,4,"After all bread slices have been cooked and removed from pan, add brown sugar to pan. Stir until melted and sticky. Add water and stir. Place French toast in caramel sauce. Turn to coat, then remove from pan. Serve."
101,6737457,1,Lightly beat egg and vanilla together in a shallow bowl.
102,6737457,2,"Spread 1 tablespoon of peanut butter on top of each slice of bread. Arrange banana slices on top of peanut butter on one slice of bread; place the other slice of bread, peanut butter-side down, on top of the banana to make a sandwich."
103,6737457,3,"Melt butter in a skillet over medium heat. Dip sandwich into egg mixture until well coated; transfer into the heated skillet. Cook until golden brown on one side, about 2 to 3 minutes; flip and continue cooking until other side is browned, about 2 minutes more. Serve hot."
104,6575972,1,"Beat together egg substitute, milk, vanilla and cinnamon. Dip bread slices in egg mixture until both sides are soaked."
105,6575972,2,Spray a skillet or frying pan with cooking spray and heat over medium high heat. Place bread slices into pan and cook until golden brown on both sides
106,6736936,1,Preheat oven to 400 degrees F (200 degrees C).
107,6736936,2,"Whisk eggs, milk, vanilla extract, cinnamon, allspice, and salt together in a large bowl. Place bread slices in egg mixture and soak, turning to coat, until bread is completely saturated."
108,6736936,3,"Melt butter in a cast-iron skillet over medium heat. Working in batches, cook bread in hot butter until golden, about 3 minutes per side. Transfer toasted bread to a baking sheet."
109,6736936,4,"Bake toast in the oven until outside is crisp and slightly puffed, 12 to 15 minutes."
110,6663139,1,"Mix eggs, milk, butter, vanilla extract, and cinnamon together in a bowl."
111,6663139,2,Line an air fryer basket with parchment paper. Dip each piece of bread into the milk mixture and place in the basket. Make sure they are not touching; cook in batches if necessary.
112,6663139,3,Preheat the air fryer to 370 degrees F (188 degrees C). Add basket and cook bread for 6 minutes; flip and cook for 3 minutes more. Sprinkle each stick with confectioners' sugar.
113,6736381,1,Spread 1 tablespoon chocolate-hazelnut spread onto one side of each of 2 slices cinnamon bread; top each with another bread slice to make 2 sandwiches.
114,6736381,2,"Beat milk, egg, and vanilla extract together in a shallow bowl until smooth. Soak each sandwich in the milk mixture until the bread is moistened, about 15 seconds per side."
115,6736381,3,Prepare a nonstick pan with cooking spray and heat over medium-high heat.
116,6736381,4,"Cook sandwiches in the hot pan until browned on the bottom, about 2 minutes. Flip sandwiches and continue cooking until other side is browned, about 1 minute more."
117,6600884,1,"In a saucepan, stir together the brown sugar, butter and water. Bring to a boil, then reduce heat to low, and simmer for 10 minutes, stirring frequently."
118,6600884,2,"Pour the brown sugar mixture into a 9x13 inch baking dish, and tilt the dish to cover the entire bottom. Place peaches in a layer over the sugar coating, then top with slices of French bread. In a medium bowl, whisk together the eggs and vanilla. Slowly pour over the bread slices to coat evenly. Sprinkle cinnamon over the top. Cover and refrigerate for 8 hours or overnight."
119,6600884,3,Remove the dish from the refrigerator about 30 minutes before baking to come to room temperature. Preheat the oven to 350 degrees F (175 degrees C).
120,6600884,4,"Bake for 25 to 30 minutes in the preheated oven, or until the bread is golden brown. Spoon out portions to serve."
121,6568452,1,"Beat together egg, milk, cinnamon, vanilla and salt."
122,6568452,2,Heat a lightly oiled skillet or griddle over medium heat.
123,6568452,3,"Soak bread slices in egg mixture for 20 second on each side, or until thoroughly coated. Cook bread until both sides are lightly browned and crisp. Serve hot."
124,6604692,1,"Whisk together milk, eggs, peanut butter, sugar, vanilla extract, and cinnamon in a large bowl."
125,6604692,2,Heat the oil in a griddle or frying pan over medium heat.
126,6604692,3,"Dunk each slice of bread in egg mixture, soaking both sides. Place in pan, and cook on both sides until golden, about 3 to 4 minutes per side. Serve hot."
127,6584483,1,"Beat together milk, eggs, sugar, cocoa powder, baking powder, and salt."
128,6584483,2,Heat a lightly buttered skillet or griddle over medium heat.
129,6584483,3,"Dip each slice of bread into egg mixture until well soaked, about 20 seconds per side. Place in pan, and cook on both sides until they are no longer gooey or shiny in the middle when cut in half, about 3 to 4 minutes per side."
130,6601909,1,"Combine eggs, milk and cinnamon; beat well. Dip bread into egg mixture until completely coated."
131,6601909,2,Heat a lightly oiled griddle or frying pan over medium high heat. Cook bread slices until they are golden brown on both sides. Serve hot.
132,6599153,1,"Grease a 9x13 inch baking pan. In a small bowl, stir together the melted butter, brown sugar and cinnamon."
133,6599153,2,"Spread the sugar mixture into the bottom of the prepared pan. Spread the apple pie filling evenly over the sugar mixture. Layer the bread slices on top of the filling, pressing down as you go. In a medium bowl, beat the eggs with the milk and vanilla. Slowly pour this mixture over the bread, making sure that it is completely absorbed. Cover the pan with aluminum foil and refrigerate overnight."
134,6599153,3,"In the morning, preheat oven to 350 degrees F (175 degrees C)."
135,6599153,4,"Place covered pan into the oven and bake at 350 degrees F (175 degrees C) for 60 to 75 minutes. When done remove from oven and turn on broiler. Remove foil and drizzle maple syrup on top of the egg topping; broil for 2 minutes, or until the syrup begins to caramelize. Remove from the oven and let stand for 10 minutes, then cut into squares. Invert the pan onto a serving tray or baking sheet so the apple filling is on top. Serve hot."
136,6737526,1,"In a small bowl, stir together the brown sugar, melted butter, and corn syrup. Pour into a greased 9x13 inch baking dish, and spread evenly. Sprinkle pecans over the sugar mixture. Arrange the bread slices in the bottom of the dish so they are in a snug single layer."
137,6737526,2,"In a medium bowl, whisk together the orange zest, orange juice, milk, sugar, cinnamon, vanilla, egg whites, and eggs. Pour this mixture over the bread, pressing on the bread slices to help absorb the liquid. Cover and refrigerate for at least one hour, or overnight."
138,6737526,3,"Preheat the oven to 350 degrees F (175 degrees C ). Remove the cover from the baking dish, and let stand for 20 minutes at room temperature."
139,6737526,4,"Bake for 35 minutes in the preheated oven, until golden brown. Dust with confectioners' sugar before serving.Dotdash Meredith Food Studios"
140,6576898,1,"In a large mixing bowl, beat the eggs. Add the milk, brown sugar and nutmeg; stir well to combine."
141,6576898,2,Soak bread slices in the egg mixture until saturated.
142,6576898,3,"Heat a lightly oiled griddle or frying pan over medium high heat. Brown slices on both sides, sprinkle with cinnamon and serve hot."
143,6575980,1,"Melt butter in the bottom of a large microwave-safe mug in the microwave, about 30 seconds. Tilt mug to coat all sides with melted butter."
144,6575980,2,"Stir melted butter, milk, egg, cinnamon, sugar, and vanilla extract together in the mug. Press bread cubes into milk mixture."
145,6575980,3,"Microwave on High until set, about 90 seconds."
146,6572752,1,"In a small saucepan, combine 1 cup brown sugar, 1/2 cup butter and 2 tablespoons corn syrup. Cook over medium heat, stirring constantly, until thickened."
147,6572752,2,"Pour sauce into a 9x13 inch baking dish and sprinkle with 1/2 cup pecans. Place 6 slices of bread on top of the sauce, sprinkle with the remaining pecans and cover with the remaining 6 slices of bread."
148,6572752,3,"Combine eggs, milk, vanilla, nutmeg, cinnamon and salt in a blender. Pour egg mixture evenly over bread slices, cover the baking dish, and refrigerate for 8 hours or overnight."
149,6572752,4,"The next morning, preheat oven to 350 degrees F (175 degrees C). Remove the French toast from the refrigerator 30 minutes prior to baking. Bake in preheated oven for 40 to 45 minutes, until lightly brown. Drizzle sauce over the toast right before serving."
150,6572752,5,"To make the Caramel Sauce: In a small saucepan, combine 1/2 cup brown sugar, 1/4 cup butter and 1 tablespoon corn syrup. Cook until thickened, stirring constantly."
151,6739498,1,Place bread slices on a wire rack to dry while preparing batter.
152,6739498,2,Melt 3 tablespoons butter in a saucepan over medium-low heat and allow to cool slightly.
153,6739498,3,"Whisk egg in a shallow bowl. Whisk sugar, salt, cinnamon, and nutmeg into egg. When butter has cooled slightly, slowly drizzle it into egg mixture while whisking. Add flour to egg mixture, a little at a time, until a smooth thick paste forms. Slowly blend in milk and vanilla; whisk until just smooth and set aside."
154,6739498,4,Heat remaining butter in a large skillet over medium heat.
155,6739498,5,Dip a bread slice in batter and allow to soak for no more than 30 seconds. Remove from batter and allow excess to drip back into the bowl. Place battered slice in the hot skillet. Repeat with remaining bread slices.
156,6739498,6,"Cook bread slices until golden, 2 to 3 minutes per side. Serve immediately."
157,6599022,1,"Beat eggs in a bowl until smooth. Add buttermilk, almond extract, cinnamon, and nutmeg and beat well until batter is smooth. Dip bread into batter until evenly coated."
158,6599022,2,"Spray a skillet with cooking spray and heat over medium heat. Cook coated bread until golden brown, 4 to 5 minutes per side."
159,6599022,3,"Combine white sugar, water, and brown sugar in a saucepan; bring to a boil and cook for 1 minute. Remove saucepan from heat and cool syrup for 2 minutes. Stir maple-flavored extract and vanilla extract into syrup. Serve syrup over French toast."
160,6738688,1,Preheat an oven to 100 degrees F ( 40 degrees C).
161,6738688,2,Heat mashed strawberries and 1/2 cup white sugar in a saucepan over medium heat.
162,6738688,3,"Mix cornstarch and water together in a bowl, then stir into the strawberries."
163,6738688,4,"Cook and stir until thickened, about 5 minutes. Reduce heat to low and simmer while preparing remaining ingredients, stirring occasionally."
164,6738688,5,Whisk together the milk and eggs in a bowl; set aside.
165,6738688,6,"Mash cream cheese, vanilla extract, and 3/4 cup white sugar in a bowl until smooth."
166,6738688,7,"Spread the cream cheese mixture over a triangle-shaped piece of bread, and top with another piece. Repeat with remaining bread and cream cheese mixture to make 8 triangle-shaped sandwiches."
