,id_recipe,Step_Count,Step Description
110,6567642,3,"Increase the heat to high and stir constantly until mixture comes to a full, rolling boil. Quickly stir in pectin and return to a full boil. Boil, stirring constantly, for 1 minute. Remove from the heat; skim off and discard any foam."
111,6567642,4,"Pack jam into hot, sterilized jars, filling to within 1/8 inch of the top. Run a clean knife or thin spatula around the insides of the jars to remove any air bubbles. Wipe rims with a moist paper towel to remove any residue. Top with lids and screw rings on tightly."
112,6567642,5,"Place a rack in the bottom of a large stockpot and fill halfway with water. Bring to a boil and lower jars 2 inches apart into the boiling water using a holder. Pour in more boiling water to cover jars by at least 1 inch. Bring to a rolling boil, cover, and process for 10 minutes."
113,6567642,6,"Remove the jars from the stockpot and let rest on a cloth-covered or wood surface, several inches apart, for 12 to 24 hours. Press the center of each lid with a finger to ensure the lid does not move up or down. Remove the rings for storage and store in a cool, dark area."
114,6567226,1,"Simmer 3 pint-size jars in a large pot of water until jelly is ready. Wash the lids and rings in warm, soapy water."
115,6567226,2,Slice ends off each prickly pear. Make 1 long vertical slit down each one. Use slit to hold skin and peel off. Discard peel.
116,6567226,3,Place peeled pears in a blender; purée in batches until liquefied. Press puréed mixture through a fine-mesh sieve set over a bowl. Discard pulp and seeds.
117,6567226,4,"Measure out 3 cups prickly pear juice and pour into a large pot. Add lemon juice and pectin; bring to a boil, stirring constantly. Add sugar and return to a boil, stirring constantly. Let cook at a boil until thickened, about 3 minutes. Remove from heat."
118,6567226,5,"Pour prickly pear jelly into the hot, sterilized jars, filling to within 1/4 inch of the top. Run a clean knife or thin spatula around the insides of the jars to remove any air bubbles. Wipe the rims of the jars with a moist paper towel to remove any food residue. Top with the lids and screw on the rings."
119,6567226,6,"Place a rack in the bottom of a stockpot and fill halfway with water; bring to a boil. Lower jars 2 inches apart into boiling water using a holder. Pour in more boiling water to cover jars by at least 1 inch. Bring to a rolling boil, cover the stockpot, and process for 15 minutes."
120,6567226,7,"Remove the jars from the stockpot and place onto a cloth-covered or wood surface several inches apart. Let cool for at least 24 hours. Press the center of each lid with a finger to ensure the lid does not move up or down. Remove the rings for storage and store in a cool, dark area."
121,6566457,1,Gather all ingredients.Dotdash Meredith Food Studios
122,6566457,2,"Make 4 to 5 slits in mangoes and microwave on High until soft, 1 to 2 minutes.Dotdash Meredith Food Studios"
123,6566457,3,"Cool, then remove the peel and inner seed; place mango pulp in a large bowl. Use a fork or potato masher to mash the pulp well.Dotdash Meredith Food Studios"
124,6566457,4,"Stir together sugar and water in a large saucepan over low heat, and bring to a boil. When the mixture begins boiling, increase heat to medium-high. Continue boiling until fine, soft threads form, 270 degrees F (135 degrees C).Dotdash Meredith Food Studios"
125,6566457,5,"Stir in mango pulp, add saffron threads, and boil until the mixture thickens, about 5 minutes.Dotdash Meredith Food Studios"
126,6566457,6,Pour cooked jam into sterilized jars and seal according to canning directions.Dotdash Meredith Food Studios
127,6650666,1,"Place apple pieces into a large slow cooker. Add white sugar, brown sugar, salt, cinnamon, nutmeg, allspice, and vinegar. Add a splash of water and mix well."
128,6650666,2,"Cover and cook on High until apples are starting to soften and release liquid, 1 to 2 hours. Reduce heat to Low and cook, uncovered, until all the apple flesh is dissolved, 5 to 6 hours. Stir occasionally."
129,6650666,3,"Puree using an immersion blender until smooth. Continue cooking, stirring occasionally, until darkened and thick, about 4 hours more. Pass apple butter through a strainer if desired. Seal in a glass container and refrigerate until cool."
130,6565340,1,"Stir the vinegar and sugar in a saucepan over medium-high heat until the sugar has dissolved, then stir in the carrot and red bell pepper. Bring to a boil, reduce heat to medium, and simmer 5 minutes. Add the habanero peppers and simmer 5 minutes longer. Pour in the pectin, and boil for 1 minute, stirring constantly. Skim and discard any foam from the jelly."
131,6565340,2,"Sterilize the jars and lids in boiling water for at least 5 minutes. Pour the jelly into the hot, sterilized jars, filling the jars to within 1/4 inch of the top. Wipe the rims of the jars with a moist paper towel to remove any food residue. Top with lids, and screw on rings."
132,6565340,3,"Place a rack in the bottom of a large stockpot and fill halfway with water. Bring to a boil over high heat, then carefully lower the jars into the pot using a holder. Leave a 2 inch space between the jars. Pour in more boiling water if necessary until the water level is at least 1 inch above the tops of the jars. Bring the water to a full boil, cover the pot, and process for 5 minutes."
133,6565340,4,"Remove the jars from the stockpot and place onto a cloth-covered or wood surface, several inches apart, until cool. Once cool, press the top of each lid with a finger, ensuring that the seal is tight (lid does not move up or down at all)."
134,6563410,1,"Fill a large bowl with cool water; add baking soda and stir to dissolve. Add figs and gently stir to clean. Drain water and rinse figs thoroughly with fresh, cool water. Drain again."
135,6563410,2,"Transfer figs to a large pot; add sugar, water, butter, lemon slices, lemon juice, cinnamon, vanilla, ginger, and cloves. Stir gently to dissolve sugar, keeping figs as intact as possible."
136,6563410,3,"Bring mixture to a boil over medium heat. Reduce the heat and simmer, stirring gently a few times to keep figs from burning onto the bottom, until figs are golden brown and coated in syrup, about 1 hour. Add salt to tame the sweetness if desired."
137,6563410,4,"Meanwhile, inspect 8 half-pint jars for cracks and rings for rust, discarding any defective ones. Immerse in simmering water until figs are ready. Wash new, unused lids and rings in warm soapy water."
138,6563410,5,"Pack figs into hot, sterilized jars and top off with syrup, filling to within 1/4 inch of the top. Run a clean knife or thin spatula around the insides of the jars to remove any air bubbles. Wipe rims with a moist paper towel to remove any residue. Top with lids and screw rings on tightly."
139,6563410,6,"Place a rack in the bottom of a large stockpot and fill halfway with water. Bring to a boil and lower jars 2 inches apart into the boiling water using a holder. Pour in more boiling water to cover jars by at least 1 inch. Bring to a rolling boil, cover, and process for 15 minutes."
140,6563410,7,"Remove the jars from the stockpot and place onto a cloth-covered or wood surface. Let rest, several inches apart, for 12 to 24 hours. Press the center of each lid with a finger to ensure the lid does not move up or down. Store in a cool, dark area, and wait at least 2 days before opening."
141,6564626,1,"Sterilize and dry jars for jelly, and set side. I like to use my dishwasher. New lids are recommended for best results."
142,6564626,2,"Combine grape juice and pectin in a large pot over medium-high heat. Bring to a boil, and stir one minute at a rolling boil. Stir in sugar for a few minutes to completely dissolve. Remove from heat."
143,6564626,3,"Ladle the hot jelly into the jars, leaving 1/2 inch of space at the top. Wipe rims of jars with a clean dry cloth. Cover with a lid and ring to seal. Let stand 24 hours at room temperature, then refrigerate. Jelly may take up to a week to set. Once set, it is ready to serve. Store in the refrigerator for up to three weeks, once set. If canning for long term storage, process in a hot water bath for 10 minutes, or contact your local extension for processing times in your area."
144,6561800,1,"Mix figs and sugar together in a large saucepan, place over medium heat, and cook, stirring often, until sugar has dissolved. Mix in strawberry gelatin; bring the mixture to a boil and boil for 7 minutes. Mash preserves with a potato masher if desired."
145,6561800,2,"Sterilize the jars and lids in boiling water for at least 5 minutes. Pack the fig preserves into the hot, sterilized jars, filling the jars to within 1/4 inch of the top. Run a knife or a thin spatula around the insides of the jars after they have been filled to remove any air bubbles. Wipe the rims of the jars with a moist paper towel to remove any food residue. Top with lids and screw on rings."
146,6561800,3,"Place a rack in the bottom of a large stockpot and fill halfway with water. Bring to a boil and lower jars into the boiling water using a holder. Leave a 2-inch space between the jars. Pour in more boiling water if necessary to bring the water level to at least 1 inch above the tops of the jars. Bring the water to a rolling boil, cover the pot, and process for 10 minutes."
147,6561800,4,"Remove the jars from the stockpot and place onto a cloth-covered or wood surface, several inches apart, until cool. Once cool, press the top of each lid with a finger, ensuring that the seal is tight (lid does not move up or down at all). Store in a cool, dark area."
148,6579108,1,Heat water in a large pot until simmering. Add 2 cups dandelion petals; simmer for 10 minutes. Remove petals with a slotted spoon and strain over a bowl; squeeze out as much liquid from them as possible. Discard petals. Repeat with remaining 2 cups petals.
149,6579108,2,"Measure out 3 cups of dandelion-infused water, adding tap water to make up the difference if needed, and pour into a large pot. Add lemon juice, pectin, and yellow food coloring; bring to a rolling boil. Add sugar; return to a boil. Cook, stirring constantly, about 1 minute. Remove from heat and skim foam off the surface if needed."
150,6579108,3,"Pour mixture into hot, sterilized jars, filling to within 1/4 inch of the top. Run a clean knife or thin spatula around the insides of the jars to remove any air bubbles. Wipe the rims of the jars with a moist paper towel to remove any residue. Top with lids and screw on rings."
151,6579108,4,"Place a rack in the bottom of a large pot and fill halfway with water. Bring to a boil and lower jars, 2 inches apart, into the boiling water using a holder. Pour in more boiling water if necessary to bring the water level to at least 1 inch above the tops of the jars. Bring the water to a rolling boil, cover the pot, and process for 7 minutes."
152,6579108,5,"Remove the jars from the pot and place on a cloth-covered or wood surface, several inches apart. Press the top of each lid with a finger, ensuring that the seal is tight. Let cool, about 24 hours."
153,6737725,1,"Combine wine, lemon juice, and pectin in a large saucepot. Bring to a boil, stirring frequently. Add sugar, stirring until dissolved. Return to a rolling boil. Boil hard 1 minute, stirring constantly. Remove from heat. Skim foam off top, if necessary."
154,6737725,2,"Ladle hot jelly into hot, sterilized jars, leaving 1/2 inch headspace. Tighten 2 piece lids. Process for 5 minutes in boiling water bath."
155,6595997,1,"Peel off the green part of the watermelon rind, and slice into 2 inch pieces. Soak the rind in a solution of 1 gallon water and 1/2 cup salt overnight."
156,6595997,2,"Remove rind from the salt water, and place in a stockpot with clean water to cover. Bring to a boil over medium-high heat, and cook for about 30 minutes, or until the rind is tender. Drain."
157,6595997,3,"In a large pot, combine the sugar, 8 cups water, and sliced lemons. Tie the cinnamon and cloves into a cheesecloth bag, and place in the pot. Bring the syrup to a boil, and boil for 5 minutes. Add the rinds, and cook until transparent. Remove spice bag. Stir in red food coloring, if using. Ladle preserves into hot sterile jars, and process to seal."
158,6649060,1,"Inspect two 5-ounce jars for cracks and rings for rust, discarding any defective ones. Immerse in simmering water until marmalade is ready. Wash new, unused lids and rings in warm soapy water."
159,6649060,2,Thoroughly wash and dry the grapefruits. Run a zester around 2 grapefruits to produce ribbons of zest. Set aside. Cut away thin strips of peel from the other two grapefruits with a sharp paring knife.
160,6649060,3,Peel off all remaining outer white parts of the fruit and discard. Cut the grapefruits into wheels. Remove any seeds.
161,6649060,4,"Put grapefruit wheels and zest strips into a non-reactive saucepan. Add sugar and stir well to cover fruit. Heat over medium-high heat until bubbling, mixing constantly. Smash the heated fruit until it liquefies. Reduce heat to low and cook over a steady boil, stirring often. Remove and discard any persistent white froth that won't disappear after being stirred. Continue to cook for about 10 minutes until marmalade begins to coat the back of a spoon."
162,6649060,5,Add zest ribbons and cook for 5 minutes more. Place a small amount of marmalade on a plate and put it in the freezer. Test the consistency after 3 minutes.
163,6649060,6,Remove the marmalade from the heat when the freezer sample meets your desired consistency.
164,6649060,7,"Pack grapefruit jam into hot, sterilized jars, filling to within 1/4 inch of the top. Run a clean knife or thin spatula around the insides of the jars to remove any air bubbles. Wipe rims with a moist paper towel to remove any residue. Top with lids and screw rings on tightly."
165,6649060,8,"Place a rack in the bottom of a large stockpot and fill halfway with water. Bring to a boil and lower jars 2 inches apart into the boiling water using a holder. Pour in more boiling water to cover jars by at least 1 inch. Bring to a rolling boil, cover, and process for 10 minutes."
166,6649060,9,"Remove the jars from the stockpot and let rest, several inches apart, for 24 hours. Press the center of each lid with a finger to ensure the lid does not move up or down. Remove the rings for storage and store in a cool, dark area."
167,6595564,1,"Prepare waterbath canner, jars and lids according to manufacturers instructions, if preserving. Prepare and measure ingredients for recipe."
168,6595564,2,Combine prepared fruit with fruit juice in a large saucepan. Gradually stir in Ball® RealFruit™ Low or No-Sugar Needed Pectin
169,6595564,3,"Add sugar, sugar substitute or honey, if using. Return mixture to a full rolling boil. Boil hard 1 minute, stirring constantly. Remove from heat. Skim foam if necessary."
170,6595564,4,"Ladle hot jam into hot jars, one at a time, leaving 1/4 inch headspace. Wipe rims. Center lids on jars. Apply bands and adjust to fingertip tight."
171,6595564,5,"Place filled jars in canner ensuring jars are covered by 1 to 2 inches of water. Place lid on canner. Bring water to gentle, steady boil."
172,6595564,6,"Process jars for 10 minutes, adjusting for altitude*. Turn off heat, remove lid and let jars stand for 5 minutes."
173,6595564,7,Remove jars and cool. Check lids for seal after 24 hours. Lid should not flex up and down when center is pressed. Clean and store according to manufacturers instructions.
174,6578795,1,"In a large saucepan or stockpot, stir together the fresh rhubarb and sugar. Cover, and let stand overnight."
175,6578795,2,"Bring the rhubarb and sugar to a boil over medium heat. Boil, stirring constantly, for 12 minutes on low heat. Remove from heat, and stir in dry gelatin mix. Transfer to sterile jars, and refrigerate."
176,6566212,1,"Combine apples, brown sugar, cinnamon, allspice, salt, and cloves in a slow cooker."
177,6566212,2,"Cook on High until the apples are tender enough to easily mash with a fork, 4 to 6 hours."
178,6566212,3,Puree apple mixture with an immersion blender until smooth.
179,6566212,4,"Sterilize the jars and lids in boiling water for at least 5 minutes. Pack apple butter into the hot, sterilized jars, filling the jars to within 1/4 inch of the top. Run a knife or a thin spatula around the insides of the jars after they have been filled to remove any air bubbles. Wipe the rims of the jars with a moist paper towel to remove any food residue. Top with lids, and screw on rings."
180,6566212,5,"Place a rack in the bottom of a large stockpot and fill halfway with water. Bring to a boil and lower jars into the boiling water using a holder. Leave a 2-inch space between the jars. Pour in more boiling water if necessary to bring the water level to at least 1 inch above the tops of the jars. Bring the water to a rolling boil, cover the pot, and process for 10 minutes."
181,6566212,6,"Remove the jars from the stockpot and place onto a cloth-covered or wood surface, several inches apart, until cool. Once cool, press the top of each lid with a finger, ensuring that the seal is tight (lid does not move up or down at all). Store in a cool, dark area."
182,6566803,1,"Divide the ginger in half, and chop half into cubes; shred the other half with a box grater or in a food processor using the shredding blade. Total ginger should equal 3 cups. Place the ginger into a large saucepan with water over medium heat, bring to a boil, and reduce heat to a simmer. Cover the pot, and simmer the ginger until tender, about 1 hour and 15 minutes. Add more water if needed to keep mixture from drying out. Pour the cooked ginger into a fine-mesh strainer, drain, and retain 1/2 cup of the ginger-flavored water. Place the cooked ginger in a bowl with the retained liquid, and cool at least 4 hours or overnight in refrigerator."
183,6566803,2,"When ginger is thoroughly cooled, place into a large, heavy-bottomed pot, and stir in the sugar; bring to a boil over medium-high heat, and boil hard for 1 minute, stirring constantly. Stir in the pouch of liquid pectin, reduce heat to a simmer, and cook for 7 more minutes, skimming foam from top of marmalade."
184,6566803,3,"Sterilize the canning jars and lids in boiling water for at least 5 minutes. Pack the marmalade into the hot, sterilized jars, filling the jars to within 1/4 inch of the top. Run a knife or a thin spatula around the insides of the jars after they have been filled to remove any air bubbles. Wipe the rims of the jars with a moist paper towel to remove any food residue. Top with lids, and screw on rings."
185,6566803,4,"Place a rack in the bottom of a large stockpot and fill halfway with water. Bring to a boil over high heat, then carefully lower the jars into the pot using a holder. Leave a 2 inch space between the jars. Pour in more boiling water if necessary until the water level is at least 1 inch above the tops of the jars. Bring the water to a full boil, cover the pot, and process for 15 minutes."
186,6566803,5,"Remove the jars from the stockpot and place onto a cloth-covered or wood surface, several inches apart, until cool. Once cool, press the top of each lid with a finger, ensuring that the seal is tight (lid does not move up or down at all). Store in a cool, dark area."
187,6584976,1,Mash blackberries in a saucepan with a potato masher. Stir in sugar until juices form. Remove 1 tablespoon blackberry juice from the saucepan; mix with cornstarch in a small bowl. Stir cornstarch mixture back into the saucepan.
188,6584976,2,"Bring blackberries to a boil. Once boiling, cook, stirring often, until jam has thickened, about 15 minutes. Stir in cinnamon and allspice."
189,6584976,3,"Remove from the heat and allow to cool, 30 to 45 minutes. Transfer jam to a bowl, cover, and refrigerate until chilled. Stir in lemon juice before serving."
190,6736585,1,"Place chopped pears into a large pot, and pour pineapple juice over them to prevent them from browning. Stir in sugar, and bring to a boil over medium-high heat. Stir frequently to prevent scorching. When the pears are at a full boil, reduce heat to medium, and cook until the mixture is the color and texture of honey. The longer you cook it, the thicker it gets. Cooking time is usually 2 to 3 hours."
191,6736585,2,"Ladle into hot sterile jars, filling to within 1/4 inch of the top. Wipe rims with a clean damp cloth, and seal jars with lids and rings. Process in a boiling water canner for 10 minutes, or the amount of time recommended by your local extension for your area."
192,6563719,1,"In a large, stainless steel saucepan, combine green pepper, white vinegar, and white sugar. Bring to a boil, and cook for 6 minutes, stirring constantly."
193,6563719,2,"Stir in liquid pectin, and continue to boil for 3 more minutes, stirring constantly. Skim off foam with a metal spoon, and remove pan from heat"
194,6563719,3,"Ladle jelly into sterilized jars, leaving a 1/2 inch space at the top. Seal, and process in a boiling-water canner for 5 minutes."
195,6562494,1,"Mix mulberries and 1 tablespoon water in a large pot; bring to a boil. Reduce heat, cover pot, and simmer, stirring frequently, until berries are softened, 15 to 20 minutes. Mash berries using a potato masher."
196,6562494,2,"Combine 2 cups water, sugar, strawberry-flavored gelatin, and pectin in a bowl; stir until gelatin is dissolved. Stir gelatin mixture into mashed mulberries; bring mixture to a boil."
197,6562494,3,"Sterilize the jars and lids in boiling water for at least 5 minutes. Pack the boiling mulberry mixture into the hot, sterilized jars, filling the jars to within 1/4 inch of the top. Run a knife or a thin spatula around the insides of the jars after they have been filled to remove any air bubbles. Wipe the rims of the jars with a moist paper towel to remove any food residue. Top with lids, and screw on rings."
198,6562494,4,"Place a rack in the bottom of a large stockpot and fill halfway with water. Bring to a boil and lower jars into the boiling water using a holder. Leave a 2-inch space between the jars. Pour in more boiling water if necessary to bring the water level to at least 1 inch above the tops of the jars. Bring the water to a rolling boil, cover the pot, and process for about 15 minutes."
199,6562494,5,"Remove the jars from the stockpot and place onto a cloth-covered or wood surface, several inches apart, until cool. Once cool, press the top of each lid with a finger, ensuring that the seal is tight (lid does not move up or down at all). Store in a cool, dark area."
200,6563679,1,"Soak apricots in boiling water in a bowl until hydrated, about 30 minutes. Blend apricots, remaining water, and vanilla extract in a food processor, working in batches, until blended but still slightly chunky."
201,6563679,2,"Combine apricot mixture with pectin in a large pot over medium heat; cook until just boiling. Add sugar and lemon juice; boil until sugar has dissolved, 1 to 2 minutes."
202,6563679,3,"Sterilize jars and lids in boiling water for at least 5 minutes. Pack the apricot jam into the hot, sterilized jars, filling the jars to within 1/4-inch of the top. Run a knife or a thin spatula around the insides of the jars after they have been filled to remove any air bubbles. Wipe the rims of the jars with a moist paper towel to remove any food residue. Top with lids, and screw on rings."
203,6563679,4,"Place a rack in the bottom of a large stockpot and fill halfway with water. Bring to a boil, then carefully lower the jars into the pot using a holder. Leave a 2-inch space between the jars. Pour in more boiling water if necessary until the water level is at least 1 inch above the tops of the jars. Bring the water to a full boil, cover the pot, and process for 10 minutes."
204,6563679,5,"Remove jars from the stockpot and place onto a cloth-covered or wood surface, several inches apart, until cool, about 1 hour. Once cool, press the top of each lid with a finger, ensuring that the seal is tight (lid does not move up or down at all). Store in a cool, dark area."
205,6649586,1,"Bring a large pot of water to a boil. Cook yam in the boiling water until tender, about 30 minutes. Drain and cool until easily handled. Peel and thinly grate the flesh."
206,6649586,2,"Melt butter in a wok over medium heat. Stir in condensed milk and vanilla extract. Add grated purple yam. Reduce heat to low and cook, stirring constantly, until mixture is sticky but not dry, about 30 minutes. Pour in evaporated milk; cook and stir for 15 minutes. Remove from heat."
207,6649586,3,"Transfer yam mixture to a container and cool to room temperature, about 30 minutes. Chill before serving."
208,6563997,1,"Place pears into a large pot over medium heat; add just enough water to cover the bottom of the pot and keep them from sticking, about 1/2 cup. Cook until the pears are soft, about 30 minutes. Press pears through a sieve or food mill, and measure out 2 quarts of the pulp."
209,6563997,2,"Pour pear pulp and sugar into a large saucepan and stir to dissolve sugar. Stir in orange zest, nutmeg, and orange juice. Cook over medium heat until mixture is thick enough to mound in a spoon. When mixture begins to thicken, stir frequently to prevent scorching on the bottom. This process will take about 1 hour."
210,6563997,3,"Ladle pear butter into hot sterile jars, leaving 1/4 inch of headspace. Remove air bubbles by sliding a metal spatula around where the pear butter touches the glass. Wipe jar rims clean, and seal with lids and rings. Process for 10 minutes in a boiling water bath. The water should cover the jars by 1 inch. Check with your local extension for exact processing times for your area."
