,id_recipe,Step_Count,Step Description
181,6577040,3,"Bake squash in the preheated oven until easily pierced with a knife, about 45 minutes. Remove from the oven and cool until easily handled. Scoop flesh into a bowl and set aside."
182,6577040,4,"Melt butter in a pot over medium-high heat. Add onion, carrot, and garlic; cook and stir until onion has softened and turned translucent, about 5 to 7 minutes. Pour chicken stock into the pot; stir in squash and simmer for 20 minutes."
183,6577040,5,Fill blender halfway with soup mixture. Cover and hold lid down; pulse a few times before leaving on to blend. Puree in batches until smooth and return to pot.
184,6577040,6,"Stir in half-and-half, nutmeg, and cinnamon; season with salt and pepper. Thin the soup with water if desired."
185,6664964,1,Gather ingredients.Dotdash Meredith Food Studios
186,6664964,2,"Combine green beans, garlic powder, onion powder, salt, and pepper in a stainless steel pot over medium-high heat. Cook, covered, until beans begin to sweat. Remove the lid and stir occasionally until beans are tender.Dotdash Meredith Food Studios"
187,6664964,3,"When beans and spices begin to char on the bottom of the pan, stir in olive oil and turn off heat. Cover and let stand a few minutes.Dotdash Meredith Food Studios"
188,6664964,4,"Scrape the bottom of the pan to incorporate charred spices. Beans should have a dark, caramel color, but not black.Dotdash Meredith Food Studios"
189,6737277,1,Toss together spinach and strawberries in a large bowl.
190,6737277,2,"Whisk oil, sugar, vinegar, sesame seeds, poppy seeds, and paprika together in a medium bowl. Pour over the spinach and strawberries, and toss to coat."
191,6739668,1,Gather all ingredients.Dotdash Meredith Food Studios
192,6739668,2,"Bring water to a boil in a small pot. Add oats and cook, stirring, for 1 minute.Dotdash Meredith Food Studios"
193,6739668,3,"Remove from heat and stir in brown sugar and maple syrup. Let sit until desired thickness is reached, 2 to 3 minutes.Dotdash Meredith Food Studios"
194,6664281,1,Preheat the oven to 400 degrees F (200 degrees C). Move an oven rack to the lowest position.
195,6664281,2,"Place salmon fillet, skin-side down, in the middle of a large piece of parchment paper; season with salt and black pepper. Cut two 3-inch slits into fillet with a sharp knife. Stuff chopped basil leaves into the slits. Spray fillet with cooking spray and arrange lemon slices on top."
196,6664281,3,Fold the edges of parchment paper over fillet several times to seal it into an airtight packet. Place sealed packet onto a baking sheet.
197,6664281,4,"Bake in the preheated oven on the bottom rack until salmon flakes easily and flesh is pink and opaque with an interior of slightly darker pink color, about 25 minutes. An instant-read thermometer inserted into the thickest part of fillet should read at least 145 degrees F (65 degrees C). To serve, cut open the parchment paper and remove lemon slices before plating."
198,6650682,1,"Round up all your ingredients, and heat peanut oil and butter in a large skillet over medium-high heat until butter begins to sizzle.Dotdash Meredith Food Studios"
199,6650682,2,"Gently toss plantain slices with brown sugar, then place into hot oil. Fry until plantains begin to turn golden brown, then turn over, and continue frying until caramelized, about 2 minutes per side.Dotdash Meredith Food StudiosDotdash Meredith Food Studios"
200,6650682,3,Drain plantains on a paper towel-lined plate and sprinkle with salt before serving.Dotdash Meredith Food Studios
201,6737637,1,"Combine oats, raisins, wheat germ, wheat bran, oat bran, walnuts, brown sugar, and sunflower seeds in a large bowl; mix well. Store muesli in an airtight container at room temperature for up to 2 months."
202,6737102,1,"Mix olive oil, lemon juice, garlic, rosemary, thyme, and oregano in a glass dish. Place chicken pieces in the mixture; cover and marinate in the refrigerator, 8 hours to overnight."
203,6737102,2,Preheat an outdoor grill for high heat and lightly oil the grate.
204,6737102,3,"Place chicken on the grill, and discard the marinade. Cook until chicken is no longer pink at the bone and the juices run clear, about 15 minutes per side (smaller pieces will not take as long). An instant-read thermometer inserted near the bone should read 165 degrees F (74 degrees C).Fabeveryday"
205,6650196,1,"Place potatoes in a large pot and cover with salted water; bring to a boil. Reduce heat to medium-low and simmer until tender, about 20 minutes. Drain."
206,6650196,2,Heat half-and-half in the microwave until just warm.
207,6650196,3,"Process unpeeled potatoes through a food mill into a medium bowl. (Or, using a potholder, peel and drop them into a bowl. Puree using a potato masher or stand mixer fitted with the paddle attachment.) Stir in warm half-and-half and salt (or beat, if using a mixer) until smooth and fluffy. Cool, cover, and refrigerate potatoes in a microwave-safe, airtight container for up to 2 days."
208,6650196,4,"Thirty minutes before serving, microwave until warm. Transfer to a heatproof bowl set over a pan of simmering water. Stir in butter to melt. Cover and keep warm."
209,6737537,1,Melt butter in a medium saucepan over medium heat. Cook and stir almonds in butter until lightly toasted. Remove from heat and let cool.Dotdash Meredith Food Studios
210,6737537,2,"Make dressing: Whisk together oil, sugar, cider vinegar, white wine vinegar, sesame seeds, poppy seeds, minced onion, and paprika in a medium bowl.Dotdash Meredith Food Studios"
211,6737537,3,Combine spinach with toasted almonds and cranberries in a large serving bowl. Pour dressing over spinach mixture; toss well.DOTDASH MEREDITH FOOD STUDIOS
212,6649809,1,"Combine avocados, onion, bell pepper, tomato, cilantro, and lime juice in a large bowl. Gently toss until evenly coated. Season with salt and pepper."
213,6604293,1,Preheat the oven to 400 degrees F (200 degrees C).
214,6604293,2,"Peel potatoes and cut them into 1/2-inch slices. Place in a pot and cover with water; bring to a boil. Boil for 2 minutes, then drain and set aside."
215,6604293,3,"Heat a large oven-proof skillet over medium-high heat. Pour in olive oil, then add onions. Sauté until lightly caramelized, 8 to 10 minutes. Stir in garlic and sauté until onions are deep brown and garlic is soft. Transfer mixture to a bowl."
216,6604293,4,"Place the skillet back on the stove over low heat. Melt butter in the skillet, then cover the bottom with 1/3 of the potatoes. Season with salt and pepper. Cover potatoes with 1/2 of the onion mixture. Cover with 1/2 of the remaining potatoes; season with salt and pepper. Spread remaining onion mixture on top. Cover with remaining potatoes; season with salt and pepper."
217,6604293,5,"Bake in the preheated oven until potatoes are tender and browned on top, 10 to 12 minutes."
218,6604293,6,Use a spatula to transfer potatoes to a serving platter. Sprinkle with chopped parsley just before serving.
219,6569933,1,Melt butter in a large stockpot over low heat. Add leeks and onion; cover and cook for 10 minutes.
220,6569933,2,"Stir in potatoes; season with salt and pepper. Add marjoram, thyme, and bay leaf; stir well. Cover and cook for 12 minutes."
221,6569933,3,"Pour in chicken broth. Bring to a boil, reduce heat, and cook, partially covered, for 30 minutes."
222,6569933,4,"Purée soup in a blender or food processor. Allow to cool to room temperature, then stir in cream."
223,6664289,1,Gather all ingredients.Dotdash Meredith Food Studios
224,6664289,2,Preheat an outdoor grill for medium-low heat and lightly oil the grate.
225,6664289,3,"Brush zucchini with olive oil. Sprinkle Italian seasoning, garlic powder, and salt over zucchini.Dotdash Meredith Food Studios"
226,6664289,4,"Cook on the preheated grill until beginning to brown, 3 to 4 minutes per side. Brush balsamic vinegar over zucchini and continue cooking 1 minute more.Dotdash Meredith Food Studios"
227,6664289,5,Serve immediately.DOTDASH MEREDITH FOOD STUDIOS
228,6650819,1,Preheat the oven to 375 degrees F (190 degrees C). Spray a baking dish with nonstick cooking spray.
229,6650819,2,"Rinse tilapia fillets under cool water, and pat dry with paper towels.Dotdash Meredith Food Studios"
230,6650819,3,"Place fillets in the prepared baking dish. Pour lemon juice over fillets, then drizzle butter on top. Sprinkle with garlic, parsley, and pepper.Dotdash Meredith Food StudiosDotdash Meredith Food Studios"
231,6650819,4,"Bake in the preheated oven until fish is white and flakes when pulled apart with a fork, about 30 minutes.DOTDASH MEREDITH FOOD STUDIOS"
232,6594528,1,Heat oil in a large skillet over medium-high heat.
233,6594528,2,"Place fillets into hot oil. Drizzle with orange juice and lemon juice, then sprinkle fillets with lemon pepper. Cook until fish flakes easily with a fork, 2 to 3 minutes per side. An instant-read thermometer inserted into the center should read at least 145 degrees F (63 degrees C)."
