,id_recipe,Step_Count,Step Description
140,6568459,3,Pour 1 1/4 cups water into the bottom of a multi-functional pressure cooker (such as Instant Pot®) and place a trivet inside. Carefully stack all 3 molds on top of the trivet.
141,6568459,4,Close and lock the lid. Select high pressure according to manufacturer's instructions; set timer for 30 minutes. Allow 10 minutes for pressure to build.
142,6568459,5,"Release pressure using the natural-release method according to manufacturer's instructions, about 15 minutes. Unlock and remove the lid. Transfer molds to a clean work surface, remove foil, and let sit for 5 minutes."
143,6568459,6,"Turn molds over to release the cooked filling. Place one in the center of each flour tortilla and roll into burritos. Let burritos cool. Wrap in parchment paper, place in a large resealable plastic bag, and freeze."
144,6586933,1,"Combine rhubarb, water, and salt in a medium saucepan over medium-high heat. Bring to a boil, stirring occasionally. Reduce heat to medium-low and simmer, stirring occasionally, until rhubarb has broken down, 6 to 8 minutes. Mix in honey and continue stirring until mixture has thickened, 2 to 3 minutes. Remove from heat."
145,6586933,2,Line five 12- to 16-ounce jars in an assembly-line fashion. Place 2 tablespoons of the rhubarb mixture into the bottom of each jar. Top each with 2 tablespoons cracker crumbs and 2/3 cup yogurt in that order. Divide remaining rhubarb mixture and cracker crumbs over parfaits and top each with 1 tablespoon crushed walnuts. Seal jars and refrigerate until ready to eat.
146,6600366,1,Drain roasted red peppers and pat dry. Puree in a food processor until finely chopped.
147,6600366,2,"Transfer roasted red peppers to a bowl. Add tuna, hard-boiled eggs, hummus, green onions, celery, Sriracha sauce, capers, and seafood seasoning. Mix together. Divide into individual 1-cup portions and refrigerate."
148,6566739,1,"Combine rice, water, and taco seasoning in a saucepan; bring to a boil. Reduce heat to low, cover, and simmer until tender, 35 to 40 minutes. Remove from the heat and let cool; it will be soggy."
149,6566739,2,"Combine black beans, pinto beans, corn, salsa, onion, cumin, garlic powder, oregano, salt, and pepper in a large bowl; toss to mix. Mix in cooked rice, Cheddar, and Monterey Jack."
150,6566739,3,Divide the bean-rice mixture evenly among the tortillas and roll up.
151,6566739,4,"Spray a cookie sheet lightly with cooking spray. Lay tortillas in a single layer on the cookie sheet and place in the freezer until fully frozen, about 2 hours. Wrap each tortilla in plastic wrap or foil and place in a large zip-top bag to store in the freezer until ready to use."
152,6594847,1,"Place eggs in a large pot and cover with an inch of water. Bring to a boil over medium-high heat, cover, and remove from heat. Let sit for 10 minutes. Drain and run under cold water to stop the cooking. Peel the eggs and chop."
153,6594847,2,"Combine eggs with mayonnaise, Cheddar cheese, green onions, mustard, and pepper in a large bowl. Stir gently until evenly mixed. Fold in bacon and tomatoes."
154,6594847,3,Layer egg salad and lettuce between 2 slices of bread to make each sandwich.
155,6582323,1,Fill a stockpot with enough water to just cover the jars. Attach a sous vide immersion cooker to the side of the pot. Set temperature to 172 degrees F (77 degrees C).
156,6582323,2,Generously oil the inside of each jar with coconut oil. Add ham and red pepper to the bottom of the jars.
157,6582323,3,"Whisk eggs and cream together in a bowl until well combined. Stir in Cheddar cheese, salt, and nutmeg. Divide egg mixture among the jars. Close jars with lids and metal bands; tighten using the tips of your fingers only. Do not over-tighten."
158,6582323,4,"Immerse in the water bath and cook for 1 hour. Carefully remove the jars, using tongs, to a heat-resistant surface. Let rest 10 minutes before opening the jars."
159,6572007,1,"In small bowl, combine Originals Oven Roasted Chicken Breast, Greek yogurt, red onion, celery and lemon juice."
160,6572007,2,"Divide chicken mixture, spring mix, cranberries, apples and pecans in half."
161,6572007,3,"To assemble, begin by placing chicken and dressing mixture into the bottom of 2 jars."
162,6572007,4,Next add lettuce then finish by topping with cranberries and pecans and tighten lids.
163,6572007,5,"Once ready to eat, empty jar into a bowl, mix and enjoy!"
164,6594515,1,"Bring a large pot of lightly salted water to a boil. Cook tortellini in the boiling water until they float to the top, 5 to 7 minutes. Drain water. Place in the refrigerator to cool, about 15 minutes."
165,6594515,2,"Layer pesto, cucumbers, tomatoes, onions, tortellini, and mache into the canning jar; season with salt and pepper."
166,6578891,1,"Combine zucchini, squash, tomatoes, fennel, Italian seasoning, salt, and pepper in a covered bowl or zip-top plastic bag. Chill and cook or use within 5 days."
