,id_recipe,Step_Count,Step Description
0,7968537,1,"Make a bed of clean kitchen towels or paper towels, and spread out the zucchini shreds on it. Lightly sprinkle with salt, and allow to sit while preparing the other ingredients, about 15 minutes."
1,7968537,2,"Preheat the oven to 400 degrees F (200 degrees C), and line a 12x18-inch sheet pan with parchment or foil."
2,7968537,3,"În a large mixing bowl, combine chicken sausage, onion, pecorino Romano cheese, and garlic."
3,7968537,4,"Roll up the towel bed with grated zucchini like a jelly roll, pressing as you go, to squeeze out excess liquid. Unroll, and add zucchini shreds to the other ingredients. Add egg and stir until all meatball ingredients are mixed well."
4,7968537,5,Form mixture into 18 to 20 2-inch meatballs and place on the prepared pan. Spray lightly with olive oil spray.
5,7968537,6,"Bake meatballs in the center of the preheated oven until lightly browned, and an instant-read thermometer reads 165 degrees F (74 degrees C) inserted near the center of meatballs, 25 to 30 minutes."
6,7968537,7,"Serve with purchased marinara as a dipping sauce, if desired."
7,7499734,1,"Combine sausage, ground beef, shallot, Parmesan cheese, and breadcrumbs in a large bowl. Use a wooden spoon to break up the ground meat and roughly mix ingredients together. Stir in beaten eggs, milk, and black pepper. Use your hands to mix all ingredients well."
8,7499734,2,Preheat the oven to 400 degrees F (200 degrees C). Line a sheet pan with parchment paper or aluminum foil.
9,7499734,3,"Pour water into a shallow bowl, and moisten fingertips and palms with water. Shape meatball mixture into about 40 ping-pong sized balls and place on the prepared sheet pan. When fingers become sticky, dip them in water."
10,7499734,4,"Bake meatballs in the preheated oven until lightly browned and a bit underdone in the center, about 20 minutes. If meatballs are larger, adjust baking time."
11,7499734,5,"Pour tomato purée into a large sauce pot or a Dutch oven set over medium-low heat. Stir in minced garlic and Italian herbs. Sample the sauce for seasoning, and adjust, if needed."
12,7499734,6,"When sauce begins to bubble slightly, add meatballs and stir gently, coating all the meatballs with sauce. Keep meatballs and sauce at a low simmer and cook, uncovered, about 20 minutes."
13,7499734,7,"To serve, place meatballs and sauce on a plate, drizzle with extra virgin olive oil, garnish with fresh basil leaves, and sprinkle with additional grated Parmesan cheese, if desired."
14,7113069,1,"Stir egg, grated Parmesan cheese, 3/4 cup panko crumbs, garlic powder, Italian herb seasoning blend, crushed red pepper, salt, and black pepper together in a large bowl."
15,7113069,2,"Put on a pair of food-grade disposable gloves, add chicken to the bowl, and mix with your hands until all the ingredients are well combined."
16,7113069,3,"Place remaining 1 cup panko crumbs on a plate. Using a 1-1/2-inch scoop, create about 24 meatballs. Gently roll each meatball in crumbs until lightly coated; set aside on a plate."
17,7113069,4,Preheat oven to 350 degrees F (175 degrees C).
18,7113069,5,"Place 1 tablespoon olive oil and 1 tablespoon butter in a large, oven-proof skillet over medium heat. Add half the meatballs and brown each side, turning until all sides are browned. Set this batch on a plate, and wipe the skillet clean."
19,7113069,6,"Repeat with reserved oil and butter, and cook the remaining meatballs in the same way."
20,7113069,7,"Wipe out the skillet again, and pour in marinara sauce. Place browned meatballs in sauce. They will not be submerged."
21,7113069,8,"Bake in the preheated oven for 25 minutes. Sprinkle on shredded mozzarella and return to the oven for an additional 5 minutes, or until the cheese is melted. Sprinkle with fresh parsley."
22,7111885,1,"Mix chicken and pork together on a plate or tray, and place in the freezer for about 15 minutes, or until firm and very cold. Partially frozen is okay."
23,7111885,2,"Add breadcrumbs to the bowl of a food processor (this should be crumbled from the inside of a loaf of fresh or day old French bread – no crust!). Add sauteed onions, egg, white wine, garlic, parsley, salt, pepper, chili flakes, and crushed fennel seeds. Add chilled chicken mixture on top."
24,7111885,3,Pulse on and off in the food processor as shown until the mixture resembles ground meat. Stopping occasionally and scraping the bowl of food processor during the process is recommended.
25,7111885,4,Transfer mixture to fridge and chill for 1 hour before shaping.
26,7111885,5,Preheat the oven to 425 degrees F (220 degrees C). Line a baking sheet with foil and lightly grease with olive oil.
27,7111885,6,"Divide mixture into 12 portions, and place on the prepared baking sheet. Use damp hands to roll into smooth balls."
28,7111885,7,"Bake in the preheated oven until meatballs are cooked through, about 18 minutes. For some additional browning, turn broiler to high, and broil meatballs for 1 to 2 minutes."
29,7111885,8,"Meatballs can be served immediately, or transferred into tomato sauce set over low heat. Simmer gently for about 20 minutes to flavor sauce."
30,6663843,1,"Add ground beef to a bowl and spread gochujang evenly over the surface of the meat. Season evenly with kosher salt, pepper, and soy sauce. Spreading out the seasoning will reduce the time you need to handle the meat. Spread fresh ginger and garlic evenly over the surface. Add green onions and cracker crumbs. Mix in quickly with a fork until well combined."
31,6663843,2,Cover and refrigerate for about 30 minutes.
32,6663843,3,Preheat the oven to 450 degrees C (220 degrees C).
33,6663843,4,Form mixture into 12 equal-sized balls using wet hands. Add to a cast iron skillet.
34,6663843,5,"Bake meatballs in the preheated oven until nicely browned, about 20 minutes."
35,6663843,6,Transfer meatballs to a plate while preparing the sauce in the same skillet.
36,6663843,7,"Drain most of the grease but 1 teaspoon out of the skillet and set onto stove over medium-high heat. Add garlic and stir until fragrant, about 1 minute. Deglaze skillet with rice vinegar and soy sauce. Stir in brown sugar, beef broth, and gochujang. Season with sesame oil and Sriracha. Stir sauce and bring to a simmer. Cook until reduced by a third."
37,6663843,8,"Meanwhile stir together cornstarch and water in a small bowl to create a slurry. Reduce heat to medium-low and mix in slurry while whisking constantly. Keep simmering sauce until it has reduced to about half. Add meatballs back into the skillet and baste with the sauce. Allow to simmer, basting generously, until meatballs are heated through and are well soaked with sauce, 3 to 5 minutes."
38,6663843,9,Serve garnished with toasted sesame seeds and green onions.
39,7570245,1,"Combine ground chicken, garlic, ginger, onion, 1 tablespoon light soy sauce, sake, egg, panko, and green onions in a bowl. Gently mix and form into 1-inch meatballs. Place shaped meatballs onto a parchment lined tray."
40,7570245,2,"For sauce, whisk together 2 teaspoons light soy sauce, dark soy sauce, honey, oyster sauce, water, and cornstarch in a bowl; set aside."
41,7570245,3,"Bring a large pot of water to a boil over high heat. Using a spider or slotted spoon, carefully lower chicken meatballs into boiling water - you may have to do this in batches. Cook until meatballs float to the top, 3 to 4 minutes. Remove meatballs with a spider or slotted spoon."
42,7570245,4,"Heat sesame oil in a wok. Add chicken meatballs, and cook until lightly browned, about 3 minutes. Pour sauce ingredients into the wok. Add the mixed vegetables, toss to mix. Cook until vegetables are crisp-tender, about 5 minutes."
43,7570245,5,Place 1/2 cup cooked jasmine rice in each bowl or on each plate. Add cooked vegetables and chicken meatballs. Serve immediately.
44,7562426,1,Preheat the oven to 400 degrees F (200 degrees C). Line a sheet pan with foil or parchment paper.
45,7562426,2,"In a large bowl, combine parsley, rosemary, oregano, dill, mint, salt, and pepper. Stir to combine. Set aside 2 tablespoons of herbs to use with vegetables later in the recipe."
46,7562426,3,"To the large bowl, add breadcrumbs, shallot, garlic, and lemon zest; stir to combine. Whisk beaten egg with 1 tablespoon olive oil, and stir into the breadcrumb mixture. Add ground turkey."
47,7562426,4,"Mix all ingredients well using your hands. If meatballs seem too wet, work in another tablespoon of bread crumbs. Form into 18 (1 1/4-inch) meatballs and place on the prepared pan. Spray meatballs with olive oil spray."
48,7562426,5,Bake in the preheated oven for 15 minutes.
49,7562426,6,"Meanwhile, combine lemon juice, reserved 2 tablespoons herb mixture, and remaining 1 tablespoon olive oil, and toss with red pepper, green pepper, red onion, and zucchini slices."
50,7562426,7,Remove meatballs from the oven; distribute vegetables around the meatballs on the pan.
51,7562426,8,"Return the pan to the oven; continue baking until vegetables are tender and meatballs are no longer pink in the center, about 15 minutes. An instant-read thermometer inserted into the center should read at least 160 degrees F (70 degrees C)."
52,7562426,9,"Sprinkle with crumbled feta cheese, chopped tomatoes, and olives. Serve warm."
53,7151712,1,Preheat oven to 425 degrees F (220 degrees C).
54,7151712,2,"Stir rotini, marinara sauce, water, pizza sauce, and milk together in a bowl. Pour into a deep baking dish; pasta should be completely submerged in sauce. Cover dish tightly with foil."
55,7151712,3,"Bake in the preheated oven for 20 minutes; uncover and arrange meatballs on top, pushing them partially into pasta and sauce; cover tightly with foil."
56,7151712,4,"Bake until pasta is tender yet firm to the bite, 20 to 30 minutes more."
57,7151712,5,Uncover; sprinkle with Parmesan cheese; return to oven for 5 minutes. Remove and let cool 5 minutes before serving.
58,6651006,1,Cover a baking sheet with foil and spray lightly with cooking spray. Soak bread crumbs in milk in a small bowl for 20 minutes.
59,6651006,2,"Meanwhile, heat olive oil in a skillet over medium heat. Add onion; cook and stir until onion has softened and turned translucent, about 5 minutes. Reduce heat to low and continue cooking and stirring until onion is very tender, about 15 minutes more."
60,6651006,3,"Gently stir beef and pork together in a large bowl. Add onions, bread crumb mixture, eggs, Parmesan cheese, parsley, garlic, salt, black pepper, Italian herb seasoning, and red pepper flakes; mix together using a rubber spatula until combined. Cover and refrigerate for about one hour."
61,6651006,4,Preheat the oven to 425 degrees F (220 degrees C).
62,6651006,5,Form mixture into balls about 1 1/2 inches in diameter; arrange in a single layer on the prepared baking sheet.
63,6651006,6,"Bake in the preheated oven until browned and cooked through, 15 to 20 minutes."
64,6651165,1,"Combine beef, veal, and pork in a large bowl. Mix in cheese, eggs, garlic, parsley, salt, and pepper."
65,6651165,2,"Add bread crumbs and slowly mix in water, 1/2 cup at a time, until mixture is moist but still holds its shape (I usually use about 1 1/4 cups of water); shape into meatballs."
66,6651165,3,"Heat olive oil in a large skillet; add meatballs in batches and cook until browned on all sides, slightly crisp, and cooked through, about 10 to 15 minutes. Drain on paper towels."
67,6648974,1,Preheat the oven to 350 degrees F (175 degrees C).
68,6648974,2,"Mix bread crumbs, Romano cheese, parsley, salt, pepper, garlic powder, and onion powder together in a large bowl; stir in water and eggs. Add ground beef and mix until well combined. Form mixture into balls and place on a nonstick baking sheet."
69,6648974,3,"Bake in the preheated oven cooked through and evenly browned, about 30 minutes."
70,6737604,1,Preheat an air fryer to 350 degrees F (175 degrees C).
71,6737604,2,"Combine beef, pork, Parmesan cheese, bread crumbs, egg, garlic, Italian seasoning, and salt in a large bowl. Mix until evenly combined. Form into 16 equal meatballs (a small ice cream scoop is helpful) and place on a baking sheet."
72,6737604,3,Place 1/2 of the meatballs in the basket of the air fryer and cook 8 minutes. Shake the basket and cook 2 minutes more. Transfer to a serving plate and let rest for 5 minutes. Repeat with remaining meatballs.
73,6663168,1,Gather all ingredients.Dotdash Meredith Food Studios
74,6663168,2,"Whisk together stock, cream, flour, soy sauce, 1/2 teaspoon pepper, and 1/2 teaspoon rosemary in a large saucepan over low heat until smooth.Dotdash Meredith Food Studios"
75,6663168,3,"Cook, stirring occasionally, until thickened, about 10 minutes.Dotdash Meredith Food Studios"
76,6663168,4,"Stir in thawed meatballs, and continue cooking until meatballs are heated through, about 5 more minutes. An instant-read thermometer inserted into the center of the meatballs should read at least 160 degrees F (71 degrees C).Dotdash Meredith Food Studios"
77,6663168,5,Taste and adjust seasonings before serving.DOTDASH MEREDITH FOOD STUDIOS
78,6663975,1,Gather all ingredients.Dotdash Meredith Food StudiosDotdash Meredith Food Studios
79,6663975,2,"In a large bowl, combine ground beef, bread crumbs, parsley, Parmesan, 1/4 teaspoon black pepper, garlic powder and beaten egg. Mix well and form into 12 balls. Store, covered, in refrigerator until needed.Dotdash Meredith Food Studios"
80,6663975,3,"In a large saucepan over medium heat, saute onion and garlic in olive oil until onion is translucent."
81,6663975,4,"Stir in tomatoes, salt, sugar and bay leaf. Cover, reduce heat to low, and simmer 90 minutes.Dotdash Meredith Food Studios"
82,6663975,5,"Stir in tomato paste, basil, 1/2 teaspoon pepper and meatballs and simmer 30 minutes more.Dotdash Meredith Food StudiosDotdash Meredith Food Studios"
83,6663975,6,Serve hot and enjoy!DOTDASH MEREDITH FOOD STUDIOS
84,6664976,1,"Combine grape jelly, chili sauce, and cayenne pepper in a saucepan over medium-high heat; cook until warm, 5 to 10 minutes."
85,6664976,2,Place meatballs in a slow cooker and top with grape jelly mixture.
86,6664976,3,Cook on Low for 3 to 4 hours.
87,6664150,1,Preheat the oven to 350 degrees F (175 degrees C).
88,6664150,2,"Combine ground beef, bread crumbs, egg, garlic, Parmesan cheese, parsley, and Italian seasoning in a large bowl. Mix with your hands until well combined. Shape mixture into 12 meatballs, and place in a baking dish.Dotdash Meredith Food Studios"
89,6664150,3,"Bake meatballs in the preheated oven until cooked through, 15 to 20 minutes. An instant-read thermometer inserted into the center should read at least 160 degrees F (71 degrees C)."
90,6664150,4,"While the meatballs are cooking, cut baguette in half lengthwise and open like a book. Remove and discard some of the bread from the inside to make a well for the meatballs."
91,6664150,5,"Brush baguette with olive oil and season with garlic powder and salt. Place baguette on a baking tray, open and with the oiled sides facing up.Dotdash Meredith Food Studios"
92,6664150,6,"When the meatballs have 5 minutes left, slip the baguette into the oven and cook until lightly toasted."
93,6664150,7,"Meanwhile, warm spaghetti sauce in a saucepan over medium heat."
94,6664150,8,Remove meatballs from the oven. Use a slotted spoon to transfer them to the hot sauce; mix gently to coat with sauce.Dotdash Meredith Food Studios
95,6664150,9,"Spoon meatballs and sauce into one side of the baguette, nestling meatballs in the well. Top with slices of provolone cheese.Dotdash Meredith Food Studios"
96,6664150,10,"Return to the oven until cheese is melted, 2 to 3 minutes.Dotdash Meredith Food Studios"
97,6664150,11,"Cool slightly, then cut into 4 sandwiches.Dotdash Meredith Food Studios"
98,6650226,1,"Make meatballs: Mix beef, bread crumbs, onion, egg, salt, and pepper together in a large bowl until well combined.Dotdash Meredith Food Studios"
99,6650226,2,Shape mixture into 1 1/2-inch diameter balls.Dotdash Meredith Food Studios
100,6650226,3,Cook meatballs in a large nonstick skillet over medium heat until evenly browned and cooked through.Dotdash Meredith Food Studios
101,6650226,4,"Make sauce: Mix brown sugar, water, ketchup, vinegar, soy sauce, and cornstarch together in a medium bowl until smooth."
102,6650226,5,"Pour sauce over meatballs. Reduce heat to low and simmer until sauce is thick, 3 to 5 minutes.Dotdash Meredith Food Studios"
103,6650226,6,Serve hot and enjoy!DOTDASH MEREDITH FOOD STUDIOS
104,6663773,1,Gather all ingredients.Dotdash Meredith Food Studios
105,6663773,2,"Place ground beef, bread crumbs, onion, garlic, parsley, and egg in a large bowl; mix well until evenly combined, then shape into 16 meatballs.Dotdash Meredith Food Studios"
106,6663773,3,Pour spaghetti sauce and crushed tomatoes into the slow cooker; stir in tomato purée. Place the meatballs into the sauce mixture.Dotdash Meredith Food Studios
107,6663773,4,Cover and cook on Low for 6 to 8 hours.
108,6663773,5,Enjoy!DOTDASH MEREDITH FOOD STUDIOS
109,6737538,1,"Whisk together beef broth and condensed soup in a slow cooker. Add steak sauce, Worcestershire sauce, garlic powder, paprika, salt, and pepper. Stir in meatballs and onion."
110,6737538,2,Cook on High for 4 hours.
111,6737538,3,"Stir in sour cream. Continue cooking until sauce is heated through, about 30 minutes."
112,6736852,1,"Mix ground beef, rice, 1/2 cup water, onion, salt, celery salt, garlic powder, and black pepper in a bowl. Roll mixture into 12 meatballs."
113,6736852,2,"Heat a large skillet over medium-high heat. Place meatballs into the hot skillet; cook, turning occasionally, until evenly browned. Drain and discard excess grease."
114,6736852,3,"Pour tomato sauce, 1 cup water, and Worcestershire sauce into the skillet; reduce heat to medium-low. Cover and simmer until meatballs are no longer pink in the center and rice is tender, about 45 minutes. Stir in more water if sauce becomes too dry."
115,6738218,1,Preheat the oven to 350 degrees F (175 degrees C).
116,6738218,2,"Place bread crumbs into a small bowl; mix in cream. Allow to stand until crumbs absorb cream, about 10 minutes.Dotdash Meredith Food Studios"
117,6738218,3,"Meanwhile, melt 1 teaspoon butter in a skillet over medium heat; cook and stir onion until light brown, about 10 minutes. Transfer onion to a mixing bowl.Dotdash Meredith Food Studios"
118,6738218,4,"Mix ground beef, ground pork, egg, brown sugar, salt, black pepper, nutmeg, allspice, and ginger with onion in the mixing bowl. Lightly mix in bread crumbs and cream.Dotdash Meredith Food Studios"
119,6738218,5,"Melt 1 tablespoon butter in a large skillet over medium heat. Pinch off about 1 1/2 tablespoon meat mixture per meatball; form into balls. Place meatballs into the skillet and cook, turning often, until browned, about 5 minutes. Insides of meatballs will still be pink.Dotdash Meredith Food Studios"
120,6738218,6,"Place browned meatballs into a baking dish, pour in chicken broth, and cover with foil."
121,6738218,7,"Bake in the preheated oven until meatballs are tender, about 40 minutes. Remove meatballs to a serving dish.Dotdash Meredith Food Studios"
122,6738218,8,Pour pan drippings into a saucepan over medium heat. Whisk flour into drippings until smooth.Dotdash Meredith Food Studios
123,6738218,9,Gradually whisk in enough beef broth to total about 2 1/2 cups liquid.Dotdash Meredith Food Studios
124,6738218,10,"Bring gravy to a simmer, whisking constantly, until thickened, about 5 minutes.Dotdash Meredith Food Studios"
125,6738218,11,"Just before serving, whisk in sour cream. Season with salt and black pepper. Serve gravy with meatballs.DOTDASH MEREDITH FOOD STUDIOS"
126,6738582,1,"Mix ground beef, croutons, sweet onion, egg, garlic, Worcestershire sauce, mustard, red pepper flakes, and Cajun seasoning in a large bowl until well combined. Form mixture into meatballs by hand."
127,6738582,2,"Melt butter in olive oil in a skillet over medium heat. Place meatballs in the hot skillet. Cook, turning constantly, until desired doneness is reached, about 20 minutes. An instant-read thermometer inserted into the center should read at least 165 degrees F (74 degrees C) for well done."
128,6650147,1,Preheat the oven to 400 degrees F (200 degrees C).
129,6650147,2,"Place ground beef, onion, bread crumbs, milk, Parmesan cheese, Worcestershire sauce, Italian seasoning, oregano, red pepper flakes, salt, garlic salt, and hot pepper sauce into a large bowl; mix until evenly combined.Dotdash Meredith Food Studios"
130,6650147,3,Shape the mixture into 12 meatballs and place onto a baking sheet.Dotdash Meredith Food Studios
131,6650147,4,"Bake in the preheated oven until no longer pink in the center, 20 to 25 minutes.Dotdash Meredith Food Studios"
132,6650147,5,Serve over pasta.DOTDASH MEREDITH FOOD STUDIOS
133,6649169,1,"Heat oil in a large skillet over medium-high heat. Add onion and garlic; cook and stir until onion is almost soft, about 3 minutes."
134,6649169,2,"Reduce heat to medium; stir in condensed soup, milk, and Worcestershire sauce. Add meatballs; reduce heat to low and simmer, covered, until tender, 35 to 40 minutes."
135,6649169,3,"Meanwhile, bring a large pot of lightly salted water to a boil. Add noodles and cook, stirring occasionally, until tender yet firm to the bite, 10 to 12 minutes; drain."
136,6649169,4,"Add sour cream, salt, and pepper to meatballs in sauce. Cook until flavors combine, about 2 minutes. Serve meatballs over noodles."
137,6737223,1,"Make the meatballs: Mix ground beef, ginger, garlic powder, and black pepper together in a large bowl until well combined. Shape into 1 1/2-inch balls."
138,6737223,2,"Sauté meatballs in a large skillet over medium-high heat until browned, about 10 minutes."
139,6737223,3,"While the meatballs are cooking, prepare the sauce: Pour pineapple juice into a liquid measuring cup, and reserve pineapple chunks; add enough water to pineapple juice to make 1 cup. Mix brown sugar and cornstarch in a small bowl."
140,6737223,4,"Transfer meatballs to a plate, reserving the pan drippings. Add pineapple juice and brown sugar mixtures to the warm pan drippings. Stir in vinegar and soy sauce and bring to a boil. Cook until sauce thickens, 2 to 3 minutes."
141,6737223,5,"Return meatballs to the skillet; add pineapple chunks, and green pepper. Simmer until meatballs are no longer pink inside, about 10 minutes. An instant-read thermometer inserted into the center should read at least 160 degrees F (71 degrees C)."
142,6649319,1,"Sauté onion in 2 tablespoons olive oil in a skillet over medium heat until onion is translucent, about 5 minutes. Stir garlic into onion and turn off heat. Transfer onion mixture to a large mixing bowl."
143,6649319,2,"Stir ground beef, ricotta cheese, parsley, egg, salt, black pepper, and cayenne pepper with onion mixture until almost combined; stir in bread crumbs and continue to mix until thoroughly blended."
144,6649319,3,"Roll about 2 tablespoons of mixture into a 1-inch ball for each meatball. Pour remaining 2 tablespoons olive oil in same skillet used to cook onions. Place skillet over medium heat and brown meatballs on all sides in hot oil, about 5 minutes. Hold a crumpled paper towel in tongs and use it to remove excess grease from skillet."
145,6649319,4,"Pour marinara sauce and water over meatballs in skillet. Stir to combine and bring to a simmer. Reduce heat to medium-low and simmer, stirring occasionally, until meatballs are cooked through and no longer pink in the center, about 30 minutes."
146,6602408,1,Preheat the oven to 400 degrees. Grease a broiler pan with buttery spread.
147,6602408,2,"Mix ground turkey, bread crumbs, parsley, Parmesan, tomato sauce, garlic, oregano, rosemary, mustard, cayenne, and salt together in a large bowl until well combined. Form mixture into 30 meatballs; place onto the prepared pan."
148,6602408,3,"Bake in the preheated oven until no longer pink inside, about 15 minutes. An instant-read thermometer inserted into the center should read at least 165 degrees F (74 degrees C)."
149,6738075,1,"Combine maple syrup, chipotle powder, and salt in saucepan and bring to a simmer over medium heat. Reduce heat to low to keep warm."
150,6738075,2,Place croutons in the bowl of a mini food processor; pulse until crushed into fine crumbs. Transfer to a shallow bowl. Whisk egg in a separate bowl.
151,6738075,3,Preheat the air fryer to 390 degrees F (200 degrees C).
152,6738075,4,"Sprinkle salmon lightly with sea salt. Lightly dip salmon into egg mixture, letting excess drip off. Coat salmon in crouton breading and shake off extra. Set on a plate and mist lightly with cooking spray."
153,6738075,5,"Spray basket of the air fryer with cooking spray. Place salmon nuggets inside, working in batches to avoid overcrowding, if necessary."
154,6738075,6,"Cook in the preheated air fryer for 3 minutes. Gently turn salmon pieces, spray lightly with oil, and cook until salmon is cooked throughout, 3 to 4 more minutes. Place on a serving platter and drizzle with warm chipotle-maple syrup. Serve immediately."
155,6568291,1,"Mix veal and pork together in a bowl until well combined. Stir in milk, onion, and egg. Mix in bread crumbs, then flour; knead well to mix. Mix in seltzer water, salt, and pepper until well combined. The mixture should be very moist, but not dripping. Cover and refrigerate for 15 to 30 minutes."
156,6568291,2,"Form about 2 1/2 tablespoons meat mixture into a slightly flattened, oval meatball about the size of a small egg. Repeat to make remaining meatballs."
157,6568291,3,"Melt margarine in a large skillet over medium heat. Fry meatballs in the hot skillet until no longer pink in the center and well browned on the outside, about 15 minutes per side. An instant-read thermometer inserted into the center should read at least 160 degrees F (70 degrees C)."
