,id_recipe,Step_Count,Step Description
0,7497329,1,Preheat the oven to 375 degrees F (190 degrees C). Spray an 8x8-inch square baking pan with nonstick spray.
1,7497329,2,Add frozen strawberries to the prepared pan and drizzle with 1 tablespoon maple syrup.
2,7497329,3,"Bake in the preheated oven until strawberries are softened and begin to release their juices, about 20 minutes."
3,7497329,4,"Meanwhile, combine peanut butter and butter in a large microwave-safe bowl, and microwave on High until butter is melted, about 30 seconds; stir. Add 1/3 cup maple syrup, almond milk, eggs, and vanilla extract; whisk until thoroughly combined. Stir in oats, flaxseed meal, baking powder, cinnamon, nutmeg, and salt until combined. Pour batter evenly over strawberries."
4,7497329,5,"Return to the preheated oven and bake until oatmeal is set in the center, 30 to 35 minutes. Remove from the oven, and allow to cool for 10 minutes before serving. Serve warm."
5,7498471,1,"Set a multi-functional pressure cooker (such as Instant Pot®) to the sauté function and press start. Heat olive oil in the cooker for 1 minute. Add oats, and cook and stir until toasted, about 3 minutes."
6,7498471,2,"Add nutmeg and cinnamon, stir well, then stir in water and vanilla extract. Turn off the sauté function."
7,7498471,3,Close and lock the lid. Select high pressure according to manufacturer’s instructions; set timer for 15 minutes. Allow 10 to 15 minutes for pressure to build.
8,7498471,4,"Release pressure using the natural-release method according to manufacturer’s instructions, 10 to 40 minutes."
9,7498471,5,"Unlock and remove the lid, then stir the oatmeal vigorously, making sure to incorporate the oats at the bottom of the pot where they will be thicker. Scoop out about 1/2 cup of oatmeal and enjoy!"
10,7497088,1,"Combine milk, sugar, and salt in a saucepan over medium-low heat and bring to a simmer."
11,7497088,2,"Add cinnamon and oats. Cook over medium-low heat until oats are tender with a bite, about 5 minutes. Use a long spoon to stir, and adjust heat to prevent splattering."
12,7497088,3,"Remove from heat; stir in vanilla and peanut butter. Serve in a large bowl, and top with honey and walnuts."
13,6740994,1,Preheat the oven to 350 degrees F (175 degrees C).
14,6740994,2,"Mix together oats, brown sugar, cinnamon, baking powder, and salt in a large bowl. Beat in eggs, milk, melted butter, and vanilla extract. Stir in dried cranberries. Spread into a 9x13-inch baking dish."
15,6740994,3,"Bake in the preheated oven until top is golden, about 40 minutes."
16,7372045,1,Preheat the oven to 375 degrees F (190 degrees C). blend for 1 minute.
17,7372045,2,"Combine rolled oats, Almond Breeze Unsweetened Vanilla Almondmilk, banana, egg, baking powder, cinnamon, vanilla extract, honey, and salt in a blender; blend for 1 minute."
18,7372045,3,Grease 3 small ramekins with cooking spray. Pour oatmeal mixture evenly into the ramekins. Mix in and top with ingredients from the flavor of your choice.
19,7372045,4,"Bake in the preheated oven until a toothpick poked in the center comes out clean, 20 to 30 minutes. Remove from the oven and allow to cool for a few minutes before enjoying warm!"
20,7372058,1,Preheat the oven to 350 degrees F (175 degrees C). Spray a 9x9 pan with nonstick cooking spray.
21,7372058,2,"Mix together mashed banana, eggs, Almond Breeze Unsweetened Vanilla Almondmilk, coconut oil, and vanilla in a large bowl until mostly smooth. Add rolled oats, baking powder, cinnamon and salt until well combined. Gently fold in strawberries and chocolate chips."
22,7372058,3,"Pour mixture into prepared pan and bake until edges start to become slightly golden brown, 25 to 35 minutes.You can substitute melted butter or melted ghee for the coconut oil.Feel free to use gluten free oats."
23,6738188,1,"Combine milk, yogurt, oats, honey, chia seeds, and cinnamon in a 1/2-pint jar with a lid; cover and shake until combined. Fold in blueberries."
24,6738188,2,"Cover and refrigerate, 8 hours to overnight."
25,6739668,1,Gather all ingredients.Dotdash Meredith Food Studios
26,6739668,2,"Bring water to a boil in a small pot. Add oats and cook, stirring, for 1 minute.Dotdash Meredith Food Studios"
27,6739668,3,"Remove from heat and stir in brown sugar and maple syrup. Let sit until desired thickness is reached, 2 to 3 minutes.Dotdash Meredith Food Studios"
28,6648805,1,"Combine water, oats, sugar, and salt in a saucepan. Add bananas and cinnamon. Bring to a boil, then reduce heat to low, and simmer until the liquid has been absorbed, stirring frequently."
29,6648805,2,"Pour into bowls, and top each with a splash of cold milk."
30,6595117,1,Gather all ingredients.Dotdash Meredith Food Studios
31,6595117,2,Combine water and oats in a multi-functional pressure cooker (such as Instant Pot). Close and lock the lid. Select high pressure according to manufacturer's instructions; set timer for 3 minutes. Allow 10 to 15 minutes for pressure to build.Dotdash Meredith Food Studios
32,6595117,3,"Release pressure using the natural-release method according to manufacturer's instructions, 10 to 40 minutes. Oats will thicken as they cool.Dotdash Meredith Food Studios"
33,6584235,1,"Combine almond milk, oats, mashed banana, and chia seeds in a 1-pint jar. Seal with a lid and shake until well combined. Refrigerate until chia seeds have swelled and mixture is thick and gel-like, 8 hours to overnight."
34,6649508,1,"Stir oats, yogurt, and almond milk together in a jar with a lid. Twist lid onto jar and refrigerate, 8 hours to overnight. Stir oatmeal and add banana when ready to eat."
35,6601747,1,"Combine oatmeal and protein powder in a microwave-safe bowl. Add blueberries, pumpkin seeds, and raisins. Add milk and heat in the microwave for about 1 minute. Stir before serving."
36,6648267,1,"Bring coconut milk to a gentle boil in a small saucepan over medium-low heat. Stir in oats and honey; lower heat and simmer until milk has mostly been absorbed, about 15 minutes."
37,6648267,2,"Sprinkle coconut flakes, brown sugar, and cinnamon into oatmeal. Cook until oats are creamy and flavors are combined, about 5 minutes."
38,6580273,1,Add Quaker® Oats to your container of choice and pour in milk.
39,6580273,2,"Layer Greek yogurt, chia seeds and mixed fruit and berries."
40,6580273,3,Refrigerate overnight and enjoy in the morning!
41,6737011,1,"Combine oats, banana, cinnamon, and salt in a microwave-safe bowl; add water and stir. Cook in microwave until water is absorbed, 2 to 3 minutes. Stir to evenly distribute cinnamon; let stand until slightly cooled, about 3 minutes."
42,6737011,2,"Spoon Greek yogurt, strawberry jam, and peanut butter over oatmeal; stir."
43,6650031,1,"Just before going to bed, combine the oats and water in a slow cooker. Set on Low, cover, and let cook overnight. In the morning, stir in the salt and half-and-half. Scoop into bowls, and sprinkle brown sugar over the top."
44,6569861,1,Preheat oven to 350 degrees F (175 degrees C). Grease an 8x8-inch baking dish.
45,6569861,2,"Mix oats, brown sugar, cinnamon, baking powder, and salt together in a bowl. Beat in milk, butter, maple syrup, eggs, and vanilla extract; fold in cranberries. Spread mixture into the prepared baking dish."
46,6569861,3,"Bake in the preheated oven until bubbling, about 40 minutes."
47,6588504,1,Place oats in a blender and process until they form a fine flour. You need 1 cup blended oats.
48,6588504,2,Mash banana in a glass or microwave-safe dish. Mix in cinnamon and vanilla. Pour in blended oats and baking soda and mix to combine. Stir in milk until well combined.
49,6588504,3,"Cook in the microwave until set, about 2 minutes. Allow to cool before eating."
50,6602117,1,"Combine water, oats, apple, cinnamon, salt, and nutmeg in a multi-functional pressure cooker (such as Instant Pot®). Close and lock the lid. Seal vent. Select Manual function; set timer for 5 minutes. Allow 10 to 15 minutes for pressure to build."
51,6602117,2,"Release pressure using the natural-release method according to manufacturer's instructions, about 10 minutes. Release remaining pressure naturally. Stir and remove pot carefully with oven mitts."
52,6737773,1,"Mix oats, water, milk, honey, sugar, vanilla extract, and salt together in a rice cooker."
53,6737773,2,"Cook oats in rice cooker until desired consistency is reached, 10 to 15 minutes."
54,6738142,1,"Combine the water, apple juice, and apples in a saucepan. Bring to a boil over high heat, and stir in the rolled oats and cinnamon. Return to a boil, then reduce heat to low, and simmer until thick, about 3 minutes. Spoon into serving bowls, and pour milk over the servings."
55,6575250,1,Preheat the oven to 350 degrees F (175 degrees C). Spray two 8-ounce ramekins with cooking spray on the bottom and sides.
56,6575250,2,"Combine oats, banana, egg, baking powder, salt, almond milk, maple syrup, vanilla, and cinnamon in a blender. Blend until all is combined well, 30 to 60 seconds. Stir in blueberries. Fill mixture into the prepared ramekins."
57,6575250,3,"Bake in the preheated oven until firm, about 25 minutes."
58,6601430,1,"Mix oats, apple, milk, yogurt, banana, raisins, walnuts, almonds, brown sugar, honey, and orange juice together in a bowl. Chill in refrigerator for at least 1 hour to set."
59,6586430,1,Preheat the oven to 350 degrees F (175 degrees C). Spray two 8-ounce ramekins with cooking spray on the bottom and sides.
60,6586430,2,"Combine oats, almond milk, banana, cocoa powder, maple syrup, baking powder, vanilla extract, and salt in a blender. Blend until all is combined well, 30 to 60 seconds. Fill mixture into the prepared ramekins and sprinkle each with 1 tablespoon chocolate chips."
61,6586430,3,"Bake in the preheated oven until firm, about 25 minutes."
62,6577514,1,"Combine milk, oats, sugar, cinnamon, nutmeg, and salt in a saucepan. Add lemon peel, if using. Bring to a boil, stirring constantly for 2 minutes."
63,6604885,1,"In a saucepan over medium heat, whisk together the egg, milk and brown sugar. Mix in the oats. When the oatmeal begins to boil, cook and stir until thick. Remove from the heat, and stir in butter until melted. Serve immediately."
64,6600153,1,"Bring water and salt to a boil in a saucepan. Stir oats into boiling water; cook oats until thick and soft, 20 to 30 minutes."
65,6600153,2,"Stir milk, cashews, cranberries, coconut, vanilla extract, and cinnamon into cooked oats; continue cooking, stirring frequently, for 10 minutes more."
66,6600153,3,Sprinkle sugar over oats to serve.
67,6588328,1,"Place water and oats in a microwave-safe bowl. Cook at 50% power, stirring half way through cooking, until oats are softened, 3 to 5 minutes. Stir in butter until melted. Stir in bacon bits and Creole seasoning until evenly distributed."
68,6736472,1,"Mix together oats and milk in a microwave-safe bowl. Cook on high for 1 to 2 minutes, stirring once. Add more milk or oats to achieve the desired consistency, and cook for another 30 seconds. Stir in pumpkin puree, pumpkin pie spice, and cinnamon sugar. Heat through, and serve."
69,6571103,1,"Stir water, almond milk, applesauce, steel-cut oats, dried cherries, brown sugar, vanilla, and cinnamon together in a slow cooker."
70,6571103,2,Cook on Low for 8 hours overnight.
71,6592080,1,"Pour cocoa powder into a microwave-safe bowl and stir in cinnamon, sweetener, and salt. Add hot water and stir thoroughly until cocoa powder has dissolved. Stir in cold water until well combined. Stir in oats and banana until mixed well."
72,6592080,2,"Microwave for 2 minutes. Remove, stir, and allow oatmeal to cool and thicken."
73,6593176,1,"Mash half the banana in a saucepan. Whisk almond milk, honey, almond extract, cinnamon, and salt with the mashed banana until smooth; bring to a boil and stir oats into the mixture. Reduce heat to medium-low and cook at a simmer until the oats are tender and the moisture has been absorbed to your desired consistency, 5 to 7 minutes. Transfer oatmeal to a bowl."
74,6593176,2,"Dice remaining banana half. Top oatmeal with banana and more cinnamon, as desired."
75,6580599,1,"Stir together almond milk, oats, chia seeds, honey, cinnamon, vanilla, and salt in a jar or container with a lid. Cover and refrigerate for 8 hours to overnight."
76,6576655,1,"Mix almond milk, oats, chia seeds, coconut, maple syrup, cocoa powder, and vanilla extract in a 12-ounce mason jar."
77,6576655,2,"Cover and refrigerate, 8 hours to overnight. Stir and serve cold."
78,6651107,1,Preheat the oven to 350 degrees F (175 degrees C). Grease 5 8-oz ramekins.
79,6651107,2,"Combine rolled oats, Greek yogurt, almond milk, maple syrup, eggs, vanilla extract, almond extract, baking powder, baking soda, salt, cinnamon, and nutmeg in a blender. Blend on high speed until batter is smooth, 1 to 2 minutes."
80,6651107,3,"To one ramekin, add pumpkin puree, cranberries, walnuts, and pumpkin pie spice. To the second ramekin, add sweetened coconut, sliced almonds, and almond extract. To the third ramekin, add cocoa powder, cherries, and chocolate chips. To the fourth ramekin, add blueberries, maple syrup, and lemon zest. To the fifth ramekin, add raisins, walnuts, cinnamon, cloves, and allspice."
81,6651107,4,Divide batter evenly between the prepared ramekins. Carefully stir each ramekin individually until all additional ingredients are thoroughly incorporated. Place ramekins onto a baking sheet.
82,6651107,5,"Bake until tops spring back lightly when touched, 30 to 35 minutes. Allow to cool 10 minutes before serving. Alternately, cool completely, cover, and place into the refrigerator or freezer for later. Re-warm before serving."
83,6605466,1,Lightly grease a pie pan.
84,6605466,2,"Beat applesauce and white sugar together in a bowl. Add oats, soy milk, 1 tablespoon plus 1/4 teaspoon baking powder, vegetable oil, and sea salt; mix well. Fold raisins into oat mixture."
85,6605466,3,Pour oat mixture into the prepared pie pan; top with brown sugar and cinnamon. Refrigerate for 8 hours to overnight.
86,6605466,4,Preheat the oven to 350 degrees F (175 degrees C).
87,6605466,5,"Bake in the preheated oven until oatmeal is firm, 35 to 50 minutes."
88,6586913,1,Preheat the oven to 350 degrees F (175 degrees C). Lightly grease a 9x13-inch baking pan.
89,6586913,2,"Mix oats, brown sugar, milk, oil, eggs, baking powder, salt, and cinnamon together in a bowl using an electric mixer. Pour into the prepared pan."
90,6586913,3,"Bake in the preheated oven until set, 25 to 30 minutes, making sure not to let brown."
91,6568422,1,"Combine oatmeal, brown sugar, vanilla, cinnamon, and salt in a multi-functional pressure cooker (such as Instant Pot). Pour in water and mix to combine. Close and lock the lid. Select high pressure according to manufacturer's instructions; set timer for 8 minutes. Allow 10 to 15 minutes for pressure to build."
92,6568422,2,"Release pressure using the natural-release method according to manufacturer's instructions, for 8 minutes. Release remaining pressure carefully using the quick-release method, about 5 minutes. Unlock and remove the lid."
93,6568422,3,"Let sit until desired consistency is reached, about 5 minutes. Stir and serve with a splash of milk."
94,6605846,1,"Place oats into the bottom of a 1-pint Mason jar. Stir in yogurt, blueberries, and stevia powder. Pour in coconut milk and stir to combine."
95,6605846,2,"Cover the jar and refrigerate, 8 hours to overnight."
96,6604533,1,Preheat the oven to 350 degrees F (175 degrees C). Grease an 8-inch square baking dish.
97,6604533,2,"Whisk eggs, oil, and brown sugar together in a bowl until brown sugar is dissolved. Combine oats, baking powder, cinnamon, and salt in a separate bowl; stir into egg mixture just until moistened. Spoon the oat mixture into the prepared baking dish."
98,6604533,3,"Bake in the preheated oven until edges are golden brown, 20 to 25 minutes."
99,6596113,1,"Stir together yogurt, oats, jam, and chia seeds in a jar or container. Cover and refrigerate, 8 hours to overnight."
100,6737853,1,"Combine oats and 2/3 cup almond milk in a bowl; cover and refrigerate until milk is absorbed by oats, 8 hours to overnight."
101,6737853,2,"Combine oats-almond milk mixture, remaining almond milk, banana, blueberries, vanilla, and maple syrup in a blender; blend until smooth."
102,6737853,3,"Pour smoothie into 2 bowls, then top with coconut, blueberries, and chia seeds."
103,6596992,1,"Combine water and salt together in a saucepan; bring to a boil. Add oats; cook and stir until halfway tender, 2 to 3 minutes. Stir flax, brown sugar, cinnamon, and vanilla extract into oatmeal; continue cooking until oats are tender, water is boiled off, and desired consistency is reached, 2 to 3 minutes more. Stir milk and blueberries into oatmeal."
104,6602625,1,"Combine water, milk, oats, apple, brown sugar, butter, cinnamon, and salt in a slow cooker; mix well."
105,6602625,2,Cook on Low for 1 hour. Reduce heat to Simmer or Warm and cook for 7 to 8 more hours.
106,6593913,1,"Stir together almond milk and oats in a medium bowl. Spoon into 2 small bowls or canning jars if desired. Cover and refrigerate 8 hours to overnight, or for up to 3 days."
107,6593913,2,"Before eating, top with granola and almonds, if desired."
108,6594258,1,Preheat oven to 350 degrees F (175 degrees C). Grease an 8x8-inch baking dish.
109,6594258,2,"Bring milk, brown sugar, cinnamon, nutmeg, and cloves to a boil in a saucepan; remove from heat. Combine oats, apples, dried cranberries, and walnuts in a bowl; transfer to the prepared baking dish. Pour milk mixture over oat mixture."
110,6594258,3,"Bake in the preheated oven until lightly browned, 30 to 35 minutes."
111,6587482,1,Preheat the oven to 350 degrees F (175 degrees C). Grease a 9x13-inch baking dish.
112,6587482,2,"Combine oats, sugar, baking powder, and salt together in a bowl. Add milk, butter, applesauce, egg, and vanilla extract; mix until a smooth, thin consistency is reached. Pour oatmeal into the prepared baking dish."
113,6587482,3,"Bake in the preheated oven until edges are golden, 25 to 30 minutes."
114,6738658,1,"Bring water to a boil in a heavy, large saucepan, and stir in the oats. Reduce heat to a simmer, and cook oats until they begin to thicken, about 10 minutes; mix in the apple, carrot, raisins, cinnamon, nutmeg, ginger, and salt. Let the oats simmer until tender, about 20 more minutes."
115,6738658,2,"While the oats are simmering, melt butter in a skillet over medium-low heat, and stir in the pecans. Toast the nuts until fragrant and lightly browned, 2 to 5 minutes, then sprinkle with brown sugar and stir until sugar has melted and coated the pecans."
116,6738658,3,"Serve in bowls, each topped with about 2 tablespoons of the pecan mixture and a dollop of yogurt."
117,6595316,1,Add oats to your container of choice. Pour in low-fat milk and yogurt.
118,6595316,2,Mix in almond extract. Add a layer of mango. Top off with a drizzle of honey and chia seeds.
119,6595316,3,Place in the refrigerator for 3 hours to overnight.
120,6590451,1,"Bring water to a boil in a saucepan; add quinoa and oats. Simmer, stirring frequently, until water is absorbed and quinoa is tender, 15 to 20 minutes."
121,6590451,2,Stir almond meal and flaxseed meal into oat-quinoa mixture; pour into a glass container and top with cinnamon. Let cool for about 15 minutes. Transfer to the refrigerator for storage.
122,6739338,1,"Combine oats, almond-coconut milk, chia seeds, coconut, cardamom, cinnamon, vanilla extract, ginger, and nutmeg in a bowl. Cover bowl with plastic wrap and refrigerate, 8 hours to overnight."
123,6568878,1,"Combine water, cinnamon, prunes, and sugar substitute in a small saucepan over medium heat; bring to a boil. Stir in oat bran and boil for 2 minutes."
124,6584615,1,"Bring milk, sugar, cinnamon, salt, and nutmeg to a gentle boil in a medium saucepan (watch carefully); stir in oats. Return to boil; reduce heat to medium and cook, stirring occasionally, until most of liquid is absorbed, about 1 minute for quick oats and 5 minutes for old-fashioned oats."
125,6584615,2,Remove oatmeal from heat. Stir in mashed bananas and pecans.
126,6584615,3,Spoon oatmeal into 6 cereal bowls.
127,6584615,4,"Top with yogurt, sliced bananas, and pecan halves, if desired."
128,6597356,1,"Combine oats, milk, flax seeds, walnuts, honey, and banana in a microwave-safe bowl. Cook in the microwave on high for 2 minutes. Mash banana with a fork and stir into mixture. Serve hot."
129,6583994,1,"Combine buckwheat, chia seeds, 1 1/2 teaspoons coconut, flax seed meal, cinnamon, and vanilla powder in a jar; stir until well mixed. Stir in milk; cover. Place in the refrigerator, 8 hours to overnight."
130,6583994,2,"Stir buckwheat mixture. Heat in the microwave for 30 seconds. Stir in mixed berries, remaining coconut, and agave."
131,6650904,1,"Place 3 to 4 slices of banana in the bottom of a jar. Layer 1 1/2 teaspoon of almond butter, 1/2 teaspoon chia seeds, and 1/2 cup oats on top. Repeat layering remaining almond butter, chia seeds, and oats, leaving a 1-inch gap at the top."
132,6650904,2,"Mix almond milk, maple syrup, and vanilla extract in a bowl. Pour over oats, leaving a 1/2-inch gap at the top to allow oats to expands as they soak. Push a knife or fork vertically through the jar to make sure milk mixture soaks all the way through."
133,6650904,3,"Cover jar tightly and refrigerate until oats are moist, 4 hours to overnight."
134,6590687,1,"In a medium saucepan, combine water, brown sugar, cinnamon, and syrup. Heat mixture to a boil."
135,6590687,2,"When water is at a boil, reduce heat and add in oats. Cook for about 5 minutes, or until all water is soaked by the oats. Remove from heat, stir in apples and raisins and serve."
136,6605270,1,"Place water, oats, milk, butter, brown sugar, vanilla extract, cinnamon, and salt into an oven-safe bowl. Place the bowl into the bottom of a slow cooker. Fill the slow cooker with water up to the water level in the oatmeal bowl. Cover the slow cooker."
137,6605270,2,"Cook on Low until oats are tender, 6 to 8 hours."
138,6605270,3,"Stir in peaches with their juices. Cover and continue to cook on Low until warmed, about 30 minutes. Serve."
