,id_recipe,Step_Count,Step Description
131,6891180,10,"Start with 1 piece (keeping the others in the fridge so they stay cool) and make two cuts starting 1/2 inch from top, all the way to the bottom to create 3 strips of dough. Braid together, and seal at bottom. Flip over and add about 1 tablespoon of dark chocolate chunks along the center of the braided dough, or more to taste. Roll up from the smaller end to create a knot. Place seam side down in buttered muffin tin."
132,6891180,11,"After all braids are done, cover, and let rise in a warm spot until doubled in size, about 1 hour."
133,6891180,12,Preheat the oven to 400 degrees F (200 degrees C).
134,6891180,13,"Brush brioche with egg wash, and sprinkle very lightly with some coarse salt. Then sprinkle very generously with the granulated sugar."
135,6891180,14,"Bake on the center rack of the preheated oven until nicely browned, 20 to 25 minutes. If brioches are getting too dark, tent with aluminum foil after 15 minutes."
136,6891180,15,Let cool in the pan for about 5 minutes and then transfer onto a rack to cool completely before serving.
137,6649943,1,Lightly dust a work surface with flour. Unroll crescent dough and divide into triangles along the perforated lines.
138,6649943,2,Spread each triangle with cream cheese.
139,6649943,3,"Drop 3 or 4 cherries on the wider portion of each crescent dough triangle. Carefully roll up each crescent, making sure the cherries stay tucked in. Fold down the ends of each roll slightly so it forms a crescent shape."
140,6649943,4,Spray the basket of the air fryer with non stick cooking spray spray. Carefully set the croissants into the basket.
141,6649943,5,Set air fryer to 400 degrees F (200 degrees C).
142,6649943,6,"Air fry croissants until puffed up and lightly browned, about 5 minutes. Check to make sure croissants are not sticking to each other and that they are not overly browned. Continue cooking for 2 to 3 minutes longer, making sure they do not get too done."
143,6649943,7,Transfer croissants to a plate and sprinkle with cinnamon.
144,6648710,1,"Prepare dough: Place milk, eggs, margarine, flour, salt, white sugar, and yeast in the pan of a bread machine in the order recommended by the manufacturer. Select dough cycle; press Start."
145,6648710,2,"When dough has doubled in size, turn it out onto a lightly floured surface. Cover it with a kitchen towel or plastic wrap and let it rest for 10 minutes."
146,6648710,3,Roll dough on a lightly floured surface to a 16x21-inch rectangle.
147,6648710,4,"Prepare filling: Combine brown sugar and cinnamon in a small bowl. Spread softened butter over the dough, then sprinkle cinnamon-sugar mixture evenly over top."
148,6648710,5,"Starting at the longer end, roll up the dough; cut into 12 rolls. Place rolls in a lightly greased 9x13-inch baking pan. Cover and let rise until nearly doubled, about 30 minutes."
149,6648710,6,"Meanwhile, preheat the oven to 400 degrees F (200 degrees C)."
150,6648710,7,"Bake rolls in the preheated oven until golden brown, about 15 minutes."
151,6648710,8,"While rolls are baking, prepare icing: Beat confectioners' sugar, butter, cream cheese, confectioners' sugar, vanilla, and salt until creamy."
152,6648710,9,Spread icing on warm rolls before serving.
153,6663838,1,"Make the dough: Pour water into a liquid measure. Add 1 teaspoon of sugar and active dry yeast; stir until dissolved. Let stand until foamy, about 10 minutes.Dotdash Meredith Food Studios"
154,6663838,2,"Meanwhile, warm milk in a small saucepan over medium heat until it just starts to bubble around the edges; do not boil. Remove from the heat and stir in 1/4 cup sugar, 1/4 cup unsalted butter, and salt until melted. Let cool until lukewarm.Dotdash Meredith Food Studios"
155,6663838,3,"Lightly whisk eggs in a large bowl. Add yeast mixture, lukewarm milk mixture, and 1 1/2 cups flour; stir until well combined.Dotdash Meredith Food Studios"
156,6663838,4,"Mix in remaining 2 1/2 cups flour (1/2 cup at a time), mixing well after each addition, until dough comes together."
157,6663838,5,"Turn dough out onto a lightly floured surface and knead until smooth, silky, and elastic, about 8 minutes.Dotdash Meredith Food Studios"
158,6663838,6,"Place dough in an oiled bowl and turn to coat with oil. Cover with a damp cloth and let rise in a warm place until doubled in volume, about 1 hour.Dotdash Meredith Food Studios"
159,6663838,7,"While the dough is rising, make the glaze: Melt 3/4 cup of unsalted butter in a small saucepan over medium heat. Add 3/4 cup brown sugar and whisk until smooth."
160,6663838,8,Grease a 9x13-inch pan. Pour glaze mixture into the pan; sprinkle pecans over top.Dotdash Meredith Food Studios
161,6663838,9,"Make the filling: Place 1/4 cup melted butter in a small bowl. Combine 3/4 cup of brown sugar, pecans, and cinnamon in a separate bowl."
162,6663838,10,"When the dough has doubled in size, turn it out onto a lightly floured surface. Roll into a 14x18-inch rectangle. Brush 1/2 of the melted butter over the dough, leaving a 1/2-inch border unbuttered. Sprinkle brown sugar mixture over top.Dotdash Meredith Food Studios"
163,6663838,11,"Start at the long edge and roll the dough tightly, pinching the seams to seal. Brush remaining butter over the dough. Cut dough into 15 equal rolls.Dotdash Meredith Food Studios"
164,6663838,12,"Place rolls, cut-sides down, into the glaze in the prepared pan. Cover and let rise until double in size, about 1 hour.Dotdash Meredith Food Studios"
165,6663838,13,Preheat the oven to 375 degrees F (190 degrees C).
166,6663838,14,"Uncover and bake in the preheated oven until golden brown, 25 to 30 minutes."
167,6663838,15,"Let cool in pan for 3 minutes, then invert onto a serving platter so the glaze is on top. Scrape any remaining glaze from the pan onto the rolls.DOTDASH MEREDITH FOOD STUDIOS"
168,6737520,1,Preheat the oven to 375 degrees F (190 degrees C). Butter two 6-cup donut pans.
169,6737520,2,"Pour apple cider into a saucepan and place over medium heat. Bring to a simmer and let it cook, watching carefully, until the cider is reduced to 1/2 cup. If it reduces too much, add enough water to make 1/2 cup. Set aside until needed.Dotdash Meredith Food Studios"
170,6737520,3,"Add flour, baking powder, baking soda, salt, 1 teaspoon cinnamon, cardamom, and nutmeg to a large bowl. Mix with a whisk until combined and set aside until needed."
171,6737520,4,"Whisk 1/2 cup white sugar, brown sugar, milk, 2 tablespoons melted butter, vanilla extract, and egg together in another bowl until combined. Add the apple cider reduction and the dry ingredients. Whisk together to form a slightly thick batter; do not overmix.Dotdash Meredith Food StudiosDotdash Meredith Food Studios"
172,6737520,5,"Spoon or pipe the batter into the prepared donut pans, filling them about 3/4 of the way up.Dotdash Meredith Food Studios"
173,6737520,6,"Bake in the center of the preheated oven until the tops are lightly browned, and the donuts spring back slightly to the touch, 10 to 12 minutes. Let cool for 10 minutes in the pans before removing to a sheet pan lined with a silicone baking mat. Cut out any donut holes as necessary."
174,6737520,7,"If desired, while still slightly warm, brush the donuts lightly with remaining melted butter.Dotdash Meredith Food Studios"
175,6737520,8,Mix 1 cup white sugar and 1 tablespoon cinnamon together for the topping in a shallow dish; toss in donuts to coat. Let cool completely before serving.Dotdash Meredith Food Studios
176,6579999,1,Heat oil in a deep-fryer to 375 degrees F (190 degrees C).
177,6579999,2,"Sift together flour, sugar, baking powder, salt, cinnamon, and nutmeg in a large bowl. Mix in butter until crumbly. Stir in milk and egg until smooth."
178,6579999,3,"Knead lightly, then turn out onto a lightly floured surface. Roll or pat to 1/4-inch thickness. Cut with a doughnut cutter, or use two round biscuit cutters of different sizes."
179,6579999,4,"Lay doughnuts in hot oil, a few at a time. Do not overcrowd the pan, or oil may overflow. Fry, turning once, until golden, about 3 minutes. Drain on paper towels."
180,6664120,1,"Sprinkle the yeast over the warm water, and let stand for 5 minutes, or until foamy.Dotdash Meredith Food Studios"
181,6664120,2,"In a large bowl, mix together the yeast mixture, milk, sugar, salt, eggs, shortening, and 2 cups of the flour. Mix for a few minutes at low speed, or stirring with a wooden spoon. Beat in remaining flour 1/2 cup at a time, until the dough no longer sticks to the bowl. Knead for about 5 minutes, or until smooth and elastic. Place the dough into a greased bowl, and cover. Set in a warm place to rise until double. Dough is ready if you touch it, and the indention remains.Dotdash Meredith Food StudiosDotdash Meredith Food Studios"
182,6664120,3,"Turn the dough out onto a floured surface, and gently roll out to 1/2 inch thickness. Cut with a floured doughnut cutter. Let doughnuts sit out to rise again until double. Cover loosely with a cloth.Dotdash Meredith Food StudiosDotdash Meredith Food Studios"
183,6664120,4,"Melt butter in a saucepan over medium heat. Stir in confectioners' sugar and vanilla until smooth. Remove from heat, and stir in hot water one tablespoon at a time until the icing is somewhat thin, but not watery. Set aside.Dotdash Meredith Food Studios"
184,6664120,5,"Heat oil in a deep-fryer or large heavy skillet to 350 degrees F (175 degrees C). Slide doughnuts into the hot oil using a wide spatula. Turn doughnuts over as they rise to the surface. Fry doughnuts on each side until golden brown. Remove from hot oil, to drain on a wire rack. Dip doughnuts into the glaze while still hot, and set onto wire racks to drain off excess. Keep a cookie sheet or tray under racks for easier clean up.Dotdash Meredith Food StudiosDotdash Meredith Food Studios"
185,6664120,6,Enjoy!DOTDASH MEREDITH FOOD STUDIOS
186,6650768,1,"Dissolve yeast in warm water. Pour into a large bowl and stir in evaporated milk, white sugar, eggs, and salt. Add 4 cups flour and beat until smooth."
187,6650768,2,"Mix in shortening. Mix in remaining 3 cups flour. Cover and refrigerate for at least 2 hours, or up to 24 hours."
188,6650768,3,Roll dough out on floured surface to 1/8-inch thick. Cut into 2 1/2-inch squares.
189,6650768,4,Heat oil in a deep pot to 360 degrees F (180 degrees C).
190,6650768,5,"Fry beignets in batches until browned and puffed. (If beignets sink and do not pop up, oil is not hot enough.) Remove from oil with a slotted spoon and drain on paper towels."
191,6650768,6,Shake confectioners' sugar over hot beignets. Serve immediately.
192,6737348,1,Preheat the oven to 400 degrees F (200 degrees C). Line a baking sheet with parchment paper.
193,6737348,2,Place shredded and chopped apples in a large bowl. Stir in brown sugar and golden raisins; set aside.Dotdash Meredith Food Studios
194,6737348,3,Place puff pastry on the prepared baking sheet. Roll lightly with a rolling pin. Arrange apple filling down one side of pastry lengthwise.Dotdash Meredith Food Studios
195,6737348,4,"Fold pastry lengthwise over apple mixture; dampen edges of pastry with water, then press or crimp edges to seal. Whisk egg and milk together; brush on top of pastry. Cut 2 or 3 slits on the crust to allow steam to escape.Dotdash Meredith Food Studios"
196,6737348,5,"Bake in the preheated oven until golden brown, 35 to 40 minutes.Dotdash Meredith Food Studios"
197,6737348,6,"Slice, serve, and enjoy!"
198,6650800,1,"Make dough: Combine water, sugar, and yeast in a large bowl. Let rest until foamy, about 5 minutes."
199,6650800,2,"Add 2 cups flour, 1 tablespoon melted butter, and salt to yeast mixture. Stir with a wooden spoon until a very wet sticky dough forms."
200,6650800,3,"Dust work surface with remaining 1/2 cup flour. Turn dough out onto the floured surface. Knead, folding in excess flour as needed, until dough is soft, slightly sticky, and elastic. Place into a greased bowl, cover, and let rise in a warm place until doubled in volume, about 1 1/2 hours."
201,6650800,4,Make seasoned sugar: Mix together sugar and most of the sea salt in a bowl. Taste and add remaining salt if desired.
202,6650800,5,Grease a 12-cup muffin tin with remaining 1 tablespoon melted butter. Spoon some of the seasoned sugar into each cup and shake to coat. Turn tin over and return excess sugar to the bowl. Set the muffin tin aside until needed.
203,6650800,6,"Transfer dough onto a floured surface and press into a rough rectangle. Roll dough into a rectangle about 1/8- to 1/4-inch thick. Grate 1 stick ice-cold butter over dough, leaving a 1-inch border. Flatten butter using lightly floured hands. Fold rectangle widthwise into thirds. Press gently to square out the edges, then place onto a silicone-lined baking sheet. Wrap in plastic and refrigerate for 30 minutes."
204,6650800,7,"Roll dough into a large rectangle again, pulling and stretching the corners as needed. Grate remaining stick ice-cold butter over the surface. Pat down with floured fingers and fold into thirds. Roll back out into a rectangle and fold into thirds. Repeat rolling and folding one more time. Wrap in plastic and refrigerate for at least 1 hour."
205,6650800,8,Preheat the oven to 375 degrees F (190 degrees C).
206,6650800,9,"Sprinkle a generous amount of seasoned sugar onto your work surface. Place dough onto sugar and sprinkle more sugar on top. Roll into a large rectangle about 1/8- to 1/4-inch thick, turning and topping with sugar between rolls."
207,6650800,10,Use a pizza cutter to trim away uneven edges. Cut dough into 12 equal squares. Sprinkle more sugar on top. Lightly pinch each pastry into a crown shape by bringing all four corners to the center; place into the prepared muffin cups. Sprinkle more sugar on top. Let rest for 10 minutes.
208,6650800,11,"Bake in the preheated oven until browned and puffed, 25 to 30 minutes. Transfer pastries to a cooling rack while still hot. Let cool for 15 minutes before serving."
209,6651121,1,Lightly grease a fluted tube pan (such as Bundt) with vegetable oil; set aside.
210,6651121,2,"Make dough: Combine warm water, yeast, and 1 teaspoon sugar in a large bowl. Let stand until bubbly and foamy, about 5 minutes."
211,6651121,3,"Stir in 1 cup flour, warm milk, egg, 3 tablespoons sugar, butter, salt, and vanilla extract until combined. Add remaining 2 1/2 cups flour. Mix and knead until dough comes together in a ball. Cover with plastic wrap and let rise in a warm place for 30 minutes."
212,6651121,4,Turn dough out onto a lightly floured surface and punch down gently to deflate. Divide dough into small or medium balls.
213,6651121,5,"Make coating: Mix together brown sugar and cinnamon in a small bowl. Dip each dough ball in melted butter, remove with a fork, then roll in cinnamon sugar mixture until well coated."
214,6651121,6,"Arrange coated dough balls in the prepared pan. Cover with plastic wrap or a damp cloth and let rise until almost doubled in size, about 45 minutes."
215,6651121,7,Preheat the oven to 350 degrees F (175 degrees C).
216,6651121,8,"Bake in the preheated oven until golden brown, about 35 minutes. Invert onto a large plate; cool for 10 minutes before serving."
217,6650554,1,Lightly grease two 9-inch round cake pans with 1 tablespoon melted butter; set aside.
218,6650554,2,"Roll bread dough out to an 18x6-inch rectangle and brush with remaining tablespoon melted butter. Mix brown sugar, walnuts, and cinnamon in a bowl; sprinkle over dough. Roll dough into a log, starting at a long edge. Moisten the other long edge with a little water; press to seal."
219,6650554,3,"Cut log into 20 slices. Arrange rolls, cut-sides down, in the prepared cake pans. Cover with a towel and let rise in a warm place until doubled in size, about 1 1/2 hours."
220,6650554,4,Preheat the oven to 350 degrees F (175 degrees C).
221,6650554,5,Pour heavy cream over rolls.
222,6650554,6,"Bake in the preheated oven until golden brown, about 25 minutes."
223,6650554,7,"Make icing: Stir confectioners' sugar, milk, and vanilla in a bowl until smooth and pourable. Add more milk or sugar as needed to reach desired consistency."
224,6650554,8,Drizzle icing over warm cinnamon rolls.
225,6568840,1,"Cream butter and 2/3 cup flour in a medium bowl until well combined. Divide into 2 equal parts, then roll each half between 2 pieces waxed paper into a 6x12-inch sheet. Chill butter sheets in the refrigerator."
226,6568840,2,Mix 3 cups flour with active dry yeast in a mixing bowl; set aside.
227,6568840,3,"Stir together milk, sugar, and salt in a small saucepan over medium heat. Heat until warm, but not hot to the touch, about 115 degrees F (43 degrees C)."
228,6568840,4,"Pour warm milk mixture over flour mixture. Add eggs, lemon extract, and almond extract. Stir for 3 minutes. Knead in remaining flour, 1/2 cup at a time, until dough is firm and pliable. Cover and let rise at room temperature until doubled in size, 30 minutes to 1 hour."
229,6568840,5,"Cut dough in half. Roll each half out to a 14-inch square. Place one cold butter sheet over half of each dough square, off to one side, then fold dough over butter sheet like the cover of a book. Pinch the edges of dough together with your fingers."
230,6568840,6,Roll each piece out to a 20x12-inch rectangle. Fold into thirds like a letter. Repeat rolling and folding one more time. Wrap in plastic and refrigerate for at least 30 minutes.
231,6568840,7,Roll and fold each piece of dough two more times. Wrap in plastic and refrigerate for at least 30 minutes.
232,6568840,8,"Roll dough out to 1/4-inch thickness. Cut dough into squares. Place a dollop of fruit preserves in the center. Fold 2 opposite corners over the center to form a filled diamond shape. Place danishes on an ungreased baking sheet. Allow to rise at room temperature until doubled in size, about 30 minutes."
233,6568840,9,Preheat the oven to 450 degrees F (220 degrees C).
234,6568840,10,Brush beaten egg white over pastries.
235,6568840,11,"Bake in the preheated oven until the bottoms are golden brown, 8 to 10 minutes."
236,6605569,1,"Combine warm water, yeast, and 1 teaspoon sugar in a small bowl. Let stand until yeast softens and begins to form a creamy foam, about 5 minutes."
237,6605569,2,"Measure flour into a mixing bowl. Combine warm milk, 2 teaspoons sugar, and salt in a separate bowl; blend milk mixture, yeast mixture, and oil into flour. Mix well and knead until smooth. Cover, and let rise until over tripled in volume, about 3 hours.Dotdash Meredith Food Studios"
238,6605569,3,"Deflate gently, and let rise again until doubled, about another 3 hours.Dotdash Meredith Food Studios"
239,6605569,4,Deflate dough and chill for 20 minutes.
240,6605569,5,"Massage butter until pliable, but not soft and oily. Pat dough into a 14x8-inch rectangle.Dotdash Meredith Food Studios"
241,6605569,6,"Smear butter over top two-thirds, leaving a 1/4-inch margin all around. Fold unbuttered third over middle third, and buttered top third down over that.Dotdash Meredith Food StudiosDotdash Meredith Food Studios"
242,6605569,7,"Turn 90 degrees, so that folds are to left and right. Roll out to a 14x6-inch rectangle. Fold in three again. Sprinkle lightly with flour, and put dough in a resealable plastic bag. Refrigerate for 2 hours.Dotdash Meredith Food Studios"
243,6605569,8,"Unwrap, sprinkle with flour, and deflate gently. Roll to a 14x6-inch rectangle, and fold again. Turn 90 degrees, and repeat. Wrap and chill 2 hours."
244,6605569,9,Preheat the oven to 475 degrees F (245 degrees C).
245,6605569,10,"To shape, roll dough out to a 20x5-inch rectangle. Cut in half crosswise, and chill half while shaping the other half. Roll out to a 15x5-inch rectangle. Cut into three 5x5-inch squares. Cut each square in half diagonally.Dotdash Meredith Food Studios"
246,6605569,11,"Roll each triangle lightly to elongate the point, and make it 7 inches long. Grab the other 2 points, and stretch them out slightly as you roll it up.Dotdash Meredith Food StudiosDotdash Meredith Food Studios"
247,6605569,12,"Place on a baking sheet, curving slightly. Let shaped croissants rise until puffy and light.Dotdash Meredith Food Studios"
248,6605569,13,"In a small bowl, beat together egg and 1 tablespoon water. Glaze croissants with egg wash."
249,6605569,14,"Bake in the preheated oven until crisp, flaky, and golden brown, about 12 to 15 minutes.Dotdash Meredith Food Studios"
250,6663119,1,Preheat the oven to 400 degrees F (200 degrees C). Adjust an oven rack to the middle position. Butter two (6 to 8-ounce) ramekins and dust with white sugar.
251,6663119,2,"Place apple slices on a microwave-safe plate, overlapping slightly if necessary. Microwave on high until slices slightly soften, about 45 seconds. Cover the plate with plastic wrap and a kitchen towel."
252,6663119,3,Mix together sugar and cinnamon in a small bowl.
253,6663119,4,"Roll puff pastry sheet to less than 1/8-inch thickness. Using a pizza cutter, cut two (3x12-inch) rectangles. Reserve remaining pieces for another use."
254,6663119,5,"Spread melted butter over dough; sprinkle with a generous amount of cinnamon sugar. Place apple slices along one long edge of dough, about 1/4 inch beyond the edge, overlapping slices slightly. Fold the bottom half of dough over apple slices to form a long ""folder"" of dough with rounded edges of apple slices exposed."
255,6663119,6,Beat together egg and water in a small bowl. Brush surface of dough with egg wash. Sprinkle with cinnamon sugar.
256,6663119,7,"Starting at one end, roll dough to form a rose-shaped pastry. Seal roll with end of dough strip. Transfer roses to the prepared ramekins. Sprinkle with cinnamon sugar."
257,6663119,8,"Bake on the middle rack in the preheated oven until well browned, about 45 minutes. Use tongs to remove the ramekins to a baking sheet to cool for 5 to 10 minutes. Remove apple roses from the ramekins and finish cooling on a wire rack. Dust with confectioners' sugar before serving."
258,6738217,1,Heat milk in a small saucepan until just hot to touch or a few bubbles form around the edge. Remove from heat and stir in margarine until melted; set aside.
259,6738217,2,"Combine 2 1/4 cups flour, white sugar, yeast, and salt in a large bowl. Add milk mixture, water, and egg; beat well. Add remaining 1 cup flour, 1/2 cup at a time, stirring well after each addition."
260,6738217,3,"Turn dough out onto a lightly floured surface and knead until smooth, about 5 minutes. Cover with a damp cloth and let rest for 10 minutes.Dotdash Meredith Food Studios"
261,6738217,4,"While dough is resting, mix together brown sugar, margarine, and cinnamon in a small bowl. Set aside."
262,6738217,5,Preheat the oven to 375 degrees F (190 degrees C). Grease a 12-cup muffin pan.
263,6738217,6,Roll dough out on a lightly floured surface into a 12x9-inch rectangle. Spread brown sugar mixture over dough; sprinkle with raisins.Dotdash Meredith Food Studios
264,6738217,7,Roll up dough and pinch seam to seal. Cut into 12 equal rolls.Dotdash Meredith Food Studios
265,6738217,8,"Place cut-side up in the prepared muffin cups. Cover and let rise until doubled, about 30 minutes.Dotdash Meredith Food StudiosDotdash Meredith Food Studios"
266,6738217,9,"Bake in the preheated oven until browned, about 20 minutes. Remove rolls from muffin cups to cool on a wire rack. Serve warm.Dotdash Meredith Food Studios"
267,6572708,1,"Make dough: Combine water, butter, bread flour, white sugar, milk powder, yeast, and salt, in that order, in the bucket of a bread machine. Select the Dough cycle. Remove dough from the machine after the cycle is done, about 1 hour 45 minutes."
268,6572708,2,"Meanwhile, make sauce: Combine brown sugar, corn syrup, and butter in a saucepan over medium heat. Cook and stir until sugar is dissolved, about 3 minutes. Pour sauce into an 8-inch square baking pan. Sprinkle with pecans and set aside."
269,6572708,3,"Fill dough: Turn dough out onto a floured surface, punch it down, and roll into an 8x12-inch rectangle. Dot with butter and sprinkle with cinnamon. Roll up and pinch seams together. Slice roll into 9 equal pieces, about 1 1/3-inches thick; place cut-side down into the baking pan on top of pecans. Set aside until rolls are doubled in size, about 1 hour."
270,6572708,4,Preheat the oven to 375 degrees F (190 degrees C).
271,6572708,5,"Bake rolls in the preheated oven until golden brown, 20 to 25 minutes. Cool in the pan for no more than 3 minutes; invert a serving platter on top of the pan, then turn over. Carefully remove the pan to release rolls and allow pecan sauce to flow over rolls."
272,6649866,1,Break up compressed yeast and stir into warm milk. Let stand for a few minutes to dissolve.
273,6649866,2,"Sift flour and salt into a large bowl. Stir in yeast mixture and egg until smooth. Stir in currants, raisins, and apple. Cover the bowl and set in a warm place to rise until doubled in volume, about 1 hour."
274,6649866,3,Heat oil in a deep-fryer to 375 degrees F (190 degrees C).
275,6649866,4,"Use two metal spoons to shape scoops of dough into 12 balls. Drop them carefully into the hot oil and fry until golden brown, about 8 minutes. Remove doughnuts with a slotted spoon and drain on paper towels."
276,6649866,5,Dust doughnuts with confectioners' sugar. Transfer to a serving platter and dust with more confectioners' sugar.
277,6649222,1,Gather all ingredients.Dotdash Meredith Food Studios
278,6649222,2,"Dissolve yeast in warm water in a small bowl. Let stand until creamy, about 10 minutes.Dotdash Meredith Food Studios"
279,6649222,3,"Stir together flour, sugar, and salt in a large bowl. Make a well in the center, then add eggs and yeast mixture; beat well until dough comes together. (Tip: Add 1 to 3 tablespoons of additional warm water, 1 tablespoon at a time, only if needed to help the dough come together.)Dotdash Meredith Food StudiosDotdash Meredith Food Studios"
