,id_recipe,Step_Count,Step Description
133,6570871,5,"Use spaghetti tongs to add the pasta directly from the water to the pan with the pancetta, allowing a bit of pasta water to help thin the sauce. Toss the pasta in the skillet to coat the pasta with the pancetta. Add avocado sauce to the pasta, stirring constantly. Mix in reserved pasta water if necessary."
134,6570871,6,Divide pasta between 2 plates. Top with the remaining cheese and black pepper. Serve immediately.
135,6601821,1,"Bring a large pot of lightly salted water to a boil. Add penne and cook, stirring occasionally, until tender yet firm to the bite, 10 to 11 minutes. Drain."
136,6601821,2,"While the pasta is cooking, heat oil in a skillet over medium heat; stir in onion and garlic. Cook and stir until the onion has softened and turned translucent, about 4 minutes. Add pancetta and prosciutto; saute until crisp and brown, about 8 minutes. Add chicken and saute until heated through, about 2 minutes. Remove from the heat and set aside to cool slightly."
137,6601821,3,"Whisk cream, Parmigiano-Reggiano cheese, egg yolks, basil, and parsley together in a large bowl until blended."
138,6601821,4,"Return chicken mixture to the stove over medium-low heat. Add drained penne and cream mixture; toss over medium-low heat until penne is thickly coated, about 4 minutes; do not let it boil or the eggs will scramble. Taste and season with salt and pepper if necessary. Transfer to a large, wide serving bowl and serve immediately."
139,6574959,1,"Heat oil in a large, high-sided skillet over medium heat. Add bacon and cook, stirring occasionally and sprinkling with garlic powder, until browned and crispy, 7 to 8 minutes."
140,6574959,2,"Meanwhile, beat eggs in a separate bowl. Mix in Parmigiano-Reggiano cheese and black pepper."
141,6574959,3,"Remove bacon onto paper towels to drain, reserving 3 tablespoons of the oil and bacon grease in the pan. Return bacon to the pan, stir in maple syrup, and bring to a simmer. Quickly turn heat down to low and let simmer for 1 to 2 minutes."
142,6574959,4,"Bring a large pot of lightly salted water to a boil. Cook spaghetti in the boiling water, stirring occasionally, until tender yet firm to the bite, about 12 minutes. Drain pasta in a strainer set over large glass bowl. Pour 1/4 cup of the pasta water into the skillet with the bacon; stir. Add pasta and toss until coated."
143,6574959,5,"Pour remaining pasta water out of the large bowl. Drop the coated noodles into the bowl. Pour in the egg mixture and quickly toss with the pasta until cheese has melted and sauce is creamy and smooth, 1 to 2 minutes."
144,6602811,1,"Bring a large pot of salted water to a boil. Add spaghetti and cook until al dente, 10 to 12 minutes. Drain."
145,6602811,2,"While the pasta is cooking, whisk the eggs, yolks, Hidden Valley® Original Ranch® Salad Dressing and Seasoning Mix, a small pinch of black pepper, and cheese together in a mixing bowl. Set aside."
146,6602811,3,"Heat oil in a large skillet set over medium heat. Add the bacon and saute for about about 5 to 7 minutes, until beginning to crisp."
147,6602811,4,"Drain pasta, reserving 1 cup of the pasta water. Add pasta to the skillet with the bacon over low heat. Stir to coat the pasta. Transfer pasta and bacon to a bowl, add the egg mixture and a small amount of the reserved pasta water for creaminess. Toss well to coat. Serve immediately with extra cheese for garnish."
148,6591493,1,"Place bacon in a large skillet and cook over medium-high heat, turning occasionally, until evenly browned, about 10 minutes. Drain bacon slices on paper towels and crumble when cool enough to handle."
149,6591493,2,"Bring a large pot of lightly salted water to a boil. Add penne and cook, stirring occasionally, until tender yet firm to the bite, about 11 minutes. Drain and transfer to a large bowl."
150,6591493,3,"At the same time, heat olive oil and butter in a 12-inch skillet over medium heat until butter is melted and oil is hot. Add onion and cook, stirring often, until tender, 3 to 5 minutes. Add mushrooms and cook, stirring often, until soft, 3 to 5 minutes. Add garlic; cook and stir until fragrant, about 1 minute. Stir in Italian seasoning, salt, and pepper and evenly distribute the contents in the skillet."
151,6591493,4,"Stir in wine and bring to a boil, about 3 minutes. Pour in 2 cups chicken stock, add cooked chicken and peas, and bring to a boil."
152,6591493,5,"While mixture is coming to a boil, place flour in a pint jar with a lid. Slowly add remaining chicken stock to the jar, stirring briskly to break up any lumps. Place the lid on the jar and shake until well blended. Slowly pour flour-stock mixture into the boiling mixture and stir to prevent lumps. Return to a boil and cook, stirring occasionally, until thickened, about 5 minutes."
153,6591493,6,"Remove from the heat and stir in 1 cup Parmesan cheese until melted. Pour the hot sauce onto the pasta, add parsley and crumbled bacon, and stir to combine. Serve in individual bowls with additional Parmesan, if desired."
154,6569011,1,"Bring a large pot of lightly salted water to a boil. Cook spaghetti in the boiling water, stirring occasionally, for 8 minutes. Pasta should still be firm. Drain."
155,6569011,2,"At the same time, place bacon in a large skillet and cook over medium-high heat, turning occasionally, until evenly browned, about 10 minutes. Drain bacon slices on paper towels and crumble when cool enough to handle. Reserve bacon drippings in the skillet."
156,6569011,3,"Return crumbled bacon to the skillet with green onion and garlic; cook in the drippings over medium heat until onion starts to soften, about 5 minutes. Add drained spaghetti and mix well."
157,6569011,4,"Slowly add beaten eggs and scramble with the spaghetti mixture for 1 to 2 minutes. Season with salt and pepper. Add Parmesan cheese, garlic powder, and onion powder; continue to scramble until all ingredients are combined. Stir in diced tomatoes and serve."
