,id_recipe,Step_Count,Step Description
280,6649222,4,"Turn dough out onto a lightly floured surface and knead until smooth and supple, about 8 minutes.Dotdash Meredith Food Studios"
281,6649222,5,Flatten dough and spread it with 1/3 of the butter.Dotdash Meredith Food Studios
282,6649222,6,Knead butter into dough.Dotdash Meredith Food StudiosDotdash Meredith Food Studios
283,6649222,7,"Repeat this step twice to incorporate remaining butter, allowing dough to rest for a few minutes between additions of butter, about 20 minutes total.Dotdash Meredith Food Studios"
284,6649222,8,"Lightly grease a large bowl with vegetable oil, place dough in the bowl, and turn to coat. Cover with plastic wrap and let rise in a warm place until doubled in volume, about 1 hour.Dotdash Meredith Food StudiosDotdash Meredith Food Studios"
285,6649222,9,"Punch down dough, cover with plastic wrap, and refrigerate for 6 hours to overnight.Dotdash Meredith Food Studios"
286,6649222,10,Preheat the oven to 400 degrees F (200 degrees C). Lightly grease two 8x4-inch loaf pans.
287,6649222,11,"Turn dough out onto a lightly floured surface. Divide dough into 2 equal pieces, form into loaves, and place into the prepared loaf pans.Dotdash Meredith Food Studios"
288,6649222,12,"Cover with greased plastic wrap and let rise until doubled in volume, about 1 hour.Dotdash Meredith Food Studios"
289,6649222,13,Make egg wash: Beat egg yolk and cold water in a small bowl. Brush on the tops of loaves.Dotdash Meredith Food Studios
290,6649222,14,"Bake loaves in the preheated oven until the tops are deep golden brown, about 25 minutes. Cool in the pans for 10 minutes before transferring to wire racks to cool completely.Dotdash Meredith Food Studios"
291,6739396,1,"Make the dough: Place milk, water, melted butter, egg, bread flour, pudding mix, sugar, salt, and yeast into a bread machine in the order listed, or follow the order recommended by the manufacturer if different. Run Dough cycle. Remove dough from the machine after the cycle is done, about 90 minutes."
292,6739396,2,"When the dough is almost finished, start the filling: Mix brown sugar, pecans, and cinnamon together in a bowl until well combined. Butter a 9x13-inch baking pan."
293,6739396,3,"Turn dough out onto a lightly floured surface and roll into a 17x10-inch rectangle. Spread 1/2 cup softened butter over the rectangle, then sprinkle brown sugar mixture over top."
294,6739396,4,"Beginning with the long side, roll dough over filling into a log; cut log into sixteen 1-inch slices. Place slices, cut-sides up, into the prepared pan. Let rise in a warm place until doubled in volume, about 45 minutes."
295,6739396,5,Preheat the oven to 350 degrees F (175 degrees C).
296,6739396,6,"Bake rolls in the preheated oven until golden brown, 15 to 20 minutes. Remove from the oven and let cool for 10 minutes."
297,6739396,7,"While the rolls are cooling, make the frosting: Stir confectioners' sugar, softened butter, cream cheese, milk, and vanilla together in a bowl until well combined. Spread over warm rolls."
298,6585796,1,"Beat eggs and 1/4 cup sugar in a large bowl until thick and lemon-colored; mix in 1 teaspoon vegetable oil. Combine 1 ½ cups of flour, baking powder, and salt; gradually add to egg mixture, mixing well until evenly combined."
299,6585796,2,Turn dough out onto a floured board and knead thoroughly until dough is smooth.
300,6585796,3,Shape dough into 16 even-sized balls. Flatten and roll each one into a very thin circle about 5 inches in diameter. Let stand uncovered on waxed paper for about 10 minutes.
301,6585796,4,"Meanwhile, combine 1 cup sugar and cinnamon in a small bowl until evenly mixed; set aside. Heat oil in a deep pan to 350 degrees F (175 degrees C)."
302,6585796,5,"Lower one circle of dough carefully into the hot oil; fry until golden, turning once, about 30 seconds on each side. Transfer to a paper towel-lined plate to drain; sprinkle with cinnamon-sugar mixture. Repeat with remaining dough. Serve or cool and store in airtight containers."
303,6570148,1,"To make the pastry: Place flour and salt in a food processor and pulse to combine. Add butter and pulse until pieces are pea-sized. Add sour cream and pulse to form a sticky dough. Cover dough tightly with plastic wrap and refrigerate for 8 hours, or overnight."
304,6570148,2,Preheat the oven to 375 degrees F (190 degrees C). Line a large baking sheet with parchment paper.
305,6570148,3,"To make the filling: Place egg yolk in a medium bowl; set egg white aside for egg wash. Add cream cheese, brown sugar, and cinnamon; beat with an electric mixer until smooth. Stir in 1 cup toasted walnuts until well combined."
306,6570148,4,"Divide chilled dough in half. Roll each piece of dough into a 10x12-inch rectangle on a lightly floured surface. Working from a short side, spoon 1/2 of the filling along the center four inches of each rectangle. On both sides of the filling, cut the unfilled pastry into eight horizontal strips. Working top to bottom, fold each strip over the filling, alternating sides. Press to seal ends and tuck under; arrange braids on the prepared baking sheet."
307,6570148,5,Beat egg white and 1 tablespoon water together until smooth; brush evenly over each braid.
308,6570148,6,"Bake kringles in the preheated oven until golden brown, about 30 to 35 minutes. Cool on the baking sheet for 30 minutes."
309,6570148,7,"While pastries are cooling, make glaze: Mix together confectioners' sugar and 2 tablespoons water in a small bowl until smooth and thin enough to drizzle. Spoon or drizzle glaze over cooled pastries; sprinkle with remaining 1/4 cup of walnuts."
310,6571416,1,"Lightly grease a 10-inch Bundt pan. Place frozen rolls into the prepared pan and sprinkle with brown sugar, pudding mix, and cinnamon. Top with raisins. Pour melted butter over rolls. Cover the pan with a clean, damp dish cloth and let sit at room temperature for 8 hours to overnight."
311,6571416,2,Preheat the oven to 350 degrees F (175 degrees C).
312,6571416,3,"Bake in the preheated oven until golden brown, about 25 minutes. Turn rolls out onto a serving plate and serve warm."
313,6588546,1,Grease and flour a 9- or 10-inch tube pan.
314,6588546,2,Mix together brown sugar and pudding mix in a small bowl. Mix together white sugar and cinnamon in a second small bowl.
315,6588546,3,"Arrange a single layer of frozen dinner rolls in the prepared pan. Sprinkle with some of the brown sugar mixture, then sprinkle with some of the white sugar mixture. Cover with 1/2 of the nuts, then drizzle with 1/2 of the melted butter. Repeat layers with remaining rolls and toppings."
316,6588546,4,Let sit uncovered on the counter for 8 hours to overnight.
317,6588546,5,Preheat the oven to 350 degrees F (175 degrees C).
318,6588546,6,"Bake in the preheated oven for 30 minutes. Let stand for a few minutes, then turn the pan onto a serving platter and lift to release bread."
319,6648928,1,"Grease a 9- or 10-inch tube pan with softened butter. Sprinkle butterscotch pudding mix and white sugar into the prepared tube pan. Arrange rolls around the pan. Sprinkle with pecans and brown sugar, then drizzle melted butter over the top. Place the pan in a cold oven and allow dough to rise 8 hours to overnight."
320,6648928,2,Remove the pan from the oven.
321,6648928,3,Preheat the oven to 350 degrees F (175 degrees C).
322,6648928,4,"Bake in the preheated oven until golden brown, 25 to 30 minutes. Invert the pan onto a large plate and lift to release bread."
323,6569546,1,"Dissolve yeast in warm water in a large bowl. Let stand until creamy, about 10 minutes."
324,6569546,2,"Add 2 1/2 cups flour, buttermilk, eggs, 1/4 cup white sugar, 1/4 cup softened butter, baking powder, and salt to yeast mixture; stir until well combined. Stir in remaining 3 cups flour, 1/2 cup at a time, beating well after each addition. Dough should remain soft and slightly sticky. Turn dough out onto a lightly floured surface and knead until smooth and elastic, about 8 minutes."
325,6569546,3,"Divide dough in half, then roll each half into a 12x7-inch rectangle. Spread each rectangle with 1 tablespoon softened butter, then sprinkle with 1/4 cup white sugar and 1 teaspoon cinnamon. Roll up halves, beginning at a wide side; pinch seams to seal well. Cut each roll into 12 equal slices."
326,6569546,4,"Coat 2 (9-inch) round cake pans, each with 1/4 cup melted butter, 1/4 cup brown sugar, 1/2 of the pecans, and 1/2 of the raisins. Arrange 12 dough slices in each prepared pan, leaving a small space between slices. Cover and let rise until doubled, 30 to 60 minutes."
327,6569546,5,Preheat the oven to 375 degrees F (190 degrees C).
328,6569546,6,"Bake in the preheated oven until golden brown, about 30 minutes. Invert the pans onto serving plates, lift up the pans to release sticky buns, and serve hot."
329,6650557,1,Preheat oven to 350 degrees F (175 degrees C). Lightly grease a 9x13 inch baking pan.
330,6650557,2,Line bottom of baking pan with 1 can of crescent rolls. Pinch all seams together to seal.
331,6650557,3,"In a large bowl, mix together cream cheese, white sugar, lemon juice, vanilla extract and sour cream. Spread filling on top of rolls. Place second can of rolls on top of filling."
332,6650557,4,Bake in preheated oven for 20 to 30 minutes.
333,6650557,5,"In a small bowl, stir together confectioners' sugar, milk and butter. After Danish has cooled, drizzle with icing."
334,6650885,1,"In a large bowl, beat almond paste with an electric mixer to break it apart. Add the almonds, sugar, and salt; continue to mix until the almond paste is no longer lumpy. Stir in the butter, egg whites, almond extract and amaretto liqueur on high speed until its as fluffy as you can get it. Set aside."
335,6650885,2,"Using half of the dough at a time, roll it out on a lightly floured surface into a rectangle that is about 8 inches wide and 1/4 inch thick. Trim the edges of the dough. Cut the dough in half lengthwise to make two 4 inch wide strips."
336,6650885,3,Preheat the oven to 400 degrees F (200 degrees C). Line baking sheets with parchment paper.
337,6650885,4,"Fill a pastry bag halfway with the almond filling and pipe a stripe of filling down the center of each strip. Whisk together the egg and water. Brush onto one edge of each strip. Fold each strip over the filling and press gently to seal it. Brush each piece with egg wash and sprinkle sliced almonds over the top. Cut into 3 to 4 inch pieces, then cut 1/2 inch slits into the sealed edge to make the ''claws''. Place the bear claws at least two inches apart on baking sheets. Refrigerate and repeat with the second half of the dough."
338,6650885,5,"Bake in the preheated oven until almonds are toasted and pastry is golden brown, 25 to 30 minutes. Cool and dust with confectioners' sugar right before serving."
339,6650559,1,"Warm the milk in a small saucepan until it bubbles, then remove from heat. Mix in the butter; stir until melted. Add water and let cool until lukewarm."
340,6650559,2,"In a large bowl, combine the milk mixture, yeast, white sugar, salt, eggs and 2 cups flour; stir well to combine. Stir in the remaining flour, 1/2 cup at a time, beating well after each addition. When the dough has pulled together, turn it out onto a lightly floured surface and knead until smooth and elastic, about 8 minutes."
341,6650559,3,"Divide dough into two pieces. Roll each piece into a 12x9 inch rectangle. In a bowl, stir together the cinnamon and brown sugar. Spread each piece with half of the butter, half of the brown sugar and cinnamon mixture. Roll up dough, using a little water to seal the seam."
342,6650559,4,"Cut each roll into 12 slices using a very sharp knife or dental floss. Place rolls onto two 9x13 inch greased baking pans. Cover and let rise until almost doubled, about 1 hour. Meanwhile, preheat oven to 375 degrees F (190 degrees C)."
343,6650559,5,Bake in preheated oven for 20 to 25 minutes until golden brown.
344,6650559,6,"To make frosting; combine confectioner's sugar, cream cheese, butter and vanilla. Add milk gradually until frosting reaches a spreading consistency. Spread over warm (but not hot) cinnamon rolls."
345,6738343,1,Grease a 10 inch Bundt pan or tube pan.
346,6738343,2,"In a medium bowl, mix together the green onion, parsley, garlic powder, salt, butter and eggs until well blended. Break the bread dough off in walnut-sized pieces, and dip each piece into the egg mixture."
347,6738343,3,"Place coated dough balls into the prepared pan. Once there is a layer of balls covering the bottom of the pan, sprinkle with Parmesan cheese. Repeat, sprinkling each layer with cheese until everything is in the pan. Cover loosely, and let rise until doubled in size, about 45 minutes. Preheat the oven to 350 degrees F (175 degrees C)."
348,6738343,4,"Bake for 30 minutes in the preheated oven, or until golden brown."
349,6650846,1,"Place warm water in the bowl of a stand mixer. Sprinkle with yeast. Let yeast dissolve for 10 minutes. Add sugar and bread flour. Sprinkle with salt; add 3 tablespoons butter. Attach the bowl to the stand mixer. Mix dough with the dough hook just until butter is completely kneaded in and the dough forms a ball and pulls away cleanly from the sides of the bowl, 3 or 4 minutes."
350,6650846,2,"Transfer dough to a work surface and form into a semi-smooth ball. Place dough back in the mixer bowl; cover. Let rise in a warm spot until doubled, about 2 hours."
351,6650846,3,"Transfer dough to a lightly floured work surface. Push and press dough to deflate it, and form it into a rectangle. Fold into thirds by lifting one end over the middle third, and folding the other side onto the middle. Wrap in plastic wrap. Place on a rimmed baking sheet lined with a silicone mat. Refrigerate until chilled through, about 1 hour."
352,6650846,4,"Cut 1 stick of butter in 1/2 lengthwise and place halves slightly apart from each other on a length of parchment paper long enough to fold over the butter. Fold the parchment paper over the butter. Press butter down. Roll out with a rolling pin to a square about 8x8 inches. Refrigerate until a little chilled and just barely flexible, 10 or 15 minutes."
353,6650846,5,Roll dough out into a rectangle slightly wider than the butter slab and just over twice as long. Place butter on one half of the dough leaving about 1 inch margin from the edge of the dough. Fold the other half of the dough over the butter. Dust work surface and dough with flour as needed.
354,6650846,6,"Press rolling pin down on dough to create ridges. Then roll out the ridges. Repeat this process. Keep pressing and rolling until dough is about the same size rectangle as you had before you folded it in half, dusting with just a bit of flour as necessary."
355,6650846,7,"Starting from the short side, fold one-third of dough over middle third. Then fold the other end over to form a small rectangle. Flatten out just slightly with rolling pin. Transfer to the silicone-lined baking sheet; cover with plastic wrap. Refrigerate until chilled, about 30 minutes."
356,6650846,8,"Transfer dough back to work surface and repeat pressing and rolling technique until dough is the size of the previous larger rectangle. Fold into thirds again, starting from the short side. Press and roll slightly. Transfer back to lined baking sheet. Cover and refrigerate about 15 minutes."
357,6650846,9,"Roll back out to a large rectangle. This time, fold dough in half. Then press and roll out into a 1/2-inch thick rectangle, using as little flour as needed to keep dough from sticking."
358,6650846,10,Dust dough with flour and roll out to a rectangle about 1/8-inch thick. Cut dough lengthwise into 6 pieces using a pastry wheel.
359,6650846,11,Pull and stretch out 1 of the dough pieces until ends are slightly tapered. Line 1 to 2 tablespoon of chocolate 1 inch parallel to the bottom edge and an equal amount of chocolate 1 more inch ahead. Roll dough up over the chocolate toward the top short edge to form a croissant with the seam at the bottom. Repeat with the remaining 5 dough pieces.
360,6650846,12,"Place shaped croissants on baking sheets lined with silicone mats. Whisk together egg and 1 tablespoon water to make the egg wash. Brush croissants with a large portion of the egg wash. Place in a warm area to allow them to rise, 60 to 90 minutes."
361,6650846,13,Preheat oven to 400 degrees F (200 degrees C). Brush croissants gently but thoroughly again with egg wash. Sprinkle sea salt on top.
362,6650846,14,"Bake in preheated oven until beautifully browned, about 25 minutes. Transfer to a cooling rack. Cool to room temperature, about 1 hour."
363,6664480,1,"In a large bowl, dissolve yeast in warm water. Let stand until creamy, about 10 minutes. In a small saucepan, heat the buttermilk until warm to the touch."
364,6664480,2,"Pour the buttermilk and oil into the yeast mixture; mix well. Combine the flour, salt and baking soda. Stir the flour mixture into the liquid 1 cup at a time, until a soft dough forms. Turn dough out onto a lightly floured surface and knead 20 times. Cover and let rest for 15 minutes. In a small bowl, stir together the butter, brown sugar and cinnamon."
365,6664480,3,"On a lightly floured surface, roll dough out into a large rectangle. Spread the brown sugar and butter mixture over the dough, roll up into a log and pinch the seam to seal. Slice into 1 inch pieces and place cut side up in a lightly greased 10x15 baking pan. Cover and let rise 30 minutes or cover and refrigerate overnight. If baking immediately, preheat oven to 400 degrees F (200 degrees C)."
366,6664480,4,"Bake in preheated oven for 20 to 25 minutes, until golden brown. Let stand for 2 to 3 minutes before serving."
367,6571370,1,Preheat the oven to 350 degrees F (175 degrees C). Butter the bottom of an 8-inch round or square baking pan and sprinkle with 2 tablespoons brown sugar.
368,6571370,2,"Combine white sugar, cinnamon, 2 tablespoons brown sugar, and vanilla extract in a bowl. Mix filling well."
369,6571370,3,Combine confectioners' sugar and milk for glaze in another bowl until well mixed.
370,6571370,4,"Separate biscuits and roll or punch down each one until flat. Coat with melted butter and sprinkle each with filling mixture to coat. Roll up each piece of dough and cut in 1/2, placing each cut-side down into the prepared pan, yielding 20 pieces."
371,6571370,5,"Bake in the preheated oven until biscuit portion on top of rolls begins to brown, about 15 minutes. Remove from the oven and glaze."
372,6737363,1,"Pour warm water into a bowl; add yeast and let stand until creamy, about 10 minutes."
373,6737363,2,"Combine yeast mixture, cake mix, and 3 cups of flour in a large bowl; stir well. Add remaining flour, 1/2 cup at a time, stirring well after each addition until dough pulls together. Turn dough out onto a lightly floured surface and knead until smooth and elastic, about 8 minutes."
374,6737363,3,"Lightly oil a large bowl; place dough in the bowl and turn to coat with oil. Cover with a damp cloth and let rise in a warm place until doubled in volume, about 30 minutes."
375,6737363,4,"Deflate dough and turn it out onto a lightly floured surface. Roll the dough into a 10x16-inch rectangle. Spread softened butter over the rectangle; sprinkle on brown sugar and cinnamon. Starting from one of the long sides, roll up the rectangle and cut into 1-inch wide rolls."
376,6737363,5,Preheat the oven to 375 degrees F (190 degrees C). Grease a 9x13-inch baking pan.
377,6737363,6,"Pour melted butter into a small bowl. Mix the white sugar and pecans in another small bowl. Dip the top of each roll in melted butter, then in sugar and pecan mixture, then arrange rolls snugly in the prepared pan. Cover rolls with a damp cloth and let rise until doubled in volume, about 30 minutes."
378,6737363,7,"Bake in the preheated oven until golden brown, about 20 minutes."
379,6603013,1,"Place 1 cup of flour in a medium bowl. Mix in butter using a fork or a pastry blender. Sprinkle 2 tablespoons of water over, and stir with a fork until dough comes together. Divide into two balls. Pat dough into two long strips on an ungreased baking sheet, about 14 inches long and 3 inches wide. Set aside."
380,6603013,2,Preheat the oven to 350 degrees F (175 degrees C).
381,6603013,3,"In a saucepan, combine 1/2 cup of butter and 1 cup of water. Bring to a rolling boil. Add 1 teaspoon of almond extract and remove from the heat. Immediately stir in 1 cup of flour until the mixture pulls away from the sides of the pan. Gradually stir in the eggs until well blended. Divide evenly, and spread over the two crusts on the baking sheet."
382,6603013,4,"Bake in the preheated oven until golden, about 1 hour. Allow to cool almost to room temperature before frosting."
383,6603013,5,"To make the frosting, mix together the confectioners' sugar, 1 teaspoon of almond extract and a splash of milk in a small bowl until smooth. Add more milk if necessary to make a pourable glaze. Drizzle over the Danish, and decorate with candy sprinkles if desired."
384,6737753,1,"Heat the milk in a small saucepan until it bubbles, then remove from heat. Add the butter and stir until melted; let cool until lukewarm."
385,6737753,2,"In a large mixing bowl, dissolve the yeast in the milk mixture. Add the sugar, 3 cups of flour, salt and eggs; stir well to combine. Add the remaining flour, 1/2 cup at a time, stirring well after each addition. When the dough has pulled together, turn it out onto a lightly floured surface and knead until smooth and supple, about 8 minutes."
386,6737753,3,"Lightly oil a large mixing bowl, place the dough in the bowl and turn to coat with oil. Cover with a damp cloth and let rise in a warm place until doubled in volume, about 1 hour."
387,6737753,4,Deflate the dough and turn it out onto a lightly floured surface and roll into a 10x 14 inch rectangle. Lightly brush the far edge with water. In a small bowl combine the cinnamon and 3/4 cup brown sugar and sprinkle over the rectangles. Then sprinkle the raisins and chopped nuts over the dough. Roll up the dough into a log and seal the seam.
388,6737753,5,"Cut the dough into 12 equal pieces; place the pieces in a greased 9x13 inch baking pan, or 12 inch deep dish pizza pan. Cover with plastic wrap and place in the refrigerator to rise overnight."
389,6737753,6,"The next morning, preheat oven to 375 degrees F (190 degrees C). Take the rolls out of the refrigerator and let stand at room temperature for 30 minutes."
390,6737753,7,"Bake the rolls for 25 to 30 minutes or until golden. Meanwhile, combine the corn syrup with the vanilla in a small bowl. Whisk in the powdered sugar and enough cream to make a thick glaze; set aside. Drizzle the glaze over the rolls and serve warm."
391,6605693,1,"Roll the bread slices until very flat. Butter the bread, and sprinkle with cinnamon sugar. Starting on one side, roll up the bread slice until tight. Repeat with the second bread slice. Cut the bread rolls into 1 inch slices."
392,6605693,2,"Mix the confectioners' sugar with the water in a small bowl to make a thin frosting. Drizzle frosting over the bread slices, and serve."
393,6602026,1,Mix white sugar and cinnamon together in a small bowl.
394,6602026,2,Roll out 1 thawed loaf into a large rectangle. Brush half of the melted butter evenly over dough. Sprinkle half of the cinnamon sugar mixture over butter. Roll up dough into a log starting with the long edge closest to you. Cut log into 1-inch slices with a sharp serrated knife. Arrange slices cut-side up in an ungreased 9x13-inch baking pan.
395,6602026,3,Repeat step 2 with second thawed loaf.
396,6602026,4,"Combine brown sugar, vanilla ice cream, and 1/2 cup butter in a small saucepan over medium heat; stir until melted and well-blended, 3 to 5 minutes. Pour caramel mixture over rolls in the baking pan. Cover with aluminum foil and refrigerate until rolls double, 8 hours to overnight."
397,6602026,5,Preheat oven to 350 degrees F (175 degrees C).
398,6602026,6,"Bake in the preheated oven until golden brown, about 30 minutes. Allow to cool in the pan for 10 minutes before serving."
399,6591655,1,"Combine potatoes, potato water, butter, sugar, salt and hot water in large mixing bowl. Stir until butter melts; set aside and let cool. Combine yeast and 1/2 cup warm water in small bowl. Let rest 5 minutes. Add eggs, 2 cups flour and yeast mixture to potato mixture. Beat until well mixed. Continue adding flour, 1 cup at a time until soft dough forms."
400,6591655,2,"Knead on a lightly floured surface until smooth and elastic (about 4 to 6 minutes), OR knead with electric mixer using dough hook. Place in a greased bowl, turning to coat. Cover."
401,6591655,3,"Let rise in a warm, draft free area about 1 hour, until doubled in size. Punch dough down; divide in half."
402,6591655,4,"Roll one portion of dough on a lightly floured surface to a 12 x 18-inch rectangle. Spread with half the butter. Combine sugar and cinnamon; sprinkle half of the mixture over surface. Roll up tightly lengthwise, sealing edges. Cut into 12 slices. Place in greased 13 x 9-inch pan. Repeat with remaining dough. Cover."
403,6591655,5,Let rise 30 to 45 minutes until nearly doubled.
404,6591655,6,Bake in preheated 350 degrees F oven for 25 to 30 minutes.
405,6591655,7,Cool for 15 minutes. Combine icing ingredients and drizzle over rolls.
406,6597706,1,"Combine 1 cup flour, 2 tablespoons brown sugar, 1 teaspoon salt, and instant yeast in a mixing bowl. Add the water and room temperature butter and beat for 1 minute. Stir in the remaining cup of flour and mix well. Turn the dough out onto a lightly floured surface and knead until smooth and elastic, about 10 minutes. Shape the dough into a ball and transfer to an oiled bowl, turning to coat the surface of the dough. Cover the bowl with plastic wrap and let the dough rise until doubled in bulk, about 1 hour."
