,id_recipe,Step_Count,Step Description
407,6597706,2,"Meanwhile, make the filling. Place the chopped apples and 3 tablespoons butter in a medium saucepan. Combine 1/2 cup brown sugar, 1 1/2 tablespoons flour, 1/4 teaspoon salt, cinnamon, and nutmeg and mix well; add the mixture to the saucepan. Bring the mixture to a boil over medium-high heat and then reduce the heat to a simmer. Cook until the apples are tender, about 5 minutes. Remove from heat and allow the filling to cool."
408,6597706,3,"Transfer the Danish dough to a floured surface and punch the dough down. Let the dough rest, covered, for 15 minutes. Roll the dough out into a 13 x 8-inch rectangle. Place the dough on a greased or parchment-lined baking sheet."
409,6597706,4,"Turn the baking sheet so that you face the short side of the dough. Spread the apple filling down the center third of the dough. With a sharp paring knife, make cuts in the dough along the right side, starting each cut about 1/4 inch from the apple filling. Cut to the edge of the dough strip, with each cut angled to about 4 o'clock. Each strip of dough should be about 1-inch thick. Repeat on the left side of the dough, angling the cuts to 8 o'clock."
410,6597706,5,"Starting at the top, fold the dough strips across the apple filling, alternating left and right. The pastry will look like a long braid. Pinch the top and bottom ends of the braid to seal in the filling. Cover the pastry and let it rise at room temperature until the dough is puffy, 30 to 40 minutes."
411,6597706,6,"Preheat an oven to 375 degrees F (190 degrees C). Bake the braid for 20 minutes, covering it with aluminum foil during the last 10 minutes of baking to prevent over-browning. Remove the pastry from the oven and allow it to cool."
412,6597706,7,"To make the glaze, heat the 2 tablespoons of butter in a saucepan over medium heat. Swirl the pan occasionally and cook until the milk solids turn brown and give off a nutty fragrance, about 5 minutes. Remove from heat and transfer to a bowl to cool slightly. Stir in the confectioners' sugar and vanilla. Mix in the milk a teaspoon at a time until the glaze is thin enough to drizzle. Decorate the Danish braid with the glaze."
413,6604466,1,"In a bread machine, put milk, egg, butter, sugar, salt, bread flour, and yeast in the order suggested by the manufacturer. Select the Dough cycle and press Start. When dough is mixed, transfer to a greased bowl; cover with plastic wrap and let rise until doubled, about 1 to 1 1/2 hours."
414,6604466,2,Grease 2 baking sheets or line them with parchment paper; set aside.
415,6604466,3,"Divide dough in half. Roll each piece out into rectangles about 12x16 inches. Spread each dough rectangle with 1 tablespoon softened butter. In a small bowl, combine 2 teaspoons ground cinnamon, 3/4 cup light brown sugar, and 1/2 cup raisins."
416,6604466,4,"Sprinkle cinnamon mixture onto buttered dough. Roll them up jelly-roll fashion, along long side. Pinch edges to seal. Stretch and twist into rings, pinching ends to seal. Place them seam-side down onto prepared baking sheets. Using clean scissors, cut 2/3 way of the way through the loaf at about 1-inch intervals. Spread each cut slightly. you wish to"
417,6604466,5,"[At this point, the dough can be refrigerated: cover dough with greased plastic wrap and refrigerate overnight. The next morning, let pastries come to room temperature for about half an hour before baking as directed in step 7.]"
418,6604466,6,"Alternately, cover each ring with a clean towel or greased plastic wrap and let loaves rise until double, about 40 minutes."
419,6604466,7,Arrange two oven racks so that both baking sheets will fit. Preheat oven to 350 degrees F (175 degrees C).
420,6604466,8,"Bake for 10 minutes in preheated; rotate baking sheets. Bake until rings are light brown and the filling is oozing and bubbling, about 10 minutes more."
421,6604466,9,"In a small mixing bowl, combine confectioners sugar, almond extract, and milk until icing is desired consistency. Drizzle icing over warm pastries."
