,id_recipe,Step_Count,Step Description
140,6573034,5,"Select Saute function. Cook until mixture thickens, about 3 minutes. Serve warm or chilled."
141,6579027,1,"Bring the water and brown rice to a boil in a saucepan. Add the salt, reduce the heat to low, cover, and simmer until the rice is tender and the liquid has been absorbed, about 50 minutes."
142,6579027,2,"Stir the milk, evaporated milk, almond extract, and sugar into the rice; add the cinnamon stick. Simmer uncovered, stirring frequently, until the dish is of pudding consistency, about 70 minutes more."
143,6585217,1,"Melt butter in a small skillet over medium heat. Mix in brown sugar, cinnamon, salt, and nutmeg. Add apples; cook and stir until apples have softened, about 10 minutes. Set aside."
144,6585217,2,"Bring water and rice to a boil in a medium saucepan. Reduce heat to medium-low, cover, and simmer until rice is tender and water has been absorbed, about 20 minutes."
145,6585217,3,"Stir 1 1/2 cups milk into rice mixture; cook until hot, 2 to 3 minutes. Add brown sugar and stir until well combined. Cook over medium heat until thick and creamy, 15 to 20 minutes. Stir in cooked apples, remaining 1/2 cup milk, and beaten egg. Cook, stirring constantly, until heated through, about 2 minutes. Remove from heat and stir in butter and vanilla extract. Serve warm."
146,6578882,1,"Bring water and rice to a boil in a saucepan. Reduce heat to medium-low, cover, and simmer until the rice is tender and liquid has been absorbed, 20 to 25 minutes."
147,6578882,2,Preheat oven to 325 degrees F (165 degrees C). Grease an 8-inch square baking dish.
148,6578882,3,"Stir milk into rice until evenly combined. Mix eggs, sugar, pudding mix, butter, vanilla extract, and salt into rice mixture; transfer to the prepared baking dish."
149,6578882,4,"Bake in the preheated oven until a knife inserted in the pudding comes out clean, about 1 hour."
150,6579935,1,"Place milk, rice, and sugar in a large pot. Bring to a boil. Reduce heat and simmer until rice is tender, 20 to 25 minutes."
151,6579935,2,"Beat eggs in a bowl. Add a small amount of the rice mixture to the eggs to temper them. Pour mixture into the pot; add raisins and vanilla extract. Let cook until thickened, 15 to 20 minutes more. Add more milk if pudding gets too thick. Pour into a serving bowl and sprinkle cinnamon on top."
152,6563750,1,"Bring water to a boil in a medium saucepan. Add rice and stir; reduce to a simmer. Cover and cook until rice tender, about 20 minutes."
153,6563750,2,"Increase heat to medium; add 1 3/4 cups milk, sugar, and salt. Cook and stir until thick and creamy, 10 to 12 minutes."
154,6563750,3,"Beat remaining 3/4 cup milk with egg in a small bowl or glass measuring cup. Add 3 tablespoons of the hot rice mixture, 1 spoonful at a time, stirring each time to temper the egg. Pour mixture into the pan and stir for 1 more minute."
155,6563750,4,"Remove from heat and stir in raisins, vanilla extract, and lemon extract. Mix in cinnamon and nutmeg. Serve hot or cold."
156,6583108,1,Preheat oven to 325 degrees F. Grease 6 (4 oz.) ramekins.
157,6583108,2,"In saucepan, combine milk and whipping cream. Cut vanilla bean lengthwise and scrape vanilla bean seeds into saucepan; add vanilla beans and salt. Bring to a low boil."
158,6583108,3,"In bowl, whisk together eggs, egg yolks, cinnamon, rice, and 1/2 cup sugar."
159,6583108,4,"Remove vanilla beans from cream mixture. Slowly pour hot cream mixture in a thin stream into the egg/rice mixture, whisking constantly."
160,6583108,5,"Pour or ladle into prepared ramekins; place ramekins on a large baking sheet and place on oven rack; carefully pour enough hot water to reach halfway up the sides of the ramekins. Bake until edges are set and centers are still slightly jiggly when shaken, approximately 25 minutes."
161,6583108,6,Remove ramekins from water bath and place on rack to cool for at least 10 minutes.
162,6583108,7,"Cover; chill at least 3 hours. When ready to serve, remove from refrigerator and sprinkle remaining sugar evenly over tops. Broil 5-6 inches from heat until sugar evenly melts and becomes a caramel color."
163,6583108,8,Remove from oven and serve immediately. (Sugar may also be browned using a professional culinary torch.)
164,6588582,1,"In the top of a double boiler, stir together rice, milk, salt, sugar, raisins and nutmeg. Cook, stirring occasionally, over simmering water 1 hour, until thick. Stir in vanilla and serve warm or cold."
165,6580050,1,"Combine the milk, cinnamon, butter, and rice in a large pot. Bring to a boil, then reduce heat to low, and simmer for 30 minutes, or until rice is tender. Gradually stir in the sugar."
166,6580050,2,"In a medium bowl, whisk together the heavy cream and eggs until smooth. Gradually whisk in about a cup of the hot milk mixture, or enough to raise the temperature to just above body temperature. Gradually stir the warmed egg mixture into the pot. This will keep you from having scrambled egg in your pudding!"
167,6580050,3,"Simmer the pudding over low heat for about 10 minutes, stirring constantly until thickened. Pour into a baking dish or bowl, and allow to cool for 10 to 15 minutes before refrigerating. Refrigerate for at least 2 hours before serving."
168,6600559,1,"Bring the water to a boil in a saucepan over high heat and add the rice. Reduce heat to medium-low and simmer, uncovered, for 7 minutes; drain well."
169,6600559,2,"Using the same saucepan, bring the milk to a boil over medium-high heat. Stir in the rice, vanilla bean, and salt. Reduce the heat to medium-low and simmer, stirring frequently, until the rice is very soft and absorbs most of the milk, 15 to 18 minutes. Remove the pan from the heat, discard the vanilla bean, and stir in the sugar."
170,6600559,3,Preheat an oven to 350 degrees F (175 degrees C). Grease a 2 quart baking dish.
171,6600559,4,"Pour half of the rice pudding mixture into a large bowl. Add the pumpkin puree, ground cinnamon, ground ginger, and ground nutmeg. Spoon the pumpkin rice pudding into the prepared baking dish. Mix the raisins into the remaining rice pudding mixture, and spoon it over the pumpkin rice pudding."
172,6600559,5,"Bake, uncovered until firm, about 30 minutes. Serve warm, sprinkled with cinnamon if desired."
173,6587542,1,"Place the rice into a food processor or blender, and process until coarse, but not pureed. Transfer to a saucepan, and stir in the milk, sugar and dates. Cook over low heat, stirring occasionally until the dates are tender, about 20 minutes. Serve warm or cold."
174,6650210,1,Preheat oven to 350 degrees F (175 degrees C). Grease an 8x8-inch baking dish.
175,6650210,2,"Whisk rice, evaporated milk, raisins, eggs, white sugar, brown sugar, custard powder, and vanilla extract together in a bowl; pour into the prepared dish. Sprinkle nutmeg over rice mixture."
176,6650210,3,"Bake in the preheated oven until a knife inserted into the center of pudding comes out clean, about 30 minutes."
177,6580723,1,"Bring the heavy cream, water, brown rice, and salt to a boil in a pot; reduce heat to low, cover, and simmer until the liquid is completely absorbed, about 80 minutes. Fold the raisins into the mixture and continue cooking until the raisins plump, about 10 minutes more."
178,6580723,2,"Whisk the egg yolks, sugar, and cinnamon together in a bowl; slowly pour into the pot with the rice while stirring. Cook and stir until the mixture thickens, about 6 minutes. Remove from heat and stir in the butter and vanilla extract."
179,6564890,1,Preheat the oven to 350 degrees F (175 degrees C).
180,6564890,2,"Bring water, rice, and grapeseed oil to a boil in a saucepan. Reduce heat to medium-low, cover, and simmer until rice is tender and water has been absorbed, about 15 minutes. Let stand for 5 to 10 minutes; fluff with a fork."
181,6564890,3,"Whisk soy milk, brown sugar, and salt together in a large bowl."
182,6564890,4,"Pour rice into a casserole dish; pour soy milk mixture on top. Add cinnamon sticks, cloves, and vanilla. Cover."
183,6564890,5,"Bake in the preheated oven until set, 30 to 45 minutes. Remove cinnamon sticks and cloves. Dust with ground cinnamon."
184,6585600,1,Place red beans into a large container and cover with several inches of cool water; let stand 3 hours to overnight. Drain and rinse.
185,6585600,2,"Combine red beans and barley in a pot; add enough water to fill 1/2 the pot. Bring to a boil, reduce heat to low, cover pot, and simmer until beans and barley are tender, about 1 hour."
186,6585600,3,Mix rice into bean-barley mixture; add more water if it has all been absorbed. Cook rice mixture for 20 minutes. Add mung beans; cook for 20 minutes.
187,6585600,4,"Mix oats, millet, and tapioca into rice mixture; cook, stirring every 5 minutes, until all the grains are softened, about 20 minutes. Add more water to reach desired thickness of porridge. Stir brown sugar and raisins into porridge; cook for 5 minutes more. Remove pot from heat, stirring occasionally to prevent sticking. Serve hot or chilled."
188,6582901,1,"Stir milk, rice, sugar, orange juice, and orange zest together in a heavy saucepan; bring to a boil, reduce heat to medium-low, and cook, stirring frequently, until the rice is tender and the mixture is thickened, 35 to 40 minutes."
189,6582901,2,Remove the saucepan from heat. Stir orange liqueur and cocoa powder through the rice mixture; add chocolate chips and stir until melted into the pudding.
190,6570801,1,"Combine water, rice flour, and sugar in a saucepan over medium heat. Cook, stirring constantly, until the mixture thickens, about 5 minutes."
191,6570801,2,"Mix milk, rose water. saffron, and cardamom together in a bowl; add to rice mixture. Bring to a boil and stir until there are no clumps, about 5 minutes."
192,6570801,3,Carefully ladle hot mixture into 6 cups; garnish each with 3 pistachios. Refrigerate for at least 1 hour.
193,6571556,1,"Bring milk, Arborio rice, sugar, butter, and salt to a boil in a large saucepan over medium-high heat. Reduce heat and simmer, uncovered, stirring frequently until rice is very tender, about 1 hour. Remove from heat."
194,6571556,2,"Beat eggs in a bowl, and gradually stir in about 1 cup of the rice mixture with the beaten eggs, adding about 1/4 cup of the hot rice at a time. Return the egg mixture into the saucepan, and stir in the heavy cream and vanilla extract."
195,6571556,3,"Pour the rice pudding into a 3-quart dish, and sprinkle with cinnamon. Allow pudding to cool slightly, then cover and refrigerate until chilled, about 4 hours."
196,6604597,1,"Stir brown rice, 1 1/4 cup milk, sugar, and salt together in a saucepan over medium heat until thick and creamy, 15 to 20 minutes. Lower heat to medium-low."
197,6604597,2,"Stir 1 cup milk, egg, cinnamon, and raisins into rice mixture, stirring constantly, until desired thickness, 3 to 5 minutes."
198,6604597,3,Remove from heat and stir butter and vanilla extract into mixture.
199,6604597,4,"Pour pudding into serving dish and garnish with nutmeg. Allow to cool to room temperature before serving, about 20 minutes."
