,id_recipe,Step_Count,Step Description
168,6664230,2,"Mix together green beans, wax beans, kidney beans, onion, sugar, vinegar, vegetable oil, salt, pepper, and celery seed. Chill in refrigerator for at least 12 hours.Dotdash Meredith Food Studios"
169,6664230,3,Enjoy!DOTDASH MEREDITH FOOD STUDIOS
170,6737319,1,"Place olive oil, lime juice, garlic, salt, and cayenne pepper in a small jar. Close the lid tightly and shake the jar until the dressing is well combined."
171,6737319,2,"Combine in a salad bowl beans, corn, avocado, bell pepper, tomatoes, green onions, and cilantro."
172,6737319,3,"Shake dressing again, pour over salad, and toss to coat."
173,6575247,1,"Mix chipotle hot sauce, rice vinegar, soy sauce, ginger, and agave syrup together in a small bowl to make sauce."
174,6575247,2,"Heat olive oil and sesame oil in a wok or large skillet over medium heat. Add ground turkey; cook, stirring to break up clumps, until juices run clear, about 6 minutes. Season with salt and pepper. Transfer to a bowl, reserving juices in the wok."
175,6575247,3,"Combine coleslaw mix, red bell pepper, green onions, and garlic in the wok; cook and stir over medium heat until slaw is slightly wilted, 1 to 2 minutes. Add sauce; mix to combine, about 1 minute. Return turkey to the wok and stir until heated through, 2 to 3 minutes."
176,6575247,4,Sprinkle sesame seeds over slaw before serving.
177,6664146,1,"Place beets into a saucepan; add enough water to cover. Bring to a boil, then cook for 20 to 30 minutes, until tender. Drain and cool, then cut into cubes.Dotdash Meredith Food Studios"
178,6664146,2,"While beets are cooking, place walnuts in a skillet over medium-low heat. Heat until warm and starting to toast. Stir in maple syrup; cook and stir until evenly coated, then remove from heat and set aside to cool.Dotdash Meredith Food Studios"
179,6664146,3,"To make the dressing: Whisk orange juice concentrate, balsamic vinegar, and olive oil together in a small bowl.Dotdash Meredith Food Studios"
180,6664146,4,"Place a large helping of baby greens onto each of four salad plates, divide candied walnuts equally and sprinkle over greens. Place equal amounts of beets over greens and top with pieces of goat cheese. Drizzle dressing over each salad.Dotdash Meredith Food Studios"
181,6738737,1,"Mix ham, eggs, celery, pickle relish, and onion together in a medium bowl until combined."
182,6738737,2,Mix mayonnaise and mustard together in a small bowl; add to ham mixture and stir to coat.
183,6738737,3,Refrigerate until ready to serve.
184,6650323,1,"Bring a large pot of water to a boil. Add potatoes, bring to a boil, and cook for 5 to 10 minutes. Add carrots and whole eggs and continue boiling until potatoes are tender, 10 to 15 minutes. Drain and slightly cool mixture."
185,6650323,2,Chop potatoes and carrot. Peel and chop eggs.
186,6650323,3,"Mix potatoes, carrot, eggs, pickles, peas, ham, and dill together in a large bowl; stir in mayonnaise until salad is evenly coated."
187,6664101,1,"Place onion and bell pepper in a microwave-safe bowl; heat in microwave on high until soft, about 1 to 2 minutes. Set aside to cool.Dotdash Meredith Food Studios"
188,6664101,2,"Combine onion, bell pepper, salad greens, deli meat, and tomato in a large salad bowl. Sprinkle with onion powder, garlic powder, salt, and black pepper; toss well to mix.Dotdash Meredith Food Studios"
189,6664101,3,Pour on salad dressing; toss well and serve.Dotdash Meredith Food Studios
190,6738941,1,"Stir balsamic vinegar and honey together in a small saucepan and place over high heat. Bring to a boil, reduce heat to low, and simmer until mixture has reduced to 1/3 cup, about 10 minutes. Set aside to cool."
191,6738941,2,"Arrange alternating slices of tomato and mozzarella decoratively on a serving platter. Sprinkle with salt and black pepper, tuck basil leaves around slices, and drizzle with olive oil and the balsamic reduction."
192,6589426,1,"Bring a large pot of lightly salted water to a boil. Cook rotini pasta at a boil until tender yet firm to the bite, about 8 minutes. Drain and rinse with cold water until cool."
193,6589426,2,"Combine pasta, salami, bell peppers, onion, mozzarella balls, and olives in a large bowl. Add salad dressing and toss to coat."
194,6589426,3,Season pasta salad with dry salad dressing mix and stir to combine. Sprinkle with Parmesan cheese before serving.
195,6739820,1,"Combine pineapple juice, sugar, eggs, flour, and 1/2 teaspoon salt in a saucepan. Stir and cook over medium heat until thickened. Remove from heat; stir in lemon juice. Let cool to room temperature, about 1 hour."
196,6739820,2,"Bring a large pot of water to a boil; add oil and remaining 2 teaspoons salt. Add pasta and cook until al dente, 5 to 7 minutes. Drain and rinse under cold water."
197,6739820,3,"Combine cooked pasta, cooled egg mixture, mandarin oranges, pineapple tidbits, crushed pineapple, and whipped topping in a large bowl; mix well. Refrigerate until chilled, 8 hours to overnight."
198,6739820,4,"Before serving, add marshmallows and coconut; toss and serve."
199,6737902,1,"Make dressing: Whisk together sugar, oil, vinegar, sesame seeds, poppy seeds, onion, paprika, and Worcestershire in a medium bowl. Cover and chill for 1 hour."
200,6737902,2,"Make salad: Combine strawberries, spinach, and almonds in a large bowl."
201,6737902,3,Pour dressing over salad; toss to coat. Refrigerate for 10 to 15 minutes before serving.
202,6595246,1,Mix red onion with lime juice in a bowl; set aside to marinate at least 10 minutes. Stir olive oil into mixture.
203,6595246,2,"Toss watermelon, baby cucumbers, and feta cheese together in a large bowl. Pour red onion mixture over watermelon mixture; toss to coat. Sprinkle mint over the salad; toss."
204,6604700,1,"Fill a large pot with lightly salted water and bring to a rolling boil. Stir in penne and return to a boil. Cook pasta uncovered, stirring occasionally, until tender yet firm to the bite, about 10 minutes; rinse with cold water and drain well."
205,6604700,2,"Whisk olive oil, vinegar, garlic, lemon juice, oregano, salt, and pepper together in a bowl; set aside."
206,6604700,3,"Combine pasta, tomatoes, green and red peppers, onion, cucumber, olives, and feta cheese in a large bowl. Pour vinaigrette over the pasta mixture and mix well. Cover and chill for 3 hours before serving."
207,6592700,1,Toss cabbage and onion together in a large bowl; set aside.
208,6592700,2,"Combine sugar, vinegar, oil, celery seed, salt, mustard, and pepper in a small saucepan; bring to a boil and simmer, stirring frequently, until sugar is dissolved, about 3 minutes. Let mixture cool slightly, about 5 minutes, then pour over cabbage mixture; toss well to coat. Cover and refrigerate at least 2 hours."
209,6663934,1,Finely shred cabbage; do not chop. Combine green onions and cabbage in a large bowl. Cover and refrigerate until ready to serve.
210,6663934,2,Preheat the oven to 350 degrees F (175 degrees C).
211,6663934,3,"Make the crunchy topping: Melt butter in a pot. Stir ramen noodles, almonds, and sesame seeds into the pot with melted butter. Spoon the mixture onto a baking sheet and bake the crunchies in the preheated oven, turning often to make sure they do not burn, for 5 to 7 minutes. When they are browned remove them from the oven."
212,6663934,4,"Make the dressing: Heat oil, sugar, vinegar, and soy sauce together in a small saucepan. Bring the dressing to a boil, let boil for 1 minute. Remove the pan from heat and let cool."
213,6663934,5,Toss together cabbage with crunchy topping and dressing immediately before serving. Serve right away or the crunchies will get soggy.
214,6650742,1,Gather all ingredients.Dotdash Meredith Food Studios
215,6650742,2,"Bring a large pot of lightly salted water to a boil. Place pasta in the pot, cook for 8 to 12 minutes, until al dente, and drain."
216,6650742,3,"Toss cooked pasta with Italian dressing, cucumbers, tomatoes, and green onions in a large bowl. Mix Parmesan cheese and Italian seasoning in a small bowl, and gently mix into the salad.Dotdash Meredith Food Studios"
217,6650742,4,"Mix Parmesan cheese and Italian seasoning in a small bowl, and gently mix into the salad. Cover, and refrigerate for at least 30 minutes before serving.Dotdash Meredith Food Studios"
218,6650742,5,Enjoy!DOTDASH MEREDITH FOOD STUDIOS
