,id_recipe,Step_Count,Step Description
137,6577300,3,"Pour sauce into a large skillet over medium-high heat. Bring to a simmer and cook for 2 minutes. Add the shrimp and parsley; cook until shrimp are pink and cooked through, 3 to 5 minutes."
138,6577300,4,"Drain the linguini, and place on a serving platter. Spoon the shrimp and sauce over the pasta, and top with a sprinkle of Parmesan cheese."
139,6598091,1,Place shrimp in a large bowl and set aside.
140,6598091,2,"Heat olive oil in a multi-functional pressure cooker (such as Instant Pot®) on Saute function. Add shallot and saute, stirring, for 1 1/2 minutes. Mix in garlic, lemon zest, red pepper flakes, salt, and pepper. Cook and stir until garlic is fragrant, about 1 1/2 minutes. Add the shallot mixture to the shrimp, stir in lemon juice, and refrigerate."
141,6598091,3,"Clean inner pot, return to the Instant Pot®, and select Saute function. Melt butter and stir in orzo. Keep stirring until all the orzo is coated with butter, about 1 1/2 minutes. Add shrimp stock and white wine; stir to combine. Bring to a boil. Close and lock the lid."
142,6598091,4,Select high pressure according to manufacturer's instructions; set timer for 4 minutes. Allow 10 to 15 minutes for pressure to build.
143,6598091,5,"Release pressure carefully using the quick-release method according to manufacturer's instructions, about 5 minutes. Unlock and remove the lid. Place the prepared shrimp in a single layer on top of the orzo."
144,6598091,6,Close and lock the lid. Select high pressure and set timer for 1 minute. Allow 5 to 10 minutes for pressure to build.
145,6598091,7,"Release pressure carefully using the quick-release method according to manufacturer's instructions, about 5 minutes. Serve warm with fresh parsley and lemon slices for garnish."
