,id_recipe,Step_Count,Step Description
145,6574655,3,"Bake in the preheated oven for 15 to 20 minutes, or until a toothpick inserted into the center of the cake comes out clean. Allow to cool. Sprinkle cakes with orange liqueur."
146,6574655,4,"Reserve 8 to 10 strawberries and slice the rest. Place one cake on a serving plate, top with half of the sliced strawberries and half of whipped topping. Cover with second layer, top with remaining strawberries and whipped topping. Garnish with whole strawberries. In the top of a double boiler, heat semisweet chocolate, stirring occasionally, until chocolate is melted and smooth. Drizzle over the strawberries."
147,6571242,1,Preheat oven to 350 degrees F (175 degrees C). Line a baking sheet with parchment paper.
148,6571242,2,"Sift the self-rising flour, 1/3 cup of sugar, and cinnamon in a large mixing bowl. Mix in the cold butter pieces, and chop the butter into the flour mixture with a pastry cutter until the mixture looks like crumbs. In a separate bowl, whisk the egg and whipped cream together, and pour into the bowl containing the flour mixture; add milk and vanilla extract. Stir to make a dough."
149,6571242,3,"Turn the dough out onto a floured surface and knead until smooth, about 1 minute. Spread the dough onto the prepared baking sheet. Sprinkle with 2 tablespoons of sugar."
150,6571242,4,"Bake in the preheated oven until golden brown, about 20 minutes; allow the cake to cool completely. With a heart-shaped cookie cutter, cut out 16 hearts from the cake. It helps to wiggle the cutter slightly while cutting. Remove cut-outs carefully to avoid breaking."
151,6571242,5,"Mix strawberries with 3 tablespoons of sugar in a bowl; place a shortcake heart on a plate, and top with sweetened strawberries, then spoon about 2 tablespoons of whipped cream on the berries. Top with another heart-shaped shortcake and serve."
152,6738287,1,"Crush about 1/4 of the strawberries with a fork. Mix together with the remaining strawberries, sugar, lemon juice, and lemon zest in a medium bowl. Set aside to macerate for up to 1 hour."
153,6738287,2,Preheat the oven to 450 degrees F (230 degrees C). Line a baking sheet with parchment paper.
154,6738287,3,"Whisk flour, sugar, baking powder, and salt together in a large bowl. Mix cream, eggs, and almond extract together in a separate bowl."
155,6738287,4,Cut cold butter cubes into the flour mixture using a pastry cutter until texture resembles damp sand. Make a well in the center and pour in the cream mixture; fold it in gently with a wooden spoon until a shaggy dough forms.
156,6738287,5,"Turn out onto a lightly floured surface and knead a few times until dough comes together. Pat out until 1/2-inch thick. Fold dough in half and then in quarters, and pat out into a 1/2-inch thickness again. Repeat folding one more time."
157,6738287,6,"Using a 3-inch biscuit cutter and taking care not to twist the cutter in the dough, cut out 12 rounds and place at least 2 inches apart on the baking sheet. Brush the tops of the biscuits with melted butter and sprinkle with sanding sugar."
158,6738287,7,"Bake in the preheated oven until golden brown on top, 10 to 12 minutes. Remove from oven and cool on a wire rack."
159,6738287,8,"While the shortcakes are cooling, make the whipped cream. Combine heavy cream, confectioners' sugar, and vanilla bean paste in the bowl of a stand mixer. Beat on medium speed until stiff peaks form, about 4 minutes."
160,6738287,9,Split the shortcakes in half and top with macerated strawberries and a dollop of whipped cream.
161,6595360,1,"Preheat oven to 350 degrees F (175 degrees C). Generously spray a 9-inch springform pan with cooking spray, and line pan with parchment paper."
162,6595360,2,"In a large mixing bowl, beat the egg yolks, honey, vanilla extract, baking soda, and salt together until thoroughly mixed; gently stir in the graham cracker crumbs. In a separate glass or metal bowl, beat the egg whites with an electric mixer until they form stiff peaks. Gently fold the whipped egg whites into the crumb mixture until just combined; do not overmix. Spread the batter into the prepared springform pan."
163,6595360,3,"Bake in the preheated oven until the cake is golden brown, about 30 minutes. Allow to cool in pan for 10 minutes before running a knife around the edge of the cake to loosen sides. Release the springform pan, and gently remove cake from the bottom; cool completely on a wire rack."
164,6595360,4,"In a saucepan, combine cardamom pods, clove, sugar, and Zinfandel wine over medium heat, and bring to a boil; reduce heat to a simmer, and cook until thickened, about 3 minutes; mix in the lemon juice. Place strawberries into a bowl, and pour the hot Zinfandel syrup over the berries; chill 2 to 3 hours to blend flavors."
165,6595360,5,"Freeze a metal mixing bowl and beaters from an electric mixer until ice cold, about 15 minutes. Pour the cold cream into the mixing bowl, and place the cold beaters into the mixer. Beat the cream with the electric mixer set on High just until the cream forms stiff peaks, about 1 minute. Discard the cardamom pods and clove from the strawberries, and top the cake with the strawberries and syrup. Serve with whipped cream."
