,id_recipe,Step_Count,Step Description
167,6597992,4,"Ladle a couple of tablespoons of batter onto the preheated iron and cook until golden brown, 3 to 5 minutes. Repeat with remaining batter."
168,6581654,1,"Preheat waffle iron. In a large mixing bowl, sift together flour, baking powder, sugar and baking soda. In a separate bowl, beat together egg yolks and milk. Add milk mixture, butter and oil to flour; stir gently to combine. Beat egg whites until stiff peaks have formed; fold into batter."
169,6581654,2,Spray preheated waffle iron with non-stick cooking spray. Pour mix onto hot waffle iron and sprinkle generously with chopped pecans. Cook until golden brown. Keep warm in oven while remaining waffles cook.
170,6592871,1,Preheat a waffle iron according to manufacturer's instructions.
171,6592871,2,"Whisk the flour, baking powder, sugar, and salt together in a mixing bowl; set aside. Beat egg whites until foamy in a separate large glass or metal mixing bowl. Whisk the egg yolks, lemon zest, and vanilla extract together in a third bowl; whisk in the milk. Stir in the flour mixture until smooth. Fold in the melted butter and then the beaten egg whites until just incorporated."
172,6592871,3,Cook the waffles according to manufacturer's instructions until golden brown.
173,6569652,1,"Make waffles: Whisk flour, white sugar, baking powder, cocoa powder, and salt together in a medium bowl."
174,6569652,2,"Beat buttermilk, melted butter, eggs, vanilla, and vinegar together in a large bowl until smooth. Stir in red food coloring. Add flour mixture; mix until just combined."
175,6569652,3,Preheat a waffle iron according to manufacturer's instructions.
176,6569652,4,"While the waffle iron is heating, make glaze: Beat cream cheese and butter together in a large bowl with an electric mixer until smooth and fluffy. Gradually mix in confectioners' sugar, alternating with milk and vanilla, until smooth. Set aside."
177,6569652,5,Spoon 1/4 to 1/2 cup waffle batter into the preheated waffle iron. Cook according to manufacturer's directions. Repeat with remaining batter.
178,6569652,6,"Lightly dust each waffle with confectioners' sugar, drizzle with glaze, and top with whipped cream and strawberries."
179,6601965,1,Preheat waffle iron according to manufacturer's directions; spray lightly with vegetable cooking spray.
180,6601965,2,"Combine flour, baking powder, soda, salt, cinnamon, ginger, and nutmeg in a large bowl. Set aside."
181,6601965,3,"Combine oil, molasses, pumpkin and buttermilk in a small bowl; set aside."
182,6601965,4,"Whisk together egg and SPLENDA® Granulated Sweetener until blended. Add buttermilk mixture, whisking until blended. Add to dry ingredients, stirring just until moistened."
183,6601965,5,Pour batter into a hot waffle iron and bake approximately 5 minutes*. Serve with maple syrup.
184,6590399,1,Preheat a waffle iron according to the manufacturer's instructions.
185,6590399,2,"Whisk flour, sugar, baking powder, and salt together in a bowl; make a well in the center of the flour mixture."
186,6590399,3,"Beat milk, coconut oil, egg, and vanilla extract together in another bowl; pour into well in the flour mixture and stir until batter is just combined."
187,6590399,4,"Ladle batter into preheated waffle iron and cook until golden and crisp, 2 to 5 minutes."
188,6573002,1,Preheat a waffle iron according to manufacturer's instructions; spray with cooking spray.
189,6573002,2,"Mix hash browns, eggs, milk, flour, onion, sriracha sauce, garlic, baking powder, salt, and pepper together in a bowl to make batter."
190,6573002,3,"Pour 1/4 of the mixture onto the preheated waffle iron; spread to the edges with a spatula. Cook until golden and warmed through, 5 to 7 minutes. Repeat with remaining batter."
191,6651073,1,Preheat a lightly greased waffle iron.
192,6651073,2,"In a medium bowl, sift together flour, sugar, baking powder, baking soda and salt."
193,6651073,3,"In a separate medium bowl, mix egg yolk, sour cream, coconut milk, pineapple and butter. Thoroughly mix in the flour mixture. Gently fold in egg whites."
194,6651073,4,"Pour the mixture into the prepared waffle iron, and cook until golden brown."
195,6599048,1,Preheat the oven to 200 degrees F (95 degrees C). Preheat a waffle iron according to manufacturer's instructions.
196,6599048,2,"Whisk flour, brown sugar, baking powder, baking soda, and salt together in a mixing bowl."
197,6599048,3,"Combine buttermilk, ricotta cheese, and eggs in a large bowl; blend with an electric mixer until smooth. Stir in melted butter and maple extract. Add flour mixture to buttermilk mixture and stir until just combined but still lumpy; don't overmix or the waffles will be tough and chewy."
198,6599048,4,"Lightly spray the waffle iron grids with cooking spray, if needed, following the manufacturer's instructions for cooking. Add about 1 cup of batter depending on the size of your waffle iron, spreading evenly, and sprinkle batter with about 2 to 3 tablespoons pecans."
199,6599048,5,"Cook until golden brown, 3 to 5 minutes, making sure the waffle is fully cooked before lifting the lid (the steam slows down once the waffles are done). Remove waffle, place on a baking sheet without stacking, cover loosely with aluminum foil, and place in the preheated oven to keep warm. Repeat with remaining batter."
200,6587866,1,Preheat a waffle iron according to manufacturer's instructions. Grease the inside of the waffle iron.
201,6587866,2,"Mix all-purpose flour, whole wheat flour, baking powder, and salt together in a bowl. Whisk milk, bananas, canola oil, eggs, and vanilla extract together in a separate bowl; stir into flour mixture until batter is moistened with a few lumps."
202,6587866,3,Spoon about 1/4 cup batter into preheated waffle iron and cook according to manufacturer's instructions.
203,6602600,1,Preheat a waffle iron according to manufacturer's instructions.
204,6602600,2,"Stir sweet potato, milk, egg, and butter together in a bowl. Whisk flour, brown sugar, baking powder, 1 teaspoon cinnamon, nutmeg, ginger, cloves, and salt together in a separate large bowl. Add potato mixture to flour mixture; stir until batter is just combined."
205,6602600,3,"Ladle batter into the preheated waffle iron and cook until waffles are golden and crisp, about 3 minutes."
206,6602600,4,"Stir maple syrup, cranberry sauce, and 1/2 teaspoon cinnamon together in a saucepan over medium heat. Cook, stirring occasionally, until well-combined and heated through, 5 to 10 minutes. Pour syrup over cooked waffles."
207,6598186,1,Preheat a waffle iron according to manufacturer's instructions.
208,6598186,2,"Beat egg whites in a glass, metal, or ceramic bowl with an electric mixer until stiff peaks form."
209,6598186,3,"Mix egg yolks in a separate bowl using a hand beater. Beat in rice milk, rice flour, tapioca starch, oil, almond meal, sugar, baking powder, vanilla extract, and salt just until smooth. Fold in stiff egg whites."
210,6598186,4,"Spray the preheated waffle iron with cooking spray. Cook waffles until golden brown and the iron stops steaming, about 5 minutes per waffle."
211,6585636,1,Preheat a waffle iron according to manufacturer's instructions.
212,6585636,2,"Sift flour, sugar, salt, and baking powder together in a bowl. Whisk in milk, butter, and heavy cream; stir in soda."
213,6585636,3,"Cook in batches in the preheated waffle iron until waffles are golden brown and the iron stops steaming, about 5 minutes."
214,6583573,1,"Preheat a waffle iron according to manufacturer's instructions. Mix flour, oats, sugar, baking powder, and salt in a large bowl."
215,6583573,2,"Beat egg yolks in another bowl, reserving egg whites in a third bowl. Add buttermilk, milk, and melted butter to egg yolks; beat until well mixed. Pour buttermilk mixture into flour mixture; beat until batter is blended."
216,6583573,3,Beat egg whites and vanilla extract in a glass or metal bowl until soft peaks form. Fold half the egg whites into the buttermilk batter until egg whites are incorporated; repeat with remaining half.
217,6583573,4,"Ladle batter into preheated waffle iron. Cook until waffles are golden and crisp, about 5 minutes. Transfer waffle to a paper towel-lined plate to prevent sogginess and repeat with remaining batter."
218,6562062,1,"Beat egg in a large bowl with a hand mixer until fluffy. Add flour, milk, chocolate chips, oil, sugar, baking powder, vanilla extract, and salt; mix just until smooth."
219,6562062,2,Spray a Belgian waffle iron with cooking spray and preheat according to manufacturer's instructions.
220,6562062,3,Pour about 3/4 cup batter onto the hot waffle iron and cook until golden brown. Repeat with remaining batter. Serve hot.
221,6602967,1,Preheat a waffle iron according to manufacturer's instructions. Grease with cooking spray.
222,6602967,2,Combine oats and almond milk in a large bowl.
223,6602967,3,Whisk egg yolk and butter together in a small bowl; stir into oat mixture.
224,6602967,4,"Beat egg white in a glass, metal, or ceramic bowl until stiff peaks form."
225,6602967,5,Stir brown sugar and baking powder into the oat mixture. Fold beaten egg white gently into the batter.
226,6602967,6,"Scoop 1/2 cup batter onto the preheated iron and spread to the edges. Close iron and cook until iron stops steaming, about 5 minutes. Repeat with remaining batter."
227,6606036,1,"Combine sourdough starter and yogurt in a bowl the night before you plan to cook the waffles. Stir while pouring in flour and brown sugar. Mix until well combined. Cover batter and let rest in the fridge, 8 hours to overnight."
228,6606036,2,Preheat a waffle iron according to manufacturer's instructions.
229,6606036,3,Beat egg in a large bowl when you're ready to make the waffles. Add melted butter and vanilla extract. Mix in baking soda and salt. Add the sourdough starter mixture and stir until batter is well combined.
230,6606036,4,"Pour batter into waffle iron and cook until golden brown, about 3 minutes per waffle."
231,6564263,1,Spray a Belgian waffle iron with cooking spray and preheat according to manufacturer's instructions.
232,6564263,2,"Beat eggs with a whisk until fluffy. Beating slightly after each ingredient, first add milk, then oil, sugar, salt, baking powder, all-purpose flour, and finally whole wheat flour; do not overbeat."
233,6564263,3,"Pour 3/4 cup batter into the center of the hot waffle iron, spreading with a metal knife if necessary. Close the iron and bake until it stops steaming, 2 to 5 minutes, depending on your iron. Carefully remove cooked waffle with a fork and repeat with remaining batter."
